{"scopus-eid": "2-s2.0-25144433929", "originalText": "serial JL 272265 291210 291838 291854 31 Comptes Rendus Biologies COMPTESRENDUSBIOLOGIES 2005-07-01 2005-07-01 2010-10-05T19:51:31 1-s2.0-S1631069105000934 S1631-0691(05)00093-4 S1631069105000934 10.1016/j.crvi.2005.05.005 S300 S300.1 FULL-TEXT 1-s2.0-S1631069105X00397 2020-03-23T06:47:34.716094Z 0 0 20050901 20050930 2005 2005-07-01T00:00:00Z articleinfo crossmark dco dateupdated tomb dateloaded datesearch indexeddate issuelist volumelist yearnav absattachment articletitlenorm authfirstinitialnorm authfirstsurnamenorm cid cids contenttype copyright dateloadedtxt docsubtype doctype doi eid ewtransactionid hubeid issfirst issn issnnorm itemstage itemtransactionid itemweight openaccess openarchive pg pgfirst pglast pii piinorm pubdateend pubdatestart pubdatetxt pubyr sortorder srctitle srctitlenorm srctype subheadings volfirst volissue webpdf webpdfpagecount figure body mmlmath affil altitemtitle articletitle auth authfirstini authfull authkeywords authlast nonengabst presentedby primabst pubtype ref alllist content subj ssids 1631-0691 16310691 328 328 9 9 Volume 328, Issue 9 3 783 793 783 793 200509 September 2005 2005-09-01 2005-09-30 2005 article fla Copyright \u00a9 2005 Acad\u00e9mie des sciences. Published by Elsevier Masson SAS All rights reserved. EMERGENCECOMPLEXPATTERNSINDUCEDBYDYNAMICSYSTEMSIMPLEMENTEDINDYNAMICSTRUCTURESDS2 ROUAULT J Version fran\u00e7aise abr\u00e9g\u00e9e 1 Introduction : le concept d'\u00e9mergence 2 Le syst\u00e8me dynamique 3 Pavage de quasi-carr\u00e9s 4 Impl\u00e9mentation dans une structure statique 5 Impl\u00e9mentation dans une structure dynamique 6 Discussion 6.1 Le mod\u00e8le SD2 6.2 Le concept d'\u00e9mergence 6.3 Complexit\u00e9 et \u00e9mergence 1 Introduction: the concept of emergence 2 The dynamic system 3 Paving of almost-squares 4 Implementation in a static structure 5 Implementation in a dynamic structure 6 Discussion 6.1 The DS2 model 6.2 The concept of emergence 6.3 Complexity and emergence References FOUET J GEORGE J BASS 1997 67 83 N GRUMBACH 1997 185 227 A THOM 1991 1993 R PREDIRENESTPASEXPLIQUERCHAMPS288 VANDEVIJVER 1997 7 23 G RICARD 2003 133 140 J CARIANI 1997 95 143 P BONABEAU 1997 85 94 E MEINHARDT 1982 H MODELSBIOLOGICALPATTERNFORMATION MEINHARDT 1995 2003 H ALGORITHMICBEAUTYSEASHELLSVIRTUALLABORATORY GIERER 1972 30 39 A MEINHARDT 2000 753 760 H LELIONNAIS 1979 F DICTIONNAIREDESMATHEMATIQUES ROUAULT J MEDINAMARTINS 1997 145 184 P BRILLOUIN 1956 L SCIENCEINFORMATIONTHEORY ROUAULTX2005X783 ROUAULTX2005X783X793 ROUAULTX2005X783XJ ROUAULTX2005X783X793XJ Full 2020-02-21T08:55:56Z OA-Window ElsevierBranded http://www.elsevier.com/open-access/userlicense/1.0/ item S1631-0691(05)00093-4 S1631069105000934 1-s2.0-S1631069105000934 10.1016/j.crvi.2005.05.005 272265 2010-11-08T03:18:07.120392-05:00 2005-09-01 2005-09-30 1-s2.0-S1631069105000934-main.pdf https://s3.amazonaws.com/prod-ucs-content-store-us-east/content/pii:S1631069105000934/MAIN/application/pdf/e4e23852a017592f46545c2387df0440/main.pdf https://s3-eu-west-1.amazonaws.com/prod-ucs-content-store-eu-west/content/pii:S1631069105000934/MAIN/application/pdf/e4e23852a017592f46545c2387df0440/main.pdf main.pdf pdf true 275878 MAIN 11 1-s2.0-S1631069105000934-main_1.png https://s3.amazonaws.com/prod-ucs-content-store-us-east/content/pii:S1631069105000934/PREVIEW/image/png/855dc32d4d7733137d24ab0b6be7f737/main_1.png https://s3-eu-west-1.amazonaws.com/prod-ucs-content-store-eu-west/content/pii:S1631069105000934/PREVIEW/image/png/855dc32d4d7733137d24ab0b6be7f737/main_1.png main_1.png png 54695 849 656 IMAGE-WEB-PDF 1 1-s2.0-S1631069105000934-si87.gif https://s3.amazonaws.com/prod-ucs-content-store-us-east/content/pii:S1631069105000934/STRIPIN/image/gif/38ab495e4939dd07790e984b25e57270/si87.gif https://s3-eu-west-1.amazonaws.com/prod-ucs-content-store-eu-west/content/pii:S1631069105000934/STRIPIN/image/gif/38ab495e4939dd07790e984b25e57270/si87.gif si87 si87.gif gif 405 14 101 ALTIMG 1-s2.0-S1631069105000934-si68.gif https://s3.amazonaws.com/prod-ucs-content-store-us-east/content/pii:S1631069105000934/STRIPIN/image/gif/4c816263cb55822b212e891067b6a73e/si68.gif https://s3-eu-west-1.amazonaws.com/prod-ucs-content-store-eu-west/content/pii:S1631069105000934/STRIPIN/image/gif/4c816263cb55822b212e891067b6a73e/si68.gif si68 si68.gif gif 962 22 323 ALTIMG 1-s2.0-S1631069105000934-si18.gif https://s3.amazonaws.com/prod-ucs-content-store-us-east/content/pii:S1631069105000934/STRIPIN/image/gif/4c816263cb55822b212e891067b6a73e/si68.gif https://s3-eu-west-1.amazonaws.com/prod-ucs-content-store-eu-west/content/pii:S1631069105000934/STRIPIN/image/gif/4c816263cb55822b212e891067b6a73e/si68.gif si18 si18.gif gif 962 22 323 ALTIMG 1-s2.0-S1631069105000934-si99.gif https://s3.amazonaws.com/prod-ucs-content-store-us-east/content/pii:S1631069105000934/STRIPIN/image/gif/16db622806a3c06beda2791e1587a52e/si94.gif https://s3-eu-west-1.amazonaws.com/prod-ucs-content-store-eu-west/content/pii:S1631069105000934/STRIPIN/image/gif/16db622806a3c06beda2791e1587a52e/si94.gif si99 si99.gif gif 270 11 71 ALTIMG 1-s2.0-S1631069105000934-si98.gif https://s3.amazonaws.com/prod-ucs-content-store-us-east/content/pii:S1631069105000934/STRIPIN/image/gif/185b886ff5ea36d0fb885378d2c1219b/si98.gif https://s3-eu-west-1.amazonaws.com/prod-ucs-content-store-eu-west/content/pii:S1631069105000934/STRIPIN/image/gif/185b886ff5ea36d0fb885378d2c1219b/si98.gif si98 si98.gif gif 1258 13 495 ALTIMG 1-s2.0-S1631069105000934-si97.gif https://s3.amazonaws.com/prod-ucs-content-store-us-east/content/pii:S1631069105000934/STRIPIN/image/gif/553b06930ff7b76cf6c34844b4111686/si97.gif https://s3-eu-west-1.amazonaws.com/prod-ucs-content-store-eu-west/content/pii:S1631069105000934/STRIPIN/image/gif/553b06930ff7b76cf6c34844b4111686/si97.gif si97 si97.gif gif 317 15 62 ALTIMG 1-s2.0-S1631069105000934-si96.gif https://s3.amazonaws.com/prod-ucs-content-store-us-east/content/pii:S1631069105000934/STRIPIN/image/gif/7073e906c44c919cceaeed0e4d07d698/si96.gif https://s3-eu-west-1.amazonaws.com/prod-ucs-content-store-eu-west/content/pii:S1631069105000934/STRIPIN/image/gif/7073e906c44c919cceaeed0e4d07d698/si96.gif si96 si96.gif gif 286 15 54 ALTIMG 1-s2.0-S1631069105000934-si95.gif https://s3.amazonaws.com/prod-ucs-content-store-us-east/content/pii:S1631069105000934/STRIPIN/image/gif/0805e07957539a381f313c3a758fa828/si45.gif https://s3-eu-west-1.amazonaws.com/prod-ucs-content-store-eu-west/content/pii:S1631069105000934/STRIPIN/image/gif/0805e07957539a381f313c3a758fa828/si45.gif si95 si95.gif gif 445 11 129 ALTIMG 1-s2.0-S1631069105000934-si94.gif https://s3.amazonaws.com/prod-ucs-content-store-us-east/content/pii:S1631069105000934/STRIPIN/image/gif/16db622806a3c06beda2791e1587a52e/si94.gif https://s3-eu-west-1.amazonaws.com/prod-ucs-content-store-eu-west/content/pii:S1631069105000934/STRIPIN/image/gif/16db622806a3c06beda2791e1587a52e/si94.gif si94 si94.gif gif 270 11 71 ALTIMG 1-s2.0-S1631069105000934-si93.gif https://s3.amazonaws.com/prod-ucs-content-store-us-east/content/pii:S1631069105000934/STRIPIN/image/gif/6bab3559d47264e807f82c29a28d6034/si43.gif https://s3-eu-west-1.amazonaws.com/prod-ucs-content-store-eu-west/content/pii:S1631069105000934/STRIPIN/image/gif/6bab3559d47264e807f82c29a28d6034/si43.gif si93 si93.gif gif 292 18 68 ALTIMG 1-s2.0-S1631069105000934-si92.gif https://s3.amazonaws.com/prod-ucs-content-store-us-east/content/pii:S1631069105000934/STRIPIN/image/gif/a60490ad523bddd1139f6091c319f824/si42.gif https://s3-eu-west-1.amazonaws.com/prod-ucs-content-store-eu-west/content/pii:S1631069105000934/STRIPIN/image/gif/a60490ad523bddd1139f6091c319f824/si42.gif si92 si92.gif gif 186 14 27 ALTIMG 1-s2.0-S1631069105000934-si91.gif https://s3.amazonaws.com/prod-ucs-content-store-us-east/content/pii:S1631069105000934/STRIPIN/image/gif/ed6058c152f009805de26f653effc52d/si91.gif https://s3-eu-west-1.amazonaws.com/prod-ucs-content-store-eu-west/content/pii:S1631069105000934/STRIPIN/image/gif/ed6058c152f009805de26f653effc52d/si91.gif si91 si91.gif gif 500 16 145 ALTIMG 1-s2.0-S1631069105000934-si90.gif https://s3.amazonaws.com/prod-ucs-content-store-us-east/content/pii:S1631069105000934/STRIPIN/image/gif/4567c944fcb43d415d228fe47fe2c7ec/si90.gif https://s3-eu-west-1.amazonaws.com/prod-ucs-content-store-eu-west/content/pii:S1631069105000934/STRIPIN/image/gif/4567c944fcb43d415d228fe47fe2c7ec/si90.gif si90 si90.gif gif 347 16 86 ALTIMG 1-s2.0-S1631069105000934-si9.gif https://s3.amazonaws.com/prod-ucs-content-store-us-east/content/pii:S1631069105000934/STRIPIN/image/gif/7b25ce55a25c9f0413b826db67f3bfcc/si9.gif https://s3-eu-west-1.amazonaws.com/prod-ucs-content-store-eu-west/content/pii:S1631069105000934/STRIPIN/image/gif/7b25ce55a25c9f0413b826db67f3bfcc/si9.gif si9 si9.gif gif 917 22 276 ALTIMG 1-s2.0-S1631069105000934-si89.gif https://s3.amazonaws.com/prod-ucs-content-store-us-east/content/pii:S1631069105000934/STRIPIN/image/gif/a60490ad523bddd1139f6091c319f824/si42.gif https://s3-eu-west-1.amazonaws.com/prod-ucs-content-store-eu-west/content/pii:S1631069105000934/STRIPIN/image/gif/a60490ad523bddd1139f6091c319f824/si42.gif si89 si89.gif gif 186 14 27 ALTIMG 1-s2.0-S1631069105000934-si88.gif https://s3.amazonaws.com/prod-ucs-content-store-us-east/content/pii:S1631069105000934/STRIPIN/image/gif/a0cff4419e587c5ea0805ac7643d67ba/si88.gif https://s3-eu-west-1.amazonaws.com/prod-ucs-content-store-eu-west/content/pii:S1631069105000934/STRIPIN/image/gif/a0cff4419e587c5ea0805ac7643d67ba/si88.gif si88 si88.gif gif 344 14 101 ALTIMG 1-s2.0-S1631069105000934-si86.gif https://s3.amazonaws.com/prod-ucs-content-store-us-east/content/pii:S1631069105000934/STRIPIN/image/gif/fd1ad097c5651654b8c30d7f83551243/si36.gif https://s3-eu-west-1.amazonaws.com/prod-ucs-content-store-eu-west/content/pii:S1631069105000934/STRIPIN/image/gif/fd1ad097c5651654b8c30d7f83551243/si36.gif si86 si86.gif gif 203 14 37 ALTIMG 1-s2.0-S1631069105000934-si85.gif https://s3.amazonaws.com/prod-ucs-content-store-us-east/content/pii:S1631069105000934/STRIPIN/image/gif/a58d7c200d0043856862daaac711a4df/si85.gif https://s3-eu-west-1.amazonaws.com/prod-ucs-content-store-eu-west/content/pii:S1631069105000934/STRIPIN/image/gif/a58d7c200d0043856862daaac711a4df/si85.gif si85 si85.gif gif 340 13 83 ALTIMG 1-s2.0-S1631069105000934-si84.gif https://s3.amazonaws.com/prod-ucs-content-store-us-east/content/pii:S1631069105000934/STRIPIN/image/gif/19a1c43ada975d1b319535761d4ac9be/si84.gif https://s3-eu-west-1.amazonaws.com/prod-ucs-content-store-eu-west/content/pii:S1631069105000934/STRIPIN/image/gif/19a1c43ada975d1b319535761d4ac9be/si84.gif si84 si84.gif gif 268 11 75 ALTIMG 1-s2.0-S1631069105000934-si83.gif https://s3.amazonaws.com/prod-ucs-content-store-us-east/content/pii:S1631069105000934/STRIPIN/image/gif/8b148098887b4068f78fb9b164a20285/si83.gif https://s3-eu-west-1.amazonaws.com/prod-ucs-content-store-eu-west/content/pii:S1631069105000934/STRIPIN/image/gif/8b148098887b4068f78fb9b164a20285/si83.gif si83 si83.gif gif 235 11 58 ALTIMG 1-s2.0-S1631069105000934-si82.gif https://s3.amazonaws.com/prod-ucs-content-store-us-east/content/pii:S1631069105000934/STRIPIN/image/gif/20ce85f739fa8f22f75a1880c33374b4/si82.gif https://s3-eu-west-1.amazonaws.com/prod-ucs-content-store-eu-west/content/pii:S1631069105000934/STRIPIN/image/gif/20ce85f739fa8f22f75a1880c33374b4/si82.gif si82 si82.gif gif 246 15 56 ALTIMG 1-s2.0-S1631069105000934-si81.gif https://s3.amazonaws.com/prod-ucs-content-store-us-east/content/pii:S1631069105000934/STRIPIN/image/gif/bc8ad4e426ff88a0db36e9d265530e0a/si81.gif https://s3-eu-west-1.amazonaws.com/prod-ucs-content-store-eu-west/content/pii:S1631069105000934/STRIPIN/image/gif/bc8ad4e426ff88a0db36e9d265530e0a/si81.gif si81 si81.gif gif 281 14 64 ALTIMG 1-s2.0-S1631069105000934-si80.gif https://s3.amazonaws.com/prod-ucs-content-store-us-east/content/pii:S1631069105000934/STRIPIN/image/gif/90399116a7d34ebe51f6b150585718f4/si80.gif https://s3-eu-west-1.amazonaws.com/prod-ucs-content-store-eu-west/content/pii:S1631069105000934/STRIPIN/image/gif/90399116a7d34ebe51f6b150585718f4/si80.gif si80 si80.gif gif 223 14 53 ALTIMG 1-s2.0-S1631069105000934-si8.gif https://s3.amazonaws.com/prod-ucs-content-store-us-east/content/pii:S1631069105000934/STRIPIN/image/gif/bf2056281a6d3d00223e479f2f7bf258/si6.gif https://s3-eu-west-1.amazonaws.com/prod-ucs-content-store-eu-west/content/pii:S1631069105000934/STRIPIN/image/gif/bf2056281a6d3d00223e479f2f7bf258/si6.gif si8 si8.gif gif 138 14 16 ALTIMG 1-s2.0-S1631069105000934-si79.gif https://s3.amazonaws.com/prod-ucs-content-store-us-east/content/pii:S1631069105000934/STRIPIN/image/gif/df5194ea41080eac93da689f597e7f8e/si79.gif https://s3-eu-west-1.amazonaws.com/prod-ucs-content-store-eu-west/content/pii:S1631069105000934/STRIPIN/image/gif/df5194ea41080eac93da689f597e7f8e/si79.gif si79 si79.gif gif 219 14 52 ALTIMG 1-s2.0-S1631069105000934-si78.gif https://s3.amazonaws.com/prod-ucs-content-store-us-east/content/pii:S1631069105000934/STRIPIN/image/gif/cd0642a9595bd193c767ba657284b49e/si78.gif https://s3-eu-west-1.amazonaws.com/prod-ucs-content-store-eu-west/content/pii:S1631069105000934/STRIPIN/image/gif/cd0642a9595bd193c767ba657284b49e/si78.gif si78 si78.gif gif 269 14 63 ALTIMG 1-s2.0-S1631069105000934-si77.gif https://s3.amazonaws.com/prod-ucs-content-store-us-east/content/pii:S1631069105000934/STRIPIN/image/gif/ecccafa7b04b2789f5daeea97e104184/si77.gif https://s3-eu-west-1.amazonaws.com/prod-ucs-content-store-eu-west/content/pii:S1631069105000934/STRIPIN/image/gif/ecccafa7b04b2789f5daeea97e104184/si77.gif si77 si77.gif gif 267 14 62 ALTIMG 1-s2.0-S1631069105000934-si76.gif https://s3.amazonaws.com/prod-ucs-content-store-us-east/content/pii:S1631069105000934/STRIPIN/image/gif/891f60d5dd283bb57b7569a71115c4a5/si76.gif https://s3-eu-west-1.amazonaws.com/prod-ucs-content-store-eu-west/content/pii:S1631069105000934/STRIPIN/image/gif/891f60d5dd283bb57b7569a71115c4a5/si76.gif si76 si76.gif gif 192 12 49 ALTIMG 1-s2.0-S1631069105000934-si75.gif https://s3.amazonaws.com/prod-ucs-content-store-us-east/content/pii:S1631069105000934/STRIPIN/image/gif/d42a847b5b4441e602765f3aa20137ce/si25.gif https://s3-eu-west-1.amazonaws.com/prod-ucs-content-store-eu-west/content/pii:S1631069105000934/STRIPIN/image/gif/d42a847b5b4441e602765f3aa20137ce/si25.gif si75 si75.gif gif 790 17 273 ALTIMG 1-s2.0-S1631069105000934-si74.gif https://s3.amazonaws.com/prod-ucs-content-store-us-east/content/pii:S1631069105000934/STRIPIN/image/gif/4ec4d1bab6a39fd7261cf99abb0389fe/si74.gif https://s3-eu-west-1.amazonaws.com/prod-ucs-content-store-eu-west/content/pii:S1631069105000934/STRIPIN/image/gif/4ec4d1bab6a39fd7261cf99abb0389fe/si74.gif si74 si74.gif gif 733 16 273 ALTIMG 1-s2.0-S1631069105000934-si73.gif https://s3.amazonaws.com/prod-ucs-content-store-us-east/content/pii:S1631069105000934/STRIPIN/image/gif/80211424f9c9745e7d9d5314bb4ae868/si73.gif https://s3-eu-west-1.amazonaws.com/prod-ucs-content-store-eu-west/content/pii:S1631069105000934/STRIPIN/image/gif/80211424f9c9745e7d9d5314bb4ae868/si73.gif si73 si73.gif gif 661 22 202 ALTIMG 1-s2.0-S1631069105000934-si72.gif https://s3.amazonaws.com/prod-ucs-content-store-us-east/content/pii:S1631069105000934/STRIPIN/image/gif/cef4d37e0a29634832eb222cb27f29fb/si72.gif https://s3-eu-west-1.amazonaws.com/prod-ucs-content-store-eu-west/content/pii:S1631069105000934/STRIPIN/image/gif/cef4d37e0a29634832eb222cb27f29fb/si72.gif si72 si72.gif gif 709 22 219 ALTIMG 1-s2.0-S1631069105000934-si71.gif https://s3.amazonaws.com/prod-ucs-content-store-us-east/content/pii:S1631069105000934/STRIPIN/image/gif/4dd440b559cb1e59908f3e857cbccb54/si71.gif https://s3-eu-west-1.amazonaws.com/prod-ucs-content-store-eu-west/content/pii:S1631069105000934/STRIPIN/image/gif/4dd440b559cb1e59908f3e857cbccb54/si71.gif si71 si71.gif gif 223 15 37 ALTIMG 1-s2.0-S1631069105000934-si70.gif https://s3.amazonaws.com/prod-ucs-content-store-us-east/content/pii:S1631069105000934/STRIPIN/image/gif/c42e0a4f7eb6ae72bd52789f912c1e87/si70.gif https://s3-eu-west-1.amazonaws.com/prod-ucs-content-store-eu-west/content/pii:S1631069105000934/STRIPIN/image/gif/c42e0a4f7eb6ae72bd52789f912c1e87/si70.gif si70 si70.gif gif 715 16 229 ALTIMG 1-s2.0-S1631069105000934-si7.gif https://s3.amazonaws.com/prod-ucs-content-store-us-east/content/pii:S1631069105000934/STRIPIN/image/gif/6bf23f800fbec7fc7ecbc88f7d979f6c/si55.gif https://s3-eu-west-1.amazonaws.com/prod-ucs-content-store-eu-west/content/pii:S1631069105000934/STRIPIN/image/gif/6bf23f800fbec7fc7ecbc88f7d979f6c/si55.gif si7 si7.gif gif 149 14 19 ALTIMG 1-s2.0-S1631069105000934-si69.gif https://s3.amazonaws.com/prod-ucs-content-store-us-east/content/pii:S1631069105000934/STRIPIN/image/gif/c9a6384ec4173697b4c917a96c9a83c6/si69.gif https://s3-eu-west-1.amazonaws.com/prod-ucs-content-store-eu-west/content/pii:S1631069105000934/STRIPIN/image/gif/c9a6384ec4173697b4c917a96c9a83c6/si69.gif si69 si69.gif gif 531 22 138 ALTIMG 1-s2.0-S1631069105000934-si67.gif https://s3.amazonaws.com/prod-ucs-content-store-us-east/content/pii:S1631069105000934/STRIPIN/image/gif/7073e906c44c919cceaeed0e4d07d698/si96.gif https://s3-eu-west-1.amazonaws.com/prod-ucs-content-store-eu-west/content/pii:S1631069105000934/STRIPIN/image/gif/7073e906c44c919cceaeed0e4d07d698/si96.gif si67 si67.gif gif 286 15 54 ALTIMG 1-s2.0-S1631069105000934-si66.gif https://s3.amazonaws.com/prod-ucs-content-store-us-east/content/pii:S1631069105000934/STRIPIN/image/gif/659b9c409724b76672121b1f23aae8fe/si16.gif https://s3-eu-west-1.amazonaws.com/prod-ucs-content-store-eu-west/content/pii:S1631069105000934/STRIPIN/image/gif/659b9c409724b76672121b1f23aae8fe/si16.gif si66 si66.gif gif 154 14 17 ALTIMG 1-s2.0-S1631069105000934-si65.gif https://s3.amazonaws.com/prod-ucs-content-store-us-east/content/pii:S1631069105000934/STRIPIN/image/gif/2e250f20e940747461381baa3b7bd753/si65.gif https://s3-eu-west-1.amazonaws.com/prod-ucs-content-store-eu-west/content/pii:S1631069105000934/STRIPIN/image/gif/2e250f20e940747461381baa3b7bd753/si65.gif si65 si65.gif gif 148 14 16 ALTIMG 1-s2.0-S1631069105000934-si64.gif https://s3.amazonaws.com/prod-ucs-content-store-us-east/content/pii:S1631069105000934/STRIPIN/image/gif/08b033f4e1967f50507289e8083d8ba8/si64.gif https://s3-eu-west-1.amazonaws.com/prod-ucs-content-store-eu-west/content/pii:S1631069105000934/STRIPIN/image/gif/08b033f4e1967f50507289e8083d8ba8/si64.gif si64 si64.gif gif 137 11 14 ALTIMG 1-s2.0-S1631069105000934-si63.gif https://s3.amazonaws.com/prod-ucs-content-store-us-east/content/pii:S1631069105000934/STRIPIN/image/gif/40c3b0b40d9c5ed392e359bc622fd9c5/si13.gif https://s3-eu-west-1.amazonaws.com/prod-ucs-content-store-eu-west/content/pii:S1631069105000934/STRIPIN/image/gif/40c3b0b40d9c5ed392e359bc622fd9c5/si13.gif si63 si63.gif gif 133 11 13 ALTIMG 1-s2.0-S1631069105000934-si62.gif https://s3.amazonaws.com/prod-ucs-content-store-us-east/content/pii:S1631069105000934/STRIPIN/image/gif/8eec95c96810cc46168be99368205e35/si62.gif https://s3-eu-west-1.amazonaws.com/prod-ucs-content-store-eu-west/content/pii:S1631069105000934/STRIPIN/image/gif/8eec95c96810cc46168be99368205e35/si62.gif si62 si62.gif gif 152 14 16 ALTIMG 1-s2.0-S1631069105000934-si61.gif https://s3.amazonaws.com/prod-ucs-content-store-us-east/content/pii:S1631069105000934/STRIPIN/image/gif/101253f9711f262efb1326619576a584/si11.gif https://s3-eu-west-1.amazonaws.com/prod-ucs-content-store-eu-west/content/pii:S1631069105000934/STRIPIN/image/gif/101253f9711f262efb1326619576a584/si11.gif si61 si61.gif gif 148 14 15 ALTIMG 1-s2.0-S1631069105000934-si60.gif https://s3.amazonaws.com/prod-ucs-content-store-us-east/content/pii:S1631069105000934/STRIPIN/image/gif/b7615e426c3f0469395d13482d6ef292/si10.gif https://s3-eu-west-1.amazonaws.com/prod-ucs-content-store-eu-west/content/pii:S1631069105000934/STRIPIN/image/gif/b7615e426c3f0469395d13482d6ef292/si10.gif si60 si60.gif gif 880 22 260 ALTIMG 1-s2.0-S1631069105000934-si6.gif https://s3.amazonaws.com/prod-ucs-content-store-us-east/content/pii:S1631069105000934/STRIPIN/image/gif/bf2056281a6d3d00223e479f2f7bf258/si6.gif https://s3-eu-west-1.amazonaws.com/prod-ucs-content-store-eu-west/content/pii:S1631069105000934/STRIPIN/image/gif/bf2056281a6d3d00223e479f2f7bf258/si6.gif si6 si6.gif gif 138 14 16 ALTIMG 1-s2.0-S1631069105000934-si59.gif https://s3.amazonaws.com/prod-ucs-content-store-us-east/content/pii:S1631069105000934/STRIPIN/image/gif/7b25ce55a25c9f0413b826db67f3bfcc/si9.gif https://s3-eu-west-1.amazonaws.com/prod-ucs-content-store-eu-west/content/pii:S1631069105000934/STRIPIN/image/gif/7b25ce55a25c9f0413b826db67f3bfcc/si9.gif si59 si59.gif gif 917 22 276 ALTIMG 1-s2.0-S1631069105000934-si58.gif https://s3.amazonaws.com/prod-ucs-content-store-us-east/content/pii:S1631069105000934/STRIPIN/image/gif/bf2056281a6d3d00223e479f2f7bf258/si6.gif https://s3-eu-west-1.amazonaws.com/prod-ucs-content-store-eu-west/content/pii:S1631069105000934/STRIPIN/image/gif/bf2056281a6d3d00223e479f2f7bf258/si6.gif si58 si58.gif gif 138 14 16 ALTIMG 1-s2.0-S1631069105000934-si57.gif https://s3.amazonaws.com/prod-ucs-content-store-us-east/content/pii:S1631069105000934/STRIPIN/image/gif/6bf23f800fbec7fc7ecbc88f7d979f6c/si55.gif https://s3-eu-west-1.amazonaws.com/prod-ucs-content-store-eu-west/content/pii:S1631069105000934/STRIPIN/image/gif/6bf23f800fbec7fc7ecbc88f7d979f6c/si55.gif si57 si57.gif gif 149 14 19 ALTIMG 1-s2.0-S1631069105000934-si56.gif https://s3.amazonaws.com/prod-ucs-content-store-us-east/content/pii:S1631069105000934/STRIPIN/image/gif/bf2056281a6d3d00223e479f2f7bf258/si6.gif https://s3-eu-west-1.amazonaws.com/prod-ucs-content-store-eu-west/content/pii:S1631069105000934/STRIPIN/image/gif/bf2056281a6d3d00223e479f2f7bf258/si6.gif si56 si56.gif gif 138 14 16 ALTIMG 1-s2.0-S1631069105000934-si55.gif https://s3.amazonaws.com/prod-ucs-content-store-us-east/content/pii:S1631069105000934/STRIPIN/image/gif/6bf23f800fbec7fc7ecbc88f7d979f6c/si55.gif https://s3-eu-west-1.amazonaws.com/prod-ucs-content-store-eu-west/content/pii:S1631069105000934/STRIPIN/image/gif/6bf23f800fbec7fc7ecbc88f7d979f6c/si55.gif si55 si55.gif gif 149 14 19 ALTIMG 1-s2.0-S1631069105000934-si54.gif https://s3.amazonaws.com/prod-ucs-content-store-us-east/content/pii:S1631069105000934/STRIPIN/image/gif/6c02647d376ff88d508451c48894cd3c/si54.gif https://s3-eu-west-1.amazonaws.com/prod-ucs-content-store-eu-west/content/pii:S1631069105000934/STRIPIN/image/gif/6c02647d376ff88d508451c48894cd3c/si54.gif si54 si54.gif gif 216 12 44 ALTIMG 1-s2.0-S1631069105000934-si53.gif https://s3.amazonaws.com/prod-ucs-content-store-us-east/content/pii:S1631069105000934/STRIPIN/image/gif/6fdea784d23137941753b7fa45a827a5/si103.gif https://s3-eu-west-1.amazonaws.com/prod-ucs-content-store-eu-west/content/pii:S1631069105000934/STRIPIN/image/gif/6fdea784d23137941753b7fa45a827a5/si103.gif si53 si53.gif gif 150 12 16 ALTIMG 1-s2.0-S1631069105000934-si52.gif https://s3.amazonaws.com/prod-ucs-content-store-us-east/content/pii:S1631069105000934/STRIPIN/image/gif/659b9c409724b76672121b1f23aae8fe/si16.gif https://s3-eu-west-1.amazonaws.com/prod-ucs-content-store-eu-west/content/pii:S1631069105000934/STRIPIN/image/gif/659b9c409724b76672121b1f23aae8fe/si16.gif si52 si52.gif gif 154 14 17 ALTIMG 1-s2.0-S1631069105000934-si51.gif https://s3.amazonaws.com/prod-ucs-content-store-us-east/content/pii:S1631069105000934/STRIPIN/image/gif/0805e07957539a381f313c3a758fa828/si45.gif https://s3-eu-west-1.amazonaws.com/prod-ucs-content-store-eu-west/content/pii:S1631069105000934/STRIPIN/image/gif/0805e07957539a381f313c3a758fa828/si45.gif si51 si51.gif gif 445 11 129 ALTIMG 1-s2.0-S1631069105000934-si50.gif https://s3.amazonaws.com/prod-ucs-content-store-us-east/content/pii:S1631069105000934/STRIPIN/image/gif/0805e07957539a381f313c3a758fa828/si45.gif https://s3-eu-west-1.amazonaws.com/prod-ucs-content-store-eu-west/content/pii:S1631069105000934/STRIPIN/image/gif/0805e07957539a381f313c3a758fa828/si45.gif si50 si50.gif gif 445 11 129 ALTIMG 1-s2.0-S1631069105000934-si5.gif https://s3.amazonaws.com/prod-ucs-content-store-us-east/content/pii:S1631069105000934/STRIPIN/image/gif/6bf23f800fbec7fc7ecbc88f7d979f6c/si55.gif https://s3-eu-west-1.amazonaws.com/prod-ucs-content-store-eu-west/content/pii:S1631069105000934/STRIPIN/image/gif/6bf23f800fbec7fc7ecbc88f7d979f6c/si55.gif si5 si5.gif gif 149 14 19 ALTIMG 1-s2.0-S1631069105000934-si49.gif https://s3.amazonaws.com/prod-ucs-content-store-us-east/content/pii:S1631069105000934/STRIPIN/image/gif/16db622806a3c06beda2791e1587a52e/si94.gif https://s3-eu-west-1.amazonaws.com/prod-ucs-content-store-eu-west/content/pii:S1631069105000934/STRIPIN/image/gif/16db622806a3c06beda2791e1587a52e/si94.gif si49 si49.gif gif 270 11 71 ALTIMG 1-s2.0-S1631069105000934-si48.gif https://s3.amazonaws.com/prod-ucs-content-store-us-east/content/pii:S1631069105000934/STRIPIN/image/gif/a44c542bdcbfc77269c32b3efe81b763/si48.gif https://s3-eu-west-1.amazonaws.com/prod-ucs-content-store-eu-west/content/pii:S1631069105000934/STRIPIN/image/gif/a44c542bdcbfc77269c32b3efe81b763/si48.gif si48 si48.gif gif 1328 15 505 ALTIMG 1-s2.0-S1631069105000934-si47.gif https://s3.amazonaws.com/prod-ucs-content-store-us-east/content/pii:S1631069105000934/STRIPIN/image/gif/553b06930ff7b76cf6c34844b4111686/si97.gif https://s3-eu-west-1.amazonaws.com/prod-ucs-content-store-eu-west/content/pii:S1631069105000934/STRIPIN/image/gif/553b06930ff7b76cf6c34844b4111686/si97.gif si47 si47.gif gif 317 15 62 ALTIMG 1-s2.0-S1631069105000934-si46.gif https://s3.amazonaws.com/prod-ucs-content-store-us-east/content/pii:S1631069105000934/STRIPIN/image/gif/7073e906c44c919cceaeed0e4d07d698/si96.gif https://s3-eu-west-1.amazonaws.com/prod-ucs-content-store-eu-west/content/pii:S1631069105000934/STRIPIN/image/gif/7073e906c44c919cceaeed0e4d07d698/si96.gif si46 si46.gif gif 286 15 54 ALTIMG 1-s2.0-S1631069105000934-si45.gif https://s3.amazonaws.com/prod-ucs-content-store-us-east/content/pii:S1631069105000934/STRIPIN/image/gif/0805e07957539a381f313c3a758fa828/si45.gif https://s3-eu-west-1.amazonaws.com/prod-ucs-content-store-eu-west/content/pii:S1631069105000934/STRIPIN/image/gif/0805e07957539a381f313c3a758fa828/si45.gif si45 si45.gif gif 445 11 129 ALTIMG 1-s2.0-S1631069105000934-si44.gif https://s3.amazonaws.com/prod-ucs-content-store-us-east/content/pii:S1631069105000934/STRIPIN/image/gif/16db622806a3c06beda2791e1587a52e/si94.gif https://s3-eu-west-1.amazonaws.com/prod-ucs-content-store-eu-west/content/pii:S1631069105000934/STRIPIN/image/gif/16db622806a3c06beda2791e1587a52e/si94.gif si44 si44.gif gif 270 11 71 ALTIMG 1-s2.0-S1631069105000934-si43.gif https://s3.amazonaws.com/prod-ucs-content-store-us-east/content/pii:S1631069105000934/STRIPIN/image/gif/6bab3559d47264e807f82c29a28d6034/si43.gif https://s3-eu-west-1.amazonaws.com/prod-ucs-content-store-eu-west/content/pii:S1631069105000934/STRIPIN/image/gif/6bab3559d47264e807f82c29a28d6034/si43.gif si43 si43.gif gif 292 18 68 ALTIMG 1-s2.0-S1631069105000934-si42.gif https://s3.amazonaws.com/prod-ucs-content-store-us-east/content/pii:S1631069105000934/STRIPIN/image/gif/a60490ad523bddd1139f6091c319f824/si42.gif https://s3-eu-west-1.amazonaws.com/prod-ucs-content-store-eu-west/content/pii:S1631069105000934/STRIPIN/image/gif/a60490ad523bddd1139f6091c319f824/si42.gif si42 si42.gif gif 186 14 27 ALTIMG 1-s2.0-S1631069105000934-si41.gif https://s3.amazonaws.com/prod-ucs-content-store-us-east/content/pii:S1631069105000934/STRIPIN/image/gif/ed6058c152f009805de26f653effc52d/si91.gif https://s3-eu-west-1.amazonaws.com/prod-ucs-content-store-eu-west/content/pii:S1631069105000934/STRIPIN/image/gif/ed6058c152f009805de26f653effc52d/si91.gif si41 si41.gif gif 500 16 145 ALTIMG 1-s2.0-S1631069105000934-si40.gif https://s3.amazonaws.com/prod-ucs-content-store-us-east/content/pii:S1631069105000934/STRIPIN/image/gif/4567c944fcb43d415d228fe47fe2c7ec/si90.gif https://s3-eu-west-1.amazonaws.com/prod-ucs-content-store-eu-west/content/pii:S1631069105000934/STRIPIN/image/gif/4567c944fcb43d415d228fe47fe2c7ec/si90.gif si40 si40.gif gif 347 16 86 ALTIMG 1-s2.0-S1631069105000934-si4.gif https://s3.amazonaws.com/prod-ucs-content-store-us-east/content/pii:S1631069105000934/STRIPIN/image/gif/0805e07957539a381f313c3a758fa828/si45.gif https://s3-eu-west-1.amazonaws.com/prod-ucs-content-store-eu-west/content/pii:S1631069105000934/STRIPIN/image/gif/0805e07957539a381f313c3a758fa828/si45.gif si4 true si4.gif gif 445 11 129 ALTIMG 1-s2.0-S1631069105000934-si39.gif https://s3.amazonaws.com/prod-ucs-content-store-us-east/content/pii:S1631069105000934/STRIPIN/image/gif/a60490ad523bddd1139f6091c319f824/si42.gif https://s3-eu-west-1.amazonaws.com/prod-ucs-content-store-eu-west/content/pii:S1631069105000934/STRIPIN/image/gif/a60490ad523bddd1139f6091c319f824/si42.gif si39 si39.gif gif 186 14 27 ALTIMG 1-s2.0-S1631069105000934-si38.gif https://s3.amazonaws.com/prod-ucs-content-store-us-east/content/pii:S1631069105000934/STRIPIN/image/gif/6014f6d98e1a64f62d83341008b8cf5f/si38.gif https://s3-eu-west-1.amazonaws.com/prod-ucs-content-store-eu-west/content/pii:S1631069105000934/STRIPIN/image/gif/6014f6d98e1a64f62d83341008b8cf5f/si38.gif si38 si38.gif gif 347 14 102 ALTIMG 1-s2.0-S1631069105000934-si37.gif https://s3.amazonaws.com/prod-ucs-content-store-us-east/content/pii:S1631069105000934/STRIPIN/image/gif/ad23583e51a1acd2c3287bf4d66c8981/si37.gif https://s3-eu-west-1.amazonaws.com/prod-ucs-content-store-eu-west/content/pii:S1631069105000934/STRIPIN/image/gif/ad23583e51a1acd2c3287bf4d66c8981/si37.gif si37 si37.gif gif 414 14 106 ALTIMG 1-s2.0-S1631069105000934-si36.gif https://s3.amazonaws.com/prod-ucs-content-store-us-east/content/pii:S1631069105000934/STRIPIN/image/gif/fd1ad097c5651654b8c30d7f83551243/si36.gif https://s3-eu-west-1.amazonaws.com/prod-ucs-content-store-eu-west/content/pii:S1631069105000934/STRIPIN/image/gif/fd1ad097c5651654b8c30d7f83551243/si36.gif si36 si36.gif gif 203 14 37 ALTIMG 1-s2.0-S1631069105000934-si35.gif https://s3.amazonaws.com/prod-ucs-content-store-us-east/content/pii:S1631069105000934/STRIPIN/image/gif/f967d478ba53ffa3711a8ceb7ea28218/si35.gif https://s3-eu-west-1.amazonaws.com/prod-ucs-content-store-eu-west/content/pii:S1631069105000934/STRIPIN/image/gif/f967d478ba53ffa3711a8ceb7ea28218/si35.gif si35 si35.gif gif 350 15 84 ALTIMG 1-s2.0-S1631069105000934-si34.gif https://s3.amazonaws.com/prod-ucs-content-store-us-east/content/pii:S1631069105000934/STRIPIN/image/gif/067e50c44da5cddb925d98b3a45dfafd/si34.gif https://s3-eu-west-1.amazonaws.com/prod-ucs-content-store-eu-west/content/pii:S1631069105000934/STRIPIN/image/gif/067e50c44da5cddb925d98b3a45dfafd/si34.gif si34 si34.gif gif 279 14 76 ALTIMG 1-s2.0-S1631069105000934-si33.gif https://s3.amazonaws.com/prod-ucs-content-store-us-east/content/pii:S1631069105000934/STRIPIN/image/gif/a2663ce7a635591f036fb00bdbca205d/si33.gif https://s3-eu-west-1.amazonaws.com/prod-ucs-content-store-eu-west/content/pii:S1631069105000934/STRIPIN/image/gif/a2663ce7a635591f036fb00bdbca205d/si33.gif si33 si33.gif gif 243 14 58 ALTIMG 1-s2.0-S1631069105000934-si32.gif https://s3.amazonaws.com/prod-ucs-content-store-us-east/content/pii:S1631069105000934/STRIPIN/image/gif/341187c359e20df0aaca0fa71c345394/si32.gif https://s3-eu-west-1.amazonaws.com/prod-ucs-content-store-eu-west/content/pii:S1631069105000934/STRIPIN/image/gif/341187c359e20df0aaca0fa71c345394/si32.gif si32 si32.gif gif 249 15 57 ALTIMG 1-s2.0-S1631069105000934-si31.gif https://s3.amazonaws.com/prod-ucs-content-store-us-east/content/pii:S1631069105000934/STRIPIN/image/gif/7a62ceba114e6995aac8b9344f25a0cf/si31.gif https://s3-eu-west-1.amazonaws.com/prod-ucs-content-store-eu-west/content/pii:S1631069105000934/STRIPIN/image/gif/7a62ceba114e6995aac8b9344f25a0cf/si31.gif si31 si31.gif gif 288 14 65 ALTIMG 1-s2.0-S1631069105000934-si30.gif https://s3.amazonaws.com/prod-ucs-content-store-us-east/content/pii:S1631069105000934/STRIPIN/image/gif/92a6a4f420b91e3a7f3789b41bf6e0aa/si30.gif https://s3-eu-west-1.amazonaws.com/prod-ucs-content-store-eu-west/content/pii:S1631069105000934/STRIPIN/image/gif/92a6a4f420b91e3a7f3789b41bf6e0aa/si30.gif si30 si30.gif gif 227 14 54 ALTIMG 1-s2.0-S1631069105000934-si3.gif https://s3.amazonaws.com/prod-ucs-content-store-us-east/content/pii:S1631069105000934/STRIPIN/image/gif/16db622806a3c06beda2791e1587a52e/si94.gif https://s3-eu-west-1.amazonaws.com/prod-ucs-content-store-eu-west/content/pii:S1631069105000934/STRIPIN/image/gif/16db622806a3c06beda2791e1587a52e/si94.gif si3 true si3.gif gif 270 11 71 ALTIMG 1-s2.0-S1631069105000934-si29.gif https://s3.amazonaws.com/prod-ucs-content-store-us-east/content/pii:S1631069105000934/STRIPIN/image/gif/73877922baf4a1ee0a6c227b44f43e62/si29.gif https://s3-eu-west-1.amazonaws.com/prod-ucs-content-store-eu-west/content/pii:S1631069105000934/STRIPIN/image/gif/73877922baf4a1ee0a6c227b44f43e62/si29.gif si29 si29.gif gif 225 14 53 ALTIMG 1-s2.0-S1631069105000934-si28.gif https://s3.amazonaws.com/prod-ucs-content-store-us-east/content/pii:S1631069105000934/STRIPIN/image/gif/ee77d52f9afbd10ce4167bc27cc47a48/si28.gif https://s3-eu-west-1.amazonaws.com/prod-ucs-content-store-eu-west/content/pii:S1631069105000934/STRIPIN/image/gif/ee77d52f9afbd10ce4167bc27cc47a48/si28.gif si28 si28.gif gif 282 14 64 ALTIMG 1-s2.0-S1631069105000934-si27.gif https://s3.amazonaws.com/prod-ucs-content-store-us-east/content/pii:S1631069105000934/STRIPIN/image/gif/98de865c368aa168a3bf86e95420631d/si27.gif https://s3-eu-west-1.amazonaws.com/prod-ucs-content-store-eu-west/content/pii:S1631069105000934/STRIPIN/image/gif/98de865c368aa168a3bf86e95420631d/si27.gif si27 si27.gif gif 277 14 63 ALTIMG 1-s2.0-S1631069105000934-si26.gif https://s3.amazonaws.com/prod-ucs-content-store-us-east/content/pii:S1631069105000934/STRIPIN/image/gif/e4f42fb15103630882a55b87e9cbd2c2/si26.gif https://s3-eu-west-1.amazonaws.com/prod-ucs-content-store-eu-west/content/pii:S1631069105000934/STRIPIN/image/gif/e4f42fb15103630882a55b87e9cbd2c2/si26.gif si26 si26.gif gif 202 15 50 ALTIMG 1-s2.0-S1631069105000934-si25.gif https://s3.amazonaws.com/prod-ucs-content-store-us-east/content/pii:S1631069105000934/STRIPIN/image/gif/d42a847b5b4441e602765f3aa20137ce/si25.gif https://s3-eu-west-1.amazonaws.com/prod-ucs-content-store-eu-west/content/pii:S1631069105000934/STRIPIN/image/gif/d42a847b5b4441e602765f3aa20137ce/si25.gif si25 si25.gif gif 790 17 273 ALTIMG 1-s2.0-S1631069105000934-si24.gif https://s3.amazonaws.com/prod-ucs-content-store-us-east/content/pii:S1631069105000934/STRIPIN/image/gif/4ec4d1bab6a39fd7261cf99abb0389fe/si74.gif https://s3-eu-west-1.amazonaws.com/prod-ucs-content-store-eu-west/content/pii:S1631069105000934/STRIPIN/image/gif/4ec4d1bab6a39fd7261cf99abb0389fe/si74.gif si24 si24.gif gif 733 16 273 ALTIMG 1-s2.0-S1631069105000934-si23.gif https://s3.amazonaws.com/prod-ucs-content-store-us-east/content/pii:S1631069105000934/STRIPIN/image/gif/80211424f9c9745e7d9d5314bb4ae868/si73.gif https://s3-eu-west-1.amazonaws.com/prod-ucs-content-store-eu-west/content/pii:S1631069105000934/STRIPIN/image/gif/80211424f9c9745e7d9d5314bb4ae868/si73.gif si23 si23.gif gif 661 22 202 ALTIMG 1-s2.0-S1631069105000934-si22.gif https://s3.amazonaws.com/prod-ucs-content-store-us-east/content/pii:S1631069105000934/STRIPIN/image/gif/cef4d37e0a29634832eb222cb27f29fb/si72.gif https://s3-eu-west-1.amazonaws.com/prod-ucs-content-store-eu-west/content/pii:S1631069105000934/STRIPIN/image/gif/cef4d37e0a29634832eb222cb27f29fb/si72.gif si22 si22.gif gif 709 22 219 ALTIMG 1-s2.0-S1631069105000934-si21.gif https://s3.amazonaws.com/prod-ucs-content-store-us-east/content/pii:S1631069105000934/STRIPIN/image/gif/4dd440b559cb1e59908f3e857cbccb54/si71.gif https://s3-eu-west-1.amazonaws.com/prod-ucs-content-store-eu-west/content/pii:S1631069105000934/STRIPIN/image/gif/4dd440b559cb1e59908f3e857cbccb54/si71.gif si21 si21.gif gif 223 15 37 ALTIMG 1-s2.0-S1631069105000934-si20.gif https://s3.amazonaws.com/prod-ucs-content-store-us-east/content/pii:S1631069105000934/STRIPIN/image/gif/762731b7dcee9c6e2845c1831a7fe29b/si20.gif https://s3-eu-west-1.amazonaws.com/prod-ucs-content-store-eu-west/content/pii:S1631069105000934/STRIPIN/image/gif/762731b7dcee9c6e2845c1831a7fe29b/si20.gif si20 si20.gif gif 810 16 258 ALTIMG 1-s2.0-S1631069105000934-si2.gif https://s3.amazonaws.com/prod-ucs-content-store-us-east/content/pii:S1631069105000934/STRIPIN/image/gif/0805e07957539a381f313c3a758fa828/si45.gif https://s3-eu-west-1.amazonaws.com/prod-ucs-content-store-eu-west/content/pii:S1631069105000934/STRIPIN/image/gif/0805e07957539a381f313c3a758fa828/si45.gif si2 true si2.gif gif 445 11 129 ALTIMG 1-s2.0-S1631069105000934-si19.gif https://s3.amazonaws.com/prod-ucs-content-store-us-east/content/pii:S1631069105000934/STRIPIN/image/gif/c9a6384ec4173697b4c917a96c9a83c6/si69.gif https://s3-eu-west-1.amazonaws.com/prod-ucs-content-store-eu-west/content/pii:S1631069105000934/STRIPIN/image/gif/c9a6384ec4173697b4c917a96c9a83c6/si69.gif si19 si19.gif gif 531 22 138 ALTIMG 1-s2.0-S1631069105000934-si17.gif https://s3.amazonaws.com/prod-ucs-content-store-us-east/content/pii:S1631069105000934/STRIPIN/image/gif/7073e906c44c919cceaeed0e4d07d698/si96.gif https://s3-eu-west-1.amazonaws.com/prod-ucs-content-store-eu-west/content/pii:S1631069105000934/STRIPIN/image/gif/7073e906c44c919cceaeed0e4d07d698/si96.gif si17 si17.gif gif 286 15 54 ALTIMG 1-s2.0-S1631069105000934-si16.gif https://s3.amazonaws.com/prod-ucs-content-store-us-east/content/pii:S1631069105000934/STRIPIN/image/gif/659b9c409724b76672121b1f23aae8fe/si16.gif https://s3-eu-west-1.amazonaws.com/prod-ucs-content-store-eu-west/content/pii:S1631069105000934/STRIPIN/image/gif/659b9c409724b76672121b1f23aae8fe/si16.gif si16 si16.gif gif 154 14 17 ALTIMG 1-s2.0-S1631069105000934-si15.gif https://s3.amazonaws.com/prod-ucs-content-store-us-east/content/pii:S1631069105000934/STRIPIN/image/gif/2e250f20e940747461381baa3b7bd753/si65.gif https://s3-eu-west-1.amazonaws.com/prod-ucs-content-store-eu-west/content/pii:S1631069105000934/STRIPIN/image/gif/2e250f20e940747461381baa3b7bd753/si65.gif si15 si15.gif gif 148 14 16 ALTIMG 1-s2.0-S1631069105000934-si14.gif https://s3.amazonaws.com/prod-ucs-content-store-us-east/content/pii:S1631069105000934/STRIPIN/image/gif/08b033f4e1967f50507289e8083d8ba8/si64.gif https://s3-eu-west-1.amazonaws.com/prod-ucs-content-store-eu-west/content/pii:S1631069105000934/STRIPIN/image/gif/08b033f4e1967f50507289e8083d8ba8/si64.gif si14 si14.gif gif 137 11 14 ALTIMG 1-s2.0-S1631069105000934-si13.gif https://s3.amazonaws.com/prod-ucs-content-store-us-east/content/pii:S1631069105000934/STRIPIN/image/gif/40c3b0b40d9c5ed392e359bc622fd9c5/si13.gif https://s3-eu-west-1.amazonaws.com/prod-ucs-content-store-eu-west/content/pii:S1631069105000934/STRIPIN/image/gif/40c3b0b40d9c5ed392e359bc622fd9c5/si13.gif si13 si13.gif gif 133 11 13 ALTIMG 1-s2.0-S1631069105000934-si12.gif https://s3.amazonaws.com/prod-ucs-content-store-us-east/content/pii:S1631069105000934/STRIPIN/image/gif/8eec95c96810cc46168be99368205e35/si62.gif https://s3-eu-west-1.amazonaws.com/prod-ucs-content-store-eu-west/content/pii:S1631069105000934/STRIPIN/image/gif/8eec95c96810cc46168be99368205e35/si62.gif si12 si12.gif gif 152 14 16 ALTIMG 1-s2.0-S1631069105000934-si11.gif https://s3.amazonaws.com/prod-ucs-content-store-us-east/content/pii:S1631069105000934/STRIPIN/image/gif/101253f9711f262efb1326619576a584/si11.gif https://s3-eu-west-1.amazonaws.com/prod-ucs-content-store-eu-west/content/pii:S1631069105000934/STRIPIN/image/gif/101253f9711f262efb1326619576a584/si11.gif si11 si11.gif gif 148 14 15 ALTIMG 1-s2.0-S1631069105000934-si104.gif https://s3.amazonaws.com/prod-ucs-content-store-us-east/content/pii:S1631069105000934/STRIPIN/image/gif/6c02647d376ff88d508451c48894cd3c/si54.gif https://s3-eu-west-1.amazonaws.com/prod-ucs-content-store-eu-west/content/pii:S1631069105000934/STRIPIN/image/gif/6c02647d376ff88d508451c48894cd3c/si54.gif si104 si104.gif gif 216 12 44 ALTIMG 1-s2.0-S1631069105000934-si103.gif https://s3.amazonaws.com/prod-ucs-content-store-us-east/content/pii:S1631069105000934/STRIPIN/image/gif/6fdea784d23137941753b7fa45a827a5/si103.gif https://s3-eu-west-1.amazonaws.com/prod-ucs-content-store-eu-west/content/pii:S1631069105000934/STRIPIN/image/gif/6fdea784d23137941753b7fa45a827a5/si103.gif si103 si103.gif gif 150 12 16 ALTIMG 1-s2.0-S1631069105000934-si102.gif https://s3.amazonaws.com/prod-ucs-content-store-us-east/content/pii:S1631069105000934/STRIPIN/image/gif/659b9c409724b76672121b1f23aae8fe/si16.gif https://s3-eu-west-1.amazonaws.com/prod-ucs-content-store-eu-west/content/pii:S1631069105000934/STRIPIN/image/gif/659b9c409724b76672121b1f23aae8fe/si16.gif si102 si102.gif gif 154 14 17 ALTIMG 1-s2.0-S1631069105000934-si101.gif https://s3.amazonaws.com/prod-ucs-content-store-us-east/content/pii:S1631069105000934/STRIPIN/image/gif/0805e07957539a381f313c3a758fa828/si45.gif https://s3-eu-west-1.amazonaws.com/prod-ucs-content-store-eu-west/content/pii:S1631069105000934/STRIPIN/image/gif/0805e07957539a381f313c3a758fa828/si45.gif si101 si101.gif gif 445 11 129 ALTIMG 1-s2.0-S1631069105000934-si100.gif https://s3.amazonaws.com/prod-ucs-content-store-us-east/content/pii:S1631069105000934/STRIPIN/image/gif/0805e07957539a381f313c3a758fa828/si45.gif https://s3-eu-west-1.amazonaws.com/prod-ucs-content-store-eu-west/content/pii:S1631069105000934/STRIPIN/image/gif/0805e07957539a381f313c3a758fa828/si45.gif si100 si100.gif gif 445 11 129 ALTIMG 1-s2.0-S1631069105000934-si10.gif https://s3.amazonaws.com/prod-ucs-content-store-us-east/content/pii:S1631069105000934/STRIPIN/image/gif/b7615e426c3f0469395d13482d6ef292/si10.gif https://s3-eu-west-1.amazonaws.com/prod-ucs-content-store-eu-west/content/pii:S1631069105000934/STRIPIN/image/gif/b7615e426c3f0469395d13482d6ef292/si10.gif si10 si10.gif gif 880 22 260 ALTIMG 1-s2.0-S1631069105000934-si1.gif https://s3.amazonaws.com/prod-ucs-content-store-us-east/content/pii:S1631069105000934/STRIPIN/image/gif/16db622806a3c06beda2791e1587a52e/si94.gif https://s3-eu-west-1.amazonaws.com/prod-ucs-content-store-eu-west/content/pii:S1631069105000934/STRIPIN/image/gif/16db622806a3c06beda2791e1587a52e/si94.gif si1 true si1.gif gif 270 11 71 ALTIMG 1-s2.0-S1631069105000934-gr001.jpg https://s3.amazonaws.com/prod-ucs-content-store-us-east/content/pii:S1631069105000934/fgr001/DOWNSAMPLED/image/jpeg/73ebbb3658a93aadb6dbbe385daed84a/gr001.jpg https://s3-eu-west-1.amazonaws.com/prod-ucs-content-store-eu-west/content/pii:S1631069105000934/fgr001/DOWNSAMPLED/image/jpeg/73ebbb3658a93aadb6dbbe385daed84a/gr001.jpg gr001 gr001.jpg jpg 95706 619 533 IMAGE-DOWNSAMPLED 1-s2.0-S1631069105000934-gr001.sml https://s3.amazonaws.com/prod-ucs-content-store-us-east/content/pii:S1631069105000934/fgr001/THUMBNAIL/image/gif/6ec6fa4f14cd51b9e2704d95a621b608/gr001.sml https://s3-eu-west-1.amazonaws.com/prod-ucs-content-store-eu-west/content/pii:S1631069105000934/fgr001/THUMBNAIL/image/gif/6ec6fa4f14cd51b9e2704d95a621b608/gr001.sml gr001 gr001.sml sml 3023 93 80 IMAGE-THUMBNAIL CRASS3 2349 S1631-0691(05)00093-4 10.1016/j.crvi.2005.05.005 Acad\u00e9mie des sciences Fig. 1 Evolution of the Meinhardt system. This figure represents, for each cell, the values of activator according to a hot color range (black=lower value, white=higher value). Time=500 cycles with step time 0.1. (A) Static structure 16\u00d716=256 cells. (B) Static structure 32\u00d732=1024 cells. We notice the arc-of-circle patterns whose centre is the upper left corner. (C) Static structure 128\u00d7128=16 384 cells. The system, initiated at the upper left corner of the cell matrix, has not achieved its expansion on the whole structure. (D) Dynamic structure from 8\u00d74=32 to 128\u00d7128=16 384 cells, with a doubling of the cells number every 50 cycles. We notice the aperiodicity and the phenotypic complexity of the pattern. Evolution du mod\u00e8le de Meinhardt. Cette figure repr\u00e9sente pour chaque cellule les valeurs de l'activateur selon une gamme de couleurs chaudes (noir = valeur inf\u00e9rieure, blanc = valeur sup\u00e9rieure). Temps = 500 cycles par pas de 0.1. Fig. 1A (en haut \u00e0 gauche) : structure statique de 16\u00d716=256 cellules. Fig. 1B (en haut \u00e0 droite) : structure statique de 32\u00d732=1024 cellules. On voit la structure en arcs de cercle centr\u00e9s sur le coin sup\u00e9rieur gauche. Fig. 1C (en bas \u00e0 gauche) : structure statique de 128\u00d7428=16 384 cellules. Le syst\u00e8me, initi\u00e9 au coin sup\u00e9rieur gauche de la matrice de cellules, n'a pas achev\u00e9 son expansion sur la totalit\u00e9 de la structure. Fig. 1D (en bas \u00e0 droite) : structure dynamique de 8\u00d74=32 \u00e0 128\u00d7128=16 384 cellules avec un doublement du nombre de cellules tous les 50 cycles. On remarquera la non-p\u00e9riodicit\u00e9 et la complexit\u00e9 ph\u00e9notypique du patron obtenu. Biological modelling / Biomod\u00e9lisation Emergence of complex patterns induced by Dynamic Systems implemented in Dynamic Structures (DS)2 \u00c9mergence de patrons complexes induits par des syst\u00e8mes dynamiques impl\u00e9ment\u00e9s dans des structures dynamiques (SD)2 Presented by Pierre Auger Jacques-Deric Rouault jacques.rouault@ibaic.u-psud.fr Laboratoire de neurobiologie de l'apprentissage, de la m\u00e9moire et de la communication, CNRS UMR 8620, universit\u00e9 Paris-Sud, b\u00e2t. 446, 91405 Orsay cedex, France Abstract We present the evolution of the simple system of Meinhardt implemented in both static or dynamic two-dimensional structures of almost-squared cells. In a static structure of 8 \u00d7 4 = 32 to 128 \u00d7 128 = 16 384 cells, the pattern observed is periodic. An algorithm allows us to divide the cells following the greater size, and to define a dynamic structure. The implementation of the same Meinhardt system in this dynamic structure varying from 32 to 16 384 cells and a context of the same genotypic complexity for the model provides aperiodic patterns, with a higher phenotypic complexity than those observed in static structures, while the number of computations is comparable. We define that emergence occurs each time the ratio of phenotypic/genotypic complexities increases. To cite this article: J.-D. Rouault, C. R. Biologies 328 (2005). R\u00e9sum\u00e9 Nous pr\u00e9sentons l'\u00e9volution du syst\u00e8me simple de Meinhardt impl\u00e9ment\u00e9 dans une structure bidimensionnelle statique ou dynamique de cellules quasi carr\u00e9es. Dans une structure statique de 8 \u00d7 4 = 32 \u00e0 128 \u00d7 128 = 16 384 cellules, le patron obtenu est p\u00e9riodique. Un algorithme permet de diviser les cellules dans le sens de leur plus grande longueur, et de d\u00e9finir une structure dynamique. L'impl\u00e9mentation du m\u00eame syst\u00e8me de Meinhardt dans cette structure dynamique variant de 32 \u00e0 16 384 cellules et dans un contexte de m\u00eame complexit\u00e9 g\u00e9notypique du mod\u00e8le induit des patrons ap\u00e9riodiques de complexit\u00e9 ph\u00e9notypique sup\u00e9rieure \u00e0 ceux produits par le m\u00eame syst\u00e8me impl\u00e9ment\u00e9 dans les structures statiques, alors que la quantit\u00e9 de calculs mise en jeu est comparable. Nous d\u00e9finissons qu'il y a \u00e9mergence chaque fois que le rapport des complexit\u00e9s ph\u00e9notypique/g\u00e9notypique s'accro\u00eet. Pour citer cet article : J.-D. Rouault, C. R. Biologies 328 (2005). Keywords Almost-squares Complexity Pattern formation Mots-cl\u00e9s Complexit\u00e9 Formation des patrons Quasi-carr\u00e9s Version fran\u00e7aise abr\u00e9g\u00e9e 1 Introduction : le concept d'\u00e9mergence Les notions d'\u00e9mergence ou de propri\u00e9t\u00e9s \u00e9mergentes sont souvent employ\u00e9es pour rendre compte de ph\u00e9nom\u00e8nes observ\u00e9s en sciences exp\u00e9rimentales. On consid\u00e8re que des ph\u00e9nom\u00e8nes tels que les cellules de B\u00e9nard en thermodynamique, les constructions et les comportements des insectes sociaux (l'intelligence de la fourmili\u00e8re est la somme de la stupidit\u00e9 de toutes les fourmis [1]), les d\u00e9placements collectifs de vols d'oiseaux ou de bancs de poissons et m\u00eame le syst\u00e8me immunitaire [2] pr\u00e9sentent un caract\u00e8re \u00e9mergent, tout comme des ph\u00e9nom\u00e8nes sociaux ou \u00e9conomiques (embouteillages, synchronisation des applaudissements), ou le comportement des syst\u00e8mes informatiques (circulation de l'information sur l'Internet, syst\u00e8mes multi-agents, automates cellulaires... [3]). Des ph\u00e9nom\u00e8nes complexes tels que l'apparition de la vie sur terre, l'\u00e9volution de nouvelles esp\u00e8ces ou la structure de la pens\u00e9e cognitive sont consid\u00e9r\u00e9s comme des ph\u00e9nom\u00e8nes typiques d'\u00e9mergence [4]. Depuis quelques ann\u00e9es, ce concept prend une importance certaine dans les sciences du vivant, de la cognition, en intelligence artificielle. Mais rares sont les aventuriers qui se risquent \u00e0 le d\u00e9finir [5]. Par d\u00e9finition, l'\u00e9mergence est l'\u00e9tat de ce qui \u00e9merge, \u00e0 savoir qui d\u00e9passe le niveau moyen, retient l'attention, sort du lot... Nous retrouvons alors le concept de saillance, utilis\u00e9 pour la reconnaissance des formes [6]. La notion d'\u00e9mergence appara\u00eet \u00e9galement dans l'assertion Le tout est plus que la somme de ses parties (contre-pied du principe Le tout est la somme des parties, attribu\u00e9 \u00e0 Aristote), qui \u00e9voque \u00e9galement des m\u00e9canismes de non-lin\u00e9arit\u00e9 ou d'interaction. L'\u00e9mergence est classiquement d\u00e9finie comme l'apparition d'un syst\u00e8me qui ne peut pas \u00eatre pr\u00e9dit ou expliqu\u00e9 \u00e0 partir des conditions ant\u00e9c\u00e9dentes [7]. Selon Georg\u00e9 [2], le syst\u00e8me ne doit et ne peut pas contenir explicitement la connaissance du but du syst\u00e8me (i.e. de la fonction \u00e9mergente) et les moyens d'y arriver. Van de Vijver [8] rappelle que l'\u00e9mergence est un processus par lequel de nouvelles structures et fonctions font leur apparition. L'\u00e9mergence renvoie \u00e0 ce qui appara\u00eet comme nouveau, inattendu, irr\u00e9versible et significatif, ou est tel \u00e0 cause de l'impossibilit\u00e9 de l'expliquer de mani\u00e8re r\u00e9ductive. Certaines de ces d\u00e9finitions pr\u00e9sentent un caract\u00e8re n\u00e9gatif \u00e9vident, ce qui ne rend pas le concept d'\u00e9mergence tr\u00e8s lisible. Les propri\u00e9t\u00e9s d'impr\u00e9visibilit\u00e9 ou de nouveaut\u00e9 qui caract\u00e9risent l'\u00e9mergence pr\u00e9sentent un aspect temporel incompatible avec une d\u00e9finition absolue. Pour certains, la notion d'\u00e9mergence ne r\u00e9pond pas \u00e0 la rigueur scientifique : Une chose sort d'une autre, sans \u00eatre \u00e0 proprement parler produite ou caus\u00e9e par elle. La notion est pour le moins obscure [9]. D'apr\u00e8s Nesle, le terme d'auto-organisation d\u00e9signe l'\u00e9mergence spontan\u00e9e et dynamique d'une structure spatiale, d'un rythme ou d'une structure spatio-temporelle (se d\u00e9veloppant dans l'espace et le temps) sous l'effet conjoint d'un apport ext\u00e9rieur d'\u00e9nergie et des interactions \u00e0 l'\u0153uvre entre les \u00e9l\u00e9ments d'un syst\u00e8me consid\u00e9r\u00e9 [10]. Selon Ricard [11], si un syst\u00e8me pr\u00e9sente un nombre de degr\u00e9s de libert\u00e9 ou une entropie sup\u00e9rieurs \u00e0 l'union des sous-syst\u00e8mes qui le composent, il est alors d\u00e9fini comme un syst\u00e8me \u00e9mergent ou complexe, ces deux termes \u00e9tant alors \u00e9quivalents. Dans l'expos\u00e9 sur l'\u00e9mergence propos\u00e9 par l'\u00e9quipe SMAC et J.-P. Georg\u00e9 [2,3], la notion d'\u00e9mergence est caract\u00e9ris\u00e9e par des propri\u00e9t\u00e9s telles que la nouveaut\u00e9, l'auto-organisation, l'irr\u00e9ductibilit\u00e9, l'interd\u00e9pendance des niveaux, mais n'est pas d\u00e9finie formellement, m\u00eame dans un cadre strictement informatique. Cariani [12] d\u00e9finit l'\u00e9mergence comme le processus par lequel de nouvelles structures ou fonctions se mettent \u00e0 exister. Il distingue l'\u00e9mergence combinatoire o\u00f9 la nouveaut\u00e9 provient de nouvelles combinaisons d'\u00e9l\u00e9ments pr\u00e9existants et l'\u00e9mergence cr\u00e9atrice, o\u00f9 la nouveaut\u00e9 na\u00eet de la cr\u00e9ation de nouveaux genres d'\u00e9l\u00e9ments. Bonabeau et Dessalles [13] distinguent deux autres types d'\u00e9mergence : l'\u00e9mergence de structures de degr\u00e9 plus \u00e9lev\u00e9 EHS, et l'\u00e9mergence relative \u00e0 un mod\u00e8le ERM. Le premier type se produit quand un ph\u00e9nom\u00e8ne appara\u00eet \u00e0 un niveau L h \u00e0 partir de constituants et de processus d\u00e9finis et en place \u00e0 un niveau inf\u00e9rieur L i , et quand les propri\u00e9t\u00e9s de L h sont difficiles ou impossibles \u00e0 d\u00e9duire des propri\u00e9t\u00e9s des constituants et des processus de L i . Suivant la seconde d\u00e9finition, il y a \u00e9mergence quand le comportement d'un syst\u00e8me naturel ne peut plus \u00eatre expliqu\u00e9 par un mod\u00e8le de ce syst\u00e8me (il d\u00e9vie ou bifurque des pr\u00e9dictions du mod\u00e8le), et un nouveau mod\u00e8le est n\u00e9cessaire. En consid\u00e9rant que les mod\u00e8les scientifiques jouent le r\u00f4le de d\u00e9tecteurs conceptuels, les auteurs montrent que ERM est un cas particulier de EHS. Trop souvent, le concept d'\u00e9mergence a \u00e9t\u00e9 utilis\u00e9 de fa\u00e7on, sinon abusive, en tout cas dans un contexte scientifique flou rendant sa compr\u00e9hension et son utilisation difficile [2]. Dans cet article, nous allons pr\u00e9senter un mod\u00e8le math\u00e9matique de morphogen\u00e8se et montrer sous quelles conditions des patrons de complexit\u00e9 sup\u00e9rieure peuvent \u00e9merger de ce mod\u00e8le. L'ambition de cette contribution est de proposer, dans le contexte relativement limit\u00e9 de ce mod\u00e8le, une d\u00e9finition plus rigoureuse du concept d'\u00e9mergence. 2 Le syst\u00e8me dynamique Nous d\u00e9finirons un mod\u00e8le comme l'impl\u00e9mentation d'un syst\u00e8me (tel que le syst\u00e8me de Turing ou le syst\u00e8me simple de Meinhardt pr\u00e9cis\u00e9 ci-dessous) dans une structure cellulaire statique ou dynamique. Le syst\u00e8me simple de Meinhardt (mod\u00e8le 3.1 de 1982 [14], \u00e9quation 2.1b de 1995\u20132003 [15]) fait intervenir deux agents : l'activateur A et l'inhibiteur H. Ce mod\u00e8le fait partie de la classe des mod\u00e8les de Gierer\u2013Meinhardt [16,17], qui sont eux-m\u00eames des mod\u00e8les de Turing. Les deux agents interagissent dans chacune des cellules du syst\u00e8me et diffusent entre les cellules voisines. L'\u00e9volution au cours du temps des concentrations a et h est d\u00e9finie par les \u00e9quations : \u2202 a / \u2202 t = s ( a 2 / h + b a ) \u2212 r a a + d a \u2202 2 a / \u2202 x 2 \u2202 h / \u2202 t = s ( a 2 + b h ) \u2212 r h h + d h \u2202 2 h / \u2202 x 2 Ce syst\u00e8me comporte sept param\u00e8tres : s (valeur fixe du substrat), b a et b h (production de base de l'activateur et de l'inhibiteur), r a et r h (taux d'\u00e9limination de l'activateur et de l'inhibiteur) et d a et d h (coefficients de diffusion de l'activateur et de l'inhibiteur). L'\u00e9tat d'\u00e9quilibre ( a a , h h ) d'une cellule du syst\u00e8me est d\u00e9fini, en absence de diffusion avec les cellules voisines, par l'\u00e9quation du 3e degr\u00e9 : a a 3 \u2212 [ ( r h + s b a ) / r a ] a a 2 + b h a a \u2212 s b a b h / r a = 0 h h = s ( a a 2 + b h ) / r h Cette \u00e9quation est r\u00e9solue num\u00e9riquement en ne retenant que la racine non complexe. Ce syst\u00e8me dynamique est simul\u00e9 num\u00e9riquement sur la base du syst\u00e8me it\u00e9ratif ( a , h ) \u2192 ( a \u2032 , h \u2032 ) \u2192 ( a \u2033 , h \u2033 ) = nouvelle valeur de ( a , h ) pour un pas de temps \u0394t. a \u2032 = a + [ s ( a 2 / h + b a ) \u2212 r a a ] \u0394 t h \u2032 = h + [ s ( a 2 + b h ) \u2212 r h h ] \u0394 t a \u2033 = a \u2032 + d a [ 4 a \u2032 \u2212 an \u2212 ae \u2212 as \u2212 aw ] \u0394 t h \u2033 = h \u2032 + d h [ 4 h \u2032 \u2212 hn \u2212 he \u2212 hs \u2212 hw ] \u0394 t o\u00f9 an, ae, as et aw repr\u00e9sentent les valeurs de l'activateur des cellules voisines (respectivement hn, he, hs et hw pour l'inhibiteur). Dans les simulations effectu\u00e9es, les valeurs des param\u00e8tres sont s = 1 , 5 , b a = 0 , 01 , b h = 0 , 01 , r a = 0 , 1 , r h = 0 , 1 , d a = 0 , 02 et d h = 0 , 5 . On a \u0394 t = 0 , 1 et le temps d'\u00e9volution est fix\u00e9 \u00e0 500 cycles, soit 5000 it\u00e9rations. \u00c0 l'\u00e9quilibre, a a = 1 , 142 et h h = 19 , 676 . Les diff\u00e9rentes simulations et les figures pr\u00e9sent\u00e9es ont \u00e9t\u00e9 r\u00e9alis\u00e9es \u00e0 l'aide du programme Meincell1 r\u00e9dig\u00e9 en Scilab [18,19] et en Ada95 sous Windows. 3 Pavage de quasi-carr\u00e9s La structure dans laquelle est impl\u00e9ment\u00e9 le syst\u00e8me est compos\u00e9e de cellules dispos\u00e9es selon un pavage r\u00e9gulier. Nous d\u00e9finirons un quasi-carr\u00e9 comme un rectangle dont les longueurs des cot\u00e9s sont a et b \u2a7d a tels que 1 , 0 \u2a7d a / b \u2a7d 2 , 0 . Ce sous-ensemble comprend les rectangles pas trop aplatis. On y trouve en particulier les carr\u00e9s et les rectangles d'or ( a / b = 1 , 618 \u2026 ) [20]. L'op\u00e9ration D qui consiste \u00e0 diviser un quasi-carr\u00e9 dans le sens de sa plus grande longueur est interne dans l'espace des quasi-carr\u00e9s. Un quasi-carr\u00e9 de rapport a / b donnera deux quasi-carr\u00e9s de rapport a \u2032 / b \u2032 = 2 b / a , puis quatre quasi-carr\u00e9s de rapport a \u2033 / b \u2033 = 2 b \u2032 / a \u2032 = a / b . Il appara\u00eet donc que l'op\u00e9rateur D2 ne modifie pas la forme a / b . Par exemple, si nous partons d'un carr\u00e9, nous retrouverons un carr\u00e9 toutes les deux divisions. L'application de l'op\u00e9ration D \u00e0 un quasi-carr\u00e9 a / b = 2 donne deux quasi-carr\u00e9s de m\u00eame rapport (principe des formats A0, A1, A2, \u2026). Chaque quasi-carr\u00e9 du pavage a les adresses de ses quatre voisins selon le voisinage de Von Neuman. Ces adresses sont utilis\u00e9es lors du processus de diffusion. Un algorithme sp\u00e9cifique permet de mettre rapidement \u00e0 jour les adresses des quasi-carr\u00e9s voisins au cours du processus de division. 4 Impl\u00e9mentation dans une structure statique La structure statique consiste en une matrice de cellules quasi-carr\u00e9es. Cette structure peut comprendre entre 8 \u00d7 4 = 32 cellules et 128 \u00d7 128 = 16 384 cellules. Chaque cellule est reli\u00e9e \u00e0 ses quatre cellules voisines, \u00e0 l'exception des cellules de bord (trois voisines) et des coins (deux voisines). Au d\u00e9part, toutes les cellules sont plac\u00e9es \u00e0 l'\u00e9tat d'\u00e9quilibre ( a a , h h ) . Pour provoquer l'\u00e9volution du syst\u00e8me, la valeur de l'inhibiteur de la premi\u00e8re cellule (situ\u00e9e au coin sup\u00e9rieur gauche) est multipli\u00e9e par deux ( a a , 2 h h ) . \u00c0 partir du coin sup\u00e9rieur gauche, on voit appara\u00eetre des arcs de cercles concentriques r\u00e9guli\u00e8rement espac\u00e9s (Fig. 1 A\u2013C). Chacun de ces arcs se discr\u00e9tise ensuite en pics r\u00e9guli\u00e8rement espac\u00e9s. Nous avons un motif p\u00e9riodique qui se r\u00e9p\u00e8te de fa\u00e7on identique ind\u00e9pendamment des dimensions (nombre de cellules) de la structure statique. 5 Impl\u00e9mentation dans une structure dynamique Dans le contexte de la structure dynamique, le nombre de cellules passe de 32 \u00e0 16 384 cellules. Pour chaque valeur de temps multiple de 50 cycles, chaque cellule quasi-carr\u00e9e se divise en deux cellules filles dans le sens de sa plus grande longueur. Les cellules filles conservent les m\u00eames valeurs d'activateur et d'inhibiteur que leur cellule m\u00e8re. Les param\u00e8tres du mod\u00e8le, les conditions initiales et les conditions temporelles d'\u00e9volution du mod\u00e8le sont identiques \u00e0 celles utilis\u00e9es pr\u00e9c\u00e9demment dans le cas de la structure statique. Dans le cas du syst\u00e8me dynamique \u00e9voluant dans une structure dynamique (SD)2 [21], nous observons des motifs (Fig. 1D) de nature tr\u00e8s diff\u00e9rente de ceux observ\u00e9es dans les structures statiques (Fig. 1A\u2013C). 6 Discussion 6.1 Le mod\u00e8le SD2 La seule diff\u00e9rence de contexte entre les Fig. 1A\u2013C et 1D r\u00e9side dans la modification dynamique du nombre de cellules ( 32 \u2192 64 \u2192 128 \u2192 256 \u2192 512 \u2192 1024 \u2192 2048 \u2192 4096 \u2192 8192 \u2192 16 384 ) au cours de la simulation dans le second cas. Le nombre total de calculs effectu\u00e9s pour l'impl\u00e9mentation du syst\u00e8me de Meinhardt dans la structure dynamique (16 368 000 op\u00e9rations \u00e9l\u00e9mentaires) est strictement compris entre ceux effectu\u00e9s pour l'impl\u00e9mentation dans la structure statique 8 \u00d7 4 = 32 cellules (160 000 op\u00e9rations \u00e9l\u00e9mentaires) et ceux relatifs \u00e0 128 \u00d7 128 = 16 384 cellules (81 920 000 op\u00e9rations \u00e9l\u00e9mentaires), qui induisent des structures p\u00e9riodiques. La structure p\u00e9riodique observ\u00e9e dans la Fig. 1A\u2013C est relativement simple \u00e0 d\u00e9crire sous la forme d'arcs de cercles \u00e9quidistants et de la r\u00e9duction de ces arcs en points \u00e9quidistants. La structure du patron de la Fig. 1D est bien plus difficile \u00e0 d\u00e9crire et exprime un degr\u00e9 de complexit\u00e9 apparente nettement sup\u00e9rieur. Cette complexit\u00e9 a \u00e9t\u00e9 obtenue en jouant sur le cot\u00e9 temporel de la simulation. En effet, un d\u00e9lai plus important entre les deux premi\u00e8res multiplications cellulaires aurait donn\u00e9 au syst\u00e8me le temps d'atteindre son \u00e9quilibre p\u00e9riodique, et ainsi de suite. De m\u00eame, un d\u00e9lai tr\u00e8s court entre les multiplications n'aurait pas permis au syst\u00e8me d'\u00e9voluer. Dans la simulation pr\u00e9sent\u00e9e, le patron complexe de la Fig. 1D pr\u00e9sente un caract\u00e8re temporel provisoire, et l'\u00e9volution du syst\u00e8me fig\u00e9 dans la configuration statique 128 \u00d7 128 = 16 384 cellules tendra vers un patron p\u00e9riodique comparable \u00e0 celui de la Fig. 1C. Nous interpr\u00e9tons la complexit\u00e9 de la Fig. 1D comme le r\u00e9sultat de l'interaction entre deux m\u00e9canismes plus simples, qui op\u00e8rent \u00e0 des vitesses diff\u00e9rentes. La distance est mesur\u00e9e en nombre de cellules, et le temps en nombre de cycles de calcul. Le premier m\u00e9canisme est une vitesse constante de propagation du syst\u00e8me dans la structure. Dans le cas d'une structure statique, par exemple celle repr\u00e9sent\u00e9e sur la Fig. 1C, en effectuant un affichage tous les 75 cycles, on voit appara\u00eetre un nouvel arc de cercle, situ\u00e9 en moyenne \u00e0 6,4 cellules du pr\u00e9c\u00e9dent. En premi\u00e8re approximation, on peut consid\u00e9rer que cette vitesse d\u00e9pend uniquement de la valeur d h du coefficient de diffusion de l'inhibiteur. Le second m\u00e9canisme est la multiplication r\u00e9guli\u00e8re dans le temps (tous les 50 cycles) du nombre de cellules. Cela se traduit par une augmentation exponentielle de la distance moyenne de deux cellules de la structure dynamique. Dans le cas d'une structure dynamique, ce second m\u00e9canisme contrarie de plus en plus le premier qui tend \u00e0 ramener \u00e0 vitesse constante le syst\u00e8me \u00e0 l'\u00e9quilibre. Si la multiplication cellulaire est arr\u00eat\u00e9e \u00e0 un moment donn\u00e9, le syst\u00e8me reviendra progressivement \u00e0 un \u00e9quilibre de nature p\u00e9riodique dans l'espace. Sinon, le syst\u00e8me tendra \u00e0 l'infini vers un \u00e9tat qui pourra \u00eatre qualifi\u00e9 \u00e0 la fois de chaotique et de fractal au sens large. Dans le contexte biologique de la morphogen\u00e8se, le nombre de cellules suit dans le temps une loi logistique avec au d\u00e9but une croissance exponentielle suivie \u00e0 la fin d'une stabilisation. \u00c0 un moment donn\u00e9, la synth\u00e8se des substances qui induisent la formation des patrons est interrompue, et comme ces substances sont transform\u00e9es en d'autres substances, le syst\u00e8me se fige dans un \u00e9tat interm\u00e9diaire plus ou moins proche de l'\u00e9quilibre. C'est cela qui permet aux z\u00e8bres et aux tigres d'avoir leurs raies et aux panth\u00e8res et aux girafes d'avoir leurs taches. Comme le souligne Lesne [10], les structures auto-organis\u00e9es sont hors d'\u00e9quilibre, car parcourues de flux de mati\u00e8re et d'\u00e9nergie. Bien que non pr\u00e9visibles au niveau de l'examen du mod\u00e8le, les patrons complexes obtenus pr\u00e9sentent un caract\u00e8re totalement d\u00e9terministe. \u00c0 chaque simulation bas\u00e9e sur les m\u00eames valeurs de param\u00e8tres, on retrouve le m\u00eame patron, de la m\u00eame mani\u00e8re que pour les mod\u00e8les qui simulent le chaos. Si la position et la longueur de chaque pic de la Fig. 1D sont impr\u00e9visibles a priori, le patron pr\u00e9sente des constantes : par exemple, les distances entre pics sont du m\u00eame ordre que les distances entre les arcs de cercle de la Fig. 1C. 6.2 Le concept d'\u00e9mergence Le patron ap\u00e9riodique pr\u00e9sent\u00e9 sur la Fig. 1D r\u00e9pond manifestement \u00e0 la d\u00e9finition de l'\u00e9mergence cr\u00e9atrice de Cariani [12]. Dans le cadre de la d\u00e9finition ERM de Bonabeau et Dessalles [13], la notion d'\u00e9mergence est relative \u00e0 un contexte th\u00e9orique et \u00e0 un r\u00e9sultat exp\u00e9rimental non pr\u00e9dit par cette th\u00e9orie. Dans le contexte de la th\u00e9orie thermodynamique des syst\u00e8mes ferm\u00e9s, l'impl\u00e9mentation d'un syst\u00e8me simple de Meinhardt, caract\u00e9ris\u00e9 par des valeurs identiques des coefficients de diffusion de l'activateur et de l'inhibiteur dans une structure statique donnera un patron uniforme, parfaitement coh\u00e9rent avec la th\u00e9orie. Si, \u00e0 pr\u00e9sent, le mod\u00e8le simple de Meinhardt consid\u00e9r\u00e9 plus haut est impl\u00e9ment\u00e9, nous observons l'\u00e9mergence d'un patron p\u00e9riodique non pr\u00e9vu par la th\u00e9orie. Dans le contexte de la th\u00e9orie de Turing ou de la dynamique des syst\u00e8mes ouverts, un tel r\u00e9sultat est pr\u00e9dit et il n'y a plus \u00e9mergence. Dans ce m\u00eame contexte th\u00e9orique, l'impl\u00e9mentation du m\u00eame syst\u00e8me de Meinhardt dans une structure dynamique induit l'\u00e9mergence d'un patron ap\u00e9riodique non pr\u00e9vu par la th\u00e9orie. La simplicit\u00e9 du mod\u00e8le de morphogen\u00e8se, d'une part, et l'extr\u00eame simplicit\u00e9 du processus de d\u00e9veloppement cellulaire, d'autre part, ne permettent pas de pr\u00e9dire la complexit\u00e9 de la Fig. 1D : c'est l'aspect inattendu de l'\u00e9mergence. Il reste alors \u00e0 envisager la construction d'un nouveau cadre th\u00e9orique plus g\u00e9n\u00e9ral, qui int\u00e8grera les pr\u00e9c\u00e9dents et pr\u00e9dira le patron ap\u00e9riodique observ\u00e9, et r\u00e9duira le caract\u00e8re \u00e9mergent des observations. Il est important de noter que, dans tous les cas, le syst\u00e8me demeure qualitativement identique, et que la quantit\u00e9 de calculs mise en jeu reste comparable. L'\u00e9mergence d'un patron de complexit\u00e9 sup\u00e9rieure n'est pas directement induite par un nombre plus \u00e9lev\u00e9 de calculs. L'\u00e9mergence ERM de Bonabeau et Dessalles [13] peut \u00eatre interpr\u00e9t\u00e9e par le fait que le formalisme utilis\u00e9 par le mod\u00e8le est insuffisant pour d\u00e9crire les structures spatiales et temporelles form\u00e9es \u00e0 partir de ce mod\u00e8le. 6.3 Complexit\u00e9 et \u00e9mergence Il appara\u00eet ici que la mod\u00e9lisation des patrons complexes introduit deux notions diff\u00e9rentes de complexit\u00e9 : \u2013 la complexit\u00e9 g\u00e9notypique du mod\u00e8le, qui peut se mesurer par le nombre de param\u00e8tres du mod\u00e8le, par le nombre d'instructions algorithmiques, ou par le nombre de calculs \u00e9l\u00e9mentaires qu'il est n\u00e9cessaire d'effectuer pour obtenir un patron donn\u00e9 ; \u2013 la complexit\u00e9 ph\u00e9notypique du patron, qui se mesure en termes d'organisation, par exemple en n\u00e9gentropie [23], propre \u00e0 quantifier les ph\u00e9nom\u00e8nes de complexification que montrent nombre de processus vitaux. En g\u00e9n\u00e9ral, pour mod\u00e9liser un patron ph\u00e9notypiquement plus complexe, on construira un mod\u00e8le g\u00e9n\u00e9tiquement plus complexe. L'objet de la mod\u00e9lisation est alors d'optimiser le rapport des deux complexit\u00e9s, en faisant mieux que le simple hasard. Par exemple, il est toujours possible de mod\u00e9liser n'importe quel patron d\u00e9fini sous la forme d'une matrice de cellules (ou pixels), par la simulation de tous les patrons possibles en faisant varier tous les \u00e9tats qu'une cellule peut prendre. Pour une matrice de n cellules \u00e0 deux \u00e9tats (noir/blanc), il y a 2 n patrons possibles, donc n \u00d7 2 n calculs \u00e9l\u00e9mentaires. Une premi\u00e8re approche consiste \u00e0 raisonner avec un mod\u00e8le constant, de complexit\u00e9 g\u00e9notypique plus ou moins grande, et \u00e0 maximiser la complexit\u00e9 ph\u00e9notypique. On cherche alors \u00e0 faire \u00e9merger du mod\u00e8le les patrons les plus complexes possibles, comme dans la discussion ci-dessus du concept d'\u00e9mergence. Il y aura \u00e9mergence chaque fois qu'un patron de complexit\u00e9 ph\u00e9notypique sup\u00e9rieure sera mod\u00e9lis\u00e9. La difficult\u00e9 de cette approche r\u00e9side dans la mesure de la n\u00e9gentropie, qui peut d\u00e9pendre de l'arbitraire de l'observateur. La seconde approche, \u00e9quivalente en th\u00e9orie, consiste \u00e0 raisonner avec un patron constant, de complexit\u00e9 ph\u00e9notypique plus ou moins grande, et \u00e0 minimiser la complexit\u00e9 g\u00e9notypique. On cherche alors \u00e0 ajuster diff\u00e9rents mod\u00e8les avec le patron donn\u00e9, en recherchant le mod\u00e8le le plus simple possible (principe de parcimonie). Tout mod\u00e8le qui permet de g\u00e9n\u00e9rer ce m\u00eame patron avec moins de calculs pr\u00e9sente un progr\u00e8s. Il y aura \u00e9mergence chaque fois qu'un nouveau mod\u00e8le de plus faible complexit\u00e9 g\u00e9n\u00e9tique permettra de g\u00e9n\u00e9rer ce m\u00eame patron. Le seul facteur arbitraire r\u00e9side dans l'ad\u00e9quation de l'ajustement entre le patron simul\u00e9 par le mod\u00e8le et le patron de r\u00e9f\u00e9rence. Il est possible de quantifier cette ad\u00e9quation en mesurant la distance des deux patrons selon une m\u00e9trique donn\u00e9e et en la comparant \u00e0 une valeur seuil fix\u00e9e a priori. Cette derni\u00e8re d\u00e9finition r\u00e9duit consid\u00e9rablement le r\u00f4le de l'observateur introduit par diff\u00e9rents auteurs dans leur d\u00e9finition de l'\u00e9mergence [5,12,13,22]. \u00c0 la diff\u00e9rence de Ricard [11], l'\u00e9mergence d\u00e9finie ci-dessus ne se r\u00e9duit pas \u00e0 la complexit\u00e9, bien qu'elle y soit fortement li\u00e9e. Enfin, et \u00e0 la diff\u00e9rence de toutes les propositions ant\u00e9rieures, tout ph\u00e9nom\u00e8ne pouvant \u00eatre qualifi\u00e9 d'\u00e9mergent au sens de notre d\u00e9finition peut \u00eatre invalid\u00e9 (falsifiable au sens de Popper). 1 Introduction: the concept of emergence The notions of emergence or emergent properties are often used to qualify phenomena observed in experimental sciences. Phenomena such as the B\u00e9nard cells in thermodynamics, the buildings and behaviours of social insects (the intelligence of ants' nest is the sum of the stupidities of all ants [1]), collective moving of flying birds or fish shoals, as the immune system [2] present an emergent character, just as social or economic phenomena (traffic jam, applause synchronization) or the behaviour of computer systems (information traffic in Internet, multi-agent systems, cellular automates, ... [3]). Complex phenomena such as the appearance of life on Earth, the evolution of new species or the structure of cognitive thought are often considered as instances of some emergent higher structure [4]. For some years, this concept takes more and more importance in biological sciences, cognitive sciences, artificial intelligence. But few are the adventurers who dare to define it [5]. By definition, emergence is the state of what is emerging, standing higher than the medium level, retaining attention, or appearing different... We have here the concept of salientness (the Ren\u00e9 Thom's saillance) used in pattern recognition [6]. The notion of emergence also appears in the maxim The whole is more than the sum of the parts (opposite of the principle The whole is the sum of the parts attributed to Aristotle) also evoking mechanisms of non-linearity or interaction. The emergence is classically defined as the appearance of a system that cannot be predicted or explained from the previous conditions [7]. According to Georg\u00e9 [2], the system must not and cannot explicitly contain the knowledge of the aim of the system (i.e. the emerging function) and the ways to reach it. Van de Vijver [8] recalls that emergence is a process where new structures and functions appear. Emergence refers to what appears as new, unexpected, irreversible and significant, or is such because it is not possible to explain it in a reductive way. Some of these definitions present an obvious negative character, which do not lead to a very legible concept. Properties of unpredictability or novelty present a temporal character incompatible with an absolute definition. For some authors, the notion of emergence does not correspond to scientific rigor. A thing comes from another one, without being made or caused by it strictly speaking. The notion is obscure at the very least [9]. According to Nesle, the term auto-organization refers to the spontaneous and dynamical emergence of a spatial structure, a rhythm, or a spatiotemporal structure (evolving in space and time) under the joint effects of an exterior supply of energy and interactions working between the elements of the system considered [10]. Following Ricard [11], if a system presents a number of degrees of freedom or entropy greater than the sum of its sub-systems, then it is defined as an emergent or complex system, the two words being equivalent. In the presentation of the SMAC group and of J.-P. Georg\u00e9 [2,3], the notion of emergence are characterized by properties of novelty, auto-organization, irreducibility, level interdependency, but is not positively defined, even in a strictly computer frame. Cariani [12] defines emergence as the process by which new structures and functions come into being. He distinguishes the combinatoric emergence wherein novelty arises by new combinations of pre-existing elements and the creative emergence wherein novelty arises by de novo creation of new kinds of elements. Bonabeau and Dessalles [13] distinguish two other kinds of emergence: emergence of higher level structures EHS, and emergence relative to a model ERM. The first kind occurs when a phenomenon appears at a level L h out of constituents and processes defined and taking place at a lower level L i , and when the properties of L h are difficult or impossible to deduce from the properties of the constituent units and processes of L i . Following the second definition, there is emergence when a natural system's behaviour can no longer be explained by a model of that system (it deviates or bifurcates from the predictions of the model) and requires a new model. In considering that scientific models play the role of conceptual detectors, the authors show that ERM is a special case of EHS. Too often, the concept of emergence has been used in an improper way or in a fuzzy scientific context leading to a difficult understanding and use [2]. In the present paper, we introduce a mathematical model of morphogenesis and we show under which conditions patterns of higher complexity can emerge from this model. The ambition of this contribution is to propose a more rigorous definition of the concept of emergence in the relatively limited context of this model. 2 The dynamic system We define a model as the implementation of a system (such as the Turing system or the simple system of Meinhardt specified below) into a static or dynamic cellular structure. The simple system of Meinhardt (model 3.1 of 1982 [14], Eq. 2.1b of 1995\u20132003 [15]) integrates two agents: the activator A and the inhibitor H. This model belongs to the class of the Gierer\u2013Meinhardt models [16,17], themselves being Turing models. The two agents interact in each cell of the system and diffuse between the next cells. The temporal evolution of the concentrations a and h is defined by the equations: \u2202 a / \u2202 t = s ( a 2 / h + b a ) \u2212 r a a + d a \u2202 2 a / \u2202 x 2 \u2202 h / \u2202 t = s ( a 2 + b h ) \u2212 r h h + d h \u2202 2 h / \u2202 x 2 This system is characterized by seven parameters: s (fixed value of the substrate), b a and b h (base productions of activator and inhibitor), r a and r h (elimination rates of activator and inhibitor) and d a and d h (diffusion coefficients of activator and inhibitor). The equilibrium state ( a a , h h ) of a cell of the system is defined, without diffusion between next cells, by the third-degree equation: a a 3 \u2212 [ ( r h + s b a ) / r a ] a a 2 + b h a a \u2212 s b a b h / r a = 0 h h = s ( a a 2 + b h ) / r h Retaining the non-complex root numerically solves this equation. This dynamic system is numerically simulated on the basis of the iterative system ( a , h ) \u2192 ( a \u2032 , h \u2032 ) \u2192 ( a \u2033 , h \u2033 ) = new value of ( a , h ) for a temporal step \u0394t. a \u2032 = a + [ s ( a 2 / h + b a ) \u2212 r a a ] \u0394 t h \u2032 = h + [ s ( a 2 + b h ) \u2212 r h h ] \u0394 t a \u2033 = a \u2032 + d a [ 4 a \u2032 \u2212 an \u2212 ae \u2212 as \u2212 aw ] \u0394 t h \u2033 = h \u2032 + d h [ 4 h \u2032 \u2212 hn \u2212 he \u2212 hs \u2212 hw ] \u0394 t where an, ae, as, and aw represent the values of the activator of the next cells (hn, he, hs and hw are the values of the inhibitor, respectively). In the simulations performed, the values of the parameters are s = 1.5 , b a = 0.01 , b h = 0.01 , r a = 0.1 , r h = 0.1 , d a = 0.02 and d h = 0.5 . We have \u0394 t = 0.1 and the temporal variation is fixed to 500 cycles, i.e. 5000 iterations. At equilibrium, a a = 1.142 and h h = 19.676 . The different simulations and the figures were realized using the program Meincell1 written in Scilab [18,19] and Ada95 under Windows OS. 3 Paving of almost-squares The structure where is implemented the system is built up with cells placed in a regular paving. An almost-square is defined as a rectangle which lengths of sides are a and b \u2a7d a such as 1.0 \u2a7d a / b \u2a7d 2.0 . This subset includes not too much flat rectangles, in particular squares and golden rectangles ( a / b = 1.618 \u2026 ) [20]. The operation D consisting in dividing an almost-square along its higher lengthwise is internal in the space of almost-squares. An almost-square characterized by the ratio a / b gives two almost-squares of ratio a \u2032 / b \u2032 = 2 b / a , then four almost-squares of ratio a \u2033 / b \u2033 = 2 b \u2032 / a \u2032 = a / b . Then, it appears that the operator D2 does not modify the shape a / b . For instance, if the original figure is a square, a square will be found every two divisions. When applied to an almost-square a / b = 2 , the operation D preserves the ratio (principle of the formats A0, A1, A2, ...). Each almost-square of the paving keeps the addresses of its four neighbours, following a Von Neuman neighbourhood. These addresses are used to apply the diffusion process. A specific algorithm rapidly updates the addresses of an almost-square and of its neighbours when it divides. 4 Implementation in a static structure The static structure consists in a matrix of almost-square cells. This structure can be made of 8 \u00d7 4 = 32 to 128 \u00d7 128 = 16 384 cells. Each of these cells is connected to its four neighbours, except the edge cells (three neighbours) and the corner cells (two neighbours). Initially, all cells are at equilibrium state ( a a , h h ) . To induce the evolution of the system, the inhibitor value of the first cell (at the upper left corner) is twice as much as the equilibrium value ( a a , 2 h h ) . From the upper left corner, concentric and regularly spaced out arc of circles (Fig. 1A\u2013C). Then each of these arcs is discretized into regularly spaced out peaks. This forms a periodic pattern identically repeated regardless of the dimensions (number of cells) of the static structure. 5 Implementation in a dynamic structure In the context of a dynamic structure, the number of cells goes from 32 to 16 384 cells. Every 50-cycles temporal period, each cell is divided into two daughter cells following its higher length. The daughter cells have the same activator and inhibitor values as their mother cell. The parameters of the model, initial conditions and temporal conditions are identical to those previously used with the static structure. For the dynamic system evolving in a dynamic structure (DS)2 [21], we observe patterns (Fig. 1D) presenting a nature very different from those observed for static structures (Fig. 1A\u2013C). 6 Discussion 6.1 The DS2 model The single contextual difference between Fig. 1 A\u2013C and 1D lies in the dynamic modification of the number of cells ( 32 \u2192 64 \u2192 128 \u2192 256 \u2192 512 \u2192 1024 \u2192 2048 \u2192 4096 \u2192 8192 \u2192 16 384 ) during the simulation for the second case. The total number of computations performed in the implementation of the Meinhardt system in the dynamic structure (16 368 000 elementary operations) is strictly bounded by those performed in the implementation in the static structure 8 \u00d7 4 = 32 cells (160 000 elementary operations) and 128 \u00d7 128 = 16 384 cells (81 920 000 elementary operations), which produce periodic patterns. The periodic patterns observed in Fig. 1A\u2013C are simple to describe in terms of equidistant arcs of circles and of reduction of these arcs of circles into equidistant points. The structure of the pattern presented in Fig. 1D is much more difficult to describe and clearly expresses a visibly higher level of complexity. This complexity was obtained by playing on the temporal character of the simulation. Indeed, a higher delay between the two first divisions should allow the system to reach its periodic equilibrium, and so on. Likewise, a very short delay between divisions should not allow the system to evolve. In the simulation presented, the complex pattern of Fig. 1D presents a provisional temporal character, and the evolution of the system frozen in the static 128 \u00d7 128 = 16 384 -cell configuration should tend towards a periodic pattern similar to the one of Fig. 1C. We interpret the complexity of Fig. 1D as the result of the interaction between two simpler mechanisms, which operate at different speeds. The distance is measured in number of cells, and the time in number of cycles of computation. The first mechanism is a constant speed of diffusion of the system in the structure. In the case of a static structure, for instance the one represented in Fig. 1C, by making a display every 75 cycles, a new arc of circle appears, located at 6.4 cells on average from the previous one. In first approximation, this speed depends only on the value of the diffusion coefficient d h of the inhibitor. The second mechanism is the regular multiplication with time (every 50 cycles) of the number of cells. The consequence is an exponential increase of the mean distance between two cells of the dynamic structure. In the case of a dynamic structure, this second mechanism impedes more and more the first one, which tends towards the system to return to the equilibrium state at constant speed. If, at a given moment, the cell multiplication is stopped, the system will progressively return to a periodical equilibrium state in space. If not, the system will ad infinitum tend towards a state that can be at the same time described as chaotic and fractal in a large sense. In the biological context of morphogenesis, the number of cells follows along time a logistic law, with an exponential increase at the beginning followed by stabilization at the end. At a given moment, the synthesis of the compounds that induce the pattern formation is stopped, and as these compounds are transformed into other compounds, the system is frozen at an intermediate state more or less close to the equilibrium state. This mechanism allows zebras and tigers to get their stripes and panthers and giraffes their spots. As stressed out by Lesne [10], the auto-organized structures are out of equilibrium, because floods of matter and energy cross them. Although unpredictable at the level of model examination, the complex patterns obtained present a wholly determinist character. For each simulation based upon the same parameter values, the same pattern is found again, as for models simulating chaos. If the position and length of each peak of Fig. 1D is a priori unpredictable, the pattern presents constants: for instance, the distances between peaks is in the same order of magnitude as the distances between arcs of circles in Fig. 1C. 6.2 The concept of emergence The aperiodic pattern presented in Fig. 1D obviously corresponds to the creative emergence of Cariani [12]. In the context of the definition ERM of Bonabeau and Dessalles [13], the notion of emergence is relative to a theoretical context and to experimental results that are not predicted by this theory. In the context of the thermodynamic theory of closed systems, implementing a simple system of Meinhardt characterized by identical values of diffusion coefficients of activator and inhibitor in a static structure will provide a uniform pattern, wholly consistent with the theory. Now, if the above Meinhardt system is implemented, we observe the emergence of a periodic pattern unpredicted by the theory. In the context of the theory of Turing or of the thermodynamic of open systems, such a result is predicted, and there is no more emergence. In this same theoretical context, the implementation of the same system of Meinhardt into a dynamic structure induces the emergence of an aperiodic pattern unpredicted by the theory. The simplicity of the model of morphogenesis, on the one hand, and the extreme simplicity of the process of cellular development, on the other hand, are not able to predict the complexity observed in Fig. 1D: this is the unexpected side of emergence. Then, a new more general theoretical frame has to be built up, which will integrate the previous ones, predict the aperiodic patterns observed, and reduce the emergent character of observations. It is important to note that in all cases, the system remains qualitatively identical, and that the amount of computations involved is comparable. The emergence of a pattern with a higher complexity is not directly induced by a higher number of computations. The ERM emergence of Bonabeau and Dessalles [13] can be interpreted by the fact that the formalism used in the model is inadequate to describe the spatial and temporal structures generated by this model. 6.3 Complexity and emergence It appears here that modelling of complex patterns introduces two different notions of complexity: \u2013 the genotypic complexity of the model, which can be measured by the number of parameters of the model, the number of algorithmic instructions or of elementary computations required to get a given pattern; \u2013 the phenotypic complexity of the pattern, measured in terms of organization, for instance in negentropy [23], likely to quantify the phenomena of complexification shown by many vital processes. Usually, in order to model a phenotypically more complex pattern, a genotypically more complex model will be built. Then, the object of modelling consists in optimizing the ratio of the two complexities, making better than the simple random. For instance, any pattern defined under the form of a matrix of cells (or pixels) can always be modelled by simulating all possible patterns, varying all states a cell can take. For a two states (black/white) n-cell matrix, there are 2 n possible patterns, then n \u00d7 2 n elementary computations. A first approach consists in reasoning with a constant model, characterized by a more or less higher genotypic complexity, and to maximize the phenotypic complexity. Then the aim is to make emerge the more complex patterns from the model, as in the above discussion about the concept of emergence. There will be emergence each time a pattern of a higher phenotypic complexity will be modelled. The difficulty of this approach lies in the measure of negentropy, which can depend on the arbitrary of the observer. The second approach, equivalent in theory, consists in reasoning with a constant pattern, characterized by a more or less higher phenotypic complexity, and to minimize the genotypic complexity. Then the aim is to fit different models with the given patterns, in searching the simplest model (principle of parsimony). Any model able to fit this same pattern with less computation will present a progress. There will be emergence each time a new model with a lower genetic complexity generates this same pattern. The only arbitrary factor lies in the appropriateness of fit between the pattern simulated by the model and the reference pattern. It is possible to quantify this appropriateness by measuring the distance between the two patterns according to a given metric and comparing it with an a priori fixed threshold value. This definition considerably reduces the role of the observer introduced by different authors in their definition of emergence [5,12,13,22]. Unlike Ricard's definition [11], the above-defined emergence is not reduced to complexity, although tightly linked to it. Finally, at the difference of all previous propositions, every phenomenon that can be qualified of emergent in the sense of our definition can be invalidated (falsifiable in the sense of Popper). References [1] J.-M. Fouet Cours de DEA, 1999 http://www710.univ-lyon1.fr/~fouet/DEA/chap8.html [2] J.-P. Georg\u00e9 Rapport interne IRIT, 2003 http://www.irit.fr/ACTIVITES/EQ_SMI/SMAC/DOCUMENTS/RECHERCHE/RapportIrit2003-12-R.pdf [3] \u00c9quipe SMAC theme \u00e9mergence http://www.irit.fr/ACTIVITES/EQ_SMI/SMAC/Emergence.html#Point4 [4] N.A. Bass C. Emmeche On emergence and explanation Intellectica 25 1997 67 83 [5] A. Grumbach \u00c0 propos d'\u00e9mergence. \u00c9mergence... ou... explication Intellectica 25 1997 185 227 [6] R. Thom Pr\u00e9dire n'est pas expliquer, Champs 288 1991 1993 Flammarion Paris 175 p [7] The new Encyclopaedia Britannica, fifteenth ed., 1995 [8] G. Van de Vijver \u00c9mergence et explication Intellectica 25 1997 7 23 [9] Dictionnaire encyclop\u00e9dique Quillet, 1977\u20131983 [10] A. Lesne, Encyclopedia Universalis, Notionnaire, sectionBiologie, Article sur l'auto-organisation, 2004, pp. 76\u201377 [11] J. Ricard What do we mean by biological complexity? C. R. Biologies 326 2003 133 140 [12] P. Cariani Emergence of new signal-primitives in neural systems Intellectica 25 1997 95 143 [13] E. Bonabeau J.-L. Dessalles Detection and emergence Intellectica 25 1997 85 94 [14] H. Meinhardt Models of Biological Pattern Formation 1982 Academic Press London 215 p [15] H. Meinhardt The Algorithmic Beauty of Sea Shells. The Virtual Laboratory third ed. 1995 2003 Springer Berlin 236 p [16] A. Gierer H. Meinhardt A theory of biological pattern formation Kibernetick 12 1972 30 39 [17] H. Meinhardt A. Gierer Pattern formation by local self-activation and lateral inhibition Bioessays 22 2000 753 760 [18] F. Le Lionnais A. Bouvier M. George Dictionnaire des math\u00e9matiques 1979 Presses universitaires de France Paris 833 p [19] INRIA, Site Scilab 3.0 http://scilabsoft.inria.fr [20] J.-D. Rouault Scilab pas-\u00e0-pas/Scilab step-to-step, 2005 http://www.ibaic.u-psud.fr/Spas/index.html [21] J.-L. Giavitto, Topological collections, Transformations and their application to the modeling and the simulation of dynamical systems, in: RTA'03, 14th Int. Conf. on Rewriting Techniques and Applications, Valencia, Spain, 9\u201311 June 2003 [22] P.R. Medina-Martins Emergence, diachronism and machines Intellectica 25 1997 145 184 [23] L. Brillouin Science and Information Theory 1956 Academic Press New York", "scopus-id": "25144433929", "pubmed-id": "16168359", "coredata": {"eid": "1-s2.0-S1631069105000934", "dc:description": "Abstract We present the evolution of the simple system of Meinhardt implemented in both static or dynamic two-dimensional structures of almost-squared cells. In a static structure of 8 \u00d7 4 = 32 to 128 \u00d7 128 = 16 384 cells, the pattern observed is periodic. An algorithm allows us to divide the cells following the greater size, and to define a dynamic structure. The implementation of the same Meinhardt system in this dynamic structure varying from 32 to 16 384 cells and a context of the same genotypic complexity for the model provides aperiodic patterns, with a higher phenotypic complexity than those observed in static structures, while the number of computations is comparable. We define that emergence occurs each time the ratio of phenotypic/genotypic complexities increases. To cite this article: J.-D. Rouault, C. R. Biologies 328 (2005).", "openArchiveArticle": "true", "prism:coverDate": "2005-09-30", "openaccessUserLicense": "http://www.elsevier.com/open-access/userlicense/1.0/", "prism:aggregationType": "Journal", "prism:url": "https://api.elsevier.com/content/article/pii/S1631069105000934", "dc:creator": {"@_fa": "true", "$": "Rouault, Jacques-Deric"}, "link": [{"@_fa": "true", "@rel": "self", "@href": "https://api.elsevier.com/content/article/pii/S1631069105000934"}, {"@_fa": "true", "@rel": "scidir", "@href": "https://www.sciencedirect.com/science/article/pii/S1631069105000934"}], "dc:format": "application/json", "openaccessType": "Full", "pii": "S1631-0691(05)00093-4", "prism:volume": "328", "prism:publisher": "Acad\u00e9mie des sciences. Published by Elsevier Masson SAS", "dc:title": "Emergence of complex patterns induced by Dynamic Systems implemented in Dynamic Structures (DS)2", "prism:copyright": "Copyright \u00a9 2005 Acad\u00e9mie des sciences. Published by Elsevier Masson SAS All rights reserved.", "openaccess": "1", "prism:issn": "16310691", "prism:issueIdentifier": "9", "dcterms:subject": [{"@_fa": "true", "$": "Almost-squares"}, {"@_fa": "true", "$": "Complexity"}, {"@_fa": "true", "$": "Pattern formation"}, {"@_fa": "true", "$": "Complexit\u00e9"}, {"@_fa": "true", "$": "Formation des patrons"}, {"@_fa": "true", "$": "Quasi-carr\u00e9s"}], "openaccessArticle": "true", "prism:publicationName": "Comptes Rendus Biologies", "prism:number": "9", "openaccessSponsorType": "ElsevierBranded", "prism:pageRange": "783-793", "prism:endingPage": "793", "pubType": "Biological modelling / Biomod\u00e9lisation", "prism:coverDisplayDate": "September 2005", "prism:doi": "10.1016/j.crvi.2005.05.005", "prism:startingPage": "783", "dc:identifier": "doi:10.1016/j.crvi.2005.05.005", "openaccessSponsorName": null}, "objects": {"object": [{"@category": "thumbnail", "@height": "14", "@width": "101", "@_fa": "true", "$": "https://api.elsevier.com/content/object/eid/1-s2.0-S1631069105000934-si87.gif?httpAccept=%2A%2F%2A", "@multimediatype": "GIF image file", "@type": "ALTIMG", "@size": "405", "@ref": "si87", "@mimetype": "image/gif"}, {"@category": "thumbnail", "@height": "22", "@width": "323", "@_fa": "true", "$": "https://api.elsevier.com/content/object/eid/1-s2.0-S1631069105000934-si68.gif?httpAccept=%2A%2F%2A", "@multimediatype": "GIF image file", "@type": "ALTIMG", "@size": "962", "@ref": "si68", "@mimetype": "image/gif"}, {"@category": "thumbnail", "@height": "22", "@width": "323", "@_fa": "true", "$": "https://api.elsevier.com/content/object/eid/1-s2.0-S1631069105000934-si18.gif?httpAccept=%2A%2F%2A", "@multimediatype": "GIF image file", "@type": "ALTIMG", "@size": "962", "@ref": "si18", "@mimetype": "image/gif"}, {"@category": "thumbnail", "@height": "11", "@width": "71", "@_fa": "true", "$": "https://api.elsevier.com/content/object/eid/1-s2.0-S1631069105000934-si99.gif?httpAccept=%2A%2F%2A", "@multimediatype": "GIF image file", "@type": "ALTIMG", "@size": "270", "@ref": "si99", "@mimetype": "image/gif"}, {"@category": "thumbnail", "@height": "13", "@width": "495", "@_fa": "true", "$": "https://api.elsevier.com/content/object/eid/1-s2.0-S1631069105000934-si98.gif?httpAccept=%2A%2F%2A", "@multimediatype": "GIF image file", "@type": "ALTIMG", "@size": "1258", "@ref": "si98", "@mimetype": "image/gif"}, {"@category": "thumbnail", "@height": "15", "@width": "62", "@_fa": "true", "$": "https://api.elsevier.com/content/object/eid/1-s2.0-S1631069105000934-si97.gif?httpAccept=%2A%2F%2A", "@multimediatype": "GIF image file", "@type": "ALTIMG", "@size": "317", "@ref": "si97", "@mimetype": "image/gif"}, {"@category": "thumbnail", "@height": "15", "@width": "54", "@_fa": "true", "$": "https://api.elsevier.com/content/object/eid/1-s2.0-S1631069105000934-si96.gif?httpAccept=%2A%2F%2A", "@multimediatype": "GIF image file", "@type": "ALTIMG", "@size": "286", "@ref": "si96", "@mimetype": "image/gif"}, {"@category": "thumbnail", "@height": "11", "@width": "129", "@_fa": "true", "$": "https://api.elsevier.com/content/object/eid/1-s2.0-S1631069105000934-si95.gif?httpAccept=%2A%2F%2A", "@multimediatype": "GIF image file", "@type": "ALTIMG", "@size": "445", "@ref": "si95", "@mimetype": "image/gif"}, {"@category": "thumbnail", "@height": "11", "@width": "71", "@_fa": "true", "$": "https://api.elsevier.com/content/object/eid/1-s2.0-S1631069105000934-si94.gif?httpAccept=%2A%2F%2A", "@multimediatype": "GIF image file", "@type": "ALTIMG", "@size": "270", "@ref": "si94", "@mimetype": "image/gif"}, {"@category": "thumbnail", "@height": "18", "@width": "68", "@_fa": "true", "$": "https://api.elsevier.com/content/object/eid/1-s2.0-S1631069105000934-si93.gif?httpAccept=%2A%2F%2A", "@multimediatype": "GIF image file", "@type": "ALTIMG", "@size": "292", "@ref": "si93", "@mimetype": "image/gif"}, {"@category": "thumbnail", "@height": "14", "@width": "27", "@_fa": "true", "$": "https://api.elsevier.com/content/object/eid/1-s2.0-S1631069105000934-si92.gif?httpAccept=%2A%2F%2A", "@multimediatype": "GIF image file", "@type": "ALTIMG", "@size": "186", "@ref": "si92", "@mimetype": "image/gif"}, {"@category": "thumbnail", "@height": "16", "@width": "145", "@_fa": "true", "$": "https://api.elsevier.com/content/object/eid/1-s2.0-S1631069105000934-si91.gif?httpAccept=%2A%2F%2A", "@multimediatype": "GIF image file", "@type": "ALTIMG", "@size": "500", "@ref": "si91", "@mimetype": "image/gif"}, {"@category": "thumbnail", "@height": "16", "@width": "86", "@_fa": "true", "$": "https://api.elsevier.com/content/object/eid/1-s2.0-S1631069105000934-si90.gif?httpAccept=%2A%2F%2A", "@multimediatype": "GIF image file", "@type": "ALTIMG", "@size": "347", "@ref": "si90", "@mimetype": "image/gif"}, {"@category": "thumbnail", "@height": "22", "@width": "276", "@_fa": "true", "$": "https://api.elsevier.com/content/object/eid/1-s2.0-S1631069105000934-si9.gif?httpAccept=%2A%2F%2A", "@multimediatype": "GIF image file", "@type": "ALTIMG", "@size": "917", "@ref": "si9", "@mimetype": "image/gif"}, {"@category": "thumbnail", "@height": "14", "@width": "27", "@_fa": "true", "$": "https://api.elsevier.com/content/object/eid/1-s2.0-S1631069105000934-si89.gif?httpAccept=%2A%2F%2A", "@multimediatype": "GIF image file", "@type": "ALTIMG", "@size": "186", "@ref": "si89", "@mimetype": "image/gif"}, {"@category": "thumbnail", "@height": "14", "@width": "101", "@_fa": "true", "$": "https://api.elsevier.com/content/object/eid/1-s2.0-S1631069105000934-si88.gif?httpAccept=%2A%2F%2A", "@multimediatype": "GIF image file", "@type": "ALTIMG", "@size": "344", "@ref": "si88", "@mimetype": "image/gif"}, {"@category": "thumbnail", "@height": "14", "@width": "37", "@_fa": "true", "$": "https://api.elsevier.com/content/object/eid/1-s2.0-S1631069105000934-si86.gif?httpAccept=%2A%2F%2A", "@multimediatype": "GIF image file", "@type": "ALTIMG", "@size": "203", "@ref": "si86", "@mimetype": "image/gif"}, {"@category": "thumbnail", "@height": "13", "@width": "83", "@_fa": "true", "$": "https://api.elsevier.com/content/object/eid/1-s2.0-S1631069105000934-si85.gif?httpAccept=%2A%2F%2A", "@multimediatype": "GIF image file", "@type": "ALTIMG", "@size": "340", "@ref": "si85", "@mimetype": "image/gif"}, {"@category": "thumbnail", "@height": "11", "@width": "75", "@_fa": "true", "$": "https://api.elsevier.com/content/object/eid/1-s2.0-S1631069105000934-si84.gif?httpAccept=%2A%2F%2A", "@multimediatype": "GIF image file", "@type": "ALTIMG", "@size": "268", "@ref": "si84", "@mimetype": "image/gif"}, {"@category": "thumbnail", "@height": "11", "@width": "58", "@_fa": "true", "$": "https://api.elsevier.com/content/object/eid/1-s2.0-S1631069105000934-si83.gif?httpAccept=%2A%2F%2A", "@multimediatype": "GIF image file", "@type": "ALTIMG", "@size": "235", "@ref": "si83", "@mimetype": "image/gif"}, {"@category": "thumbnail", "@height": "15", "@width": "56", "@_fa": "true", "$": "https://api.elsevier.com/content/object/eid/1-s2.0-S1631069105000934-si82.gif?httpAccept=%2A%2F%2A", "@multimediatype": "GIF image file", "@type": "ALTIMG", "@size": "246", "@ref": "si82", "@mimetype": "image/gif"}, {"@category": "thumbnail", "@height": "14", "@width": "64", "@_fa": "true", "$": "https://api.elsevier.com/content/object/eid/1-s2.0-S1631069105000934-si81.gif?httpAccept=%2A%2F%2A", "@multimediatype": "GIF image file", "@type": "ALTIMG", "@size": "281", "@ref": "si81", "@mimetype": "image/gif"}, {"@category": "thumbnail", "@height": "14", "@width": "53", "@_fa": "true", "$": "https://api.elsevier.com/content/object/eid/1-s2.0-S1631069105000934-si80.gif?httpAccept=%2A%2F%2A", "@multimediatype": "GIF image file", "@type": "ALTIMG", "@size": "223", "@ref": "si80", "@mimetype": "image/gif"}, {"@category": "thumbnail", "@height": "14", "@width": "16", "@_fa": "true", "$": "https://api.elsevier.com/content/object/eid/1-s2.0-S1631069105000934-si8.gif?httpAccept=%2A%2F%2A", "@multimediatype": "GIF image file", "@type": "ALTIMG", "@size": "138", "@ref": "si8", "@mimetype": "image/gif"}, {"@category": "thumbnail", "@height": "14", "@width": "52", "@_fa": "true", "$": "https://api.elsevier.com/content/object/eid/1-s2.0-S1631069105000934-si79.gif?httpAccept=%2A%2F%2A", "@multimediatype": "GIF image file", "@type": "ALTIMG", "@size": "219", "@ref": "si79", "@mimetype": "image/gif"}, {"@category": "thumbnail", "@height": "14", "@width": "63", "@_fa": "true", "$": "https://api.elsevier.com/content/object/eid/1-s2.0-S1631069105000934-si78.gif?httpAccept=%2A%2F%2A", "@multimediatype": "GIF image file", "@type": "ALTIMG", "@size": "269", "@ref": "si78", "@mimetype": "image/gif"}, {"@category": "thumbnail", "@height": "14", "@width": "62", "@_fa": "true", "$": "https://api.elsevier.com/content/object/eid/1-s2.0-S1631069105000934-si77.gif?httpAccept=%2A%2F%2A", "@multimediatype": "GIF image file", "@type": "ALTIMG", "@size": "267", "@ref": "si77", "@mimetype": "image/gif"}, {"@category": "thumbnail", "@height": "12", "@width": "49", "@_fa": "true", "$": "https://api.elsevier.com/content/object/eid/1-s2.0-S1631069105000934-si76.gif?httpAccept=%2A%2F%2A", "@multimediatype": "GIF image file", "@type": "ALTIMG", "@size": "192", "@ref": "si76", "@mimetype": "image/gif"}, {"@category": "thumbnail", "@height": "17", "@width": "273", "@_fa": "true", "$": "https://api.elsevier.com/content/object/eid/1-s2.0-S1631069105000934-si75.gif?httpAccept=%2A%2F%2A", "@multimediatype": "GIF image file", "@type": "ALTIMG", "@size": "790", "@ref": "si75", "@mimetype": "image/gif"}, {"@category": "thumbnail", "@height": "16", "@width": "273", "@_fa": "true", "$": "https://api.elsevier.com/content/object/eid/1-s2.0-S1631069105000934-si74.gif?httpAccept=%2A%2F%2A", "@multimediatype": "GIF image file", "@type": "ALTIMG", "@size": "733", "@ref": "si74", "@mimetype": "image/gif"}, {"@category": "thumbnail", "@height": "22", "@width": "202", "@_fa": "true", "$": "https://api.elsevier.com/content/object/eid/1-s2.0-S1631069105000934-si73.gif?httpAccept=%2A%2F%2A", "@multimediatype": "GIF image file", "@type": "ALTIMG", "@size": "661", "@ref": "si73", "@mimetype": "image/gif"}, {"@category": "thumbnail", "@height": "22", "@width": "219", "@_fa": "true", "$": "https://api.elsevier.com/content/object/eid/1-s2.0-S1631069105000934-si72.gif?httpAccept=%2A%2F%2A", "@multimediatype": "GIF image file", "@type": "ALTIMG", "@size": "709", "@ref": "si72", "@mimetype": "image/gif"}, {"@category": "thumbnail", "@height": "15", "@width": "37", "@_fa": "true", "$": "https://api.elsevier.com/content/object/eid/1-s2.0-S1631069105000934-si71.gif?httpAccept=%2A%2F%2A", "@multimediatype": "GIF image file", "@type": "ALTIMG", "@size": "223", "@ref": "si71", "@mimetype": "image/gif"}, {"@category": "thumbnail", "@height": "16", "@width": "229", "@_fa": "true", "$": "https://api.elsevier.com/content/object/eid/1-s2.0-S1631069105000934-si70.gif?httpAccept=%2A%2F%2A", "@multimediatype": "GIF image file", "@type": "ALTIMG", "@size": "715", "@ref": "si70", "@mimetype": "image/gif"}, {"@category": "thumbnail", "@height": "14", "@width": "19", "@_fa": "true", "$": "https://api.elsevier.com/content/object/eid/1-s2.0-S1631069105000934-si7.gif?httpAccept=%2A%2F%2A", "@multimediatype": "GIF image file", "@type": "ALTIMG", "@size": "149", "@ref": "si7", "@mimetype": "image/gif"}, {"@category": "thumbnail", "@height": "22", "@width": "138", "@_fa": "true", "$": "https://api.elsevier.com/content/object/eid/1-s2.0-S1631069105000934-si69.gif?httpAccept=%2A%2F%2A", "@multimediatype": "GIF image file", "@type": "ALTIMG", "@size": "531", "@ref": "si69", "@mimetype": "image/gif"}, {"@category": "thumbnail", "@height": "15", "@width": "54", "@_fa": "true", "$": "https://api.elsevier.com/content/object/eid/1-s2.0-S1631069105000934-si67.gif?httpAccept=%2A%2F%2A", "@multimediatype": "GIF image file", "@type": "ALTIMG", "@size": "286", "@ref": "si67", "@mimetype": "image/gif"}, {"@category": "thumbnail", "@height": "14", "@width": "17", "@_fa": "true", "$": "https://api.elsevier.com/content/object/eid/1-s2.0-S1631069105000934-si66.gif?httpAccept=%2A%2F%2A", "@multimediatype": "GIF image file", "@type": "ALTIMG", "@size": "154", "@ref": "si66", "@mimetype": "image/gif"}, {"@category": "thumbnail", "@height": "14", "@width": "16", "@_fa": "true", "$": "https://api.elsevier.com/content/object/eid/1-s2.0-S1631069105000934-si65.gif?httpAccept=%2A%2F%2A", "@multimediatype": "GIF image file", "@type": "ALTIMG", "@size": "148", "@ref": "si65", "@mimetype": "image/gif"}, {"@category": "thumbnail", "@height": "11", "@width": "14", "@_fa": "true", "$": "https://api.elsevier.com/content/object/eid/1-s2.0-S1631069105000934-si64.gif?httpAccept=%2A%2F%2A", "@multimediatype": "GIF image file", "@type": "ALTIMG", "@size": "137", "@ref": "si64", "@mimetype": "image/gif"}, {"@category": "thumbnail", "@height": "11", "@width": "13", "@_fa": "true", "$": "https://api.elsevier.com/content/object/eid/1-s2.0-S1631069105000934-si63.gif?httpAccept=%2A%2F%2A", "@multimediatype": "GIF image file", "@type": "ALTIMG", "@size": "133", "@ref": "si63", "@mimetype": "image/gif"}, {"@category": "thumbnail", "@height": "14", "@width": "16", "@_fa": "true", "$": "https://api.elsevier.com/content/object/eid/1-s2.0-S1631069105000934-si62.gif?httpAccept=%2A%2F%2A", "@multimediatype": "GIF image file", "@type": "ALTIMG", "@size": "152", "@ref": "si62", "@mimetype": "image/gif"}, {"@category": "thumbnail", "@height": "14", "@width": "15", "@_fa": "true", "$": "https://api.elsevier.com/content/object/eid/1-s2.0-S1631069105000934-si61.gif?httpAccept=%2A%2F%2A", "@multimediatype": "GIF image file", "@type": "ALTIMG", "@size": "148", "@ref": "si61", "@mimetype": "image/gif"}, {"@category": "thumbnail", "@height": "22", "@width": "260", "@_fa": "true", "$": "https://api.elsevier.com/content/object/eid/1-s2.0-S1631069105000934-si60.gif?httpAccept=%2A%2F%2A", "@multimediatype": "GIF image file", "@type": "ALTIMG", "@size": "880", "@ref": "si60", "@mimetype": "image/gif"}, {"@category": "thumbnail", "@height": "14", "@width": "16", "@_fa": "true", "$": "https://api.elsevier.com/content/object/eid/1-s2.0-S1631069105000934-si6.gif?httpAccept=%2A%2F%2A", "@multimediatype": "GIF image file", "@type": "ALTIMG", "@size": "138", "@ref": "si6", "@mimetype": "image/gif"}, {"@category": "thumbnail", "@height": "22", "@width": "276", "@_fa": "true", "$": "https://api.elsevier.com/content/object/eid/1-s2.0-S1631069105000934-si59.gif?httpAccept=%2A%2F%2A", "@multimediatype": "GIF image file", "@type": "ALTIMG", "@size": "917", "@ref": "si59", "@mimetype": "image/gif"}, {"@category": "thumbnail", "@height": "14", "@width": "16", "@_fa": "true", "$": "https://api.elsevier.com/content/object/eid/1-s2.0-S1631069105000934-si58.gif?httpAccept=%2A%2F%2A", "@multimediatype": "GIF image file", "@type": "ALTIMG", "@size": "138", "@ref": "si58", "@mimetype": "image/gif"}, {"@category": "thumbnail", "@height": "14", "@width": "19", "@_fa": "true", "$": "https://api.elsevier.com/content/object/eid/1-s2.0-S1631069105000934-si57.gif?httpAccept=%2A%2F%2A", "@multimediatype": "GIF image file", "@type": "ALTIMG", "@size": "149", "@ref": "si57", "@mimetype": "image/gif"}, {"@category": "thumbnail", "@height": "14", "@width": "16", "@_fa": "true", "$": "https://api.elsevier.com/content/object/eid/1-s2.0-S1631069105000934-si56.gif?httpAccept=%2A%2F%2A", "@multimediatype": "GIF image file", "@type": "ALTIMG", "@size": "138", "@ref": "si56", "@mimetype": "image/gif"}, {"@category": "thumbnail", "@height": "14", "@width": "19", "@_fa": "true", "$": "https://api.elsevier.com/content/object/eid/1-s2.0-S1631069105000934-si55.gif?httpAccept=%2A%2F%2A", "@multimediatype": "GIF image file", "@type": "ALTIMG", "@size": "149", "@ref": "si55", "@mimetype": "image/gif"}, {"@category": "thumbnail", "@height": "12", "@width": "44", "@_fa": "true", "$": "https://api.elsevier.com/content/object/eid/1-s2.0-S1631069105000934-si54.gif?httpAccept=%2A%2F%2A", "@multimediatype": "GIF image file", "@type": "ALTIMG", "@size": "216", "@ref": "si54", "@mimetype": "image/gif"}, {"@category": "thumbnail", "@height": "12", "@width": "16", "@_fa": "true", "$": "https://api.elsevier.com/content/object/eid/1-s2.0-S1631069105000934-si53.gif?httpAccept=%2A%2F%2A", "@multimediatype": "GIF image file", "@type": "ALTIMG", "@size": "150", "@ref": "si53", "@mimetype": "image/gif"}, {"@category": "thumbnail", "@height": "14", "@width": "17", "@_fa": "true", "$": "https://api.elsevier.com/content/object/eid/1-s2.0-S1631069105000934-si52.gif?httpAccept=%2A%2F%2A", "@multimediatype": "GIF image file", "@type": "ALTIMG", "@size": "154", "@ref": "si52", "@mimetype": "image/gif"}, {"@category": "thumbnail", "@height": "11", "@width": "129", "@_fa": "true", "$": "https://api.elsevier.com/content/object/eid/1-s2.0-S1631069105000934-si51.gif?httpAccept=%2A%2F%2A", "@multimediatype": "GIF image file", "@type": "ALTIMG", "@size": "445", "@ref": "si51", "@mimetype": "image/gif"}, {"@category": "thumbnail", "@height": "11", "@width": "129", "@_fa": "true", "$": "https://api.elsevier.com/content/object/eid/1-s2.0-S1631069105000934-si50.gif?httpAccept=%2A%2F%2A", "@multimediatype": "GIF image file", "@type": "ALTIMG", "@size": "445", "@ref": "si50", "@mimetype": "image/gif"}, {"@category": "thumbnail", "@height": "14", "@width": "19", "@_fa": "true", "$": "https://api.elsevier.com/content/object/eid/1-s2.0-S1631069105000934-si5.gif?httpAccept=%2A%2F%2A", "@multimediatype": "GIF image file", "@type": "ALTIMG", "@size": "149", "@ref": "si5", "@mimetype": "image/gif"}, {"@category": "thumbnail", "@height": "11", "@width": "71", "@_fa": "true", "$": "https://api.elsevier.com/content/object/eid/1-s2.0-S1631069105000934-si49.gif?httpAccept=%2A%2F%2A", "@multimediatype": "GIF image file", "@type": "ALTIMG", "@size": "270", "@ref": "si49", "@mimetype": "image/gif"}, {"@category": "thumbnail", "@height": "15", "@width": "505", "@_fa": "true", "$": "https://api.elsevier.com/content/object/eid/1-s2.0-S1631069105000934-si48.gif?httpAccept=%2A%2F%2A", "@multimediatype": "GIF image file", "@type": "ALTIMG", "@size": "1328", "@ref": "si48", "@mimetype": "image/gif"}, {"@category": "thumbnail", "@height": "15", "@width": "62", "@_fa": "true", "$": "https://api.elsevier.com/content/object/eid/1-s2.0-S1631069105000934-si47.gif?httpAccept=%2A%2F%2A", "@multimediatype": "GIF image file", "@type": "ALTIMG", "@size": "317", "@ref": "si47", "@mimetype": "image/gif"}, {"@category": "thumbnail", "@height": "15", "@width": "54", "@_fa": "true", "$": "https://api.elsevier.com/content/object/eid/1-s2.0-S1631069105000934-si46.gif?httpAccept=%2A%2F%2A", "@multimediatype": "GIF image file", "@type": "ALTIMG", "@size": "286", "@ref": "si46", "@mimetype": "image/gif"}, {"@category": "thumbnail", "@height": "11", "@width": "129", "@_fa": "true", "$": "https://api.elsevier.com/content/object/eid/1-s2.0-S1631069105000934-si45.gif?httpAccept=%2A%2F%2A", "@multimediatype": "GIF image file", "@type": "ALTIMG", "@size": "445", "@ref": "si45", "@mimetype": "image/gif"}, {"@category": "thumbnail", "@height": "11", "@width": "71", "@_fa": "true", "$": "https://api.elsevier.com/content/object/eid/1-s2.0-S1631069105000934-si44.gif?httpAccept=%2A%2F%2A", "@multimediatype": "GIF image file", "@type": "ALTIMG", "@size": "270", "@ref": "si44", "@mimetype": "image/gif"}, {"@category": "thumbnail", "@height": "18", "@width": "68", "@_fa": "true", "$": "https://api.elsevier.com/content/object/eid/1-s2.0-S1631069105000934-si43.gif?httpAccept=%2A%2F%2A", "@multimediatype": "GIF image file", "@type": "ALTIMG", "@size": "292", "@ref": "si43", "@mimetype": "image/gif"}, {"@category": "thumbnail", "@height": "14", "@width": "27", "@_fa": "true", "$": "https://api.elsevier.com/content/object/eid/1-s2.0-S1631069105000934-si42.gif?httpAccept=%2A%2F%2A", "@multimediatype": "GIF image file", "@type": "ALTIMG", "@size": "186", "@ref": "si42", "@mimetype": "image/gif"}, {"@category": "thumbnail", "@height": "16", "@width": "145", "@_fa": "true", "$": "https://api.elsevier.com/content/object/eid/1-s2.0-S1631069105000934-si41.gif?httpAccept=%2A%2F%2A", "@multimediatype": "GIF image file", "@type": "ALTIMG", "@size": "500", "@ref": "si41", "@mimetype": "image/gif"}, {"@category": "thumbnail", "@height": "16", "@width": "86", "@_fa": "true", "$": "https://api.elsevier.com/content/object/eid/1-s2.0-S1631069105000934-si40.gif?httpAccept=%2A%2F%2A", "@multimediatype": "GIF image file", "@type": "ALTIMG", "@size": "347", "@ref": "si40", "@mimetype": "image/gif"}, {"@category": "thumbnail", "@height": "11", "@width": "129", "@_fa": "true", "$": "https://api.elsevier.com/content/object/eid/1-s2.0-S1631069105000934-si4.gif?httpAccept=%2A%2F%2A", "@multimediatype": "GIF image file", "@type": "ALTIMG", "@size": "445", "@ref": "si4", "@mimetype": "image/gif"}, {"@category": "thumbnail", "@height": "14", "@width": "27", "@_fa": "true", "$": "https://api.elsevier.com/content/object/eid/1-s2.0-S1631069105000934-si39.gif?httpAccept=%2A%2F%2A", "@multimediatype": "GIF image file", "@type": "ALTIMG", "@size": "186", "@ref": "si39", "@mimetype": "image/gif"}, {"@category": "thumbnail", "@height": "14", "@width": "102", "@_fa": "true", "$": "https://api.elsevier.com/content/object/eid/1-s2.0-S1631069105000934-si38.gif?httpAccept=%2A%2F%2A", "@multimediatype": "GIF image file", "@type": "ALTIMG", "@size": "347", "@ref": "si38", "@mimetype": "image/gif"}, {"@category": "thumbnail", "@height": "14", "@width": "106", "@_fa": "true", "$": "https://api.elsevier.com/content/object/eid/1-s2.0-S1631069105000934-si37.gif?httpAccept=%2A%2F%2A", "@multimediatype": "GIF image file", "@type": "ALTIMG", "@size": "414", "@ref": "si37", "@mimetype": "image/gif"}, {"@category": "thumbnail", "@height": "14", "@width": "37", "@_fa": "true", "$": "https://api.elsevier.com/content/object/eid/1-s2.0-S1631069105000934-si36.gif?httpAccept=%2A%2F%2A", "@multimediatype": "GIF image file", "@type": "ALTIMG", "@size": "203", "@ref": "si36", "@mimetype": "image/gif"}, {"@category": "thumbnail", "@height": "15", "@width": "84", "@_fa": "true", "$": "https://api.elsevier.com/content/object/eid/1-s2.0-S1631069105000934-si35.gif?httpAccept=%2A%2F%2A", "@multimediatype": "GIF image file", "@type": "ALTIMG", "@size": "350", "@ref": "si35", "@mimetype": "image/gif"}, {"@category": "thumbnail", "@height": "14", "@width": "76", "@_fa": "true", "$": "https://api.elsevier.com/content/object/eid/1-s2.0-S1631069105000934-si34.gif?httpAccept=%2A%2F%2A", "@multimediatype": "GIF image file", "@type": "ALTIMG", "@size": "279", "@ref": "si34", "@mimetype": "image/gif"}, {"@category": "thumbnail", "@height": "14", "@width": "58", "@_fa": "true", "$": "https://api.elsevier.com/content/object/eid/1-s2.0-S1631069105000934-si33.gif?httpAccept=%2A%2F%2A", "@multimediatype": "GIF image file", "@type": "ALTIMG", "@size": "243", "@ref": "si33", "@mimetype": "image/gif"}, {"@category": "thumbnail", "@height": "15", "@width": "57", "@_fa": "true", "$": "https://api.elsevier.com/content/object/eid/1-s2.0-S1631069105000934-si32.gif?httpAccept=%2A%2F%2A", "@multimediatype": "GIF image file", "@type": "ALTIMG", "@size": "249", "@ref": "si32", "@mimetype": "image/gif"}, {"@category": "thumbnail", "@height": "14", "@width": "65", "@_fa": "true", "$": "https://api.elsevier.com/content/object/eid/1-s2.0-S1631069105000934-si31.gif?httpAccept=%2A%2F%2A", "@multimediatype": "GIF image file", "@type": "ALTIMG", "@size": "288", "@ref": "si31", "@mimetype": "image/gif"}, {"@category": "thumbnail", "@height": "14", "@width": "54", "@_fa": "true", "$": "https://api.elsevier.com/content/object/eid/1-s2.0-S1631069105000934-si30.gif?httpAccept=%2A%2F%2A", "@multimediatype": "GIF image file", "@type": "ALTIMG", "@size": "227", "@ref": "si30", "@mimetype": "image/gif"}, {"@category": "thumbnail", "@height": "11", "@width": "71", "@_fa": "true", "$": "https://api.elsevier.com/content/object/eid/1-s2.0-S1631069105000934-si3.gif?httpAccept=%2A%2F%2A", "@multimediatype": "GIF image file", "@type": "ALTIMG", "@size": "270", "@ref": "si3", "@mimetype": "image/gif"}, {"@category": "thumbnail", "@height": "14", "@width": "53", "@_fa": "true", "$": "https://api.elsevier.com/content/object/eid/1-s2.0-S1631069105000934-si29.gif?httpAccept=%2A%2F%2A", "@multimediatype": "GIF image file", "@type": "ALTIMG", "@size": "225", "@ref": "si29", "@mimetype": "image/gif"}, {"@category": "thumbnail", "@height": "14", "@width": "64", "@_fa": "true", "$": "https://api.elsevier.com/content/object/eid/1-s2.0-S1631069105000934-si28.gif?httpAccept=%2A%2F%2A", "@multimediatype": "GIF image file", "@type": "ALTIMG", "@size": "282", "@ref": "si28", "@mimetype": "image/gif"}, {"@category": "thumbnail", "@height": "14", "@width": "63", "@_fa": "true", "$": "https://api.elsevier.com/content/object/eid/1-s2.0-S1631069105000934-si27.gif?httpAccept=%2A%2F%2A", "@multimediatype": "GIF image file", "@type": "ALTIMG", "@size": "277", "@ref": "si27", "@mimetype": "image/gif"}, {"@category": "thumbnail", "@height": "15", "@width": "50", "@_fa": "true", "$": "https://api.elsevier.com/content/object/eid/1-s2.0-S1631069105000934-si26.gif?httpAccept=%2A%2F%2A", "@multimediatype": "GIF image file", "@type": "ALTIMG", "@size": "202", "@ref": "si26", "@mimetype": "image/gif"}, {"@category": "thumbnail", "@height": "17", "@width": "273", "@_fa": "true", "$": "https://api.elsevier.com/content/object/eid/1-s2.0-S1631069105000934-si25.gif?httpAccept=%2A%2F%2A", "@multimediatype": "GIF image file", "@type": "ALTIMG", "@size": "790", "@ref": "si25", "@mimetype": "image/gif"}, {"@category": "thumbnail", "@height": "16", "@width": "273", "@_fa": "true", "$": "https://api.elsevier.com/content/object/eid/1-s2.0-S1631069105000934-si24.gif?httpAccept=%2A%2F%2A", "@multimediatype": "GIF image file", "@type": "ALTIMG", "@size": "733", "@ref": "si24", "@mimetype": "image/gif"}, {"@category": "thumbnail", "@height": "22", "@width": "202", "@_fa": "true", "$": "https://api.elsevier.com/content/object/eid/1-s2.0-S1631069105000934-si23.gif?httpAccept=%2A%2F%2A", "@multimediatype": "GIF image file", "@type": "ALTIMG", "@size": "661", "@ref": "si23", "@mimetype": "image/gif"}, {"@category": "thumbnail", "@height": "22", "@width": "219", "@_fa": "true", "$": "https://api.elsevier.com/content/object/eid/1-s2.0-S1631069105000934-si22.gif?httpAccept=%2A%2F%2A", "@multimediatype": "GIF image file", "@type": "ALTIMG", "@size": "709", "@ref": "si22", "@mimetype": "image/gif"}, {"@category": "thumbnail", "@height": "15", "@width": "37", "@_fa": "true", "$": "https://api.elsevier.com/content/object/eid/1-s2.0-S1631069105000934-si21.gif?httpAccept=%2A%2F%2A", "@multimediatype": "GIF image file", "@type": "ALTIMG", "@size": "223", "@ref": "si21", "@mimetype": "image/gif"}, {"@category": "thumbnail", "@height": "16", "@width": "258", "@_fa": "true", "$": "https://api.elsevier.com/content/object/eid/1-s2.0-S1631069105000934-si20.gif?httpAccept=%2A%2F%2A", "@multimediatype": "GIF image file", "@type": "ALTIMG", "@size": "810", "@ref": "si20", "@mimetype": "image/gif"}, {"@category": "thumbnail", "@height": "11", "@width": "129", "@_fa": "true", "$": "https://api.elsevier.com/content/object/eid/1-s2.0-S1631069105000934-si2.gif?httpAccept=%2A%2F%2A", "@multimediatype": "GIF image file", "@type": "ALTIMG", "@size": "445", "@ref": "si2", "@mimetype": "image/gif"}, {"@category": "thumbnail", "@height": "22", "@width": "138", "@_fa": "true", "$": "https://api.elsevier.com/content/object/eid/1-s2.0-S1631069105000934-si19.gif?httpAccept=%2A%2F%2A", "@multimediatype": "GIF image file", "@type": "ALTIMG", "@size": "531", "@ref": "si19", "@mimetype": "image/gif"}, {"@category": "thumbnail", "@height": "15", "@width": "54", "@_fa": "true", "$": "https://api.elsevier.com/content/object/eid/1-s2.0-S1631069105000934-si17.gif?httpAccept=%2A%2F%2A", "@multimediatype": "GIF image file", "@type": "ALTIMG", "@size": "286", "@ref": "si17", "@mimetype": "image/gif"}, {"@category": "thumbnail", "@height": "14", "@width": "17", "@_fa": "true", "$": "https://api.elsevier.com/content/object/eid/1-s2.0-S1631069105000934-si16.gif?httpAccept=%2A%2F%2A", "@multimediatype": "GIF image file", "@type": "ALTIMG", "@size": "154", "@ref": "si16", "@mimetype": "image/gif"}, {"@category": "thumbnail", "@height": "14", "@width": "16", "@_fa": "true", "$": "https://api.elsevier.com/content/object/eid/1-s2.0-S1631069105000934-si15.gif?httpAccept=%2A%2F%2A", "@multimediatype": "GIF image file", "@type": "ALTIMG", "@size": "148", "@ref": "si15", "@mimetype": "image/gif"}, {"@category": "thumbnail", "@height": "11", "@width": "14", "@_fa": "true", "$": "https://api.elsevier.com/content/object/eid/1-s2.0-S1631069105000934-si14.gif?httpAccept=%2A%2F%2A", "@multimediatype": "GIF image file", "@type": "ALTIMG", "@size": "137", "@ref": "si14", "@mimetype": "image/gif"}, {"@category": "thumbnail", "@height": "11", "@width": "13", "@_fa": "true", "$": "https://api.elsevier.com/content/object/eid/1-s2.0-S1631069105000934-si13.gif?httpAccept=%2A%2F%2A", "@multimediatype": "GIF image file", "@type": "ALTIMG", "@size": "133", "@ref": "si13", "@mimetype": "image/gif"}, {"@category": "thumbnail", "@height": "14", "@width": "16", "@_fa": "true", "$": "https://api.elsevier.com/content/object/eid/1-s2.0-S1631069105000934-si12.gif?httpAccept=%2A%2F%2A", "@multimediatype": "GIF image file", "@type": "ALTIMG", "@size": "152", "@ref": "si12", "@mimetype": "image/gif"}, {"@category": "thumbnail", "@height": "14", "@width": "15", "@_fa": "true", "$": "https://api.elsevier.com/content/object/eid/1-s2.0-S1631069105000934-si11.gif?httpAccept=%2A%2F%2A", "@multimediatype": "GIF image file", "@type": "ALTIMG", "@size": "148", "@ref": "si11", "@mimetype": "image/gif"}, {"@category": "thumbnail", "@height": "12", "@width": "44", "@_fa": "true", "$": "https://api.elsevier.com/content/object/eid/1-s2.0-S1631069105000934-si104.gif?httpAccept=%2A%2F%2A", "@multimediatype": "GIF image file", "@type": "ALTIMG", "@size": "216", "@ref": "si104", "@mimetype": "image/gif"}, {"@category": "thumbnail", "@height": "12", "@width": "16", "@_fa": "true", "$": "https://api.elsevier.com/content/object/eid/1-s2.0-S1631069105000934-si103.gif?httpAccept=%2A%2F%2A", "@multimediatype": "GIF image file", "@type": "ALTIMG", "@size": "150", "@ref": "si103", "@mimetype": "image/gif"}, {"@category": "thumbnail", "@height": "14", "@width": "17", "@_fa": "true", "$": "https://api.elsevier.com/content/object/eid/1-s2.0-S1631069105000934-si102.gif?httpAccept=%2A%2F%2A", "@multimediatype": "GIF image file", "@type": "ALTIMG", "@size": "154", "@ref": "si102", "@mimetype": "image/gif"}, {"@category": "thumbnail", "@height": "11", "@width": "129", "@_fa": "true", "$": "https://api.elsevier.com/content/object/eid/1-s2.0-S1631069105000934-si101.gif?httpAccept=%2A%2F%2A", "@multimediatype": "GIF image file", "@type": "ALTIMG", "@size": "445", "@ref": "si101", "@mimetype": "image/gif"}, {"@category": "thumbnail", "@height": "11", "@width": "129", "@_fa": "true", "$": "https://api.elsevier.com/content/object/eid/1-s2.0-S1631069105000934-si100.gif?httpAccept=%2A%2F%2A", "@multimediatype": "GIF image file", "@type": "ALTIMG", "@size": "445", "@ref": "si100", "@mimetype": "image/gif"}, {"@category": "thumbnail", "@height": "22", "@width": "260", "@_fa": "true", "$": "https://api.elsevier.com/content/object/eid/1-s2.0-S1631069105000934-si10.gif?httpAccept=%2A%2F%2A", "@multimediatype": "GIF image file", "@type": "ALTIMG", "@size": "880", "@ref": "si10", "@mimetype": "image/gif"}, {"@category": "thumbnail", "@height": "11", "@width": "71", "@_fa": "true", "$": "https://api.elsevier.com/content/object/eid/1-s2.0-S1631069105000934-si1.gif?httpAccept=%2A%2F%2A", "@multimediatype": "GIF image file", "@type": "ALTIMG", "@size": "270", "@ref": "si1", "@mimetype": "image/gif"}, {"@category": "standard", "@height": "619", "@width": "533", "@_fa": "true", "$": "https://api.elsevier.com/content/object/eid/1-s2.0-S1631069105000934-gr001.jpg?httpAccept=%2A%2F%2A", "@multimediatype": "JPEG image file", "@type": "IMAGE-DOWNSAMPLED", "@size": "95706", "@ref": "gr001", "@mimetype": "image/jpeg"}, {"@category": "thumbnail", "@height": "93", "@width": "80", "@_fa": "true", "$": "https://api.elsevier.com/content/object/eid/1-s2.0-S1631069105000934-gr001.sml?httpAccept=%2A%2F%2A", "@multimediatype": "GIF image file", "@type": "IMAGE-THUMBNAIL", "@size": "3023", "@ref": "gr001", "@mimetype": "image/gif"}]}, "link": {"@rel": "abstract", "@href": "https://api.elsevier.com/content/abstract/scopus_id/25144433929"}}