{"scopus-eid": "2-s2.0-59349098610", "originalText": "serial JL 271122 291210 291684 291736 31 80 Vision Research VISIONRESEARCH 2008-12-13 2008-12-13 2011-01-20T15:00:00 1-s2.0-S004269890800566X S0042-6989(08)00566-X S004269890800566X 10.1016/j.visres.2008.11.002 S300 S300.1 FULL-TEXT 1-s2.0-S0042698909X00027 2015-05-14T02:56:28.155321-04:00 0 0 20090201 20090228 2009 2008-12-13T00:00:00Z articleinfo crossmark dco dateupdated tomb dateloaded datesearch indexeddate issuelist volumelist yearnav articletitlenorm authfirstinitialnorm authfirstsurnamenorm cid cids contenttype copyright dateloadedtxt docsubtype doctype doi eid ewtransactionid hubeid issfirst issn issnnorm itemstage itemtransactionid itemweight oauserlicense openaccess openarchive pg pgfirst pglast pii piinorm pubdateend pubdatestart pubdatetxt pubyr sortorder srctitle srctitlenorm srctype subheadings volfirst volissue webpdf webpdfpagecount figure table body mmlmath acknowledge affil articletitle auth authfirstini authfull authkeywords authlast primabst ref alllist content oa subj ssids 0042-6989 00426989 49 49 3 3 Volume 49, Issue 3 9 362 367 362 367 200902 February 2009 2009-02-01 2009-02-28 2009 article fla Crown copyright \u00a9 2008 Published by Elsevier Ltd. All rights reserved. TRACKINGUNKNOWNMOVINGTARGETSOMNIDIRECTIONALVISION SHUYING Y 1 Introduction 2 Detecting moving target using optical flow algorithm 2.1 Optical flow algorithm 2.2 Constructing the polar coordinate on an omni-image 2.3 Calculating the velocity fields and detecting moving targets 3 Kernel particle filter 4 Experiments 4.1 Detecting experiment 4.2 Tracking experiment 4.2.1 Simulation 4.2.2 Video tracking 4.2.2.1 Constructing a dynamic elliptical template with affine transformation 4.2.2.2 Tracking moving targets using kernel particle filter 5 Conclusion Acknowledgments References CHANG 2005 242 245 C CHENG 1995 790 799 Y GUO 2007 1588 1595 R SILVERMAN 1986 B DENSITYESTIMATIONFORSTATISTICSDATAANALYSIS SHUYINGX2009X362 SHUYINGX2009X362X367 SHUYINGX2009X362XY SHUYINGX2009X362X367XY 2013-07-18T13:41:53Z OA-Window Full ElsevierBranded http://www.elsevier.com/open-access/userlicense/1.0/ item S0042-6989(08)00566-X S004269890800566X 1-s2.0-S004269890800566X 10.1016/j.visres.2008.11.002 271122 2011-02-03T13:36:38.493941-05:00 2009-02-01 2009-02-28 1-s2.0-S004269890800566X-main.pdf https://s3.amazonaws.com/prod-ucs-content-store-us-east/content/pii:S004269890800566X/MAIN/application/pdf/e13a063f54f411d68a68e2ae6181fcf6/main.pdf https://s3-eu-west-1.amazonaws.com/prod-ucs-content-store-eu-west/content/pii:S004269890800566X/MAIN/application/pdf/e13a063f54f411d68a68e2ae6181fcf6/main.pdf main.pdf pdf true 2139056 MAIN 6 1-s2.0-S004269890800566X-main_1.png https://s3.amazonaws.com/prod-ucs-content-store-us-east/content/pii:S004269890800566X/PREVIEW/image/png/25567b6713b2ec64db9c10ca2d08a6d0/main_1.png https://s3-eu-west-1.amazonaws.com/prod-ucs-content-store-eu-west/content/pii:S004269890800566X/PREVIEW/image/png/25567b6713b2ec64db9c10ca2d08a6d0/main_1.png main_1.png png 60145 849 656 IMAGE-WEB-PDF 1 1-s2.0-S004269890800566X-si9.gif https://s3.amazonaws.com/prod-ucs-content-store-us-east/content/pii:S004269890800566X/STRIPIN/image/gif/6a7fad29b5672561af2cd6f476c24aa4/si9.gif https://s3-eu-west-1.amazonaws.com/prod-ucs-content-store-eu-west/content/pii:S004269890800566X/STRIPIN/image/gif/6a7fad29b5672561af2cd6f476c24aa4/si9.gif si9 si9.gif gif 469 22 61 ALTIMG 1-s2.0-S004269890800566X-si8.gif https://s3.amazonaws.com/prod-ucs-content-store-us-east/content/pii:S004269890800566X/STRIPIN/image/gif/ef8da02ddbabd0405f456201c86baed3/si8.gif https://s3-eu-west-1.amazonaws.com/prod-ucs-content-store-eu-west/content/pii:S004269890800566X/STRIPIN/image/gif/ef8da02ddbabd0405f456201c86baed3/si8.gif si8 si8.gif gif 474 22 61 ALTIMG 1-s2.0-S004269890800566X-si7.gif https://s3.amazonaws.com/prod-ucs-content-store-us-east/content/pii:S004269890800566X/STRIPIN/image/gif/6a7fad29b5672561af2cd6f476c24aa4/si9.gif https://s3-eu-west-1.amazonaws.com/prod-ucs-content-store-eu-west/content/pii:S004269890800566X/STRIPIN/image/gif/6a7fad29b5672561af2cd6f476c24aa4/si9.gif si7 si7.gif gif 469 22 61 ALTIMG 1-s2.0-S004269890800566X-si6.gif https://s3.amazonaws.com/prod-ucs-content-store-us-east/content/pii:S004269890800566X/STRIPIN/image/gif/ccb624b6ff3089208e3354a481594c08/si6.gif https://s3-eu-west-1.amazonaws.com/prod-ucs-content-store-eu-west/content/pii:S004269890800566X/STRIPIN/image/gif/ccb624b6ff3089208e3354a481594c08/si6.gif si6 si6.gif gif 1429 46 245 ALTIMG 1-s2.0-S004269890800566X-si52.gif https://s3.amazonaws.com/prod-ucs-content-store-us-east/content/pii:S004269890800566X/STRIPIN/image/gif/384bb500672033a4a1f4c219f34c0102/si52.gif https://s3-eu-west-1.amazonaws.com/prod-ucs-content-store-eu-west/content/pii:S004269890800566X/STRIPIN/image/gif/384bb500672033a4a1f4c219f34c0102/si52.gif si52 si52.gif gif 715 25 141 ALTIMG 1-s2.0-S004269890800566X-si51.gif https://s3.amazonaws.com/prod-ucs-content-store-us-east/content/pii:S004269890800566X/STRIPIN/image/gif/1e365c9c4be9bdf573816cc09b429488/si51.gif https://s3-eu-west-1.amazonaws.com/prod-ucs-content-store-eu-west/content/pii:S004269890800566X/STRIPIN/image/gif/1e365c9c4be9bdf573816cc09b429488/si51.gif si51 si51.gif gif 728 25 122 ALTIMG 1-s2.0-S004269890800566X-si50.gif https://s3.amazonaws.com/prod-ucs-content-store-us-east/content/pii:S004269890800566X/STRIPIN/image/gif/b53dfec57f3ece4cdc928de67a3eb0b7/si50.gif https://s3-eu-west-1.amazonaws.com/prod-ucs-content-store-eu-west/content/pii:S004269890800566X/STRIPIN/image/gif/b53dfec57f3ece4cdc928de67a3eb0b7/si50.gif si50 si50.gif gif 1139 30 189 ALTIMG 1-s2.0-S004269890800566X-si5.gif https://s3.amazonaws.com/prod-ucs-content-store-us-east/content/pii:S004269890800566X/STRIPIN/image/gif/ee0cc348c8c847af09290d39185e5895/si5.gif https://s3-eu-west-1.amazonaws.com/prod-ucs-content-store-eu-west/content/pii:S004269890800566X/STRIPIN/image/gif/ee0cc348c8c847af09290d39185e5895/si5.gif si5 si5.gif gif 1406 46 241 ALTIMG 1-s2.0-S004269890800566X-si49.gif https://s3.amazonaws.com/prod-ucs-content-store-us-east/content/pii:S004269890800566X/STRIPIN/image/gif/8e92dab82a38868fafdf01cb732d07a8/si49.gif https://s3-eu-west-1.amazonaws.com/prod-ucs-content-store-eu-west/content/pii:S004269890800566X/STRIPIN/image/gif/8e92dab82a38868fafdf01cb732d07a8/si49.gif si49 si49.gif gif 811 25 183 ALTIMG 1-s2.0-S004269890800566X-si48.gif https://s3.amazonaws.com/prod-ucs-content-store-us-east/content/pii:S004269890800566X/STRIPIN/image/gif/d86bb67d3052c038cca9e5a3d6b040dd/si48.gif https://s3-eu-west-1.amazonaws.com/prod-ucs-content-store-eu-west/content/pii:S004269890800566X/STRIPIN/image/gif/d86bb67d3052c038cca9e5a3d6b040dd/si48.gif si48 si48.gif gif 1440 30 248 ALTIMG 1-s2.0-S004269890800566X-si47.gif https://s3.amazonaws.com/prod-ucs-content-store-us-east/content/pii:S004269890800566X/STRIPIN/image/gif/e4cff294d132c0546d68ae3fc4fd24e9/si47.gif https://s3-eu-west-1.amazonaws.com/prod-ucs-content-store-eu-west/content/pii:S004269890800566X/STRIPIN/image/gif/e4cff294d132c0546d68ae3fc4fd24e9/si47.gif si47 si47.gif gif 793 26 124 ALTIMG 1-s2.0-S004269890800566X-si46.gif https://s3.amazonaws.com/prod-ucs-content-store-us-east/content/pii:S004269890800566X/STRIPIN/image/gif/a4c8f4da4fce2a85d0398f34ffcc7ed2/si46.gif https://s3-eu-west-1.amazonaws.com/prod-ucs-content-store-eu-west/content/pii:S004269890800566X/STRIPIN/image/gif/a4c8f4da4fce2a85d0398f34ffcc7ed2/si46.gif si46 si46.gif gif 765 26 158 ALTIMG 1-s2.0-S004269890800566X-si45.gif https://s3.amazonaws.com/prod-ucs-content-store-us-east/content/pii:S004269890800566X/STRIPIN/image/gif/abb0760688bb26588cfca265228bf411/si45.gif https://s3-eu-west-1.amazonaws.com/prod-ucs-content-store-eu-west/content/pii:S004269890800566X/STRIPIN/image/gif/abb0760688bb26588cfca265228bf411/si45.gif si45 si45.gif gif 559 19 99 ALTIMG 1-s2.0-S004269890800566X-si44.gif https://s3.amazonaws.com/prod-ucs-content-store-us-east/content/pii:S004269890800566X/STRIPIN/image/gif/3434463f45ab1b85bb083a977065027a/si44.gif https://s3-eu-west-1.amazonaws.com/prod-ucs-content-store-eu-west/content/pii:S004269890800566X/STRIPIN/image/gif/3434463f45ab1b85bb083a977065027a/si44.gif si44 si44.gif gif 406 21 73 ALTIMG 1-s2.0-S004269890800566X-si43.gif https://s3.amazonaws.com/prod-ucs-content-store-us-east/content/pii:S004269890800566X/STRIPIN/image/gif/681e66f1838ad5c38836c47518ff6731/si43.gif https://s3-eu-west-1.amazonaws.com/prod-ucs-content-store-eu-west/content/pii:S004269890800566X/STRIPIN/image/gif/681e66f1838ad5c38836c47518ff6731/si43.gif si43 si43.gif gif 415 30 38 ALTIMG 1-s2.0-S004269890800566X-si42.gif https://s3.amazonaws.com/prod-ucs-content-store-us-east/content/pii:S004269890800566X/STRIPIN/image/gif/2f3a7cca274770fa1bd24e2b70c9fe71/si42.gif https://s3-eu-west-1.amazonaws.com/prod-ucs-content-store-eu-west/content/pii:S004269890800566X/STRIPIN/image/gif/2f3a7cca274770fa1bd24e2b70c9fe71/si42.gif si42 si42.gif gif 231 18 17 ALTIMG 1-s2.0-S004269890800566X-si41.gif https://s3.amazonaws.com/prod-ucs-content-store-us-east/content/pii:S004269890800566X/STRIPIN/image/gif/7475ae603a835bc4cb3cdacc9aaadb4a/si41.gif https://s3-eu-west-1.amazonaws.com/prod-ucs-content-store-eu-west/content/pii:S004269890800566X/STRIPIN/image/gif/7475ae603a835bc4cb3cdacc9aaadb4a/si41.gif si41 si41.gif gif 608 30 72 ALTIMG 1-s2.0-S004269890800566X-si40.gif https://s3.amazonaws.com/prod-ucs-content-store-us-east/content/pii:S004269890800566X/STRIPIN/image/gif/cb639808cf821aea6a44b753aeabaf67/si40.gif https://s3-eu-west-1.amazonaws.com/prod-ucs-content-store-eu-west/content/pii:S004269890800566X/STRIPIN/image/gif/cb639808cf821aea6a44b753aeabaf67/si40.gif si40 si40.gif gif 1739 83 211 ALTIMG 1-s2.0-S004269890800566X-si4.gif https://s3.amazonaws.com/prod-ucs-content-store-us-east/content/pii:S004269890800566X/STRIPIN/image/gif/39ceec9f19bc625e581dbee2185d1082/si4.gif https://s3-eu-west-1.amazonaws.com/prod-ucs-content-store-eu-west/content/pii:S004269890800566X/STRIPIN/image/gif/39ceec9f19bc625e581dbee2185d1082/si4.gif si4 si4.gif gif 681 19 120 ALTIMG 1-s2.0-S004269890800566X-si39.gif https://s3.amazonaws.com/prod-ucs-content-store-us-east/content/pii:S004269890800566X/STRIPIN/image/gif/0e3d5bd15521fe0cb1e06a2a92f86627/si39.gif https://s3-eu-west-1.amazonaws.com/prod-ucs-content-store-eu-west/content/pii:S004269890800566X/STRIPIN/image/gif/0e3d5bd15521fe0cb1e06a2a92f86627/si39.gif si39 si39.gif gif 1459 42 259 ALTIMG 1-s2.0-S004269890800566X-si38.gif https://s3.amazonaws.com/prod-ucs-content-store-us-east/content/pii:S004269890800566X/STRIPIN/image/gif/0991ac6532c7d67216485881e2991724/si38.gif https://s3-eu-west-1.amazonaws.com/prod-ucs-content-store-eu-west/content/pii:S004269890800566X/STRIPIN/image/gif/0991ac6532c7d67216485881e2991724/si38.gif si38 si38.gif gif 994 22 194 ALTIMG 1-s2.0-S004269890800566X-si37.gif https://s3.amazonaws.com/prod-ucs-content-store-us-east/content/pii:S004269890800566X/STRIPIN/image/gif/f19f1d3aedcf18c193cb61ccc5be6b19/si37.gif https://s3-eu-west-1.amazonaws.com/prod-ucs-content-store-eu-west/content/pii:S004269890800566X/STRIPIN/image/gif/f19f1d3aedcf18c193cb61ccc5be6b19/si37.gif si37 si37.gif gif 708 20 151 ALTIMG 1-s2.0-S004269890800566X-si36.gif https://s3.amazonaws.com/prod-ucs-content-store-us-east/content/pii:S004269890800566X/STRIPIN/image/gif/6aa208178d58961d6bb133ba81aa6187/si36.gif https://s3-eu-west-1.amazonaws.com/prod-ucs-content-store-eu-west/content/pii:S004269890800566X/STRIPIN/image/gif/6aa208178d58961d6bb133ba81aa6187/si36.gif si36 si36.gif gif 2346 46 423 ALTIMG 1-s2.0-S004269890800566X-si35.gif https://s3.amazonaws.com/prod-ucs-content-store-us-east/content/pii:S004269890800566X/STRIPIN/image/gif/0eba68377d8e0fd62862b770f66eebb7/si35.gif https://s3-eu-west-1.amazonaws.com/prod-ucs-content-store-eu-west/content/pii:S004269890800566X/STRIPIN/image/gif/0eba68377d8e0fd62862b770f66eebb7/si35.gif si35 si35.gif gif 559 15 132 ALTIMG 1-s2.0-S004269890800566X-si34.gif https://s3.amazonaws.com/prod-ucs-content-store-us-east/content/pii:S004269890800566X/STRIPIN/image/gif/ff31326e7b37e45d21a14fe3a3ddfc32/si34.gif https://s3-eu-west-1.amazonaws.com/prod-ucs-content-store-eu-west/content/pii:S004269890800566X/STRIPIN/image/gif/ff31326e7b37e45d21a14fe3a3ddfc32/si34.gif si34 si34.gif gif 555 19 142 ALTIMG 1-s2.0-S004269890800566X-si33.gif https://s3.amazonaws.com/prod-ucs-content-store-us-east/content/pii:S004269890800566X/STRIPIN/image/gif/35a12908da28a37857563f95092a6252/si33.gif https://s3-eu-west-1.amazonaws.com/prod-ucs-content-store-eu-west/content/pii:S004269890800566X/STRIPIN/image/gif/35a12908da28a37857563f95092a6252/si33.gif si33 si33.gif gif 605 40 83 ALTIMG 1-s2.0-S004269890800566X-si32.gif https://s3.amazonaws.com/prod-ucs-content-store-us-east/content/pii:S004269890800566X/STRIPIN/image/gif/236a56bdb57e61d3fdfe9a26e6e77350/si32.gif https://s3-eu-west-1.amazonaws.com/prod-ucs-content-store-eu-west/content/pii:S004269890800566X/STRIPIN/image/gif/236a56bdb57e61d3fdfe9a26e6e77350/si32.gif si32 si32.gif gif 2050 44 288 ALTIMG 1-s2.0-S004269890800566X-si31.gif https://s3.amazonaws.com/prod-ucs-content-store-us-east/content/pii:S004269890800566X/STRIPIN/image/gif/b6d4c76f5c916d838b16729db6eb7b55/si31.gif https://s3-eu-west-1.amazonaws.com/prod-ucs-content-store-eu-west/content/pii:S004269890800566X/STRIPIN/image/gif/b6d4c76f5c916d838b16729db6eb7b55/si31.gif si31 si31.gif gif 1513 43 217 ALTIMG 1-s2.0-S004269890800566X-si30.gif https://s3.amazonaws.com/prod-ucs-content-store-us-east/content/pii:S004269890800566X/STRIPIN/image/gif/e610e1f99213cfd3304eb2013256fd84/si30.gif https://s3-eu-west-1.amazonaws.com/prod-ucs-content-store-eu-west/content/pii:S004269890800566X/STRIPIN/image/gif/e610e1f99213cfd3304eb2013256fd84/si30.gif si30 si30.gif gif 1579 43 325 ALTIMG 1-s2.0-S004269890800566X-si3.gif https://s3.amazonaws.com/prod-ucs-content-store-us-east/content/pii:S004269890800566X/STRIPIN/image/gif/cacf169d9dc4c5ca14e844979b518dc4/si3.gif https://s3-eu-west-1.amazonaws.com/prod-ucs-content-store-eu-west/content/pii:S004269890800566X/STRIPIN/image/gif/cacf169d9dc4c5ca14e844979b518dc4/si3.gif si3 si3.gif gif 499 21 102 ALTIMG 1-s2.0-S004269890800566X-si29.gif https://s3.amazonaws.com/prod-ucs-content-store-us-east/content/pii:S004269890800566X/STRIPIN/image/gif/12d18c92275c1c7645229b79ae2845bb/si29.gif https://s3-eu-west-1.amazonaws.com/prod-ucs-content-store-eu-west/content/pii:S004269890800566X/STRIPIN/image/gif/12d18c92275c1c7645229b79ae2845bb/si29.gif si29 si29.gif gif 907 43 174 ALTIMG 1-s2.0-S004269890800566X-si28.gif https://s3.amazonaws.com/prod-ucs-content-store-us-east/content/pii:S004269890800566X/STRIPIN/image/gif/dba22df01639f0f1e241d5ed35b82c0a/si28.gif https://s3-eu-west-1.amazonaws.com/prod-ucs-content-store-eu-west/content/pii:S004269890800566X/STRIPIN/image/gif/dba22df01639f0f1e241d5ed35b82c0a/si28.gif si28 si28.gif gif 388 19 69 ALTIMG 1-s2.0-S004269890800566X-si27.gif https://s3.amazonaws.com/prod-ucs-content-store-us-east/content/pii:S004269890800566X/STRIPIN/image/gif/c29de54df2cab2a9d4097c1a3cb22b91/si27.gif https://s3-eu-west-1.amazonaws.com/prod-ucs-content-store-eu-west/content/pii:S004269890800566X/STRIPIN/image/gif/c29de54df2cab2a9d4097c1a3cb22b91/si27.gif si27 si27.gif gif 329 14 56 ALTIMG 1-s2.0-S004269890800566X-si26.gif https://s3.amazonaws.com/prod-ucs-content-store-us-east/content/pii:S004269890800566X/STRIPIN/image/gif/a6f71c5cfea69f399c2506443ecd249b/si26.gif https://s3-eu-west-1.amazonaws.com/prod-ucs-content-store-eu-west/content/pii:S004269890800566X/STRIPIN/image/gif/a6f71c5cfea69f399c2506443ecd249b/si26.gif si26 si26.gif gif 253 12 30 ALTIMG 1-s2.0-S004269890800566X-si25.gif https://s3.amazonaws.com/prod-ucs-content-store-us-east/content/pii:S004269890800566X/STRIPIN/image/gif/a4ac3392a1a645f7765b72eeca2172f0/si25.gif https://s3-eu-west-1.amazonaws.com/prod-ucs-content-store-eu-west/content/pii:S004269890800566X/STRIPIN/image/gif/a4ac3392a1a645f7765b72eeca2172f0/si25.gif si25 si25.gif gif 622 39 94 ALTIMG 1-s2.0-S004269890800566X-si24.gif https://s3.amazonaws.com/prod-ucs-content-store-us-east/content/pii:S004269890800566X/STRIPIN/image/gif/35e017582839687d03d6eaa78044702c/si24.gif https://s3-eu-west-1.amazonaws.com/prod-ucs-content-store-eu-west/content/pii:S004269890800566X/STRIPIN/image/gif/35e017582839687d03d6eaa78044702c/si24.gif si24 si24.gif gif 1594 45 321 ALTIMG 1-s2.0-S004269890800566X-si23.gif https://s3.amazonaws.com/prod-ucs-content-store-us-east/content/pii:S004269890800566X/STRIPIN/image/gif/43e0a708cc4be5fbf10974b89ec6e53b/si23.gif https://s3-eu-west-1.amazonaws.com/prod-ucs-content-store-eu-west/content/pii:S004269890800566X/STRIPIN/image/gif/43e0a708cc4be5fbf10974b89ec6e53b/si23.gif si23 si23.gif gif 294 21 24 ALTIMG 1-s2.0-S004269890800566X-si22.gif https://s3.amazonaws.com/prod-ucs-content-store-us-east/content/pii:S004269890800566X/STRIPIN/image/gif/baa6d2ac54cf77cf69943c314506b305/si22.gif https://s3-eu-west-1.amazonaws.com/prod-ucs-content-store-eu-west/content/pii:S004269890800566X/STRIPIN/image/gif/baa6d2ac54cf77cf69943c314506b305/si22.gif si22 si22.gif gif 287 22 23 ALTIMG 1-s2.0-S004269890800566X-si21.gif https://s3.amazonaws.com/prod-ucs-content-store-us-east/content/pii:S004269890800566X/STRIPIN/image/gif/8cf83977b0c3a8addd3e0b15df29da86/si21.gif https://s3-eu-west-1.amazonaws.com/prod-ucs-content-store-eu-west/content/pii:S004269890800566X/STRIPIN/image/gif/8cf83977b0c3a8addd3e0b15df29da86/si21.gif si21 si21.gif gif 1549 47 266 ALTIMG 1-s2.0-S004269890800566X-si20.gif https://s3.amazonaws.com/prod-ucs-content-store-us-east/content/pii:S004269890800566X/STRIPIN/image/gif/6f7959caa3e0d39474bfe6a117c39233/si20.gif https://s3-eu-west-1.amazonaws.com/prod-ucs-content-store-eu-west/content/pii:S004269890800566X/STRIPIN/image/gif/6f7959caa3e0d39474bfe6a117c39233/si20.gif si20 si20.gif gif 1093 47 187 ALTIMG 1-s2.0-S004269890800566X-si2.gif https://s3.amazonaws.com/prod-ucs-content-store-us-east/content/pii:S004269890800566X/STRIPIN/image/gif/6c928cc0cb8524771c9813b9a0edcff1/si2.gif https://s3-eu-west-1.amazonaws.com/prod-ucs-content-store-eu-west/content/pii:S004269890800566X/STRIPIN/image/gif/6c928cc0cb8524771c9813b9a0edcff1/si2.gif si2 si2.gif gif 1355 40 205 ALTIMG 1-s2.0-S004269890800566X-si19.gif https://s3.amazonaws.com/prod-ucs-content-store-us-east/content/pii:S004269890800566X/STRIPIN/image/gif/c96aa05057810fb99b91a5a348b9d050/si19.gif https://s3-eu-west-1.amazonaws.com/prod-ucs-content-store-eu-west/content/pii:S004269890800566X/STRIPIN/image/gif/c96aa05057810fb99b91a5a348b9d050/si19.gif si19 si19.gif gif 948 47 113 ALTIMG 1-s2.0-S004269890800566X-si18.gif https://s3.amazonaws.com/prod-ucs-content-store-us-east/content/pii:S004269890800566X/STRIPIN/image/gif/a6b9a4b9dcf3be650b1ea81b3981ab91/si18.gif https://s3-eu-west-1.amazonaws.com/prod-ucs-content-store-eu-west/content/pii:S004269890800566X/STRIPIN/image/gif/a6b9a4b9dcf3be650b1ea81b3981ab91/si18.gif si18 si18.gif gif 349 24 35 ALTIMG 1-s2.0-S004269890800566X-si17.gif https://s3.amazonaws.com/prod-ucs-content-store-us-east/content/pii:S004269890800566X/STRIPIN/image/gif/e8ad0e0a8ba20922e01f9779933de0c5/si17.gif https://s3-eu-west-1.amazonaws.com/prod-ucs-content-store-eu-west/content/pii:S004269890800566X/STRIPIN/image/gif/e8ad0e0a8ba20922e01f9779933de0c5/si17.gif si17 si17.gif gif 1591 47 202 ALTIMG 1-s2.0-S004269890800566X-si16.gif https://s3.amazonaws.com/prod-ucs-content-store-us-east/content/pii:S004269890800566X/STRIPIN/image/gif/e18880cc5022737332fa81fcc43e9450/si16.gif https://s3-eu-west-1.amazonaws.com/prod-ucs-content-store-eu-west/content/pii:S004269890800566X/STRIPIN/image/gif/e18880cc5022737332fa81fcc43e9450/si16.gif si16 si16.gif gif 989 48 161 ALTIMG 1-s2.0-S004269890800566X-si15.gif https://s3.amazonaws.com/prod-ucs-content-store-us-east/content/pii:S004269890800566X/STRIPIN/image/gif/f30a05d609180ee8e1467c0ea2bda86f/si15.gif https://s3-eu-west-1.amazonaws.com/prod-ucs-content-store-eu-west/content/pii:S004269890800566X/STRIPIN/image/gif/f30a05d609180ee8e1467c0ea2bda86f/si15.gif si15 si15.gif gif 1190 47 203 ALTIMG 1-s2.0-S004269890800566X-si14.gif https://s3.amazonaws.com/prod-ucs-content-store-us-east/content/pii:S004269890800566X/STRIPIN/image/gif/a4f11d62ff81117018a4f251dd366eb1/si14.gif https://s3-eu-west-1.amazonaws.com/prod-ucs-content-store-eu-west/content/pii:S004269890800566X/STRIPIN/image/gif/a4f11d62ff81117018a4f251dd366eb1/si14.gif si14 si14.gif gif 1344 39 297 ALTIMG 1-s2.0-S004269890800566X-si13.gif https://s3.amazonaws.com/prod-ucs-content-store-us-east/content/pii:S004269890800566X/STRIPIN/image/gif/826224ac6644d81969879df7a8a547e8/si13.gif https://s3-eu-west-1.amazonaws.com/prod-ucs-content-store-eu-west/content/pii:S004269890800566X/STRIPIN/image/gif/826224ac6644d81969879df7a8a547e8/si13.gif si13 si13.gif gif 992 18 200 ALTIMG 1-s2.0-S004269890800566X-si12.gif https://s3.amazonaws.com/prod-ucs-content-store-us-east/content/pii:S004269890800566X/STRIPIN/image/gif/cc72e2d719e2a3ebf3c115d8cc59b76d/si12.gif https://s3-eu-west-1.amazonaws.com/prod-ucs-content-store-eu-west/content/pii:S004269890800566X/STRIPIN/image/gif/cc72e2d719e2a3ebf3c115d8cc59b76d/si12.gif si12 si12.gif gif 573 17 118 ALTIMG 1-s2.0-S004269890800566X-si11.gif https://s3.amazonaws.com/prod-ucs-content-store-us-east/content/pii:S004269890800566X/STRIPIN/image/gif/e95f1365e6fc41b48639d0e6141fe8e1/si11.gif https://s3-eu-west-1.amazonaws.com/prod-ucs-content-store-eu-west/content/pii:S004269890800566X/STRIPIN/image/gif/e95f1365e6fc41b48639d0e6141fe8e1/si11.gif si11 si11.gif gif 412 20 52 ALTIMG 1-s2.0-S004269890800566X-si10.gif https://s3.amazonaws.com/prod-ucs-content-store-us-east/content/pii:S004269890800566X/STRIPIN/image/gif/5683524d840a2a2bcb3c12f89435cc4b/si10.gif https://s3-eu-west-1.amazonaws.com/prod-ucs-content-store-eu-west/content/pii:S004269890800566X/STRIPIN/image/gif/5683524d840a2a2bcb3c12f89435cc4b/si10.gif si10 si10.gif gif 470 20 79 ALTIMG 1-s2.0-S004269890800566X-si1.gif https://s3.amazonaws.com/prod-ucs-content-store-us-east/content/pii:S004269890800566X/STRIPIN/image/gif/5c2f8e4c1794bc0ca8669741116ca3b2/si1.gif https://s3-eu-west-1.amazonaws.com/prod-ucs-content-store-eu-west/content/pii:S004269890800566X/STRIPIN/image/gif/5c2f8e4c1794bc0ca8669741116ca3b2/si1.gif si1 si1.gif gif 949 19 222 ALTIMG 1-s2.0-S004269890800566X-gr1.jpg https://s3.amazonaws.com/prod-ucs-content-store-us-east/content/pii:S004269890800566X/gr1/DOWNSAMPLED/image/jpeg/97babb9566bdd3ac4771ef8c903a2b40/gr1.jpg https://s3-eu-west-1.amazonaws.com/prod-ucs-content-store-eu-west/content/pii:S004269890800566X/gr1/DOWNSAMPLED/image/jpeg/97babb9566bdd3ac4771ef8c903a2b40/gr1.jpg gr1 gr1.jpg jpg 16214 212 227 IMAGE-DOWNSAMPLED 1-s2.0-S004269890800566X-gr1.sml https://s3.amazonaws.com/prod-ucs-content-store-us-east/content/pii:S004269890800566X/gr1/THUMBNAIL/image/gif/fa6fa922fd968acde64ece71683e27b2/gr1.sml https://s3-eu-west-1.amazonaws.com/prod-ucs-content-store-eu-west/content/pii:S004269890800566X/gr1/THUMBNAIL/image/gif/fa6fa922fd968acde64ece71683e27b2/gr1.sml gr1 gr1.sml sml 3348 163 175 IMAGE-THUMBNAIL 1-s2.0-S004269890800566X-gr1_lrg.jpg https://s3.amazonaws.com/prod-ucs-content-store-us-east/content/pii:S004269890800566X/gr1/HIGHRES/image/jpeg/c5acc7fe34cb3c19a3c3402a076604c0/gr1_lrg.jpg https://s3-eu-west-1.amazonaws.com/prod-ucs-content-store-eu-west/content/pii:S004269890800566X/gr1/HIGHRES/image/jpeg/c5acc7fe34cb3c19a3c3402a076604c0/gr1_lrg.jpg gr1 gr1_lrg.jpg jpg 37567 564 604 IMAGE-HIGH-RES 1-s2.0-S004269890800566X-gr2.jpg https://s3.amazonaws.com/prod-ucs-content-store-us-east/content/pii:S004269890800566X/gr2/DOWNSAMPLED/image/jpeg/4e651b58212a864f97bb016c55947d3d/gr2.jpg https://s3-eu-west-1.amazonaws.com/prod-ucs-content-store-eu-west/content/pii:S004269890800566X/gr2/DOWNSAMPLED/image/jpeg/4e651b58212a864f97bb016c55947d3d/gr2.jpg gr2 gr2.jpg jpg 41911 214 642 IMAGE-DOWNSAMPLED 1-s2.0-S004269890800566X-gr2.sml https://s3.amazonaws.com/prod-ucs-content-store-us-east/content/pii:S004269890800566X/gr2/THUMBNAIL/image/gif/1f7ab68f91afcc0e36159097459580b9/gr2.sml https://s3-eu-west-1.amazonaws.com/prod-ucs-content-store-eu-west/content/pii:S004269890800566X/gr2/THUMBNAIL/image/gif/1f7ab68f91afcc0e36159097459580b9/gr2.sml gr2 gr2.sml sml 8313 73 219 IMAGE-THUMBNAIL 1-s2.0-S004269890800566X-gr2_lrg.jpg https://s3.amazonaws.com/prod-ucs-content-store-us-east/content/pii:S004269890800566X/gr2/HIGHRES/image/jpeg/16455ce2a1d76d0167e7ba0febc2e1bc/gr2_lrg.jpg https://s3-eu-west-1.amazonaws.com/prod-ucs-content-store-eu-west/content/pii:S004269890800566X/gr2/HIGHRES/image/jpeg/16455ce2a1d76d0167e7ba0febc2e1bc/gr2_lrg.jpg gr2 gr2_lrg.jpg jpg 145194 570 1707 IMAGE-HIGH-RES 1-s2.0-S004269890800566X-gr3.jpg https://s3.amazonaws.com/prod-ucs-content-store-us-east/content/pii:S004269890800566X/gr3/DOWNSAMPLED/image/jpeg/8b1733d6e290c2373fa5d5d5de3f6b5d/gr3.jpg https://s3-eu-west-1.amazonaws.com/prod-ucs-content-store-eu-west/content/pii:S004269890800566X/gr3/DOWNSAMPLED/image/jpeg/8b1733d6e290c2373fa5d5d5de3f6b5d/gr3.jpg gr3 gr3.jpg jpg 42122 249 290 IMAGE-DOWNSAMPLED 1-s2.0-S004269890800566X-gr3.sml https://s3.amazonaws.com/prod-ucs-content-store-us-east/content/pii:S004269890800566X/gr3/THUMBNAIL/image/gif/555d175cb0b4bdf28af6e7f899b5504a/gr3.sml https://s3-eu-west-1.amazonaws.com/prod-ucs-content-store-eu-west/content/pii:S004269890800566X/gr3/THUMBNAIL/image/gif/555d175cb0b4bdf28af6e7f899b5504a/gr3.sml gr3 gr3.sml sml 6811 164 191 IMAGE-THUMBNAIL 1-s2.0-S004269890800566X-gr3_lrg.jpg https://s3.amazonaws.com/prod-ucs-content-store-us-east/content/pii:S004269890800566X/gr3/HIGHRES/image/jpeg/2212c74fe8adfb4bf721cb50bc679ebb/gr3_lrg.jpg https://s3-eu-west-1.amazonaws.com/prod-ucs-content-store-eu-west/content/pii:S004269890800566X/gr3/HIGHRES/image/jpeg/2212c74fe8adfb4bf721cb50bc679ebb/gr3_lrg.jpg gr3 gr3_lrg.jpg jpg 145342 662 771 IMAGE-HIGH-RES 1-s2.0-S004269890800566X-gr4.jpg https://s3.amazonaws.com/prod-ucs-content-store-us-east/content/pii:S004269890800566X/gr4/DOWNSAMPLED/image/jpeg/d3ac8207cb588e3ef29ce9ad663c61ee/gr4.jpg https://s3-eu-west-1.amazonaws.com/prod-ucs-content-store-eu-west/content/pii:S004269890800566X/gr4/DOWNSAMPLED/image/jpeg/d3ac8207cb588e3ef29ce9ad663c61ee/gr4.jpg gr4 gr4.jpg jpg 33800 274 369 IMAGE-DOWNSAMPLED 1-s2.0-S004269890800566X-gr4.sml https://s3.amazonaws.com/prod-ucs-content-store-us-east/content/pii:S004269890800566X/gr4/THUMBNAIL/image/gif/dda56a276f898451203cdcd1b0337b8a/gr4.sml https://s3-eu-west-1.amazonaws.com/prod-ucs-content-store-eu-west/content/pii:S004269890800566X/gr4/THUMBNAIL/image/gif/dda56a276f898451203cdcd1b0337b8a/gr4.sml gr4 gr4.sml sml 8217 163 219 IMAGE-THUMBNAIL 1-s2.0-S004269890800566X-gr4_lrg.jpg https://s3.amazonaws.com/prod-ucs-content-store-us-east/content/pii:S004269890800566X/gr4/HIGHRES/image/jpeg/3b8afdb04fb22856e8783fc4dc83ebf5/gr4_lrg.jpg https://s3-eu-west-1.amazonaws.com/prod-ucs-content-store-eu-west/content/pii:S004269890800566X/gr4/HIGHRES/image/jpeg/3b8afdb04fb22856e8783fc4dc83ebf5/gr4_lrg.jpg gr4 gr4_lrg.jpg jpg 90810 729 980 IMAGE-HIGH-RES 1-s2.0-S004269890800566X-gr5.jpg https://s3.amazonaws.com/prod-ucs-content-store-us-east/content/pii:S004269890800566X/gr5/DOWNSAMPLED/image/jpeg/09213b4cf672bf5680754b795e4f9534/gr5.jpg https://s3-eu-west-1.amazonaws.com/prod-ucs-content-store-eu-west/content/pii:S004269890800566X/gr5/DOWNSAMPLED/image/jpeg/09213b4cf672bf5680754b795e4f9534/gr5.jpg gr5 gr5.jpg jpg 21239 286 369 IMAGE-DOWNSAMPLED 1-s2.0-S004269890800566X-gr5.sml https://s3.amazonaws.com/prod-ucs-content-store-us-east/content/pii:S004269890800566X/gr5/THUMBNAIL/image/gif/39a3c09f2dc647594cc8538d05be7494/gr5.sml https://s3-eu-west-1.amazonaws.com/prod-ucs-content-store-eu-west/content/pii:S004269890800566X/gr5/THUMBNAIL/image/gif/39a3c09f2dc647594cc8538d05be7494/gr5.sml gr5 gr5.sml sml 4646 164 211 IMAGE-THUMBNAIL 1-s2.0-S004269890800566X-gr5_lrg.jpg https://s3.amazonaws.com/prod-ucs-content-store-us-east/content/pii:S004269890800566X/gr5/HIGHRES/image/jpeg/5971152bc36e7f3e76c6ead8754b23ad/gr5_lrg.jpg https://s3-eu-west-1.amazonaws.com/prod-ucs-content-store-eu-west/content/pii:S004269890800566X/gr5/HIGHRES/image/jpeg/5971152bc36e7f3e76c6ead8754b23ad/gr5_lrg.jpg gr5 gr5_lrg.jpg jpg 53414 760 980 IMAGE-HIGH-RES 1-s2.0-S004269890800566X-gr6.jpg https://s3.amazonaws.com/prod-ucs-content-store-us-east/content/pii:S004269890800566X/gr6/DOWNSAMPLED/image/jpeg/2124e5ff41ebfbf49c97d1a943a4581d/gr6.jpg https://s3-eu-west-1.amazonaws.com/prod-ucs-content-store-eu-west/content/pii:S004269890800566X/gr6/DOWNSAMPLED/image/jpeg/2124e5ff41ebfbf49c97d1a943a4581d/gr6.jpg gr6 gr6.jpg jpg 129345 646 660 IMAGE-DOWNSAMPLED 1-s2.0-S004269890800566X-gr6.sml https://s3.amazonaws.com/prod-ucs-content-store-us-east/content/pii:S004269890800566X/gr6/THUMBNAIL/image/gif/5fa09791235329076d117e1534962faf/gr6.sml https://s3-eu-west-1.amazonaws.com/prod-ucs-content-store-eu-west/content/pii:S004269890800566X/gr6/THUMBNAIL/image/gif/5fa09791235329076d117e1534962faf/gr6.sml gr6 gr6.sml sml 14216 163 167 IMAGE-THUMBNAIL 1-s2.0-S004269890800566X-gr6_lrg.jpg https://s3.amazonaws.com/prod-ucs-content-store-us-east/content/pii:S004269890800566X/gr6/HIGHRES/image/jpeg/1b6314e5b573c4a147743cbb4f7b719d/gr6_lrg.jpg https://s3-eu-west-1.amazonaws.com/prod-ucs-content-store-eu-west/content/pii:S004269890800566X/gr6/HIGHRES/image/jpeg/1b6314e5b573c4a147743cbb4f7b719d/gr6_lrg.jpg gr6 gr6_lrg.jpg jpg 444106 1715 1753 IMAGE-HIGH-RES VR 5538 S0042-6989(08)00566-X 10.1016/j.visres.2008.11.002 Fig. 1 The sketch map of coordinate transformation. Fig. 2 The computed images for optical flow fields. Fig. 3 Optical flow fields. Fig. 4 State estimation at N =100. Fig. 5 RMSE with different particle numbers. Fig. 6 Pictures of the tracking process. (a) Particle filter with 200 particles. (b) Kernel particle filter with 30 particles, three iterations. (c) Tracking model doing affine transformation. Table 1 KPF algorithm. Given s t , 0 ( \u00b7 ) , \u03c9 t , 0 ( \u00b7 ) : Calculate the empirical covariance matrix C ^ t of s t , 0 ( \u00b7 ) ; Compute At such that A t A t T = C ^ t ; Draw e ( \u00b7 ) \u223c N ( 0 , I n x ) ; s t , 1 ( \u00b7 ) = s t , 0 ( \u00b7 ) + \u03bb 0 \u2022 A t \u2022 e ( \u00b7 ) ; \u03c9 t , 1 ( \u00b7 ) = weight ( s t , 1 ( \u00b7 ) ) ; For j=0: I\u22121 \u03bbj +1 = f(\u03bb 0, j +1);//Determine kernel radius s t , j + 1 ( \u00b7 ) = MeanShift s t , j ( \u00b7 ) , \u03c9 t , j ( \u00b7 ) , \u03bb j + 1 ;//Mean shift s t , j + 1 ( \u00b7 ) = s t , j + 1 ( \u00b7 ) + \u03bb j \u2022 A t \u2022 e ( \u00b7 ) ;//Perturbation \u03c9 t , j + 1 ( \u00b7 ) = reweight s t , j + 1 ( \u00b7 ) ;//Reweight End x t = \u2211 n = 1 N s t , I ( n ) \u03c9 t , I ( n ) ;//Estimate s t ( \u00b7 ) = s t , I ( \u00b7 ) , \u03c9 t ( \u00b7 ) = \u03c9 t , I ( \u00b7 ) ;//Propagate Tracking unknown moving targets on omnidirectional vision Yang Shu-Ying \u204e ysying126@126.com Ge WeiMin Zhang Cheng Department of Computer Science and Engineering, Tianjin University of Technology, 263 Hongqinan Road, Nankai District, Tianjin 300191, China \u204e Corresponding author. Abstract This paper presents an integrated method by using optical flow and kernel particle filter (KPF) to detect and track moving targets in omnidirectional vision. According to the circle character in omnidirectional image, the algorithms of optical flow fields and kernel particle filter are improved based on the polar coordinates at the omnidirectional center. The edge of a motion object can be detected by optical flow fields and is surrounded by a reference region. In order to resolve some shape distortions such as rotation and scaling in the omnidirectional image a dynamic elliptical template with affine transformations is constructed and its motion model is established to predict particle state. Histograms are used as the features in the reference region and particle regions. The Bhattacharyya distance is computed for particle weights. Gaussian kernel function is used in kernel particle filter. Experiment results show that the method can detect and track moving objects and has better performance at real-time and accuracy. Keywords Omnidirectional vision Optical flow Particle filter Kernel particle filter 1 Introduction The aim of detection and tracking is to extract moving targets information exactly from complex background, select proper target features, and track moving targets at real-time. The detection and tracking of real-world objects is a challenging problem due to the presence of noise, clutter and dynamic changes in a scene. A variety of detection and tracking algorithms have been proposed and implemented to overcome these difficulties. Optical flow expresses the variation of image and information of motional targets, and it can be used to detect the motion of objects (Jin, Junhong, Wang, Lulu, & Hong, 2005). This approach does not need to define features of a moving target in advance. Optical flow has been extensively studied in the computer vision community. Ha et al. (2004) proposed to detect flying vehicles motion by optical flow algorithm. Yamamoto, Mae, Shirai, and Miura (1995) detected multiple moving objects based on optical flow. Tsutsui, Miura, Jun, and Yoshiaki (2001) used an optical flow way to detect persons by using multiple cameras in indoor environments. However, optical flow computation needs a lot of time, so it is not suit for real-time tracking. Particle filter (PF) has also been widely used in visual tracking field. It offers a probabilistic framework for dynamic state estimation. It is successful for nonlinear non-Gaussian estimation problems. PF does not perform well when the dynamic system has a very small process noise, or if the observation noise has very small variance. In these cases, the particle set quickly collapses to one single point in the state space and the filter performance is severely affected. Chang and Ansari (2003, 2005) and Chang, Ansari, and Khokhar (2005) have proposed a kernel particle filter (KPF) that invokes mean shift to allocate particles more efficiently and use importance sampling to maintain fair samples from the posterior. We compare KPF with the standard PF using simulated and video tracking and show that KPF have better performance on accuracy and speed. In our system an omnidirectional camera with a fish eye is used. The omnidirectional vision (omni-vision) can provide a 360\u00b0 view of the environment in a single image and has been applied in the field of computer vision in recent years. For its advantages of omni direction, compact visual information and direction features, it is of great promising for target tracking and is suitable to wide range applications, such as autonomous navigation (Guo & Qin, 2007), scene reconstruction and surveillance (Delahoche, Pegard, Marhic, & Vasseur, 1997), etc. In this paper, optical flow field is used to detect moving targets and kernel particle filter is used to track the detected moving objects. Based on the circle character of the omni-image, the polar coordinate is constructed to decrease the number of computed pixels. The calculation equation of optical flow fields and the tracking algorithm of KPF are improved at the polar coordinates. The edge of a random motion body is detected by optical flow fields and is surrounded by an ellipse named as a reference region in KPF. After detecting the target region, the histogram is picked up as the feature of candidate regions and reference region. A dynamic motion model is established to predict particle state. The Bhattacharyya distance is computed for particle weights. The particles with small weight are sampled again. Finally, the target state is computed by the total of particle states with weights. 2 Detecting moving target using optical flow algorithm 2.1 Optical flow algorithm The estimation of the motion fields is called optical flow fields (Wang, Huang, & Lin, 2006), which are direction vector fields. For the calculating optical flow fields, it may be assumed that the object brightness is changeless when the object motion. Given a brightness function I(x, y, t) at a pixel position (x, y) and time t, this brightness conservation condition can be written as: (1) I ( x , y , t ) = I ( x + v x t , y + v y t , 0 ) where vx and vy are defined as the components of the motion velocity in x and y direction, respectively. Difference I(x, y, t) with respect to t is assumed as zero, given as the following equation. (2) dI dt = \u2202 I \u2202 x dx dt + \u2202 I \u2202 y dy dt + \u2202 I \u2202 t = 0 2.2 Constructing the polar coordinate on an omni-image Omni-images are circular. Each pixel in the omnidirectional image has its brightness. Its brightness can be exactly acquired based on either the XY coordinates or the polar coordinate. Since the optical flow computation cost too much time, we propose constructing the polar coordinate. The center O(0,0) at the XY coordinates is located on the left-top. The center O\u2032(R, R) of an omni-image (see Fig. 1 ) can be obtained. The (XY) coordinates can be transformed into the (X\u2032Y\u2032) coordinates. A pixel P(x, y) can be transformed into P(x\u2032, y\u2032) which is based on the center O\u2032(R, R) of the omni-image. The polar coordinates system can be calculated by the following equations. (3) r = x \u2032 2 + y \u2032 2 (4) \u03b8 = arctan ( y \u2032 / x \u2032 ) where \u03b8 (0\u00b0\u2a7d \u03b8 \u2a7d360\u00b0) is the intersection angle between O\u2032P and X\u2032 axis, and r is the length of O\u2032P (0\u2a7d r \u2a7d R). 2.3 Calculating the velocity fields and detecting moving targets Every pixel has brightness at (r, \u03b8) polar coordinates. The line of every 1\u00b0 is picked up from the center to the boundary of omni-image. The length of the line is from 0 to R. The angle \u03b8 of the line is from 0 to 359. So the total number of pixels is 360\u00d7 R. The optical flows of these pixels are calculated. So the number of pixels is declined greatly compared with original image. The time of computing optical flow is shorter. The speed of recognizing moving target is improved. Ir , I\u03b8 , It can be calculated from the previous frame, current and next based on polar coordinates. Here, the 3D Sobel convolution kernel is used. Each sum of Ir , I\u03b8 , It is computed by 3D Sobel convolution kernel. ur , \u03b8 is the centripetal velocity from r to the center, vr , \u03b8 is the angle velocity. The following equations are used to calculate the velocity fields [ur , \u03b8 , vr , \u03b8 ] for each pixel (r, \u03b8) in the current frame at polar coordinates. (5) u r , \u03b8 k + 1 = u \u00af r , \u03b8 k - I r [ I r u \u00af r , \u03b8 k + I \u03b8 v \u00af r , \u03b8 k + I t ] \u03b1 2 + I r 2 + I \u03b8 2 (6) v r , \u03b8 k + 1 = v \u00af r , \u03b8 k - I \u03b8 [ I r u \u00af r , \u03b8 k + I \u03b8 v \u00af r , \u03b8 k + I t ] \u03b1 2 + I r 2 + I \u03b8 2 In these equations, [ u r , \u03b8 k , v r , \u03b8 k ] is the velocity estimate at the kth times for the pixel at (r, \u03b8), and [ u \u00af r , \u03b8 k , v \u00af r , \u03b8 k ] is the neighborhood average of [ u r , \u03b8 k , v r , \u03b8 k ] . Accord to the velocity fields [ur , \u03b8 , vr , \u03b8 ] each pixel (r, \u03b8) can be determined whether from moving target or from background 3 Kernel particle filter According to Chang and Ansari (2005), Chang et al. (2005), we use KPF algorithm to track moving targets. Given a particle set at time t: S t = { s t i } i = 1 N and associated weights { \u03c9 t i } i = 1 N . Denote the target state and observation at time t as xt and zt , respectively. x t \u2208 R n x , z t \u2208 R n z . Let z 0: t be the history of observations up to time t. In recursive Bayesian estimation, the posterior PDF is estimated by propagating the PDF over time: (7) p ( x t | z 0 : t ) \u221d p ( z t | x t ) p ( x t | z 0 : t - 1 ) where (8) p ( x t | z 0 : t - 1 ) = \u222b p ( x t | x t - 1 ) p ( x t - 1 | z 0 : t - 1 ) dx t - 1 Kernel density estimate (KDE) (Silverman, 1986) is used in this work to form a continuous estimate of the posterior in order to facilitate gradient estimation. The kernel density estimation of the posterior with kernel K can be formulated as (9) p \u02c6 ( x t | z 0 : t ) = \u2211 n = 1 N K \u03bb ( x t - s t i ) \u03c9 t i where K\u03bb is the kernel scaled by the kernel width \u03bb (10) \u03bb opt = 4 ( n x + 2 ) N 1 n x + 4 Mean shift can be used as a mode-seeking procedure to locate the posterior modes (Cheng, 1995). Each particle is moved to its sample mean determined by (11) m ( s t i ) = \u2211 l = 1 N K \u03bb ( s t i - s t l ) \u03c9 t l s t l \u2211 l = 1 N K \u03bb ( s t i - s t l ) \u03c9 t l The mean shift is applied repeatedly to a particle set. Denote the particle set after the jth mean shift procedure at time t as { s t , j ( \u00b7 ) } . After each mean shift procedure, the weight is re-computed as the posterior density evaluated at the new particle positions augmented with a particle density balancing factor (12) \u03c9 t , j i = p ( s t , j i | z 0 : t ) q t , j ( s t , j i ) where the denominator is the new proposal density that captures the non-uniformity of the new particle set (13) q t , j ( s t , j i ) = \u2211 l = 1 N K \u03bb ( s t , j i - s t , j l ) And the posterior density is given by (14) p s t i | z 0 : t \u221d p z t | s t i \u00b7 \u2211 l = 1 N p s t i | s t - 1 l \u03c9 t - 1 l The KPF pseudo code (Cheng and Ansari, 2005) is given in Table 1 . 4 Experiments Our intention is to use the most appropriate method to detect and track moving targets through omni-vision. 4.1 Detecting experiment Using the improved computing method of optical flow we can detect the moving target at a higher speed on omni-images. The initial k is 0. [ur , \u03b8 , vr , \u03b8 ] is initialized as 0 for each pixel. The average centripetal velocity u \u00af r , \u03b8 k for each pixel is computed along the direction of (r +1, r, r \u22121) by using [111;101;111] as the kernel. The average angle velocity v \u00af r , \u03b8 k for each pixel along the direction of (\u03b8 +1, \u03b8, \u03b8 \u22121) by using [010;101;010] as the kernel. The parameter \u03b1 is the smoothness factor, here \u03b1 =500. The optical flow fields can be computed by using its previous frame, current frame and its next frame, for example Fig. 2 .The moved object\u2019s optical flow is different from the others in background from Fig. 3 . The moving target in optical flow fields can be located. So the optical flow technique can be used to obtain the initial target region. The region is defined as the reference region in the particle filter. Next step is to use KPF to track the moving object. 4.2 Tracking experiment 4.2.1 Simulation In tracking people system, the people often do rotation, turning, accelerating and other movements. The typical nonlinear model is used as following. x k = x k - 1 2 + 25 x k - 1 1 + x k - 1 2 + 8 cos ( 1.2 k ) + \u03b1 k - 1 The observation equation is as follows: Z k = x k 2 20 + \u03b2 k where \u03b1 k - 1 is a zero-mean white Gaussian noise with covariance Q =1, denote the initial state of the target x \u00af 0 = 0.1 , and the initial mean square error P 0 =2. \u03b2k \u22121 is a zero-mean white Gaussian noise with covariance R =1. Gaussian kernel function is used in KPF. In our experiments we set \u03bbi = \u03b7i\u03bb 0, where \u03bb 0 = 1 2 \u03bb opt , and \u03b7 is a number empirically chosen to be 0.8. The running number is 50 times in PF and KPF at different particle numbers. The estimated states in PF and KPF with 100 particle numbers are showed in Fig. 4 .The average root mean square errors (RMSE) with different particle numbers are shown in Fig. 5 . It is shown from Fig. 5 that KPF with less particle numbers gives the better performance before 200 particle numbers than PF. PF with 300 particles achieved the best performance while KPF with 100 samples and three iterations (300 weight computations) gives the better performance. It is clear that KPF provides faster convergence. But with the increase of the particle numbers beyond 300, the performance of KPF reduced quickly than that of PF. 4.2.2 Video tracking 4.2.2.1 Constructing a dynamic elliptical template with affine transformation Before tracking object, the region of moving target has been extracted. As the shape of object is always changed and distorted in omni-image, a fixed template could not change as the distortion of moving target. So we propose constructing a dynamic elliptical template with affine transformation. An ellipse model to represent object region is used, which is more similar to the object shape in omnidirectional image. Eq. (15) is a normal ellipse equation. (15) ( x - x c ) 2 a 2 + ( y - y c ) 2 b 2 = 1 Eq. (15) is changed in the polar coordinates as following: (16) ( r cos \u03b8 - r c cos \u03b8 c ) 2 a 2 + ( r sin \u03b8 - r c sin \u03b8 c ) 2 b 2 = 1 Affine transformation model can be described as Eq. (17): (17) X \u2032 y \u2032 = k cos \u03b4 sin \u03b4 - sin \u03b4 cos \u03b4 x y To construct a dynamic ellipse model according to the change of object shape, the affine transformation model can be modified in the polar coordinate as: (18) r \u2032 cos \u03b8 \u2032 r \u2032 sin \u03b8 \u2032 = k cos \u03b4 sin \u03b4 - sin \u03b4 cos \u03b4 r cos \u03b8 r sin \u03b8 So, r \u2032 = k \u00b7 r \u03b8 \u2032 = \u03b8 - \u03b4 . In this, (r, \u03b8) represent the position in the polar coordinates based on the center O\u2032(R, R) of an omni-image. (a, b) are the lengths of the ellipse in x-axis and y-axis. (r\u2032, \u03b8\u2032) are the polar coordinates affine transformation. The parameter k is the scaling factor and \u03b4 is the angle of rotation. The initial motion parameters (r, \u03b8, a, b) of reference region can be acquired. 4.2.2.2 Tracking moving targets using kernel particle filter We randomly distribute particle set as S ={((ri , \u03b8i , ai , bi ), wi )|i =1,\u2026, n} in which { w i = 1 n | i = 1 , \u2026 , n } and n represents the number of particles. Random dynamic model to predict particle state information is defined as following. (19) s t = As t - 1 + B \u03c9 t - 1 To the ith particle, (20) r t i = A 1 r t - 1 i + B 1 \u03c9 t - 1 i , \u03b8 t i = A 2 \u03b8 t - 1 i + B 2 \u03c9 t - 1 i , a t i = A 3 a t - 1 i + B 3 \u03c9 t - 1 i , b t i = A 4 b t - 1 i + B 4 \u03c9 t - 1 i , i = 1 , \u2026 , n The parameters of A 1, A 2, A 3, A 4 are constants, B 1, B 2, B 3, B 4 represent particle propagation radiuses. The parameter of \u03c9t \u22121 represents a random number between [\u22121,1]. The weight of each particle is determined by the Bhattacharyya factor based on particle color histogram Hi and template color histogram Hm . The color space employed is the normalized as sixteen bins for each chromaticity channel. Bhattacharyya distance is defined as D i = 1 - \u03c1 [ H i c , H m c ] , here, \u03c1 [ H i c , H m c ] = \u2211 c = 1 M H i c gH m c . According to PF the weight of a particle is defined as (21) p ( z t | s t i ) = 1 2 \u03c0 \u03c3 exp - 1 2 \u03c3 2 ( 1 / D i ) 2 If the weight of a particle is too small, the particle is reset using the resample technique. Here, the particle with smaller weight is covered by the particle with the largest weight. After normalizing the particle weights, the parameters of tracked target are computed as following and they are the sum of particles\u2019 weighted parameters. (22) r t = \u2211 i = 1 n w t i r t i , \u03b8 t = \u2211 i = 1 n w t i \u03b8 t i , a t = \u2211 i = 1 n w t i a t i , b t = \u2211 i = 1 n w t i b t i We present results by tracking an object, and show that kernel particle filter is superior to conventional particle filter in tracking rapid motion. The random motion is tracked by PF and KPF. The test video sequence consists of 300 frames of an object moving in a laboratory environment. The motion of the object includes velocity changing and suddenly direction changing. The picked up ellipse area is defined as the model of the object. A few frames of the tracking results using PF and KPF are shown in Fig. 6 . Here, the noise \u03c9t is assumed to be a Gaussian process with zero mean. Gaussian kernel function is used in KPF. In order to improve the computing speed, in our experiments we set \u03bbi =1, and the parameters of k, A 1, A 2, A 3, A 4, B 1, B 2, B 3, B 4 are all defined as 1. From Fig. 6a we can see the center of all particles is in the left of the center of moving object. The PF with 200 particles tends to lag behind when the object produces quick movement that fail to cover the likelihood modes. On the other hand, From Fig. 6b we can see the center of all particles is close to the center of moving object. KPF with 30 particles and three iterations is able to move exactly track the object throughout the sequence. From Fig. 6c we can see the dynamic elliptical template has the function of affine transformation. 5 Conclusion In our experiments, the proposed methods have better performance and can track unexpected random motion and distortion of object. In initial detection state, the required computation time is very longer. Experiment results show that the target template can do affine transformation and the ellipse shape can be changed as the moving target. Thus, the tracking methods keep tracking precise very well when the object rotates or distorts in omni-vision image. At the same time, we use two methods of PF and KPF to track an object. The KPF algorithm is found to provide improved tracking performance in handling rapid motion and occlusion with 85% fewer particles, compared with PF. Next steps of our works should consider finding a better method to save computation time and improve the robust of the estimation. Acknowledgments This research was supported by the Tianjin Science and Technology Development Foundation on the Grant 20071308. References Chang and Ansari, 2003 Chang, Cheng, & Ansari, R. (2003). Kernel particle filter: Iterative sampling for efficient visual tracking. In Proceedings of the IEEE international conference on image processing, Barcelona, Spain, September 2003, pp. 977\u2013980. Chang and Ansari, 2005 Cheng Chang R. Ansari Kernel particle filter for visual tracking IEEE Signal Processing Letters 12 3 2005 242 245 Chang et al., 2005 Chang, Cheng, Ansari, R., & Khokhar, Ashfaq. (2005). Multiple object tracking with kernel particle filter. In Proceedings of the 2005 IEEE computer society conference on computer vision and pattern recognition. Cheng, 1995 Y. Cheng Mean shift, mode seeking, and clustering IEEE Transactions on PAMI 17 8 1995 790 799 Delahoche et al., 1997 Delahoche, L., Pegard, C., Marhic, B., & Vasseur, P. (1997). A navigation system based on an ominidirectional vision sensor [C]. In Proceedings of IEEE conference on intelligent robots and systems (pp. 718\u2013724). Grenoble, France: IEEE. Guo and Qin, 2007 Rong-Hua Guo Zheng Qin An unscented particle filter for ground maneuvering target tracking [J] Journal of Zhejiang University 8 10 2007 1588 1595 Ha et al., 2004 Ha, Jincheol, Alvino, Christopher, Pryor, Gallagher, Niethammer, Marc, Johnson, Eric, & Tannenbaum, Allen. (2004). Active contours and optical flow for automatic tracking of flying vehicles [C]. In Proceeding of the 2004 American control conference (pp. 3441\u20133446). Boston, MA, United States: Institute of Electrical and Electronics Engineers Inc. Jin et al., 2005 Jin, Li, Junhong, Xu, Wang, Cong, Lulu, Zhou, & Hong, Yu. (2005). Research on real-time detection of moving target using gradient optical flow [C]. In Proceedings of ICMA 2005 (pp. 1796\u20131801). Niagara Falls, Canada: Institute of Electrical and Electronics Engineers Computer Society. Silverman, 1986 B.W. Silverman Density estimation for statistics and data analysis 1986 Chapman & Hall London, UK Tsutsui et al., 2001 Tsutsui, Hideki (Department of CCMS, Osaka University), Miura, Jun, Shirai, Yoshiaki. (2001). Optical flow-based person tracking by multiple cameras [C]. In IEEE international conference on multisensor fusion and integration for intelligent systems (pp. 91\u201396). Baden-Baden: Institute of Electrical and Electronics Engineers Inc. Wang et al., 2006 Wang, Ming-Liang, Huang, Chi-Chang, & Lin, Huei-Yung. (2006). An intelligent surveillance system based on an omnidirectional vision sensor [C]. In Proceedings of 2006 IEEE conference on cybernetics and intelligent systems (p. 4017871). Bangkok, Thailand: Institute of Electrical and Electronics Engineers Computer Society. Yamamoto et al., 1995 Yamamoto, S., Mae, Y., Shirai, Y., & Miura, J. (1995). Real-time multiple object tracking based on optical flows [C]. In Proceedings of the 1995 IEEE international conference on robotics and automation (pp. 2328\u20132333). Nagoya, Japan: IEEE.", "scopus-id": "59349098610", "pubmed-id": "19032961", "coredata": {"eid": "1-s2.0-S004269890800566X", "dc:description": "Abstract This paper presents an integrated method by using optical flow and kernel particle filter (KPF) to detect and track moving targets in omnidirectional vision. According to the circle character in omnidirectional image, the algorithms of optical flow fields and kernel particle filter are improved based on the polar coordinates at the omnidirectional center. The edge of a motion object can be detected by optical flow fields and is surrounded by a reference region. In order to resolve some shape distortions such as rotation and scaling in the omnidirectional image a dynamic elliptical template with affine transformations is constructed and its motion model is established to predict particle state. Histograms are used as the features in the reference region and particle regions. The Bhattacharyya distance is computed for particle weights. Gaussian kernel function is used in kernel particle filter. Experiment results show that the method can detect and track moving objects and has better performance at real-time and accuracy.", "openArchiveArticle": "true", "prism:coverDate": "2009-02-28", "openaccessUserLicense": "http://www.elsevier.com/open-access/userlicense/1.0/", "prism:aggregationType": "Journal", "prism:url": "https://api.elsevier.com/content/article/pii/S004269890800566X", "dc:creator": [{"@_fa": "true", "$": "Shu-Ying, Yang"}, {"@_fa": "true", "$": "WeiMin, Ge"}, {"@_fa": "true", "$": "Cheng, Zhang"}], "link": [{"@_fa": "true", "@rel": "self", "@href": "https://api.elsevier.com/content/article/pii/S004269890800566X"}, {"@_fa": "true", "@rel": "scidir", "@href": "https://www.sciencedirect.com/science/article/pii/S004269890800566X"}], "dc:format": "application/json", "openaccessType": "Full", "pii": "S0042-6989(08)00566-X", "prism:volume": "49", "prism:publisher": "Published by Elsevier Ltd.", "dc:title": "Tracking unknown moving targets on omnidirectional vision", "prism:copyright": "Crown copyright \u00a9 2008 Published by Elsevier Ltd. All rights reserved.", "openaccess": "1", "prism:issn": "00426989", "prism:issueIdentifier": "3", "dcterms:subject": [{"@_fa": "true", "$": "Omnidirectional vision"}, {"@_fa": "true", "$": "Optical flow"}, {"@_fa": "true", "$": "Particle filter"}, {"@_fa": "true", "$": "Kernel particle filter"}], "openaccessArticle": "true", "prism:publicationName": "Vision Research", "prism:number": "3", "openaccessSponsorType": "ElsevierBranded", "prism:pageRange": "362-367", "prism:endingPage": "367", "prism:coverDisplayDate": "February 2009", "prism:doi": "10.1016/j.visres.2008.11.002", "prism:startingPage": "362", "dc:identifier": "doi:10.1016/j.visres.2008.11.002", "openaccessSponsorName": null}, "objects": {"object": [{"@category": "thumbnail", "@height": "22", "@width": "61", "@_fa": "true", "$": "https://api.elsevier.com/content/object/eid/1-s2.0-S004269890800566X-si9.gif?httpAccept=%2A%2F%2A", "@multimediatype": "GIF image file", "@type": "ALTIMG", "@size": "469", "@ref": "si9", "@mimetype": "image/gif"}, {"@category": "thumbnail", "@height": "22", "@width": "61", "@_fa": "true", "$": "https://api.elsevier.com/content/object/eid/1-s2.0-S004269890800566X-si8.gif?httpAccept=%2A%2F%2A", "@multimediatype": "GIF image file", "@type": "ALTIMG", "@size": "474", "@ref": "si8", "@mimetype": "image/gif"}, {"@category": "thumbnail", "@height": "22", "@width": "61", "@_fa": "true", "$": "https://api.elsevier.com/content/object/eid/1-s2.0-S004269890800566X-si7.gif?httpAccept=%2A%2F%2A", "@multimediatype": "GIF image file", "@type": "ALTIMG", "@size": "469", "@ref": "si7", "@mimetype": "image/gif"}, {"@category": "thumbnail", "@height": "46", "@width": "245", "@_fa": "true", "$": "https://api.elsevier.com/content/object/eid/1-s2.0-S004269890800566X-si6.gif?httpAccept=%2A%2F%2A", "@multimediatype": "GIF image file", "@type": "ALTIMG", "@size": "1429", "@ref": "si6", "@mimetype": "image/gif"}, {"@category": "thumbnail", "@height": "25", "@width": "141", "@_fa": "true", "$": "https://api.elsevier.com/content/object/eid/1-s2.0-S004269890800566X-si52.gif?httpAccept=%2A%2F%2A", "@multimediatype": "GIF image file", "@type": "ALTIMG", "@size": "715", "@ref": "si52", "@mimetype": "image/gif"}, {"@category": "thumbnail", "@height": "25", "@width": "122", "@_fa": "true", "$": "https://api.elsevier.com/content/object/eid/1-s2.0-S004269890800566X-si51.gif?httpAccept=%2A%2F%2A", "@multimediatype": "GIF image file", "@type": "ALTIMG", "@size": "728", "@ref": "si51", "@mimetype": "image/gif"}, {"@category": "thumbnail", "@height": "30", "@width": "189", "@_fa": "true", "$": "https://api.elsevier.com/content/object/eid/1-s2.0-S004269890800566X-si50.gif?httpAccept=%2A%2F%2A", "@multimediatype": "GIF image file", "@type": "ALTIMG", "@size": "1139", "@ref": "si50", "@mimetype": "image/gif"}, {"@category": "thumbnail", "@height": "46", "@width": "241", "@_fa": "true", "$": "https://api.elsevier.com/content/object/eid/1-s2.0-S004269890800566X-si5.gif?httpAccept=%2A%2F%2A", "@multimediatype": "GIF image file", "@type": "ALTIMG", "@size": "1406", "@ref": "si5", "@mimetype": "image/gif"}, {"@category": "thumbnail", "@height": "25", "@width": "183", "@_fa": "true", "$": "https://api.elsevier.com/content/object/eid/1-s2.0-S004269890800566X-si49.gif?httpAccept=%2A%2F%2A", "@multimediatype": "GIF image file", "@type": "ALTIMG", "@size": "811", "@ref": "si49", "@mimetype": "image/gif"}, {"@category": "thumbnail", "@height": "30", "@width": "248", "@_fa": "true", "$": "https://api.elsevier.com/content/object/eid/1-s2.0-S004269890800566X-si48.gif?httpAccept=%2A%2F%2A", "@multimediatype": "GIF image file", "@type": "ALTIMG", "@size": "1440", "@ref": "si48", "@mimetype": "image/gif"}, {"@category": "thumbnail", "@height": "26", "@width": "124", "@_fa": "true", "$": "https://api.elsevier.com/content/object/eid/1-s2.0-S004269890800566X-si47.gif?httpAccept=%2A%2F%2A", "@multimediatype": "GIF image file", "@type": "ALTIMG", "@size": "793", "@ref": "si47", "@mimetype": "image/gif"}, {"@category": "thumbnail", "@height": "26", "@width": "158", "@_fa": "true", "$": "https://api.elsevier.com/content/object/eid/1-s2.0-S004269890800566X-si46.gif?httpAccept=%2A%2F%2A", "@multimediatype": "GIF image file", "@type": "ALTIMG", "@size": "765", "@ref": "si46", "@mimetype": "image/gif"}, {"@category": "thumbnail", "@height": "19", "@width": "99", "@_fa": "true", "$": "https://api.elsevier.com/content/object/eid/1-s2.0-S004269890800566X-si45.gif?httpAccept=%2A%2F%2A", "@multimediatype": "GIF image file", "@type": "ALTIMG", "@size": "559", "@ref": "si45", "@mimetype": "image/gif"}, {"@category": "thumbnail", "@height": "21", "@width": "73", "@_fa": "true", "$": "https://api.elsevier.com/content/object/eid/1-s2.0-S004269890800566X-si44.gif?httpAccept=%2A%2F%2A", "@multimediatype": "GIF image file", "@type": "ALTIMG", "@size": "406", "@ref": "si44", "@mimetype": "image/gif"}, {"@category": "thumbnail", "@height": "30", "@width": "38", "@_fa": "true", "$": "https://api.elsevier.com/content/object/eid/1-s2.0-S004269890800566X-si43.gif?httpAccept=%2A%2F%2A", "@multimediatype": "GIF image file", "@type": "ALTIMG", "@size": "415", "@ref": "si43", "@mimetype": "image/gif"}, {"@category": "thumbnail", "@height": "18", "@width": "17", "@_fa": "true", "$": "https://api.elsevier.com/content/object/eid/1-s2.0-S004269890800566X-si42.gif?httpAccept=%2A%2F%2A", "@multimediatype": "GIF image file", "@type": "ALTIMG", "@size": "231", "@ref": "si42", "@mimetype": "image/gif"}, {"@category": "thumbnail", "@height": "30", "@width": "72", "@_fa": "true", "$": "https://api.elsevier.com/content/object/eid/1-s2.0-S004269890800566X-si41.gif?httpAccept=%2A%2F%2A", "@multimediatype": "GIF image file", "@type": "ALTIMG", "@size": "608", "@ref": "si41", "@mimetype": "image/gif"}, {"@category": "thumbnail", "@height": "83", "@width": "211", "@_fa": "true", "$": "https://api.elsevier.com/content/object/eid/1-s2.0-S004269890800566X-si40.gif?httpAccept=%2A%2F%2A", "@multimediatype": "GIF image file", "@type": "ALTIMG", "@size": "1739", "@ref": "si40", "@mimetype": "image/gif"}, {"@category": "thumbnail", "@height": "19", "@width": "120", "@_fa": "true", "$": "https://api.elsevier.com/content/object/eid/1-s2.0-S004269890800566X-si4.gif?httpAccept=%2A%2F%2A", "@multimediatype": "GIF image file", "@type": "ALTIMG", "@size": "681", "@ref": "si4", "@mimetype": "image/gif"}, {"@category": "thumbnail", "@height": "42", "@width": "259", "@_fa": "true", "$": "https://api.elsevier.com/content/object/eid/1-s2.0-S004269890800566X-si39.gif?httpAccept=%2A%2F%2A", "@multimediatype": "GIF image file", "@type": "ALTIMG", "@size": "1459", "@ref": "si39", "@mimetype": "image/gif"}, {"@category": "thumbnail", "@height": "22", "@width": "194", "@_fa": "true", "$": "https://api.elsevier.com/content/object/eid/1-s2.0-S004269890800566X-si38.gif?httpAccept=%2A%2F%2A", "@multimediatype": "GIF image file", "@type": "ALTIMG", "@size": "994", "@ref": "si38", "@mimetype": "image/gif"}, {"@category": "thumbnail", "@height": "20", "@width": "151", "@_fa": "true", "$": "https://api.elsevier.com/content/object/eid/1-s2.0-S004269890800566X-si37.gif?httpAccept=%2A%2F%2A", "@multimediatype": "GIF image file", "@type": "ALTIMG", "@size": "708", "@ref": "si37", "@mimetype": "image/gif"}, {"@category": "thumbnail", "@height": "46", "@width": "423", "@_fa": "true", "$": "https://api.elsevier.com/content/object/eid/1-s2.0-S004269890800566X-si36.gif?httpAccept=%2A%2F%2A", "@multimediatype": "GIF image file", "@type": "ALTIMG", "@size": "2346", "@ref": "si36", "@mimetype": "image/gif"}, {"@category": "thumbnail", "@height": "15", "@width": "132", "@_fa": "true", "$": "https://api.elsevier.com/content/object/eid/1-s2.0-S004269890800566X-si35.gif?httpAccept=%2A%2F%2A", "@multimediatype": "GIF image file", "@type": "ALTIMG", "@size": "559", "@ref": "si35", "@mimetype": "image/gif"}, {"@category": "thumbnail", "@height": "19", "@width": "142", "@_fa": "true", "$": "https://api.elsevier.com/content/object/eid/1-s2.0-S004269890800566X-si34.gif?httpAccept=%2A%2F%2A", "@multimediatype": "GIF image file", "@type": "ALTIMG", "@size": "555", "@ref": "si34", "@mimetype": "image/gif"}, {"@category": "thumbnail", "@height": "40", "@width": "83", "@_fa": "true", "$": "https://api.elsevier.com/content/object/eid/1-s2.0-S004269890800566X-si33.gif?httpAccept=%2A%2F%2A", "@multimediatype": "GIF image file", "@type": "ALTIMG", "@size": "605", "@ref": "si33", "@mimetype": "image/gif"}, {"@category": "thumbnail", "@height": "44", "@width": "288", "@_fa": "true", "$": "https://api.elsevier.com/content/object/eid/1-s2.0-S004269890800566X-si32.gif?httpAccept=%2A%2F%2A", "@multimediatype": "GIF image file", "@type": "ALTIMG", "@size": "2050", "@ref": "si32", "@mimetype": "image/gif"}, {"@category": "thumbnail", "@height": "43", "@width": "217", "@_fa": "true", "$": "https://api.elsevier.com/content/object/eid/1-s2.0-S004269890800566X-si31.gif?httpAccept=%2A%2F%2A", "@multimediatype": "GIF image file", "@type": "ALTIMG", "@size": "1513", "@ref": "si31", "@mimetype": "image/gif"}, {"@category": "thumbnail", "@height": "43", "@width": "325", "@_fa": "true", "$": "https://api.elsevier.com/content/object/eid/1-s2.0-S004269890800566X-si30.gif?httpAccept=%2A%2F%2A", "@multimediatype": "GIF image file", "@type": "ALTIMG", "@size": "1579", "@ref": "si30", "@mimetype": "image/gif"}, {"@category": "thumbnail", "@height": "21", "@width": "102", "@_fa": "true", "$": "https://api.elsevier.com/content/object/eid/1-s2.0-S004269890800566X-si3.gif?httpAccept=%2A%2F%2A", "@multimediatype": "GIF image file", "@type": "ALTIMG", "@size": "499", "@ref": "si3", "@mimetype": "image/gif"}, {"@category": "thumbnail", "@height": "43", "@width": "174", "@_fa": "true", "$": "https://api.elsevier.com/content/object/eid/1-s2.0-S004269890800566X-si29.gif?httpAccept=%2A%2F%2A", "@multimediatype": "GIF image file", "@type": "ALTIMG", "@size": "907", "@ref": "si29", "@mimetype": "image/gif"}, {"@category": "thumbnail", "@height": "19", "@width": "69", "@_fa": "true", "$": "https://api.elsevier.com/content/object/eid/1-s2.0-S004269890800566X-si28.gif?httpAccept=%2A%2F%2A", "@multimediatype": "GIF image file", "@type": "ALTIMG", "@size": "388", "@ref": "si28", "@mimetype": "image/gif"}, {"@category": "thumbnail", "@height": "14", "@width": "56", "@_fa": "true", "$": "https://api.elsevier.com/content/object/eid/1-s2.0-S004269890800566X-si27.gif?httpAccept=%2A%2F%2A", "@multimediatype": "GIF image file", "@type": "ALTIMG", "@size": "329", "@ref": "si27", "@mimetype": "image/gif"}, {"@category": "thumbnail", "@height": "12", "@width": "30", "@_fa": "true", "$": "https://api.elsevier.com/content/object/eid/1-s2.0-S004269890800566X-si26.gif?httpAccept=%2A%2F%2A", "@multimediatype": "GIF image file", "@type": "ALTIMG", "@size": "253", "@ref": "si26", "@mimetype": "image/gif"}, {"@category": "thumbnail", "@height": "39", "@width": "94", "@_fa": "true", "$": "https://api.elsevier.com/content/object/eid/1-s2.0-S004269890800566X-si25.gif?httpAccept=%2A%2F%2A", "@multimediatype": "GIF image file", "@type": "ALTIMG", "@size": "622", "@ref": "si25", "@mimetype": "image/gif"}, {"@category": "thumbnail", "@height": "45", "@width": "321", "@_fa": "true", "$": "https://api.elsevier.com/content/object/eid/1-s2.0-S004269890800566X-si24.gif?httpAccept=%2A%2F%2A", "@multimediatype": "GIF image file", "@type": "ALTIMG", "@size": "1594", "@ref": "si24", "@mimetype": "image/gif"}, {"@category": "thumbnail", "@height": "21", "@width": "24", "@_fa": "true", "$": "https://api.elsevier.com/content/object/eid/1-s2.0-S004269890800566X-si23.gif?httpAccept=%2A%2F%2A", "@multimediatype": "GIF image file", "@type": "ALTIMG", "@size": "294", "@ref": "si23", "@mimetype": "image/gif"}, {"@category": "thumbnail", "@height": "22", "@width": "23", "@_fa": "true", "$": "https://api.elsevier.com/content/object/eid/1-s2.0-S004269890800566X-si22.gif?httpAccept=%2A%2F%2A", "@multimediatype": "GIF image file", "@type": "ALTIMG", "@size": "287", "@ref": "si22", "@mimetype": "image/gif"}, {"@category": "thumbnail", "@height": "47", "@width": "266", "@_fa": "true", "$": "https://api.elsevier.com/content/object/eid/1-s2.0-S004269890800566X-si21.gif?httpAccept=%2A%2F%2A", "@multimediatype": "GIF image file", "@type": "ALTIMG", "@size": "1549", "@ref": "si21", "@mimetype": "image/gif"}, {"@category": "thumbnail", "@height": "47", "@width": "187", "@_fa": "true", "$": "https://api.elsevier.com/content/object/eid/1-s2.0-S004269890800566X-si20.gif?httpAccept=%2A%2F%2A", "@multimediatype": "GIF image file", "@type": "ALTIMG", "@size": "1093", "@ref": "si20", "@mimetype": "image/gif"}, {"@category": "thumbnail", "@height": "40", "@width": "205", "@_fa": "true", "$": "https://api.elsevier.com/content/object/eid/1-s2.0-S004269890800566X-si2.gif?httpAccept=%2A%2F%2A", "@multimediatype": "GIF image file", "@type": "ALTIMG", "@size": "1355", "@ref": "si2", "@mimetype": "image/gif"}, {"@category": "thumbnail", "@height": "47", "@width": "113", "@_fa": "true", "$": "https://api.elsevier.com/content/object/eid/1-s2.0-S004269890800566X-si19.gif?httpAccept=%2A%2F%2A", "@multimediatype": "GIF image file", "@type": "ALTIMG", "@size": "948", "@ref": "si19", "@mimetype": "image/gif"}, {"@category": "thumbnail", "@height": "24", "@width": "35", "@_fa": "true", "$": "https://api.elsevier.com/content/object/eid/1-s2.0-S004269890800566X-si18.gif?httpAccept=%2A%2F%2A", "@multimediatype": "GIF image file", "@type": "ALTIMG", "@size": "349", "@ref": "si18", "@mimetype": "image/gif"}, {"@category": "thumbnail", "@height": "47", "@width": "202", "@_fa": "true", "$": "https://api.elsevier.com/content/object/eid/1-s2.0-S004269890800566X-si17.gif?httpAccept=%2A%2F%2A", "@multimediatype": "GIF image file", "@type": "ALTIMG", "@size": "1591", "@ref": "si17", "@mimetype": "image/gif"}, {"@category": "thumbnail", "@height": "48", "@width": "161", "@_fa": "true", "$": "https://api.elsevier.com/content/object/eid/1-s2.0-S004269890800566X-si16.gif?httpAccept=%2A%2F%2A", "@multimediatype": "GIF image file", "@type": "ALTIMG", "@size": "989", "@ref": "si16", "@mimetype": "image/gif"}, {"@category": "thumbnail", "@height": "47", "@width": "203", "@_fa": "true", "$": "https://api.elsevier.com/content/object/eid/1-s2.0-S004269890800566X-si15.gif?httpAccept=%2A%2F%2A", "@multimediatype": "GIF image file", "@type": "ALTIMG", "@size": "1190", "@ref": "si15", "@mimetype": "image/gif"}, {"@category": "thumbnail", "@height": "39", "@width": "297", "@_fa": "true", "$": "https://api.elsevier.com/content/object/eid/1-s2.0-S004269890800566X-si14.gif?httpAccept=%2A%2F%2A", "@multimediatype": "GIF image file", "@type": "ALTIMG", "@size": "1344", "@ref": "si14", "@mimetype": "image/gif"}, {"@category": "thumbnail", "@height": "18", "@width": "200", "@_fa": "true", "$": "https://api.elsevier.com/content/object/eid/1-s2.0-S004269890800566X-si13.gif?httpAccept=%2A%2F%2A", "@multimediatype": "GIF image file", "@type": "ALTIMG", "@size": "992", "@ref": "si13", "@mimetype": "image/gif"}, {"@category": "thumbnail", "@height": "17", "@width": "118", "@_fa": "true", "$": "https://api.elsevier.com/content/object/eid/1-s2.0-S004269890800566X-si12.gif?httpAccept=%2A%2F%2A", "@multimediatype": "GIF image file", "@type": "ALTIMG", "@size": "573", "@ref": "si12", "@mimetype": "image/gif"}, {"@category": "thumbnail", "@height": "20", "@width": "52", "@_fa": "true", "$": "https://api.elsevier.com/content/object/eid/1-s2.0-S004269890800566X-si11.gif?httpAccept=%2A%2F%2A", "@multimediatype": "GIF image file", "@type": "ALTIMG", "@size": "412", "@ref": "si11", "@mimetype": "image/gif"}, {"@category": "thumbnail", "@height": "20", "@width": "79", "@_fa": "true", "$": "https://api.elsevier.com/content/object/eid/1-s2.0-S004269890800566X-si10.gif?httpAccept=%2A%2F%2A", "@multimediatype": "GIF image file", "@type": "ALTIMG", "@size": "470", "@ref": "si10", "@mimetype": "image/gif"}, {"@category": "thumbnail", "@height": "19", "@width": "222", "@_fa": "true", "$": "https://api.elsevier.com/content/object/eid/1-s2.0-S004269890800566X-si1.gif?httpAccept=%2A%2F%2A", "@multimediatype": "GIF image file", "@type": "ALTIMG", "@size": "949", "@ref": "si1", "@mimetype": "image/gif"}, {"@category": "standard", "@height": "212", "@width": "227", "@_fa": "true", "$": "https://api.elsevier.com/content/object/eid/1-s2.0-S004269890800566X-gr1.jpg?httpAccept=%2A%2F%2A", "@multimediatype": "JPEG image file", "@type": "IMAGE-DOWNSAMPLED", "@size": "16214", "@ref": "gr1", "@mimetype": "image/jpeg"}, {"@category": "thumbnail", "@height": "163", "@width": "175", "@_fa": "true", "$": "https://api.elsevier.com/content/object/eid/1-s2.0-S004269890800566X-gr1.sml?httpAccept=%2A%2F%2A", "@multimediatype": "GIF image file", "@type": "IMAGE-THUMBNAIL", "@size": "3348", "@ref": "gr1", "@mimetype": "image/gif"}, {"@category": "high", "@height": "564", "@width": "604", "@_fa": "true", "$": "https://api.elsevier.com/content/object/eid/1-s2.0-S004269890800566X-gr1_lrg.jpg?httpAccept=%2A%2F%2A", "@multimediatype": "JPEG image file", "@type": "IMAGE-HIGH-RES", "@size": "37567", "@ref": "gr1", "@mimetype": "image/jpeg"}, {"@category": "standard", "@height": "214", "@width": "642", "@_fa": "true", "$": "https://api.elsevier.com/content/object/eid/1-s2.0-S004269890800566X-gr2.jpg?httpAccept=%2A%2F%2A", "@multimediatype": "JPEG image file", "@type": "IMAGE-DOWNSAMPLED", "@size": "41911", "@ref": "gr2", "@mimetype": "image/jpeg"}, {"@category": "thumbnail", "@height": "73", "@width": "219", "@_fa": "true", "$": "https://api.elsevier.com/content/object/eid/1-s2.0-S004269890800566X-gr2.sml?httpAccept=%2A%2F%2A", "@multimediatype": "GIF image file", "@type": "IMAGE-THUMBNAIL", "@size": "8313", "@ref": "gr2", "@mimetype": "image/gif"}, {"@category": "high", "@height": "570", "@width": "1707", "@_fa": "true", "$": "https://api.elsevier.com/content/object/eid/1-s2.0-S004269890800566X-gr2_lrg.jpg?httpAccept=%2A%2F%2A", "@multimediatype": "JPEG image file", "@type": "IMAGE-HIGH-RES", "@size": "145194", "@ref": "gr2", "@mimetype": "image/jpeg"}, {"@category": "standard", "@height": "249", "@width": "290", "@_fa": "true", "$": "https://api.elsevier.com/content/object/eid/1-s2.0-S004269890800566X-gr3.jpg?httpAccept=%2A%2F%2A", "@multimediatype": "JPEG image file", "@type": "IMAGE-DOWNSAMPLED", "@size": "42122", "@ref": "gr3", "@mimetype": "image/jpeg"}, {"@category": "thumbnail", "@height": "164", "@width": "191", "@_fa": "true", "$": "https://api.elsevier.com/content/object/eid/1-s2.0-S004269890800566X-gr3.sml?httpAccept=%2A%2F%2A", "@multimediatype": "GIF image file", "@type": "IMAGE-THUMBNAIL", "@size": "6811", "@ref": "gr3", "@mimetype": "image/gif"}, {"@category": "high", "@height": "662", "@width": "771", "@_fa": "true", "$": "https://api.elsevier.com/content/object/eid/1-s2.0-S004269890800566X-gr3_lrg.jpg?httpAccept=%2A%2F%2A", "@multimediatype": "JPEG image file", "@type": "IMAGE-HIGH-RES", "@size": "145342", "@ref": "gr3", "@mimetype": "image/jpeg"}, {"@category": "standard", "@height": "274", "@width": "369", "@_fa": "true", "$": "https://api.elsevier.com/content/object/eid/1-s2.0-S004269890800566X-gr4.jpg?httpAccept=%2A%2F%2A", "@multimediatype": "JPEG image file", "@type": "IMAGE-DOWNSAMPLED", "@size": "33800", "@ref": "gr4", "@mimetype": "image/jpeg"}, {"@category": "thumbnail", "@height": "163", "@width": "219", "@_fa": "true", "$": "https://api.elsevier.com/content/object/eid/1-s2.0-S004269890800566X-gr4.sml?httpAccept=%2A%2F%2A", "@multimediatype": "GIF image file", "@type": "IMAGE-THUMBNAIL", "@size": "8217", "@ref": "gr4", "@mimetype": "image/gif"}, {"@category": "high", "@height": "729", "@width": "980", "@_fa": "true", "$": "https://api.elsevier.com/content/object/eid/1-s2.0-S004269890800566X-gr4_lrg.jpg?httpAccept=%2A%2F%2A", "@multimediatype": "JPEG image file", "@type": "IMAGE-HIGH-RES", "@size": "90810", "@ref": "gr4", "@mimetype": "image/jpeg"}, {"@category": "standard", "@height": "286", "@width": "369", "@_fa": "true", "$": "https://api.elsevier.com/content/object/eid/1-s2.0-S004269890800566X-gr5.jpg?httpAccept=%2A%2F%2A", "@multimediatype": "JPEG image file", "@type": "IMAGE-DOWNSAMPLED", "@size": "21239", "@ref": "gr5", "@mimetype": "image/jpeg"}, {"@category": "thumbnail", "@height": "164", "@width": "211", "@_fa": "true", "$": "https://api.elsevier.com/content/object/eid/1-s2.0-S004269890800566X-gr5.sml?httpAccept=%2A%2F%2A", "@multimediatype": "GIF image file", "@type": "IMAGE-THUMBNAIL", "@size": "4646", "@ref": "gr5", "@mimetype": "image/gif"}, {"@category": "high", "@height": "760", "@width": "980", "@_fa": "true", "$": "https://api.elsevier.com/content/object/eid/1-s2.0-S004269890800566X-gr5_lrg.jpg?httpAccept=%2A%2F%2A", "@multimediatype": "JPEG image file", "@type": "IMAGE-HIGH-RES", "@size": "53414", "@ref": "gr5", "@mimetype": "image/jpeg"}, {"@category": "standard", "@height": "646", "@width": "660", "@_fa": "true", "$": "https://api.elsevier.com/content/object/eid/1-s2.0-S004269890800566X-gr6.jpg?httpAccept=%2A%2F%2A", "@multimediatype": "JPEG image file", "@type": "IMAGE-DOWNSAMPLED", "@size": "129345", "@ref": "gr6", "@mimetype": "image/jpeg"}, {"@category": "thumbnail", "@height": "163", "@width": "167", "@_fa": "true", "$": "https://api.elsevier.com/content/object/eid/1-s2.0-S004269890800566X-gr6.sml?httpAccept=%2A%2F%2A", "@multimediatype": "GIF image file", "@type": "IMAGE-THUMBNAIL", "@size": "14216", "@ref": "gr6", "@mimetype": "image/gif"}, {"@category": "high", "@height": "1715", "@width": "1753", "@_fa": "true", "$": "https://api.elsevier.com/content/object/eid/1-s2.0-S004269890800566X-gr6_lrg.jpg?httpAccept=%2A%2F%2A", "@multimediatype": "JPEG image file", "@type": "IMAGE-HIGH-RES", "@size": "444106", "@ref": "gr6", "@mimetype": "image/jpeg"}]}, "link": {"@rel": "abstract", "@href": "https://api.elsevier.com/content/abstract/scopus_id/59349098610"}}