{"scopus-eid": "2-s2.0-84951855624", "originalText": "serial JL 271125 291210 291735 291818 291866 291884 31 90 Neural Networks NEURALNETWORKS 2015-09-28 2015-09-28 2016-05-10 2016-05-10 2016-05-10T13:31:33 1-s2.0-S0893608015001768 S0893-6080(15)00176-8 S0893608015001768 10.1016/j.neunet.2015.09.001 S300 S300.1 FULL-TEXT 1-s2.0-S0893608016X00044 2016-05-10T09:21:20.933274-04:00 0 0 20160601 20160630 2016 2015-09-28T13:38:42.125491Z articleinfo articletitlenorm authfirstinitialnorm authfirstsurnamenorm cid cids confeditor contenttype copyright crossmark dateloaded dateloadedtxt datesearch datesort dateupdated dco docsubtype doctype doi eid ewtransactionid fundingbodyid hubeid indexeddate issn issnnorm itemstage itemtransactionid itemweight oauserlicense openaccess openarchive pg pgfirst pglast pii piinorm pubdateend pubdatestart pubdatetxt pubyr sectiontitle sortorder sponsoredaccesstype srctitle srctitlenorm srctype ssids alllist content oa subj subheadings suppl tomb vol volfirst volissue volumelist webpdf webpdfpagecount yearnav figure table body mmlmath acknowledge affil articletitle auth authfirstini authfull authkeywords authlast grantsponsor grantsponsorid orcid primabst pubtype ref 0893-6080 08936080 UNLIMITED NONE true 78 78 C Volume 78 8 75 87 75 87 201606 June 2016 2016-06-01 2016-06-30 2016 Special Issue on \"Neural Network Learning in Big Data\" Asim Roy Nikola Kasabov Irwin King Kumar Venayagamoorthy Algorithms article fla \u00a9 2015 The Authors. Published by Elsevier Ltd. SMARTSAMPLINGINCREMENTALFUNCTIONLEARNINGFORLARGEHIGHDIMENSIONALDATA LOYOLAR D 1 Introduction 2 Data sampling methods 2.1 Stochastic methods 2.2 Deterministic methods 2.2.1 Low discrepancy methods 2.2.2 Experimental design methods 2.3 Geometrical methods 2.3.1 Uniform grid 2.3.2 Latin hypercube 2.3.3 Centroidal Voronoi Tessellation 2.3.4 Opposite methods 2.4 Hybrid methods 2.5 Sampling in high dimensional space 2.6 Sampling non-uniform distributions 2.7 Importance sampling 3 Comparison of sampling methods 3.1 Benchmark functions 3.1.1 Shifted Ackley function 3.1.2 Composition function 3.1.3 Fast Fractal Double Dip function 3.2 Discrepancy as measure of uniformity in the input space 3.3 Statistical measures of the response function in the output space 4 Smart sampling and incremental function learning algorithm 4.1 Initialization phase 4.2 Smart sampling during initialization 4.3 Smart sampling during iteration 4.4 Incremental function learning 4.5 Check convergence 4.6 Determine approximator accuracy and confidence levels 5 Results 5.1 Regression of 5-D input space benchmark function 5.2 Regression of 100-D input space benchmark function 5.3 Regression of 62-D output space function from a real-world problem 5.4 Regression of 280-D input space function from a real-world problem 6 Conclusions Acknowledgments References ALIPPI 2014 C INTELLIGENCEFOREMBEDDEDSYSTEMSAMETHODOLOGICALAPPROACH AZIZA 2014 222 237 M BRAATEN 1979 249 258 E BUZA 2014 145 152 K DATAANALYSISMACHINELEARNINGKNOWLEDGEDISCOVERY FEEDBACKPREDICTIONFORBLOGS CERVELLERA 2013 504 509 C CHERNOFF 1952 493 507 H CIOPPA 2002 T EFFICIENTNEARLYORTHOGONALSPACEFILLINGEXPERIMENTALDESIGNSFORHIGHDIMENSIONALCOMPLEXMODELS DU 2010 119 142 Q FANG 2002 275 296 K FLATO 2013 G EVALUATIONCLIMATEMODELSINCLIMATECHANGE2013PHYSICALSCIENCEBASISCONTRIBUTIONWORKINGGROUPIFIFTHASSESSMENTREPORTINTERGOVERNMENTALPANELCLIMATECHANGE GIMENOGARCIA 2012 2261 2276 S GNECCO 2011 171 182 G GORDON 2000 147 168 C GRELL 2005 6957 6975 G HALTON 1960 84 90 J HAN 2011 520 533 J HAUPT 2009 S ARTIFICIALINTELLIGENCEMETHODSINENVIRONMENTALSCIENCES HILBERT 2011 60 65 M HSIEH 1998 1855 1870 W JIN 2014 12 13 Y KAINEN 2012 1203 1214 P KOLMOGOROV 1957 953 956 A KRASNOPOLSKY 2003 335 348 V KRASNOPOLSKY 2007 RG3009 V LEUNG 2001 41 53 Y LOYOLA 2006 168 177 D LYNCH 2006 206 208 P EMERGENCENUMERICALWEATHERPREDICTION ENIACINTEGRATIONS LYNCH 2008 28 29 C MACKAY 1995 469 505 D MARSAGLIA 2000 G MATSUMOTO 1998 3 30 M MCKAY 1979 239 245 M MENUT 2013 981 1028 L MORCRETTE 1991 9121 9132 J MOSKOWITZ 1996 37 54 B NIEDERREITER 1992 H RANDOMNUMBERGENERATIONQUASIMONTECARLOMETHODS OLEARY 2013 96 99 D PATELLI 2011 1 7 E PENG 2012 3 10 L PERKINS 2012 T QAZI 2006 595 607 M RAHNAMAYAN 2008 64 79 S RICHTER 2014 8044 8056 R ROMERO 2006 1266 1280 V SACKS 1989 409 423 J SAGAUT 2006 P LARGEEDDYSIMULATIONFORINCOMPRESSIBLEFLOWS SCHUESSLER 2011 70 79 O ADAPTIVENATURALCOMPUTINGALGORITHMS PARALLELTRAININGARTIFICIALNEURALNETWORKSUSINGMULTITHREADEDMULTICORECPUS THIEMARD 2001 850 880 E TRIPATHI 2006 621 640 S VAPNIK 2006 V ESTIMATIONDEPENDENCESBASEDEMPIRICALDATA YITENG 2014 14 26 Z LOYOLARX2016X75 LOYOLARX2016X75X87 LOYOLARX2016X75XD LOYOLARX2016X75X87XD Full 2015-09-29T08:32:04Z Author http://creativecommons.org/licenses/by/4.0/ 2018-05-10T00:00:00Z UnderEmbargo http://creativecommons.org/licenses/by-nc-nd/4.0/ This is an open access article under the CC BY license. \u00a9 2015 The Authors. Published by Elsevier Ltd. item S0893-6080(15)00176-8 S0893608015001768 1-s2.0-S0893608015001768 10.1016/j.neunet.2015.09.001 271125 2016-05-10T08:44:35.747815-04:00 2016-06-01 2016-06-30 UNLIMITED NONE 1-s2.0-S0893608015001768-main.pdf https://s3-eu-west-1.amazonaws.com/prod-ucs-content-store-eu-west/content/pii:S0893608015001768/MAIN/application/pdf/04b4c2d6a4a465a221750a0567221eb2/main.pdf https://s3.amazonaws.com/prod-ucs-content-store-us-east/content/pii:S0893608015001768/MAIN/application/pdf/04b4c2d6a4a465a221750a0567221eb2/main.pdf main.pdf pdf true 4465710 MAIN 13 1-s2.0-S0893608015001768-main_1.png https://s3-eu-west-1.amazonaws.com/prod-ucs-content-store-eu-west/content/pii:S0893608015001768/PREVIEW/image/png/7312ea0ac3e0b577fd5de23af43d99dd/main_1.png https://s3.amazonaws.com/prod-ucs-content-store-us-east/content/pii:S0893608015001768/PREVIEW/image/png/7312ea0ac3e0b577fd5de23af43d99dd/main_1.png main_1.png png 62111 849 656 IMAGE-WEB-PDF 1 1-s2.0-S0893608015001768-gr4.sml https://s3-eu-west-1.amazonaws.com/prod-ucs-content-store-eu-west/content/pii:S0893608015001768/gr4/THUMBNAIL/image/gif/96fda9960973244ec4d6e2c1c7f18682/gr4.sml https://s3.amazonaws.com/prod-ucs-content-store-us-east/content/pii:S0893608015001768/gr4/THUMBNAIL/image/gif/96fda9960973244ec4d6e2c1c7f18682/gr4.sml gr4 gr4.sml sml 16344 56 219 IMAGE-THUMBNAIL 1-s2.0-S0893608015001768-gr2.sml https://s3-eu-west-1.amazonaws.com/prod-ucs-content-store-eu-west/content/pii:S0893608015001768/gr2/THUMBNAIL/image/gif/3c50cabbdec6e88c7df2591f7832012e/gr2.sml https://s3.amazonaws.com/prod-ucs-content-store-us-east/content/pii:S0893608015001768/gr2/THUMBNAIL/image/gif/3c50cabbdec6e88c7df2591f7832012e/gr2.sml gr2 gr2.sml sml 31307 128 219 IMAGE-THUMBNAIL 1-s2.0-S0893608015001768-fx1.sml https://s3-eu-west-1.amazonaws.com/prod-ucs-content-store-eu-west/content/pii:S0893608015001768/fx1/THUMBNAIL/image/gif/592d41545712187f4fc6d697f5433161/fx1.sml https://s3.amazonaws.com/prod-ucs-content-store-us-east/content/pii:S0893608015001768/fx1/THUMBNAIL/image/gif/592d41545712187f4fc6d697f5433161/fx1.sml fx1 fx1.sml sml 22993 164 176 IMAGE-THUMBNAIL 1-s2.0-S0893608015001768-gr1.sml https://s3-eu-west-1.amazonaws.com/prod-ucs-content-store-eu-west/content/pii:S0893608015001768/gr1/THUMBNAIL/image/gif/f296e2e95a28846faedb008a7f352d76/gr1.sml https://s3.amazonaws.com/prod-ucs-content-store-us-east/content/pii:S0893608015001768/gr1/THUMBNAIL/image/gif/f296e2e95a28846faedb008a7f352d76/gr1.sml gr1 gr1.sml sml 24192 86 219 IMAGE-THUMBNAIL 1-s2.0-S0893608015001768-gr5.sml https://s3-eu-west-1.amazonaws.com/prod-ucs-content-store-eu-west/content/pii:S0893608015001768/gr5/THUMBNAIL/image/gif/d7953ae50404b5a82ff97cde179341b6/gr5.sml https://s3.amazonaws.com/prod-ucs-content-store-us-east/content/pii:S0893608015001768/gr5/THUMBNAIL/image/gif/d7953ae50404b5a82ff97cde179341b6/gr5.sml gr5 gr5.sml sml 18728 94 219 IMAGE-THUMBNAIL 1-s2.0-S0893608015001768-gr7.sml https://s3-eu-west-1.amazonaws.com/prod-ucs-content-store-eu-west/content/pii:S0893608015001768/gr7/THUMBNAIL/image/gif/345909bad605f0ee92bb451b33a0f151/gr7.sml https://s3.amazonaws.com/prod-ucs-content-store-us-east/content/pii:S0893608015001768/gr7/THUMBNAIL/image/gif/345909bad605f0ee92bb451b33a0f151/gr7.sml gr7 gr7.sml sml 26652 164 204 IMAGE-THUMBNAIL 1-s2.0-S0893608015001768-gr6.sml https://s3-eu-west-1.amazonaws.com/prod-ucs-content-store-eu-west/content/pii:S0893608015001768/gr6/THUMBNAIL/image/gif/3e0a519bdb3a3125165bc2d9c11d6b32/gr6.sml https://s3.amazonaws.com/prod-ucs-content-store-us-east/content/pii:S0893608015001768/gr6/THUMBNAIL/image/gif/3e0a519bdb3a3125165bc2d9c11d6b32/gr6.sml gr6 gr6.sml sml 22166 163 100 IMAGE-THUMBNAIL 1-s2.0-S0893608015001768-gr3.sml https://s3-eu-west-1.amazonaws.com/prod-ucs-content-store-eu-west/content/pii:S0893608015001768/gr3/THUMBNAIL/image/gif/c17eca3d1847861b61ed3d33d694afae/gr3.sml https://s3.amazonaws.com/prod-ucs-content-store-us-east/content/pii:S0893608015001768/gr3/THUMBNAIL/image/gif/c17eca3d1847861b61ed3d33d694afae/gr3.sml gr3 gr3.sml sml 18532 45 219 IMAGE-THUMBNAIL 1-s2.0-S0893608015001768-gr4.jpg https://s3-eu-west-1.amazonaws.com/prod-ucs-content-store-eu-west/content/pii:S0893608015001768/gr4/DOWNSAMPLED/image/jpeg/73b44559a1060c82227f2da75d668236/gr4.jpg https://s3.amazonaws.com/prod-ucs-content-store-us-east/content/pii:S0893608015001768/gr4/DOWNSAMPLED/image/jpeg/73b44559a1060c82227f2da75d668236/gr4.jpg gr4 gr4.jpg jpg 88285 192 753 IMAGE-DOWNSAMPLED 1-s2.0-S0893608015001768-gr2.jpg https://s3-eu-west-1.amazonaws.com/prod-ucs-content-store-eu-west/content/pii:S0893608015001768/gr2/DOWNSAMPLED/image/jpeg/35760d7d8dcaed22fc835c66da776c12/gr2.jpg https://s3.amazonaws.com/prod-ucs-content-store-us-east/content/pii:S0893608015001768/gr2/DOWNSAMPLED/image/jpeg/35760d7d8dcaed22fc835c66da776c12/gr2.jpg gr2 gr2.jpg jpg 168491 440 753 IMAGE-DOWNSAMPLED 1-s2.0-S0893608015001768-fx1.jpg https://s3-eu-west-1.amazonaws.com/prod-ucs-content-store-eu-west/content/pii:S0893608015001768/fx1/DOWNSAMPLED/image/jpeg/462b936431a2d6a00d6434073a17602f/fx1.jpg https://s3.amazonaws.com/prod-ucs-content-store-us-east/content/pii:S0893608015001768/fx1/DOWNSAMPLED/image/jpeg/462b936431a2d6a00d6434073a17602f/fx1.jpg fx1 fx1.jpg jpg 79798 351 376 IMAGE-DOWNSAMPLED 1-s2.0-S0893608015001768-gr1.jpg https://s3-eu-west-1.amazonaws.com/prod-ucs-content-store-eu-west/content/pii:S0893608015001768/gr1/DOWNSAMPLED/image/jpeg/46aa3daf3d939e3430dc22aeb39abe40/gr1.jpg https://s3.amazonaws.com/prod-ucs-content-store-us-east/content/pii:S0893608015001768/gr1/DOWNSAMPLED/image/jpeg/46aa3daf3d939e3430dc22aeb39abe40/gr1.jpg gr1 gr1.jpg jpg 136881 297 753 IMAGE-DOWNSAMPLED 1-s2.0-S0893608015001768-gr5.jpg https://s3-eu-west-1.amazonaws.com/prod-ucs-content-store-eu-west/content/pii:S0893608015001768/gr5/DOWNSAMPLED/image/jpeg/1c2b85fc6d8f7e756048bad1eca637c7/gr5.jpg https://s3.amazonaws.com/prod-ucs-content-store-us-east/content/pii:S0893608015001768/gr5/DOWNSAMPLED/image/jpeg/1c2b85fc6d8f7e756048bad1eca637c7/gr5.jpg gr5 gr5.jpg jpg 93708 271 633 IMAGE-DOWNSAMPLED 1-s2.0-S0893608015001768-gr7.jpg https://s3-eu-west-1.amazonaws.com/prod-ucs-content-store-eu-west/content/pii:S0893608015001768/gr7/DOWNSAMPLED/image/jpeg/fc71325b63da4975e5f8601a56023adc/gr7.jpg https://s3.amazonaws.com/prod-ucs-content-store-us-east/content/pii:S0893608015001768/gr7/DOWNSAMPLED/image/jpeg/fc71325b63da4975e5f8601a56023adc/gr7.jpg gr7 gr7.jpg jpg 166226 518 646 IMAGE-DOWNSAMPLED 1-s2.0-S0893608015001768-gr6.jpg https://s3-eu-west-1.amazonaws.com/prod-ucs-content-store-eu-west/content/pii:S0893608015001768/gr6/DOWNSAMPLED/image/jpeg/755dccee96920c07985b88db5528d222/gr6.jpg https://s3.amazonaws.com/prod-ucs-content-store-us-east/content/pii:S0893608015001768/gr6/DOWNSAMPLED/image/jpeg/755dccee96920c07985b88db5528d222/gr6.jpg gr6 gr6.jpg jpg 238389 956 585 IMAGE-DOWNSAMPLED 1-s2.0-S0893608015001768-gr3.jpg https://s3-eu-west-1.amazonaws.com/prod-ucs-content-store-eu-west/content/pii:S0893608015001768/gr3/DOWNSAMPLED/image/jpeg/255357d3b3144c28661a2c6500d24bb1/gr3.jpg https://s3.amazonaws.com/prod-ucs-content-store-us-east/content/pii:S0893608015001768/gr3/DOWNSAMPLED/image/jpeg/255357d3b3144c28661a2c6500d24bb1/gr3.jpg gr3 gr3.jpg jpg 104707 155 753 IMAGE-DOWNSAMPLED 1-s2.0-S0893608015001768-si25.gif https://s3-eu-west-1.amazonaws.com/prod-ucs-content-store-eu-west/content/pii:S0893608015001768/STRIPIN/image/gif/665abc31954f7385b0d4cf5520e0596b/si25.gif https://s3.amazonaws.com/prod-ucs-content-store-us-east/content/pii:S0893608015001768/STRIPIN/image/gif/665abc31954f7385b0d4cf5520e0596b/si25.gif si25 si25.gif gif 145 8 14 ALTIMG 1-s2.0-S0893608015001768-si123.gif https://s3-eu-west-1.amazonaws.com/prod-ucs-content-store-eu-west/content/pii:S0893608015001768/STRIPIN/image/gif/72e84c1aee44bad0c72b66faa62abf5f/si123.gif https://s3.amazonaws.com/prod-ucs-content-store-us-east/content/pii:S0893608015001768/STRIPIN/image/gif/72e84c1aee44bad0c72b66faa62abf5f/si123.gif si123 si123.gif gif 516 18 127 ALTIMG 1-s2.0-S0893608015001768-si56.gif https://s3-eu-west-1.amazonaws.com/prod-ucs-content-store-eu-west/content/pii:S0893608015001768/STRIPIN/image/gif/6b179d7ac735cf0ad00dafb42f22e66f/si56.gif https://s3.amazonaws.com/prod-ucs-content-store-us-east/content/pii:S0893608015001768/STRIPIN/image/gif/6b179d7ac735cf0ad00dafb42f22e66f/si56.gif si56 si56.gif gif 433 19 73 ALTIMG 1-s2.0-S0893608015001768-si149.gif https://s3-eu-west-1.amazonaws.com/prod-ucs-content-store-eu-west/content/pii:S0893608015001768/STRIPIN/image/gif/5524d6e4114bb5bc3f7b2fb0abeccdc7/si149.gif https://s3.amazonaws.com/prod-ucs-content-store-us-east/content/pii:S0893608015001768/STRIPIN/image/gif/5524d6e4114bb5bc3f7b2fb0abeccdc7/si149.gif si149 si149.gif gif 418 18 73 ALTIMG 1-s2.0-S0893608015001768-si143.gif https://s3-eu-west-1.amazonaws.com/prod-ucs-content-store-eu-west/content/pii:S0893608015001768/STRIPIN/image/gif/4e20ee94aeee643f316fadf97e6bf103/si143.gif https://s3.amazonaws.com/prod-ucs-content-store-us-east/content/pii:S0893608015001768/STRIPIN/image/gif/4e20ee94aeee643f316fadf97e6bf103/si143.gif si143 si143.gif gif 231 15 29 ALTIMG 1-s2.0-S0893608015001768-si204.gif https://s3-eu-west-1.amazonaws.com/prod-ucs-content-store-eu-west/content/pii:S0893608015001768/STRIPIN/image/gif/2297d81c4d44ac7197d1b4cb9deb8688/si204.gif https://s3.amazonaws.com/prod-ucs-content-store-us-east/content/pii:S0893608015001768/STRIPIN/image/gif/2297d81c4d44ac7197d1b4cb9deb8688/si204.gif si204 si204.gif gif 275 17 57 ALTIMG 1-s2.0-S0893608015001768-si71.gif https://s3-eu-west-1.amazonaws.com/prod-ucs-content-store-eu-west/content/pii:S0893608015001768/STRIPIN/image/gif/52fd481708688963ed7ab598826dfe59/si71.gif https://s3.amazonaws.com/prod-ucs-content-store-us-east/content/pii:S0893608015001768/STRIPIN/image/gif/52fd481708688963ed7ab598826dfe59/si71.gif si71 si71.gif gif 361 15 82 ALTIMG 1-s2.0-S0893608015001768-si169.gif https://s3-eu-west-1.amazonaws.com/prod-ucs-content-store-eu-west/content/pii:S0893608015001768/STRIPIN/image/gif/8e701effc0904388e96166957f8c1767/si169.gif https://s3.amazonaws.com/prod-ucs-content-store-us-east/content/pii:S0893608015001768/STRIPIN/image/gif/8e701effc0904388e96166957f8c1767/si169.gif si169 si169.gif gif 368 15 55 ALTIMG 1-s2.0-S0893608015001768-si121.gif https://s3-eu-west-1.amazonaws.com/prod-ucs-content-store-eu-west/content/pii:S0893608015001768/STRIPIN/image/gif/33bca2955756b95261ba8691b5eb6684/si121.gif https://s3.amazonaws.com/prod-ucs-content-store-us-east/content/pii:S0893608015001768/STRIPIN/image/gif/33bca2955756b95261ba8691b5eb6684/si121.gif si121 si121.gif gif 990 42 171 ALTIMG 1-s2.0-S0893608015001768-si166.gif https://s3-eu-west-1.amazonaws.com/prod-ucs-content-store-eu-west/content/pii:S0893608015001768/STRIPIN/image/gif/e89a295efcbbfabaef5676220d4735fa/si166.gif https://s3.amazonaws.com/prod-ucs-content-store-us-east/content/pii:S0893608015001768/STRIPIN/image/gif/e89a295efcbbfabaef5676220d4735fa/si166.gif si166 si166.gif gif 314 15 45 ALTIMG 1-s2.0-S0893608015001768-si160.gif https://s3-eu-west-1.amazonaws.com/prod-ucs-content-store-eu-west/content/pii:S0893608015001768/STRIPIN/image/gif/24546d48c5960897a450253f6cba8f74/si160.gif https://s3.amazonaws.com/prod-ucs-content-store-us-east/content/pii:S0893608015001768/STRIPIN/image/gif/24546d48c5960897a450253f6cba8f74/si160.gif si160 si160.gif gif 1082 32 266 ALTIMG 1-s2.0-S0893608015001768-si31.gif https://s3-eu-west-1.amazonaws.com/prod-ucs-content-store-eu-west/content/pii:S0893608015001768/STRIPIN/image/gif/0d5246af1babc9c1bece84f00384632a/si31.gif https://s3.amazonaws.com/prod-ucs-content-store-us-east/content/pii:S0893608015001768/STRIPIN/image/gif/0d5246af1babc9c1bece84f00384632a/si31.gif si31 si31.gif gif 123 8 10 ALTIMG 1-s2.0-S0893608015001768-si81.gif https://s3-eu-west-1.amazonaws.com/prod-ucs-content-store-eu-west/content/pii:S0893608015001768/STRIPIN/image/gif/e6ea7bb18770a6fb19187cec6e927139/si81.gif https://s3.amazonaws.com/prod-ucs-content-store-us-east/content/pii:S0893608015001768/STRIPIN/image/gif/e6ea7bb18770a6fb19187cec6e927139/si81.gif si81 si81.gif gif 259 15 32 ALTIMG 1-s2.0-S0893608015001768-si53.gif https://s3-eu-west-1.amazonaws.com/prod-ucs-content-store-eu-west/content/pii:S0893608015001768/STRIPIN/image/gif/7038714687b4a3e9b0940d2f9c8701c9/si53.gif https://s3.amazonaws.com/prod-ucs-content-store-us-east/content/pii:S0893608015001768/STRIPIN/image/gif/7038714687b4a3e9b0940d2f9c8701c9/si53.gif si53 si53.gif gif 975 41 194 ALTIMG 1-s2.0-S0893608015001768-si17.gif https://s3-eu-west-1.amazonaws.com/prod-ucs-content-store-eu-west/content/pii:S0893608015001768/STRIPIN/image/gif/1f643fd4c6e55bcd1104ace055803957/si17.gif https://s3.amazonaws.com/prod-ucs-content-store-us-east/content/pii:S0893608015001768/STRIPIN/image/gif/1f643fd4c6e55bcd1104ace055803957/si17.gif si17 si17.gif gif 360 15 76 ALTIMG 1-s2.0-S0893608015001768-si46.gif https://s3-eu-west-1.amazonaws.com/prod-ucs-content-store-eu-west/content/pii:S0893608015001768/STRIPIN/image/gif/04b1940002965b9e7ac747d29af34a9a/si46.gif https://s3.amazonaws.com/prod-ucs-content-store-us-east/content/pii:S0893608015001768/STRIPIN/image/gif/04b1940002965b9e7ac747d29af34a9a/si46.gif si46 si46.gif gif 1230 44 290 ALTIMG 1-s2.0-S0893608015001768-si147.gif https://s3-eu-west-1.amazonaws.com/prod-ucs-content-store-eu-west/content/pii:S0893608015001768/STRIPIN/image/gif/e150afe3869d12d6037b2da5df54815c/si147.gif https://s3.amazonaws.com/prod-ucs-content-store-us-east/content/pii:S0893608015001768/STRIPIN/image/gif/e150afe3869d12d6037b2da5df54815c/si147.gif si147 si147.gif gif 327 15 55 ALTIMG 1-s2.0-S0893608015001768-si168.gif https://s3-eu-west-1.amazonaws.com/prod-ucs-content-store-eu-west/content/pii:S0893608015001768/STRIPIN/image/gif/df18b2552e818d2eccc525109dd361e9/si168.gif https://s3.amazonaws.com/prod-ucs-content-store-us-east/content/pii:S0893608015001768/STRIPIN/image/gif/df18b2552e818d2eccc525109dd361e9/si168.gif si168 si168.gif gif 434 15 69 ALTIMG 1-s2.0-S0893608015001768-si7.gif https://s3-eu-west-1.amazonaws.com/prod-ucs-content-store-eu-west/content/pii:S0893608015001768/STRIPIN/image/gif/df2e7d4107e7c72f2d88f0baabe7bce6/si7.gif https://s3.amazonaws.com/prod-ucs-content-store-us-east/content/pii:S0893608015001768/STRIPIN/image/gif/df2e7d4107e7c72f2d88f0baabe7bce6/si7.gif si7 si7.gif gif 454 17 72 ALTIMG 1-s2.0-S0893608015001768-si155.gif https://s3-eu-west-1.amazonaws.com/prod-ucs-content-store-eu-west/content/pii:S0893608015001768/STRIPIN/image/gif/799faa127c92f90b7a37c7d517acdfb6/si155.gif https://s3.amazonaws.com/prod-ucs-content-store-us-east/content/pii:S0893608015001768/STRIPIN/image/gif/799faa127c92f90b7a37c7d517acdfb6/si155.gif si155 si155.gif gif 404 15 97 ALTIMG 1-s2.0-S0893608015001768-si68.gif https://s3-eu-west-1.amazonaws.com/prod-ucs-content-store-eu-west/content/pii:S0893608015001768/STRIPIN/image/gif/fb0a47ff3221339016ac05793445913a/si68.gif https://s3.amazonaws.com/prod-ucs-content-store-us-east/content/pii:S0893608015001768/STRIPIN/image/gif/fb0a47ff3221339016ac05793445913a/si68.gif si68 si68.gif gif 2797 98 321 ALTIMG 1-s2.0-S0893608015001768-si88.gif https://s3-eu-west-1.amazonaws.com/prod-ucs-content-store-eu-west/content/pii:S0893608015001768/STRIPIN/image/gif/c7fd064c2648702724f62777b6630270/si88.gif https://s3.amazonaws.com/prod-ucs-content-store-us-east/content/pii:S0893608015001768/STRIPIN/image/gif/c7fd064c2648702724f62777b6630270/si88.gif si88 si88.gif gif 141 18 11 ALTIMG 1-s2.0-S0893608015001768-si14.gif https://s3-eu-west-1.amazonaws.com/prod-ucs-content-store-eu-west/content/pii:S0893608015001768/STRIPIN/image/gif/c4eb6fd41ec3ac46524a9e885ceba1a6/si14.gif https://s3.amazonaws.com/prod-ucs-content-store-us-east/content/pii:S0893608015001768/STRIPIN/image/gif/c4eb6fd41ec3ac46524a9e885ceba1a6/si14.gif si14 si14.gif gif 280 14 72 ALTIMG 1-s2.0-S0893608015001768-si78.gif https://s3-eu-west-1.amazonaws.com/prod-ucs-content-store-eu-west/content/pii:S0893608015001768/STRIPIN/image/gif/4d2e49bf7b0048b882a868bc271b0d1c/si78.gif https://s3.amazonaws.com/prod-ucs-content-store-us-east/content/pii:S0893608015001768/STRIPIN/image/gif/4d2e49bf7b0048b882a868bc271b0d1c/si78.gif si78 si78.gif gif 145 11 13 ALTIMG 1-s2.0-S0893608015001768-si173.gif https://s3-eu-west-1.amazonaws.com/prod-ucs-content-store-eu-west/content/pii:S0893608015001768/STRIPIN/image/gif/ca79bb392672f3a09e27f66a7142857a/si173.gif https://s3.amazonaws.com/prod-ucs-content-store-us-east/content/pii:S0893608015001768/STRIPIN/image/gif/ca79bb392672f3a09e27f66a7142857a/si173.gif si173 si173.gif gif 166 12 17 ALTIMG 1-s2.0-S0893608015001768-si216.gif https://s3-eu-west-1.amazonaws.com/prod-ucs-content-store-eu-west/content/pii:S0893608015001768/STRIPIN/image/gif/edfe90ea4d3c9f441d8195d65d6a713a/si216.gif https://s3.amazonaws.com/prod-ucs-content-store-us-east/content/pii:S0893608015001768/STRIPIN/image/gif/edfe90ea4d3c9f441d8195d65d6a713a/si216.gif si216 si216.gif gif 335 14 71 ALTIMG 1-s2.0-S0893608015001768-si115.gif https://s3-eu-west-1.amazonaws.com/prod-ucs-content-store-eu-west/content/pii:S0893608015001768/STRIPIN/image/gif/b998a3858d1f2008db2cbfa39f54d675/si115.gif https://s3.amazonaws.com/prod-ucs-content-store-us-east/content/pii:S0893608015001768/STRIPIN/image/gif/b998a3858d1f2008db2cbfa39f54d675/si115.gif si115 si115.gif gif 179 12 37 ALTIMG 1-s2.0-S0893608015001768-si114.gif https://s3-eu-west-1.amazonaws.com/prod-ucs-content-store-eu-west/content/pii:S0893608015001768/STRIPIN/image/gif/cf47bfca5f50e255c81b74e69fa63194/si114.gif https://s3.amazonaws.com/prod-ucs-content-store-us-east/content/pii:S0893608015001768/STRIPIN/image/gif/cf47bfca5f50e255c81b74e69fa63194/si114.gif si114 si114.gif gif 334 15 68 ALTIMG 1-s2.0-S0893608015001768-si189.gif https://s3-eu-west-1.amazonaws.com/prod-ucs-content-store-eu-west/content/pii:S0893608015001768/STRIPIN/image/gif/4a775cd46f15fae6ef8c3db6888a49be/si189.gif https://s3.amazonaws.com/prod-ucs-content-store-us-east/content/pii:S0893608015001768/STRIPIN/image/gif/4a775cd46f15fae6ef8c3db6888a49be/si189.gif si189 si189.gif gif 585 16 159 ALTIMG 1-s2.0-S0893608015001768-si124.gif https://s3-eu-west-1.amazonaws.com/prod-ucs-content-store-eu-west/content/pii:S0893608015001768/STRIPIN/image/gif/af72cf377e7cd7ae76bc267df242de9e/si124.gif https://s3.amazonaws.com/prod-ucs-content-store-us-east/content/pii:S0893608015001768/STRIPIN/image/gif/af72cf377e7cd7ae76bc267df242de9e/si124.gif si124 si124.gif gif 276 15 39 ALTIMG 1-s2.0-S0893608015001768-si181.gif https://s3-eu-west-1.amazonaws.com/prod-ucs-content-store-eu-west/content/pii:S0893608015001768/STRIPIN/image/gif/34b7981408bc4db5558e3461b1387d7c/si181.gif https://s3.amazonaws.com/prod-ucs-content-store-us-east/content/pii:S0893608015001768/STRIPIN/image/gif/34b7981408bc4db5558e3461b1387d7c/si181.gif si181 si181.gif gif 257 16 33 ALTIMG 1-s2.0-S0893608015001768-si202.gif https://s3-eu-west-1.amazonaws.com/prod-ucs-content-store-eu-west/content/pii:S0893608015001768/STRIPIN/image/gif/0c593a9ede86f858b8248657065d7228/si202.gif https://s3.amazonaws.com/prod-ucs-content-store-us-east/content/pii:S0893608015001768/STRIPIN/image/gif/0c593a9ede86f858b8248657065d7228/si202.gif si202 si202.gif gif 332 14 71 ALTIMG 1-s2.0-S0893608015001768-si26.gif https://s3-eu-west-1.amazonaws.com/prod-ucs-content-store-eu-west/content/pii:S0893608015001768/STRIPIN/image/gif/df3b5a6e5879cf6871df091885a2826e/si26.gif https://s3.amazonaws.com/prod-ucs-content-store-us-east/content/pii:S0893608015001768/STRIPIN/image/gif/df3b5a6e5879cf6871df091885a2826e/si26.gif si26 si26.gif gif 135 12 10 ALTIMG 1-s2.0-S0893608015001768-si15.gif https://s3-eu-west-1.amazonaws.com/prod-ucs-content-store-eu-west/content/pii:S0893608015001768/STRIPIN/image/gif/04f70217021a77c9923ea7d72f426860/si15.gif https://s3.amazonaws.com/prod-ucs-content-store-us-east/content/pii:S0893608015001768/STRIPIN/image/gif/04f70217021a77c9923ea7d72f426860/si15.gif si15 si15.gif gif 266 13 53 ALTIMG 1-s2.0-S0893608015001768-si122.gif https://s3-eu-west-1.amazonaws.com/prod-ucs-content-store-eu-west/content/pii:S0893608015001768/STRIPIN/image/gif/8779b6a899b48515b4cf578e54086ccc/si122.gif https://s3.amazonaws.com/prod-ucs-content-store-us-east/content/pii:S0893608015001768/STRIPIN/image/gif/8779b6a899b48515b4cf578e54086ccc/si122.gif si122 si122.gif gif 446 18 101 ALTIMG 1-s2.0-S0893608015001768-si138.gif https://s3-eu-west-1.amazonaws.com/prod-ucs-content-store-eu-west/content/pii:S0893608015001768/STRIPIN/image/gif/ec66cb39831453b19222a5d98b4a9789/si138.gif https://s3.amazonaws.com/prod-ucs-content-store-us-east/content/pii:S0893608015001768/STRIPIN/image/gif/ec66cb39831453b19222a5d98b4a9789/si138.gif si138 si138.gif gif 193 15 22 ALTIMG 1-s2.0-S0893608015001768-si66.gif https://s3-eu-west-1.amazonaws.com/prod-ucs-content-store-eu-west/content/pii:S0893608015001768/STRIPIN/image/gif/17899c5bbecd71c8f41ac71d102a4016/si66.gif https://s3.amazonaws.com/prod-ucs-content-store-us-east/content/pii:S0893608015001768/STRIPIN/image/gif/17899c5bbecd71c8f41ac71d102a4016/si66.gif si66 si66.gif gif 1463 60 276 ALTIMG 1-s2.0-S0893608015001768-si199.gif https://s3-eu-west-1.amazonaws.com/prod-ucs-content-store-eu-west/content/pii:S0893608015001768/STRIPIN/image/gif/da9a13e28d45f7facdb1b2b81edbbb90/si199.gif https://s3.amazonaws.com/prod-ucs-content-store-us-east/content/pii:S0893608015001768/STRIPIN/image/gif/da9a13e28d45f7facdb1b2b81edbbb90/si199.gif si199 si199.gif gif 289 12 60 ALTIMG 1-s2.0-S0893608015001768-si11.gif https://s3-eu-west-1.amazonaws.com/prod-ucs-content-store-eu-west/content/pii:S0893608015001768/STRIPIN/image/gif/a6ada077fa2e7f2525507c2b93b876bf/si11.gif https://s3.amazonaws.com/prod-ucs-content-store-us-east/content/pii:S0893608015001768/STRIPIN/image/gif/a6ada077fa2e7f2525507c2b93b876bf/si11.gif si11 si11.gif gif 237 14 30 ALTIMG 1-s2.0-S0893608015001768-si126.gif https://s3-eu-west-1.amazonaws.com/prod-ucs-content-store-eu-west/content/pii:S0893608015001768/STRIPIN/image/gif/b1f51914f139f59a81c0472936b808c1/si126.gif https://s3.amazonaws.com/prod-ucs-content-store-us-east/content/pii:S0893608015001768/STRIPIN/image/gif/b1f51914f139f59a81c0472936b808c1/si126.gif si126 si126.gif gif 133 12 9 ALTIMG 1-s2.0-S0893608015001768-si8.gif https://s3-eu-west-1.amazonaws.com/prod-ucs-content-store-eu-west/content/pii:S0893608015001768/STRIPIN/image/gif/95416c659c933d05595f0b01a14173fe/si8.gif https://s3.amazonaws.com/prod-ucs-content-store-us-east/content/pii:S0893608015001768/STRIPIN/image/gif/95416c659c933d05595f0b01a14173fe/si8.gif si8 si8.gif gif 194 14 22 ALTIMG 1-s2.0-S0893608015001768-si191.gif https://s3-eu-west-1.amazonaws.com/prod-ucs-content-store-eu-west/content/pii:S0893608015001768/STRIPIN/image/gif/91c83460c2fe4bd1e2ceb033d0325384/si191.gif https://s3.amazonaws.com/prod-ucs-content-store-us-east/content/pii:S0893608015001768/STRIPIN/image/gif/91c83460c2fe4bd1e2ceb033d0325384/si191.gif si191 si191.gif gif 506 20 123 ALTIMG 1-s2.0-S0893608015001768-si196.gif https://s3-eu-west-1.amazonaws.com/prod-ucs-content-store-eu-west/content/pii:S0893608015001768/STRIPIN/image/gif/ff3fdc1bf894ec71e09368eb682f3c0b/si196.gif https://s3.amazonaws.com/prod-ucs-content-store-us-east/content/pii:S0893608015001768/STRIPIN/image/gif/ff3fdc1bf894ec71e09368eb682f3c0b/si196.gif si196 si196.gif gif 246 15 68 ALTIMG 1-s2.0-S0893608015001768-si132.gif https://s3-eu-west-1.amazonaws.com/prod-ucs-content-store-eu-west/content/pii:S0893608015001768/STRIPIN/image/gif/5c4d60d944d6a633f7e74dd7b0ec8f41/si132.gif https://s3.amazonaws.com/prod-ucs-content-store-us-east/content/pii:S0893608015001768/STRIPIN/image/gif/5c4d60d944d6a633f7e74dd7b0ec8f41/si132.gif si132 si132.gif gif 293 18 36 ALTIMG 1-s2.0-S0893608015001768-si57.gif https://s3-eu-west-1.amazonaws.com/prod-ucs-content-store-eu-west/content/pii:S0893608015001768/STRIPIN/image/gif/fa6b3f33f5a5a39f62f6760eb28a8134/si57.gif https://s3.amazonaws.com/prod-ucs-content-store-us-east/content/pii:S0893608015001768/STRIPIN/image/gif/fa6b3f33f5a5a39f62f6760eb28a8134/si57.gif si57 si57.gif gif 221 15 30 ALTIMG 1-s2.0-S0893608015001768-si180.gif https://s3-eu-west-1.amazonaws.com/prod-ucs-content-store-eu-west/content/pii:S0893608015001768/STRIPIN/image/gif/860c0cce9b7221d4793db7d065eab633/si180.gif https://s3.amazonaws.com/prod-ucs-content-store-us-east/content/pii:S0893608015001768/STRIPIN/image/gif/860c0cce9b7221d4793db7d065eab633/si180.gif si180 si180.gif gif 912 32 215 ALTIMG 1-s2.0-S0893608015001768-si73.gif https://s3-eu-west-1.amazonaws.com/prod-ucs-content-store-eu-west/content/pii:S0893608015001768/STRIPIN/image/gif/b853a01ced42750ca922f29b04f3f170/si73.gif https://s3.amazonaws.com/prod-ucs-content-store-us-east/content/pii:S0893608015001768/STRIPIN/image/gif/b853a01ced42750ca922f29b04f3f170/si73.gif si73 si73.gif gif 706 44 136 ALTIMG 1-s2.0-S0893608015001768-si193.gif https://s3-eu-west-1.amazonaws.com/prod-ucs-content-store-eu-west/content/pii:S0893608015001768/STRIPIN/image/gif/8b4c5fe13198a326c68e02c951fb9159/si193.gif https://s3.amazonaws.com/prod-ucs-content-store-us-east/content/pii:S0893608015001768/STRIPIN/image/gif/8b4c5fe13198a326c68e02c951fb9159/si193.gif si193 si193.gif gif 394 16 92 ALTIMG 1-s2.0-S0893608015001768-si51.gif https://s3-eu-west-1.amazonaws.com/prod-ucs-content-store-eu-west/content/pii:S0893608015001768/STRIPIN/image/gif/7d13e5d01b45e45c2131a6c98f1e3646/si51.gif https://s3.amazonaws.com/prod-ucs-content-store-us-east/content/pii:S0893608015001768/STRIPIN/image/gif/7d13e5d01b45e45c2131a6c98f1e3646/si51.gif si51 si51.gif gif 466 15 131 ALTIMG 1-s2.0-S0893608015001768-si54.gif https://s3-eu-west-1.amazonaws.com/prod-ucs-content-store-eu-west/content/pii:S0893608015001768/STRIPIN/image/gif/87e4eca2a4bcbc6b05978780826e2080/si54.gif https://s3.amazonaws.com/prod-ucs-content-store-us-east/content/pii:S0893608015001768/STRIPIN/image/gif/87e4eca2a4bcbc6b05978780826e2080/si54.gif si54 si54.gif gif 141 12 13 ALTIMG 1-s2.0-S0893608015001768-si159.gif https://s3-eu-west-1.amazonaws.com/prod-ucs-content-store-eu-west/content/pii:S0893608015001768/STRIPIN/image/gif/d7034e6812141ea3d481a77669b6decb/si159.gif https://s3.amazonaws.com/prod-ucs-content-store-us-east/content/pii:S0893608015001768/STRIPIN/image/gif/d7034e6812141ea3d481a77669b6decb/si159.gif si159 si159.gif gif 736 20 171 ALTIMG 1-s2.0-S0893608015001768-si83.gif https://s3-eu-west-1.amazonaws.com/prod-ucs-content-store-eu-west/content/pii:S0893608015001768/STRIPIN/image/gif/f3b137656aa30210dbe65e7ddbe596e7/si83.gif https://s3.amazonaws.com/prod-ucs-content-store-us-east/content/pii:S0893608015001768/STRIPIN/image/gif/f3b137656aa30210dbe65e7ddbe596e7/si83.gif si83 si83.gif gif 210 15 28 ALTIMG 1-s2.0-S0893608015001768-si205.gif https://s3-eu-west-1.amazonaws.com/prod-ucs-content-store-eu-west/content/pii:S0893608015001768/STRIPIN/image/gif/51ab4538c907fdfaaf0fc5a2867c354b/si205.gif https://s3.amazonaws.com/prod-ucs-content-store-us-east/content/pii:S0893608015001768/STRIPIN/image/gif/51ab4538c907fdfaaf0fc5a2867c354b/si205.gif si205 si205.gif gif 1167 21 316 ALTIMG 1-s2.0-S0893608015001768-si2.gif https://s3-eu-west-1.amazonaws.com/prod-ucs-content-store-eu-west/content/pii:S0893608015001768/STRIPIN/image/gif/0a981202d043d4b326fd3ea0839ddd04/si2.gif https://s3.amazonaws.com/prod-ucs-content-store-us-east/content/pii:S0893608015001768/STRIPIN/image/gif/0a981202d043d4b326fd3ea0839ddd04/si2.gif si2 si2.gif gif 183 14 20 ALTIMG 1-s2.0-S0893608015001768-si125.gif https://s3-eu-west-1.amazonaws.com/prod-ucs-content-store-eu-west/content/pii:S0893608015001768/STRIPIN/image/gif/bbb5ba9b1faffd666bdf474e7a8d48dd/si125.gif https://s3.amazonaws.com/prod-ucs-content-store-us-east/content/pii:S0893608015001768/STRIPIN/image/gif/bbb5ba9b1faffd666bdf474e7a8d48dd/si125.gif si125 si125.gif gif 117 8 9 ALTIMG 1-s2.0-S0893608015001768-si171.gif https://s3-eu-west-1.amazonaws.com/prod-ucs-content-store-eu-west/content/pii:S0893608015001768/STRIPIN/image/gif/6dea63b4bef73e25fa2d67092324dc47/si171.gif https://s3.amazonaws.com/prod-ucs-content-store-us-east/content/pii:S0893608015001768/STRIPIN/image/gif/6dea63b4bef73e25fa2d67092324dc47/si171.gif si171 si171.gif gif 813 35 154 ALTIMG 1-s2.0-S0893608015001768-si80.gif https://s3-eu-west-1.amazonaws.com/prod-ucs-content-store-eu-west/content/pii:S0893608015001768/STRIPIN/image/gif/7a001d039b876e99bf93a80b5ac68b68/si80.gif https://s3.amazonaws.com/prod-ucs-content-store-us-east/content/pii:S0893608015001768/STRIPIN/image/gif/7a001d039b876e99bf93a80b5ac68b68/si80.gif si80 si80.gif gif 786 31 180 ALTIMG 1-s2.0-S0893608015001768-si48.gif https://s3-eu-west-1.amazonaws.com/prod-ucs-content-store-eu-west/content/pii:S0893608015001768/STRIPIN/image/gif/4b928627e8285c1128a9027a3f95098a/si48.gif https://s3.amazonaws.com/prod-ucs-content-store-us-east/content/pii:S0893608015001768/STRIPIN/image/gif/4b928627e8285c1128a9027a3f95098a/si48.gif si48 si48.gif gif 381 15 110 ALTIMG 1-s2.0-S0893608015001768-si16.gif https://s3-eu-west-1.amazonaws.com/prod-ucs-content-store-eu-west/content/pii:S0893608015001768/STRIPIN/image/gif/046beff969d04e8f36517128015b5d21/si16.gif https://s3.amazonaws.com/prod-ucs-content-store-us-east/content/pii:S0893608015001768/STRIPIN/image/gif/046beff969d04e8f36517128015b5d21/si16.gif si16 si16.gif gif 264 13 54 ALTIMG 1-s2.0-S0893608015001768-si178.gif https://s3-eu-west-1.amazonaws.com/prod-ucs-content-store-eu-west/content/pii:S0893608015001768/STRIPIN/image/gif/e0064de5e6fb798772549cdf51aa16a7/si178.gif https://s3.amazonaws.com/prod-ucs-content-store-us-east/content/pii:S0893608015001768/STRIPIN/image/gif/e0064de5e6fb798772549cdf51aa16a7/si178.gif si178 si178.gif gif 248 18 29 ALTIMG 1-s2.0-S0893608015001768-si183.gif https://s3-eu-west-1.amazonaws.com/prod-ucs-content-store-eu-west/content/pii:S0893608015001768/STRIPIN/image/gif/2d8b1f53cb72a43dc670e1a011a6a6fa/si183.gif https://s3.amazonaws.com/prod-ucs-content-store-us-east/content/pii:S0893608015001768/STRIPIN/image/gif/2d8b1f53cb72a43dc670e1a011a6a6fa/si183.gif si183 si183.gif gif 309 15 54 ALTIMG 1-s2.0-S0893608015001768-si116.gif https://s3-eu-west-1.amazonaws.com/prod-ucs-content-store-eu-west/content/pii:S0893608015001768/STRIPIN/image/gif/2b7d215a2451809e75d03f4e455a24aa/si116.gif https://s3.amazonaws.com/prod-ucs-content-store-us-east/content/pii:S0893608015001768/STRIPIN/image/gif/2b7d215a2451809e75d03f4e455a24aa/si116.gif si116 si116.gif gif 354 15 68 ALTIMG 1-s2.0-S0893608015001768-si207.gif https://s3-eu-west-1.amazonaws.com/prod-ucs-content-store-eu-west/content/pii:S0893608015001768/STRIPIN/image/gif/cce7940856b451da7e71d11f7ca48d58/si207.gif https://s3.amazonaws.com/prod-ucs-content-store-us-east/content/pii:S0893608015001768/STRIPIN/image/gif/cce7940856b451da7e71d11f7ca48d58/si207.gif si207 si207.gif gif 308 12 61 ALTIMG 1-s2.0-S0893608015001768-si213.gif https://s3-eu-west-1.amazonaws.com/prod-ucs-content-store-eu-west/content/pii:S0893608015001768/STRIPIN/image/gif/8ef64401eeaf4cd4a02041eb00ad206d/si213.gif https://s3.amazonaws.com/prod-ucs-content-store-us-east/content/pii:S0893608015001768/STRIPIN/image/gif/8ef64401eeaf4cd4a02041eb00ad206d/si213.gif si213 si213.gif gif 305 12 61 ALTIMG 1-s2.0-S0893608015001768-si18.gif https://s3-eu-west-1.amazonaws.com/prod-ucs-content-store-eu-west/content/pii:S0893608015001768/STRIPIN/image/gif/a7a8d8daf55d5a383c15f5ff354f044c/si18.gif https://s3.amazonaws.com/prod-ucs-content-store-us-east/content/pii:S0893608015001768/STRIPIN/image/gif/a7a8d8daf55d5a383c15f5ff354f044c/si18.gif si18 si18.gif gif 160 11 35 ALTIMG 1-s2.0-S0893608015001768-si1.gif https://s3-eu-west-1.amazonaws.com/prod-ucs-content-store-eu-west/content/pii:S0893608015001768/STRIPIN/image/gif/fe9472ae522c05850bfa85d075283bd1/si1.gif https://s3.amazonaws.com/prod-ucs-content-store-us-east/content/pii:S0893608015001768/STRIPIN/image/gif/fe9472ae522c05850bfa85d075283bd1/si1.gif si1 si1.gif gif 304 14 63 ALTIMG 1-s2.0-S0893608015001768-si174.gif https://s3-eu-west-1.amazonaws.com/prod-ucs-content-store-eu-west/content/pii:S0893608015001768/STRIPIN/image/gif/075de912c27820bef138ba59be803814/si174.gif https://s3.amazonaws.com/prod-ucs-content-store-us-east/content/pii:S0893608015001768/STRIPIN/image/gif/075de912c27820bef138ba59be803814/si174.gif si174 si174.gif gif 160 15 12 ALTIMG 1-s2.0-S0893608015001768-si226.gif https://s3-eu-west-1.amazonaws.com/prod-ucs-content-store-eu-west/content/pii:S0893608015001768/STRIPIN/image/gif/77182a5561fb50e6f255eb106b961715/si226.gif https://s3.amazonaws.com/prod-ucs-content-store-us-east/content/pii:S0893608015001768/STRIPIN/image/gif/77182a5561fb50e6f255eb106b961715/si226.gif si226 si226.gif gif 140 11 12 ALTIMG 1-s2.0-S0893608015001768-si206.gif https://s3-eu-west-1.amazonaws.com/prod-ucs-content-store-eu-west/content/pii:S0893608015001768/STRIPIN/image/gif/40420ad57a98b719a5915278662f369c/si206.gif https://s3.amazonaws.com/prod-ucs-content-store-us-east/content/pii:S0893608015001768/STRIPIN/image/gif/40420ad57a98b719a5915278662f369c/si206.gif si206 si206.gif gif 285 11 61 ALTIMG 1-s2.0-S0893608015001768-si101.gif https://s3-eu-west-1.amazonaws.com/prod-ucs-content-store-eu-west/content/pii:S0893608015001768/STRIPIN/image/gif/14f3d33f0e5ab5be90e305141ef820fe/si101.gif https://s3.amazonaws.com/prod-ucs-content-store-us-east/content/pii:S0893608015001768/STRIPIN/image/gif/14f3d33f0e5ab5be90e305141ef820fe/si101.gif si101 si101.gif gif 133 11 9 ALTIMG 1-s2.0-S0893608015001768-si133.gif https://s3-eu-west-1.amazonaws.com/prod-ucs-content-store-eu-west/content/pii:S0893608015001768/STRIPIN/image/gif/e8560c8e539147298670ac2a6a0ddc41/si133.gif https://s3.amazonaws.com/prod-ucs-content-store-us-east/content/pii:S0893608015001768/STRIPIN/image/gif/e8560c8e539147298670ac2a6a0ddc41/si133.gif si133 si133.gif gif 173 15 15 ALTIMG 1-s2.0-S0893608015001768-si136.gif https://s3-eu-west-1.amazonaws.com/prod-ucs-content-store-eu-west/content/pii:S0893608015001768/STRIPIN/image/gif/1550b8c0f223e51f26c5b0e5f527e9db/si136.gif https://s3.amazonaws.com/prod-ucs-content-store-us-east/content/pii:S0893608015001768/STRIPIN/image/gif/1550b8c0f223e51f26c5b0e5f527e9db/si136.gif si136 si136.gif gif 392 15 112 ALTIMG 1-s2.0-S0893608015001768-si74.gif https://s3-eu-west-1.amazonaws.com/prod-ucs-content-store-eu-west/content/pii:S0893608015001768/STRIPIN/image/gif/49358c4ee8a422429dcfd1553683a898/si74.gif https://s3.amazonaws.com/prod-ucs-content-store-us-east/content/pii:S0893608015001768/STRIPIN/image/gif/49358c4ee8a422429dcfd1553683a898/si74.gif si74 si74.gif gif 288 15 56 ALTIMG 1-s2.0-S0893608015001768-si175.gif https://s3-eu-west-1.amazonaws.com/prod-ucs-content-store-eu-west/content/pii:S0893608015001768/STRIPIN/image/gif/388fbc8891ebbd9788381eb4bc28489b/si175.gif https://s3.amazonaws.com/prod-ucs-content-store-us-east/content/pii:S0893608015001768/STRIPIN/image/gif/388fbc8891ebbd9788381eb4bc28489b/si175.gif si175 si175.gif gif 190 15 26 ALTIMG 1-s2.0-S0893608015001768-si43.gif https://s3-eu-west-1.amazonaws.com/prod-ucs-content-store-eu-west/content/pii:S0893608015001768/STRIPIN/image/gif/632e055d271346a68e8aae73a89d4459/si43.gif https://s3.amazonaws.com/prod-ucs-content-store-us-east/content/pii:S0893608015001768/STRIPIN/image/gif/632e055d271346a68e8aae73a89d4459/si43.gif si43 si43.gif gif 2716 118 378 ALTIMG 1-s2.0-S0893608015001768-si157.gif https://s3-eu-west-1.amazonaws.com/prod-ucs-content-store-eu-west/content/pii:S0893608015001768/STRIPIN/image/gif/9ee5f21dd848e4d5f195070f599b5c8a/si157.gif https://s3.amazonaws.com/prod-ucs-content-store-us-east/content/pii:S0893608015001768/STRIPIN/image/gif/9ee5f21dd848e4d5f195070f599b5c8a/si157.gif si157 si157.gif gif 314 15 51 ALTIMG 1-s2.0-S0893608015001768-si154.gif https://s3-eu-west-1.amazonaws.com/prod-ucs-content-store-eu-west/content/pii:S0893608015001768/STRIPIN/image/gif/ea4d56bb7733654aa0735db904f0b32e/si154.gif https://s3.amazonaws.com/prod-ucs-content-store-us-east/content/pii:S0893608015001768/STRIPIN/image/gif/ea4d56bb7733654aa0735db904f0b32e/si154.gif si154 si154.gif gif 352 15 66 ALTIMG 1-s2.0-S0893608015001768-si72.gif https://s3-eu-west-1.amazonaws.com/prod-ucs-content-store-eu-west/content/pii:S0893608015001768/STRIPIN/image/gif/773b410932faadec5ee50c980dd9d536/si72.gif https://s3.amazonaws.com/prod-ucs-content-store-us-east/content/pii:S0893608015001768/STRIPIN/image/gif/773b410932faadec5ee50c980dd9d536/si72.gif si72 si72.gif gif 205 15 26 ALTIMG 1-s2.0-S0893608015001768-si100.gif https://s3-eu-west-1.amazonaws.com/prod-ucs-content-store-eu-west/content/pii:S0893608015001768/STRIPIN/image/gif/88b9c1a285c97104f3e73d132ac9ca7f/si100.gif https://s3.amazonaws.com/prod-ucs-content-store-us-east/content/pii:S0893608015001768/STRIPIN/image/gif/88b9c1a285c97104f3e73d132ac9ca7f/si100.gif si100 si100.gif gif 114 9 9 ALTIMG 1-s2.0-S0893608015001768-si150.gif https://s3-eu-west-1.amazonaws.com/prod-ucs-content-store-eu-west/content/pii:S0893608015001768/STRIPIN/image/gif/f9943263781e5116e3068b0ad6a28d9d/si150.gif https://s3.amazonaws.com/prod-ucs-content-store-us-east/content/pii:S0893608015001768/STRIPIN/image/gif/f9943263781e5116e3068b0ad6a28d9d/si150.gif si150 si150.gif gif 139 12 10 ALTIMG 1-s2.0-S0893608015001768-si144.gif https://s3-eu-west-1.amazonaws.com/prod-ucs-content-store-eu-west/content/pii:S0893608015001768/STRIPIN/image/gif/a3c84b91b8c958eedfde08c5fe004d33/si144.gif https://s3.amazonaws.com/prod-ucs-content-store-us-east/content/pii:S0893608015001768/STRIPIN/image/gif/a3c84b91b8c958eedfde08c5fe004d33/si144.gif si144 si144.gif gif 486 15 100 ALTIMG 1-s2.0-S0893608015001768-si165.gif https://s3-eu-west-1.amazonaws.com/prod-ucs-content-store-eu-west/content/pii:S0893608015001768/STRIPIN/image/gif/db43dee3517083839659542140cfd778/si165.gif https://s3.amazonaws.com/prod-ucs-content-store-us-east/content/pii:S0893608015001768/STRIPIN/image/gif/db43dee3517083839659542140cfd778/si165.gif si165 si165.gif gif 257 15 31 ALTIMG 1-s2.0-S0893608015001768-si60.gif https://s3-eu-west-1.amazonaws.com/prod-ucs-content-store-eu-west/content/pii:S0893608015001768/STRIPIN/image/gif/a046cfe699afa389277a51569c5ce7f6/si60.gif https://s3.amazonaws.com/prod-ucs-content-store-us-east/content/pii:S0893608015001768/STRIPIN/image/gif/a046cfe699afa389277a51569c5ce7f6/si60.gif si60 si60.gif gif 135 11 11 ALTIMG 1-s2.0-S0893608015001768-si224.gif https://s3-eu-west-1.amazonaws.com/prod-ucs-content-store-eu-west/content/pii:S0893608015001768/STRIPIN/image/gif/88cea81c6091ef6a34f4f1b2b5b84dfe/si224.gif https://s3.amazonaws.com/prod-ucs-content-store-us-east/content/pii:S0893608015001768/STRIPIN/image/gif/88cea81c6091ef6a34f4f1b2b5b84dfe/si224.gif si224 si224.gif gif 275 15 53 ALTIMG 1-s2.0-S0893608015001768-si153.gif https://s3-eu-west-1.amazonaws.com/prod-ucs-content-store-eu-west/content/pii:S0893608015001768/STRIPIN/image/gif/8f7262030db6b1c030dfbcf49b49b0e1/si153.gif https://s3.amazonaws.com/prod-ucs-content-store-us-east/content/pii:S0893608015001768/STRIPIN/image/gif/8f7262030db6b1c030dfbcf49b49b0e1/si153.gif si153 si153.gif gif 131 11 12 ALTIMG 1-s2.0-S0893608015001768-si59.gif https://s3-eu-west-1.amazonaws.com/prod-ucs-content-store-eu-west/content/pii:S0893608015001768/STRIPIN/image/gif/75513396e9f48078371c9051201acce6/si59.gif https://s3.amazonaws.com/prod-ucs-content-store-us-east/content/pii:S0893608015001768/STRIPIN/image/gif/75513396e9f48078371c9051201acce6/si59.gif si59 si59.gif gif 270 15 46 ALTIMG 1-s2.0-S0893608015001768-si188.gif https://s3-eu-west-1.amazonaws.com/prod-ucs-content-store-eu-west/content/pii:S0893608015001768/STRIPIN/image/gif/583563cad97372de2f245b0704bfffae/si188.gif https://s3.amazonaws.com/prod-ucs-content-store-us-east/content/pii:S0893608015001768/STRIPIN/image/gif/583563cad97372de2f245b0704bfffae/si188.gif si188 si188.gif gif 412 16 94 ALTIMG 1-s2.0-S0893608015001768-si223.gif https://s3-eu-west-1.amazonaws.com/prod-ucs-content-store-eu-west/content/pii:S0893608015001768/STRIPIN/image/gif/6f55816ae49ddcc2a1af5f546ba838c8/si223.gif https://s3.amazonaws.com/prod-ucs-content-store-us-east/content/pii:S0893608015001768/STRIPIN/image/gif/6f55816ae49ddcc2a1af5f546ba838c8/si223.gif si223 si223.gif gif 251 13 48 ALTIMG 1-s2.0-S0893608015001768-si70.gif https://s3-eu-west-1.amazonaws.com/prod-ucs-content-store-eu-west/content/pii:S0893608015001768/STRIPIN/image/gif/cd50a58e1bd98e2a7d058f2edd8bd6b2/si70.gif https://s3.amazonaws.com/prod-ucs-content-store-us-east/content/pii:S0893608015001768/STRIPIN/image/gif/cd50a58e1bd98e2a7d058f2edd8bd6b2/si70.gif si70 si70.gif gif 600 39 115 ALTIMG 1-s2.0-S0893608015001768-si6.gif https://s3-eu-west-1.amazonaws.com/prod-ucs-content-store-eu-west/content/pii:S0893608015001768/STRIPIN/image/gif/fb023e036b3f9191b882e0e2e0d674aa/si6.gif https://s3.amazonaws.com/prod-ucs-content-store-us-east/content/pii:S0893608015001768/STRIPIN/image/gif/fb023e036b3f9191b882e0e2e0d674aa/si6.gif si6 si6.gif gif 432 17 71 ALTIMG 1-s2.0-S0893608015001768-si65.gif https://s3-eu-west-1.amazonaws.com/prod-ucs-content-store-eu-west/content/pii:S0893608015001768/STRIPIN/image/gif/7ed0d911726548625478ee3d9c44f9a4/si65.gif https://s3.amazonaws.com/prod-ucs-content-store-us-east/content/pii:S0893608015001768/STRIPIN/image/gif/7ed0d911726548625478ee3d9c44f9a4/si65.gif si65 si65.gif gif 155 14 15 ALTIMG 1-s2.0-S0893608015001768-si77.gif https://s3-eu-west-1.amazonaws.com/prod-ucs-content-store-eu-west/content/pii:S0893608015001768/STRIPIN/image/gif/00efd474d4f5b39f5c3d12b265aff45b/si77.gif https://s3.amazonaws.com/prod-ucs-content-store-us-east/content/pii:S0893608015001768/STRIPIN/image/gif/00efd474d4f5b39f5c3d12b265aff45b/si77.gif si77 si77.gif gif 152 12 18 ALTIMG 1-s2.0-S0893608015001768-si27.gif https://s3-eu-west-1.amazonaws.com/prod-ucs-content-store-eu-west/content/pii:S0893608015001768/STRIPIN/image/gif/f8208cfb59d78e5b6077343f8699c9bf/si27.gif https://s3.amazonaws.com/prod-ucs-content-store-us-east/content/pii:S0893608015001768/STRIPIN/image/gif/f8208cfb59d78e5b6077343f8699c9bf/si27.gif si27 si27.gif gif 202 12 43 ALTIMG 1-s2.0-S0893608015001768-si195.gif https://s3-eu-west-1.amazonaws.com/prod-ucs-content-store-eu-west/content/pii:S0893608015001768/STRIPIN/image/gif/0a049781232a2f51720ffde633233e85/si195.gif https://s3.amazonaws.com/prod-ucs-content-store-us-east/content/pii:S0893608015001768/STRIPIN/image/gif/0a049781232a2f51720ffde633233e85/si195.gif si195 si195.gif gif 190 15 42 ALTIMG 1-s2.0-S0893608015001768-si20.gif https://s3-eu-west-1.amazonaws.com/prod-ucs-content-store-eu-west/content/pii:S0893608015001768/STRIPIN/image/gif/de8d3ab71d45fada8bd6cb1e42eb4a21/si20.gif https://s3.amazonaws.com/prod-ucs-content-store-us-east/content/pii:S0893608015001768/STRIPIN/image/gif/de8d3ab71d45fada8bd6cb1e42eb4a21/si20.gif si20 si20.gif gif 129 14 11 ALTIMG 1-s2.0-S0893608015001768-si36.gif https://s3-eu-west-1.amazonaws.com/prod-ucs-content-store-eu-west/content/pii:S0893608015001768/STRIPIN/image/gif/e4d60501243fc5babdb00df73f22f62e/si36.gif https://s3.amazonaws.com/prod-ucs-content-store-us-east/content/pii:S0893608015001768/STRIPIN/image/gif/e4d60501243fc5babdb00df73f22f62e/si36.gif si36 si36.gif gif 211 15 24 ALTIMG 1-s2.0-S0893608015001768-si208.gif https://s3-eu-west-1.amazonaws.com/prod-ucs-content-store-eu-west/content/pii:S0893608015001768/STRIPIN/image/gif/9e5c5e2ead71a902c93c7fdd1cd3cfe8/si208.gif https://s3.amazonaws.com/prod-ucs-content-store-us-east/content/pii:S0893608015001768/STRIPIN/image/gif/9e5c5e2ead71a902c93c7fdd1cd3cfe8/si208.gif si208 si208.gif gif 412 14 87 ALTIMG 1-s2.0-S0893608015001768-si187.gif https://s3-eu-west-1.amazonaws.com/prod-ucs-content-store-eu-west/content/pii:S0893608015001768/STRIPIN/image/gif/0730ef6cf905aeb1d7757cd98796109d/si187.gif https://s3.amazonaws.com/prod-ucs-content-store-us-east/content/pii:S0893608015001768/STRIPIN/image/gif/0730ef6cf905aeb1d7757cd98796109d/si187.gif si187 si187.gif gif 336 16 81 ALTIMG 1-s2.0-S0893608015001768-si5.gif https://s3-eu-west-1.amazonaws.com/prod-ucs-content-store-eu-west/content/pii:S0893608015001768/STRIPIN/image/gif/852fc6c1dbbbf6e729ab4f20add1ad5a/si5.gif https://s3.amazonaws.com/prod-ucs-content-store-us-east/content/pii:S0893608015001768/STRIPIN/image/gif/852fc6c1dbbbf6e729ab4f20add1ad5a/si5.gif si5 si5.gif gif 376 17 60 ALTIMG 1-s2.0-S0893608015001768-si186.gif https://s3-eu-west-1.amazonaws.com/prod-ucs-content-store-eu-west/content/pii:S0893608015001768/STRIPIN/image/gif/cbc1cfce36750dd968d9071ba69e23b1/si186.gif https://s3.amazonaws.com/prod-ucs-content-store-us-east/content/pii:S0893608015001768/STRIPIN/image/gif/cbc1cfce36750dd968d9071ba69e23b1/si186.gif si186 si186.gif gif 133 15 11 ALTIMG 1-s2.0-S0893608015001768-si212.gif https://s3-eu-west-1.amazonaws.com/prod-ucs-content-store-eu-west/content/pii:S0893608015001768/STRIPIN/image/gif/49c4e3f6834e1ba0908e0b9ca8978954/si212.gif https://s3.amazonaws.com/prod-ucs-content-store-us-east/content/pii:S0893608015001768/STRIPIN/image/gif/49c4e3f6834e1ba0908e0b9ca8978954/si212.gif si212 si212.gif gif 285 11 61 ALTIMG 1-s2.0-S0893608015001768-si38.gif https://s3-eu-west-1.amazonaws.com/prod-ucs-content-store-eu-west/content/pii:S0893608015001768/STRIPIN/image/gif/65c078e9951c1b3efa626fa421eb7e7b/si38.gif https://s3.amazonaws.com/prod-ucs-content-store-us-east/content/pii:S0893608015001768/STRIPIN/image/gif/65c078e9951c1b3efa626fa421eb7e7b/si38.gif si38 si38.gif gif 135 12 10 ALTIMG 1-s2.0-S0893608015001768-si112.gif https://s3-eu-west-1.amazonaws.com/prod-ucs-content-store-eu-west/content/pii:S0893608015001768/STRIPIN/image/gif/da14f972b2ad8b4149b786e25596da15/si112.gif https://s3.amazonaws.com/prod-ucs-content-store-us-east/content/pii:S0893608015001768/STRIPIN/image/gif/da14f972b2ad8b4149b786e25596da15/si112.gif si112 si112.gif gif 217 11 32 ALTIMG 1-s2.0-S0893608015001768-si49.gif https://s3-eu-west-1.amazonaws.com/prod-ucs-content-store-eu-west/content/pii:S0893608015001768/STRIPIN/image/gif/86023093a970e4dac9a026b372d85d86/si49.gif https://s3.amazonaws.com/prod-ucs-content-store-us-east/content/pii:S0893608015001768/STRIPIN/image/gif/86023093a970e4dac9a026b372d85d86/si49.gif si49 si49.gif gif 256 13 49 ALTIMG 1-s2.0-S0893608015001768-si44.gif https://s3-eu-west-1.amazonaws.com/prod-ucs-content-store-eu-west/content/pii:S0893608015001768/STRIPIN/image/gif/01cc2e606afccc6dfd07cad8ad3d2d4b/si44.gif https://s3.amazonaws.com/prod-ucs-content-store-us-east/content/pii:S0893608015001768/STRIPIN/image/gif/01cc2e606afccc6dfd07cad8ad3d2d4b/si44.gif si44 si44.gif gif 303 15 79 ALTIMG 1-s2.0-S0893608015001768-si24.gif https://s3-eu-west-1.amazonaws.com/prod-ucs-content-store-eu-west/content/pii:S0893608015001768/STRIPIN/image/gif/3c9bf31d7a26d13d58d9e08525778e1c/si24.gif https://s3.amazonaws.com/prod-ucs-content-store-us-east/content/pii:S0893608015001768/STRIPIN/image/gif/3c9bf31d7a26d13d58d9e08525778e1c/si24.gif si24 si24.gif gif 124 8 10 ALTIMG 1-s2.0-S0893608015001768-si129.gif https://s3-eu-west-1.amazonaws.com/prod-ucs-content-store-eu-west/content/pii:S0893608015001768/STRIPIN/image/gif/01c4e861dd2b78bf2013775d0547722f/si129.gif https://s3.amazonaws.com/prod-ucs-content-store-us-east/content/pii:S0893608015001768/STRIPIN/image/gif/01c4e861dd2b78bf2013775d0547722f/si129.gif si129 si129.gif gif 780 15 215 ALTIMG 1-s2.0-S0893608015001768-si182.gif https://s3-eu-west-1.amazonaws.com/prod-ucs-content-store-eu-west/content/pii:S0893608015001768/STRIPIN/image/gif/725029f0d5a30ae4d262a3a21359e676/si182.gif https://s3.amazonaws.com/prod-ucs-content-store-us-east/content/pii:S0893608015001768/STRIPIN/image/gif/725029f0d5a30ae4d262a3a21359e676/si182.gif si182 si182.gif gif 2127 84 256 ALTIMG 1-s2.0-S0893608015001768-si64.gif https://s3-eu-west-1.amazonaws.com/prod-ucs-content-store-eu-west/content/pii:S0893608015001768/STRIPIN/image/gif/02a6ad23e96d7e9ac65cfc20f6834d47/si64.gif https://s3.amazonaws.com/prod-ucs-content-store-us-east/content/pii:S0893608015001768/STRIPIN/image/gif/02a6ad23e96d7e9ac65cfc20f6834d47/si64.gif si64 si64.gif gif 217 13 40 ALTIMG 1-s2.0-S0893608015001768-si52.gif https://s3-eu-west-1.amazonaws.com/prod-ucs-content-store-eu-west/content/pii:S0893608015001768/STRIPIN/image/gif/dfdd862c47a6a59e789d0503fb8b5e2b/si52.gif https://s3.amazonaws.com/prod-ucs-content-store-us-east/content/pii:S0893608015001768/STRIPIN/image/gif/dfdd862c47a6a59e789d0503fb8b5e2b/si52.gif si52 si52.gif gif 306 17 39 ALTIMG 1-s2.0-S0893608015001768-si102.gif https://s3-eu-west-1.amazonaws.com/prod-ucs-content-store-eu-west/content/pii:S0893608015001768/STRIPIN/image/gif/64dae770a51c404c4460b5aee27fe580/si102.gif https://s3.amazonaws.com/prod-ucs-content-store-us-east/content/pii:S0893608015001768/STRIPIN/image/gif/64dae770a51c404c4460b5aee27fe580/si102.gif si102 si102.gif gif 994 32 256 ALTIMG 1-s2.0-S0893608015001768-si55.gif https://s3-eu-west-1.amazonaws.com/prod-ucs-content-store-eu-west/content/pii:S0893608015001768/STRIPIN/image/gif/5bcd47deafa303d9d9423d25c2457e00/si55.gif https://s3.amazonaws.com/prod-ucs-content-store-us-east/content/pii:S0893608015001768/STRIPIN/image/gif/5bcd47deafa303d9d9423d25c2457e00/si55.gif si55 si55.gif gif 344 15 79 ALTIMG 1-s2.0-S0893608015001768-si58.gif https://s3-eu-west-1.amazonaws.com/prod-ucs-content-store-eu-west/content/pii:S0893608015001768/STRIPIN/image/gif/398bc145bd2b93fa4aec5731c563082b/si58.gif https://s3.amazonaws.com/prod-ucs-content-store-us-east/content/pii:S0893608015001768/STRIPIN/image/gif/398bc145bd2b93fa4aec5731c563082b/si58.gif si58 si58.gif gif 125 14 10 ALTIMG 1-s2.0-S0893608015001768-si45.gif https://s3-eu-west-1.amazonaws.com/prod-ucs-content-store-eu-west/content/pii:S0893608015001768/STRIPIN/image/gif/1d0de1e4628330599d3688cffce87100/si45.gif https://s3.amazonaws.com/prod-ucs-content-store-us-east/content/pii:S0893608015001768/STRIPIN/image/gif/1d0de1e4628330599d3688cffce87100/si45.gif si45 si45.gif gif 1755 44 393 ALTIMG 1-s2.0-S0893608015001768-si33.gif https://s3-eu-west-1.amazonaws.com/prod-ucs-content-store-eu-west/content/pii:S0893608015001768/STRIPIN/image/gif/1f1f2011784b4f3b01fe73c1927f76cc/si33.gif https://s3.amazonaws.com/prod-ucs-content-store-us-east/content/pii:S0893608015001768/STRIPIN/image/gif/1f1f2011784b4f3b01fe73c1927f76cc/si33.gif si33 si33.gif gif 969 41 177 ALTIMG 1-s2.0-S0893608015001768-si128.gif https://s3-eu-west-1.amazonaws.com/prod-ucs-content-store-eu-west/content/pii:S0893608015001768/STRIPIN/image/gif/6b9028dedf023e2b7fd97a6ee2b5ddba/si128.gif https://s3.amazonaws.com/prod-ucs-content-store-us-east/content/pii:S0893608015001768/STRIPIN/image/gif/6b9028dedf023e2b7fd97a6ee2b5ddba/si128.gif si128 si128.gif gif 177 11 21 ALTIMG 1-s2.0-S0893608015001768-si158.gif https://s3-eu-west-1.amazonaws.com/prod-ucs-content-store-eu-west/content/pii:S0893608015001768/STRIPIN/image/gif/e472106ca0dfce5474936cf7a0379572/si158.gif https://s3.amazonaws.com/prod-ucs-content-store-us-east/content/pii:S0893608015001768/STRIPIN/image/gif/e472106ca0dfce5474936cf7a0379572/si158.gif si158 si158.gif gif 249 15 33 ALTIMG 1-s2.0-S0893608015001768-si179.gif https://s3-eu-west-1.amazonaws.com/prod-ucs-content-store-eu-west/content/pii:S0893608015001768/STRIPIN/image/gif/eb79158a55276462e7ace40392aafb06/si179.gif https://s3.amazonaws.com/prod-ucs-content-store-us-east/content/pii:S0893608015001768/STRIPIN/image/gif/eb79158a55276462e7ace40392aafb06/si179.gif si179 si179.gif gif 246 16 33 ALTIMG 1-s2.0-S0893608015001768-si113.gif https://s3-eu-west-1.amazonaws.com/prod-ucs-content-store-eu-west/content/pii:S0893608015001768/STRIPIN/image/gif/fe02a8a672c42f9eb576c2ca8f541b30/si113.gif https://s3.amazonaws.com/prod-ucs-content-store-us-east/content/pii:S0893608015001768/STRIPIN/image/gif/fe02a8a672c42f9eb576c2ca8f541b30/si113.gif si113 si113.gif gif 595 35 110 ALTIMG 1-s2.0-S0893608015001768-si172.gif https://s3-eu-west-1.amazonaws.com/prod-ucs-content-store-eu-west/content/pii:S0893608015001768/STRIPIN/image/gif/b95208f67ae064693ff081a9d10d2027/si172.gif https://s3.amazonaws.com/prod-ucs-content-store-us-east/content/pii:S0893608015001768/STRIPIN/image/gif/b95208f67ae064693ff081a9d10d2027/si172.gif si172 si172.gif gif 281 14 43 ALTIMG 1-s2.0-S0893608015001768-si190.gif https://s3-eu-west-1.amazonaws.com/prod-ucs-content-store-eu-west/content/pii:S0893608015001768/STRIPIN/image/gif/9478edc7b5b5cb851af07fce14270098/si190.gif https://s3.amazonaws.com/prod-ucs-content-store-us-east/content/pii:S0893608015001768/STRIPIN/image/gif/9478edc7b5b5cb851af07fce14270098/si190.gif si190 si190.gif gif 318 15 61 ALTIMG 1-s2.0-S0893608015001768-si97.gif https://s3-eu-west-1.amazonaws.com/prod-ucs-content-store-eu-west/content/pii:S0893608015001768/STRIPIN/image/gif/de6d91be85876fbd684abeedeee12140/si97.gif https://s3.amazonaws.com/prod-ucs-content-store-us-east/content/pii:S0893608015001768/STRIPIN/image/gif/de6d91be85876fbd684abeedeee12140/si97.gif si97 si97.gif gif 724 31 152 ALTIMG 1-s2.0-S0893608015001768-si19.gif https://s3-eu-west-1.amazonaws.com/prod-ucs-content-store-eu-west/content/pii:S0893608015001768/STRIPIN/image/gif/ebf60784d2208b96b2ebd36f1a96d657/si19.gif https://s3.amazonaws.com/prod-ucs-content-store-us-east/content/pii:S0893608015001768/STRIPIN/image/gif/ebf60784d2208b96b2ebd36f1a96d657/si19.gif si19 si19.gif gif 114 8 8 ALTIMG 1-s2.0-S0893608015001768-si217.gif https://s3-eu-west-1.amazonaws.com/prod-ucs-content-store-eu-west/content/pii:S0893608015001768/STRIPIN/image/gif/bd536b20637c3dd5bd3d446823675222/si217.gif https://s3.amazonaws.com/prod-ucs-content-store-us-east/content/pii:S0893608015001768/STRIPIN/image/gif/bd536b20637c3dd5bd3d446823675222/si217.gif si217 si217.gif gif 281 17 57 ALTIMG 1-s2.0-S0893608015001768-si139.gif https://s3-eu-west-1.amazonaws.com/prod-ucs-content-store-eu-west/content/pii:S0893608015001768/STRIPIN/image/gif/22bad645582d8713da885771227dba29/si139.gif https://s3.amazonaws.com/prod-ucs-content-store-us-east/content/pii:S0893608015001768/STRIPIN/image/gif/22bad645582d8713da885771227dba29/si139.gif si139 si139.gif gif 345 15 77 ALTIMG 1-s2.0-S0893608015001768-si167.gif https://s3-eu-west-1.amazonaws.com/prod-ucs-content-store-eu-west/content/pii:S0893608015001768/STRIPIN/image/gif/ac2dd0d2e7a034af1cbf9ed18a1be415/si167.gif https://s3.amazonaws.com/prod-ucs-content-store-us-east/content/pii:S0893608015001768/STRIPIN/image/gif/ac2dd0d2e7a034af1cbf9ed18a1be415/si167.gif si167 si167.gif gif 1177 39 199 ALTIMG 1-s2.0-S0893608015001768-si222.gif https://s3-eu-west-1.amazonaws.com/prod-ucs-content-store-eu-west/content/pii:S0893608015001768/STRIPIN/image/gif/6116dba53ce90d265347ee2d2de69b13/si222.gif https://s3.amazonaws.com/prod-ucs-content-store-us-east/content/pii:S0893608015001768/STRIPIN/image/gif/6116dba53ce90d265347ee2d2de69b13/si222.gif si222 si222.gif gif 288 15 43 ALTIMG 1-s2.0-S0893608015001768-si198.gif https://s3-eu-west-1.amazonaws.com/prod-ucs-content-store-eu-west/content/pii:S0893608015001768/STRIPIN/image/gif/99952e0c45fbe9fa94ac4eb2b6d5d642/si198.gif https://s3.amazonaws.com/prod-ucs-content-store-us-east/content/pii:S0893608015001768/STRIPIN/image/gif/99952e0c45fbe9fa94ac4eb2b6d5d642/si198.gif si198 si198.gif gif 290 11 61 ALTIMG NN 3525 S0893-6080(15)00176-8 10.1016/j.neunet.2015.09.001 The Authors Fig. 1 Sampling sequences generated with (a) uniform grid, (b) pseudo-random, (c) Halton, (d) CVT, and (e) LCVT. The top panel shows the sequences corresponding to 2-D input space with a total of 25 (white circle) and 100 (black points) samples. The bottom panel shows plots of the same sampling sequences for a 9-D input space sampled with 2 points per dimension giving a total of 2 9 = 524 samples projected to the dimension 7 and 9. Fig. 2 Sampling sequences (black points) created from the sequences from Fig. 1 resampled using important sampling functions represented as color surface plot on the background. (top panel) 2-D input space with 100 samples and exponential important sampling function. (middle panel) A 9-D input space with 512 samples projected to the dimension 7 and 9 and resampled with a 2-D Gaussian probability distribution important sampling function. (bottom panel) Histogram showing the distribution of the samples shown in the middle panel. (For interpretation of the references to color in this figure legend, the reader is referred to the web version of this article.) Fig. 3 Plots of the benchmark functions for a 2-D input space: (a) Shifted Ackley, (b) Composition, and (c) Fast Fractal Double Dip. Fig. 4 Discrepancy measurements in (a) infinite, (b) L2 and (c) modified L2 star norms for 5-D input space sequences as function of the number of samples. The five curves per plot correspond to different sampling methods: uniform grid (UG), CVT, pseudo-random (PR), LCVT and Halton (HA). Fig. 5 (a) Modified L2-star discrepancy as function of the number of samples for 9-D input space for LCVT (cyan) and HA (orange) sampling sequences, LCVT performs better than Halton for sequences with less than 700 samples. (b) Sampling method with lower discrepancy as function of the input space dimension and the number of samples, LCVT outperforms Halton in case of low dimensions and relative few samples. (For interpretation of the references to color in this figure legend, the reader is referred to the web version of this article.) Fig. 6 Statistical moments (a) mean, (b) standard deviation, (c) skewness, and (d) kurtosis of the response function in the output space as function of the number of sample patterns for two of the benchmark functions depicted in Fig. 3. The left panels correspond to the Fast Fractal Double Dip function for a 5-D input space and the right panels correspond to the Composition function for a 10-D input space. Fig. 7 Incremental learning of the Rosenbrock function in 5-D input space. The plots show the approximation results from (a) 45 samples, (b) 65 and (c) 85 samples. After a few iterations the learned function accurately approximates the target function (d). Table 1 SSIFL results for the Shifted Ackley function F SA in 5 dimensions. Iteration Train samples Test samples F SA mean F SA StdDev NN epochs NN MSE Occam ratio 1 6 5 ( 7776 ) 55 \u2212118.757 1.0441 34 0.000688 0.9381 2 7 5 ( 16 807 ) 65 \u2212118.759 1.0446 17 0.000626 1.0659 3 8 5 ( 32 768 ) 75 \u2212118.454 1.0454 17 0.000598 0.9378 Table 2 SSIFL results for the Rosenbrock function F RO in 100 dimensions. Iteration Train samples Test samples F RO mean F RO StdDev NN epochs NN MSE Occam ratio 1 105 104 5830.62 789.85 42 459310 0.9964 2 106 105 5809.56 768.17 272 308080 0.9575 Table 3 SSIFL results for the real-world remote sensing ( F RTM ) function with 5 input and 62 output dimensions. Iteration Train samples Test samples F RTM Av.mean F RTM Av.StdDev NN epochs NN MSE Occam ratio 1 55 45 0.082274 0.069293 9700 2.0e\u221206 1.0100 2 65 55 0.082301 0.069333 4315 1.7e\u221206 0.9564 3 75 65 0.082296 0.069340 50662 8.2e\u221207 1.0268 4 85 75 0.082333 0.069367 12918 6.9e\u221207 0.9851 5 95 85 0.082319 0.06935 142 6.9e\u221207 0.9823 6 105 95 0.082291 0.069338 70625 5.7e\u221207 1.0141 7 115 105 0.082289 0.069343 200000 2.8e\u221207 1.0081 8 125 115 0.082286 0.069342 61291 2.5e\u221207 0.9797 Table 4 SSIFL results for the real-world blog problem with 280 input dimensions. Iteration Train samples Test samples NN epochs NN MSE Occam ratio 1 1000 100 159 0.0003592 4.1621 2 10000 1000 106 8.161e\u221205 0.8903 3 41397 10000 124 0.000478 1.2640 2016 Special Issue Smart sampling and incremental function learning for very large high dimensional data Diego G. Loyola R \u204e Diego.Loyola@dlr.de Mattia Pedergnana Sebasti\u00e1n Gimeno Garc\u00eda German Aerospace Center (DLR), Oberpfaffenhofen, 82234 Wessling, Germany German Aerospace Center (DLR) Oberpfaffenhofen Wessling 82234 Germany \u204e Corresponding author. Tel.: +49 8153 28 1367; fax: +49 8153 28 1446. Abstract Very large high dimensional data are common nowadays and they impose new challenges to data-driven and data-intensive algorithms. Computational Intelligence techniques have the potential to provide powerful tools for addressing these challenges, but the current literature focuses mainly on handling scalability issues related to data volume in terms of sample size for classification tasks. This work presents a systematic and comprehensive approach for optimally handling regression tasks with very large high dimensional data. The proposed approach is based on smart sampling techniques for minimizing the number of samples to be generated by using an iterative approach that creates new sample sets until the input and output space of the function to be approximated are optimally covered. Incremental function learning takes place in each sampling iteration, the new samples are used to fine tune the regression results of the function learning algorithm. The accuracy and confidence levels of the resulting approximation function are assessed using the probably approximately correct computation framework. The smart sampling and incremental function learning techniques can be easily used in practical applications and scale well in the case of extremely large data. The feasibility and good results of the proposed techniques are demonstrated using benchmark functions as well as functions from real-world problems. Keywords High dimensional function approximation Sampling discrepancy Design of experiments Probably approximately correct computation Function learning Neural networks 1 Introduction Computer-based simulations of tremendously complex mathematical systems describing multifaceted physical, chemical, dynamical and engineering models are usually associated with very expensive costs in terms of processing time and storage. Complex mathematical models are present in a wide variety of scientific areas such as the simulation of atmospheric processes in numerical weather prediction (Han & Pan, 2011; Hsieh & Tang, 1998; Lynch, 2006; Morcrette, 1991), climate modeling (Flato et al., 2013), (Gordon et al., 2000), chemical transport (Grell et al., 2005), (Menut et al., 2013), radiative transfer (Gimeno Garc\u00eda, Trautmann, & Venema, 2012) and large eddy simulations (Sagaut, 2006). Other scientific disciplines such as genetics, aerodynamics, or statistical mechanics also make use of highly complex models. The input space of these models can be of high dimensionality with hundreds or more components. The usage of more realistic models usually introduces new dimensions leading to an exponential increase in volume, i.e. \u201cBig Data\u201d (Hilbert & L\u00f3pez, 2011; Lynch, 2008). The speeding-up of such models is a crucial problem in practical applications like weather forecasting, remote sensing, and climate modeling among others. These complex models can be approximated using for example neural networks (Haupt, Pasini, & Marzban, 2009; Loyola, 2006; Qazi & Linshu, 2006), support vector machines (Tripathi, Srinivas, & Nanjundiah, 2006), kernel smoothing models (Cervellera & Macci\u00f2, 2013), and the resulting computational intelligence systems are being deployed in operational environments, see for example Krasnopolsky and Chevallier (2003) and Loyola (2006). Related work found in the literature usually addresses function approximations from complex mathematical models in the general framework of statistical machine learning where it is assumed that the training samples are created independently according to an unknown probability density function (Krasnopolsky & Schiller, 2007). However, having a mathematical model to parameterize, we can freely choose the sample points that better characterize the input and output spaces of the model. The selection of samples to be used in function approximation problems is less explored in the literature, sometimes it is called design of experiments (Sacks, Welch, Mitchell, & Wynn, 1989) or active learning (En\u0103chescu, 2013). In this study we develop a general function approximation framework in which the choice of the samples describing the function is an integral part of the learning problem. The goal is to find a regression model that accurately approximates a function f : X \u2192 Y with input X \u2282 R n and output Y \u2282 R m from a set of training samples T = { x i , y i } for i = 1 to s , subject to the constraint of minimizing the number of calls to the target function f , i.e. minimizing the number of samples s . The dimensionality of the data needed to solve this problem is characterized by the number of samples s and the dimensionality of the mapping represented by f with n inputs and m outputs. On one side, the complexity of a function does not necessarily increase for a high dimensional input space; moreover the limiting factor for an accurate function approximation is the intrinsic complexity of the target function and not the dimension of the input data space (Kolmogorov, 1957). Accuracy of approximation can be achieved in high dimensional cases for target functions with lower complexity (Gnecco, K\u016frkov\u00e1, & Sanguineti, 2011). On the other side, systematically sampling the input space with k values per dimension will require in total s = k n calls to f , therefore the number of samples s for mappings with high dimensional input size grows exponentially with the input dimension n . These difficulties are usually referred as \u201cthe curse of dimensionality\u201d problem (Vapnik, 2006) and it has severe consequences not only for the time needed to create the training dataset but also for the algorithms needed to solve function approximation problems that must deal with very large number of samples of high dimensionality, i.e. \u201cBig Data\u201d. The data volume component of Big Data is a hot topic in machine learning, see for example Jin and Hammer (2014) and O\u2019Leary (2013) and the references therein. But the main focus on the current literature is the sample size and not the sample dimension problem. Only a few studies address the big dimension problem such as for example theoretical investigations of computational models efficiency in high dimensional context (Kainen, K\u016frkov\u00e1, & Sanguineti, 2012) and for classification tasks wherein the explosion of features brings about new challenges to computational intelligence (Yiteng, Yew-Soon, & Tsang, 2014). In this article we focus on the under-explored topic of big dimensionality for regression tasks. The paper is organized as follows: Section 2 gives an overview of data sampling methods and discrepancy measurements. Section 3 shows a comparison of sampling methods and evaluates their performance for high dimension input problems. Section 4 presents the smart sampling and incremental function learning (SSIFL) algorithm that optimally solves this kind of function approximation problems and Section 5 shows the results of applying SSIFL to a number of benchmark and real-world functions. Finally, the conclusions are given in Section 6. 2 Data sampling methods Generally speaking a good sampling method should create training data that accurately represents the underlying function preserving the statistical characteristics of the complete dataset. This section presents first a survey of sampling methods grouped in four categories that can be applied to generating high dimensional sample data. 2.1 Stochastic methods Pseudo-Random number generators (PR) (Marsaglia & Tsang, 2000; Matsumoto & Nishimura, 1998) are commonly used to create samples in a given range. PR methods are fast and simple to use, but they are not distributed uniformly enough especially for the cases of low number of sampling points and/or large number of dimensions. PR sampling is sometimes called \u201cpure\u201d or \u201cplain\u201d Monte Carlo (Swiler, Slepoy, & Giunta, 2006). 2.2 Deterministic methods Uniform populations can be created using quasi-random or sub-random sequences that cover the input space quickly and evenly, the uniformity and coverage improves continually as more data points are added to the sequence. Deterministic methods can be divided into two subcategories (Kazimipour, Li, & Qin, 2013) described in the next subsections. 2.2.1 Low discrepancy methods Low Discrepancy methods have the support of theoretical upper-bounds on discrepancy. Halton, Sobol, Niederreiter, Hammersley, and Faure are well known sequences from this category. In this work we use Halton sequences, shortened as (HA), which are constructed according to a deterministic algorithm that uses prime numbers as bases for each dimension (Halton, 1960). Halton sequences work well in low dimensionality, but they lose uniformity in high dimensions. Workaround solutions such as using big prime numbers, setting leap values, scrambling and shuffling improve the sampling uniformity in such cases. The HA method is computationally efficient even for very high dimensional spaces. 2.2.2 Experimental design methods Experimental Design methods are commonly used for initializing the population of evolutionary algorithms in order to accelerate convergence speed and improve stability. The most representative methods in this category are: \u2022 Uniform Design: a space-filling method based on prime numbers that generates points uniformly scattered on the input domain (Peng, Wang, Dai, & Cao, 2012). \u2022 Orthogonal Design: based on Latin squares for creating orthogonal arrays (Leung & Wang, 2001). 2.3 Geometrical methods 2.3.1 Uniform grid Uniform grid (UG) is the simplest sampling method in which the samples are created using node points at fixed intervals uniformly distributed for every dimension. UG is commonly used for creating look-up tables to accelerate complex model computations (Perkins et al., 2012; Richter, Heege, Kiselev, & Schl\u00e4pfer, 2014). Using a uniform grid is convenient for storing the look-up tables in multi-dimensional arrays. As we will show in Sections 3.2 and 3.3, the coverage of the input space using UG is very poor for low number of sampling points and high dimensions. 2.3.2 Latin hypercube Latin hypercube sampling (McKay, Beckman, & Conover, 1979) partitions the input space into bins of equal probability and distributes the samples in such a way that only one sample is located in each axis-aligned hyperplane. This method and variations like nearly-orthogonal Latin hypercube (Cioppa, 2002) and Distributed Hypercube and Improved Hypercube sampling (Beachkofski & Grandhi, 2002) are very popular in computer model problems. A Particle Swarm Optimization algorithm for solving large-scale Latin hypercube design problems was proposed recently (Aziza & Tayarani-N., 2014). Latin hypercube sampling is useful when the underlying function has a low order distribution but this method produces clustering of sampling points at high dimensions. 2.3.3 Centroidal Voronoi Tessellation Centroidal Voronoi Tessellation (CVT) generates sample points located at the center of mass of each Voronoi cell covering the input space. The CVT algorithm starts with an initial partition and then iteratively updates the estimate of the centroids of the corresponding Voronoi sub regions. Recent advances in mathematical and computational studies and in practical applications of CVT are presented in Du, Gunzburger, and Ju (2010). One important advantages of CVT is that sampling points may be easily distributed according to a prescribed density function. One drawback of the CVT method lies in being computationally demanding for high dimensional spaces. 2.3.4 Opposite methods The Opposition Based Learning initialization is a well-known method used to initialize the population in evolutionary algorithms (Rahnamayan, Tizhoosh, & Salama, 2008). The sequence of opposite points (complimentary point with respect to given bounds) is created from the original sequence, then both sequences are merged and a fitness function is used to select the best samples. The Quasi-opposition Based Learning (Rahnamayan, Tizhoosh, & Salama, 2007) is an improvement on the previous method that increases the sequence uniformity by creating opposite points using a random range. The opposite sampling methods are computationally very effective and straightforward to use. 2.4 Hybrid methods Hybrid methods combine different sampling methods with the aim of improving the sampling coverage and uniformity. A sampling method can be used as (a) pre-processing step, e.g. the computation of CVT samples can be initialized with stochastic or deterministic methods and (b) as post-processing, e.g. using geometrical methods to reorganize or create new samples. In this work we use Latinized CVT (LCVT) (Romero, Burkardt, Gunzburger, & Peterson, 2006). We create first a Halton sequence as initial population, then the CVT sample is computed and finally the sequence is Latinized. 2.5 Sampling in high dimensional space The sampling methods usually perform very well in low dimensions, the top panels of Fig. 1 contrast the 2-D input space sequences created using 25 and 100 points drawn from uniform grid, pseudo random, Halton, CVT, and LCVT methods. A visual inspection of the sampling sequences in a 2-D space gives a fast qualitative feedback on the degree of uniformity achieved and how it varies over the input space. In the 2-D case using a uniform grid sampling is very appealing, the points are well spread and the samples with 25 and 100 points are complementary. Note that the Halton sequences with 25 and 100 points overlap whereas the corresponding sequences created with the other sampling methods do not. A workaround solution for creating complementary Halton sequences is to use different prime numbers as basis of different sequences. The random sequence is less uniform than the other ones. Most of the sample strategies have problems with high dimensional sequences as can be appreciated in the bottom panels of Fig. 1 showing sampling sequences for a 9-D input space with 2 points per dimension given a total of 512 samples. The plots show the sampling points projected into dimensions 7 and 9. All the points with uniform grid sampling concentrate on only 4 places as this sampling algorithm allocate two fixed grid points per dimension. Halton has well known spurious correlation problems (Robinson & Atcitty, 1999) that leave large empty regions not covered, this problem can be at least partially solved using alternative algorithms like scrambled Halton. The points created with the CVT algorithm concentrate mainly in four regions reflecting the good volumetric but bad spatial uniformity of the samples when projected to single dimensions. Only LCVT behaves qualitatively better than pure random. Developing algorithms for creating good sampling uniformity in high dimensional spaces with low computational cost remains an area of active research. 2.6 Sampling non-uniform distributions A sequence of uniformly distributed points can be mapped into another sequence that reflects a desired non-uniform join probability distribution function using different techniques like the rejection method or weighted sampling (Moskowitz & Caflisch, 1996). In this paper we use the more generic procedure described in Romero et al. (2006). The cumulative distribution function CDF( x ) for a random variable x is (1) CDF ( x ) = \u222b 0 x \u2264 1 PDF ( x \u2032 ) d x \u2032 where PDF( x ) is the probability density function of the random input x . Since the CDF is defined in the unit hypercube domain it is possible to inverse-map sequences uniformly distributed between 0 and 1 into sequences { x i } drawn from the density function PDF( x ). 2.7 Importance sampling Importance sampling is a commonly used method for variance in Monte Carlo integration (Moskowitz & Caflisch, 1996) and system reliability analysis (Patelli, Pradlwarter, & Schu\u00ebller, 2011). An importance function h is introduced which mimics the behavior of the function f to approximate, sampling points are generated according to the distribution of h instead of being uniformly distributed. In this work we create importance sampling sequences following the distribution of h by first creating a uniformly distributed sequence and then computing the inverse-map using (1) and the normalized h (integral equals 1) as a density function. The top panel of Fig. 2 depicts the sampling sequences corresponding to the top panel of Fig. 1 transformed using as important sampling function an exponential function. The middle panel of Fig. 2 illustrates the sampling sequences corresponding to the bottom panel of Fig. 1 transformed using as important sampling function a 2-D Gaussian probability distribution with standard deviation of 0.8 and 1.2. Finally the bottom panel of Fig. 2 shows histograms resulting from the sampling sequences of the middle panel. The problems of the sampling methods in this 9-D case are more evident in the histograms. All samples from uniform grid concentrate on 4 positions, similarly the samples from CVT concentrate on 4 regions. 3 Comparison of sampling methods This section presents a systematic comparison of selected sampling methods from the different categories described in the previous chapter. First the benchmark functions used for the comparison are presented, then we describe how to quantitatively assess the goodness of the sampling methods both in: the input space (uniformity measures) and in the output space (statistical measures). Finally the results of the different sampling methods applied to a number of benchmark function are discussed. 3.1 Benchmark functions Three benchmark functions commonly used to test the performance of global optimization algorithms are used in this work. Asymmetric benchmark functions containing multiple minima and maxima were selected to better evaluate the effects of the different sampling strategies. 3.1.1 Shifted Ackley function A number of unimodal and multimodal basic functions like Sphere, Rosenbrock, Rastrigin, Weierstrass, Griewank, and Ackley are commonly used for testing optimization problems. We selected the shifted Ackley\u2019s function defined in a multi-dimensional input space as (2) F SA ( x ) = \u2212 20 exp ( \u2212 0.2 1 / n \u2211 i = 1 n z i 2 ) \u2212 exp ( 1 / n \u2211 i = 1 n cos ( 2 \u03c0 z i ) ) + 20 + e + f _ bias i with z = ( x \u2212 o ) the shifted global optimum. This function is multi-modal, shifted, separable and scalable, see Tang et al. (2008). 3.1.2 Composition function More complex functions can be created by combining basic functions (3) F CO ( x ) = \u2211 i = 1 n { w i \u2217 [ f i ( x i \u2212 o i ) / ( \u03bb i \u2217 M i ) + bias i ] + f _ bias i } . The various parameters used in this equation define the way the basic functions are combined, see CF5 in Liang, Suganthan, and Deb (2005) for details. 3.1.3 Fast Fractal Double Dip function This multimodal function is defined as (4) F FD ( x ) = \u2211 i = 1 n fractal ( x i + twist ( x ( i mod n ) + 1 ) ) . Specifics about this function including the definition of twist() and fractal() can be found in Tang et al. (2008). Fig. 3 shows 3-D plots of the functions Shifted Ackley, Composition, and Fast Fractal Double Dip for the case of 2-D input space. 3.2 Discrepancy as measure of uniformity in the input space Discrepancy is a quantity that measures the uniformity of a set of points in a hyper dimensional cube and it is usually employed in the integral approximation field. Given a dataset of s points P = { x 1 , \u2026 , x s } with x \u2282 R n the n -dimensional unit cube I n = [ 0 , 1 ) n , n \u2265 1 , the infinite star discrepancy D s \u2217 ( P ) is defined as (5) D s \u2217 ( P ) = sup J \u2208 I \u2217 | A ( J , P ) s \u2212 V ( J ) | where I \u2217 is the family of all subintervals of I n = [ 0 , 1 ) n of the form \u220f i = 1 n [ 0 , J i ) , V ( J ) is the volume of a subinterval J , and A ( J , P ) is the number of points of P belonging to J (Niederreiter, 1992). The star discrepancy describes the relationship between the number of points in a subinterval and its volume. D s \u2217 ( P ) varies between 0 and 1; low discrepancy values indicate that the points are well scattered over the input space. The optimal sampling methods are the ones that rapidly converge to a star discrepancy of 0 as the number of sample points increases. The computation of D s \u2217 ( P ) for n \u2265 2 is a time consuming and not an easy task (Thi\u00e9mard, 2001). Alternatives more suitable for high dimensional data are the L 2 -star discrepancy (Braaten & Weller, 1979) (6) D s L 2 ( P ) = 1 s \u2211 k = 1 s ( A ( J ( k ) , P ) s \u2212 V ( J ( k ) ) ) 2 and the modified L 2 -star discrepancy (Qazi & Linshu, 2006) defined as (7) D s M L 2 ( P ) = ( 4 3 ) n \u2212 2 1 \u2212 n s \u2211 d = 1 s \u2210 i = 1 n ( 3 \u2212 x d i 2 ) + 1 s 2 \u2211 d = 1 s \u2211 j = 1 s \u2210 i = 1 n ( 2 \u2212 max ( x d i , x j i ) ) . The discrepancy of 5-D input space sequences as function of the number of samples created using different sampling methods is depicted in Fig. 4 . The three plots correspond to discrepancy computed with (5), (6), and (7). The best sampling methods are HA and LCVT with similar convergence rates of discrepancy; both outperform pseudo random sequences by a factor of 10 regarding the number of samples needed to reach a given discrepancy. The worst sampling method is by far the uniform grid; it needs 105 samples to reach similar discrepancy levels achieved with only 102 samples created with HA or LCVT. It is important to note that discrepancy is calculated using the 5-D samples and not their 2-D projections depicted in the plots. Spurious correlation problems on samples projected into single dimensions, like the ones from HA shown in the bottom of Fig. 1, are not reflected in such discrepancy measurements. The left plot of Fig. 5 shows the modified L2-star discrepancy as function of the number of samples for a 9-D input space for LCVT and HA sampling sequences, the error bars correspond to the worst discrepancy computed in the 2-D projections. As it can be appreciated, LCVT outperforms HA when relative few samples are available but the situations change around 700 samples where HA has a lower discrepancy as LCVT. The right plot of Fig. 5 shows the inflection point between LCVT and HA modified L2-star discrepancy as function of the input space dimension and the number of samples. 3.3 Statistical measures of the response function in the output space The goodness of a sampling method with respect to the coverage in the output space of a response function f can be assessed by the multivariate function integration expressed as (8) I ( f ) = \u222b C n f ( x ) d x with C n = [ 0 , 1 ) n . The sample mean gives an approximation to I ( f ) by (9) I \u02c6 ( f , P ) = 1 s \u2211 i = 1 s f ( x i ) where P = { x i } for i = 1 to s is a set of points in C n . If the sampling points x i are i.i.d. uniformly distributed on C n then it is known that the sample mean is unbiased. The Koksma\u2013Hlawka inequality gives an upper bound for the approximation error (10) | I ( f ) \u2212 I \u02c6 ( f , P ) | \u2264 D ( P ) \u03c5 ( f ) where D ( P ) is the discrepancy of P as defined in Section 3.2, and v ( f ) is a measure of the variation of f as defined in Fang, Ma, and Winker (2002). If the sampling method used to create P converges to a discrepancy of 0 as the number of sample points increases, then this inequality ensures that the sample mean converges to the multivariate function integral. Therefore the convergence rate of the sample mean from the output space of a response function depending on the number of sample points can be used to measure the goodness of a sampling method. The efficacy of sampling methods is commonly compared using estimates of response function mean and standard deviation (Romero et al., 2006). In this work we propose to use not only the mean and standard deviation, but also the higher order statistics skewness (measure of the asymmetry) and the Kurtosis (measure of the peakedness) as they provide complementary information of f computed from the samples in P . Fig. 6 depicts the statistical moments of the Fast Fractal Double Dip function for a 5-D input space and the Composition function for a 10-D input space as function of the number of samples. The uniform grid sampling for the case of 10 dimensions does not converge even with a large number of samples, the performance of CVT is slightly better, while PR, LCVT and HA nicely converge with increasing samples. The convergence of the statistical moments on the response function can be used to take an informed decision on the adequate number of samples required to properly cover the output space. 4 Smart sampling and incremental function learning algorithm In this section we present the Smart Sampling and Incremental Function Learning Algorithm (SSIFL) based on the results from the previous section. First the problem is formalized, then the algorithm SSIFL stages are listed and then finally the single steps are described in detail in the following subsections. The goal of the SSIFL algorithm is to find a Probably Approximately Correct Computation (PACC) regression model f \u02c6 that accurately approximates a Lebesgue measurable function f : X \u2192 Y with input X \u2282 R n and output Y \u2282 R m from a set of finite training samples T = { x i , y i } for i = 1 to s , subject to the constraint of minimizing the number of calls to the function f needed to create the training samples s . Following the PACC framework from Alippi (2014) and using as figure of merit u ( x ) = ( | f ( x ) \u2212 f \u02c6 ( x ) | ) , we have that f \u02c6 is a PACC of function f at accuracy \u03c4 and confidence \u03b7 when (11) Pr ( | f ( x ) \u2212 f \u02c6 ( x ) | \u2264 \u03c4 ) \u2265 \u03b7 , \u2200 x \u2208 X . In other terms, the function f \u02c6 is approximately correct in the sense that it approximates f at level \u03c4 with probability \u03b7 . If \u03c4 is small, then f \u02c6 provides a value which approximates the true f with high probability. The PACC formalism allows a probabilistic performance estimation of \u03c4 and \u03b7 from a finite dataset as described in Section 4.6. The minimum number of samples s PACC required for assessing inequality (11) can be calculated using the Chernoff bound (Chernoff, 1952) as (12) s PACC \u2265 1 2 \u03b5 2 ln 2 \u03b4 where \u03b5 \u2208 ( 0 , 1 ) are the expected accuracy and confidence 1 \u2212 \u03b4 levels, \u03b4 \u2208 ( 0 , 1 ) . According to this inequality, the accuracy is more demanding on the number of samples (quadratic bound) than the confidence (linear bound). It is important to note that the Chernoff bound does not depend on the input dimension of f , that means that the PACC framework allow us to escape the curse of dimensionality problem for assessing \u03c4 and \u03b7 (Alippi, 2014). The SSIFL algorithm is described in the following table. The algorithm numbered steps are described in more detail in the following subsections, the step numbers are the same as the corresponding subchapter numbers. 4.1 Initialization phase The number of samples to create the approximation function with input space dimension n is selected using the following sequence (13) s ( n , i ) = { i d if n \u2264 9 1 0 i if n \u2265 10 . This equation creates a sequence of the form { 2 d , 3 d , 4 d , \u2026 } for 9 input dimensions or less, for larger dimensions the sequence is { 10 2 , 10 3 , 10 4 , \u2026 } . For given dimension and index, the sequence s ( d , i ) determines the number of samples following a good compromise on the number of samples to generate per iteration. Alternative formulations can be used as well. The accuracy \u03b5 and confidence \u03b4 levels are selected, then s PACC is computed using (12) and s val is selected from the sequences defined by (13) such that s ( n , s val \u2212 1 ) \u2264 s PACC \u2264 s ( n , s val ) . In other terms, the minimum number of samples used to create the training, testing and validation datasets is selected such that it satisfies the Chernoff bound for the given \u03b5 and \u03b4 . The number of iteration is set to 0 and the function approximator f \u02c6 ( \u03b8 0 ) is created using the initial model parameters \u03b8 0 . In case that a neural network is used, then the model parameters are the network weights and biases. 4.2 Smart sampling during initialization The sampling method LCVT or HA is selected based on the right plot of Fig. 5 and using the current input space dimension n and the number of samples s to generate. Once the sampling method is selected then the set of inputs X = { x 1 , \u2026 , x s } with X \u2282 R n is created. In case that a probability density function of f ( ) is available then the input sequence is resampled using the important sampling technique as described in Section 2.7. In the next step, the output Y = { f ( x i ) } for i = 1 to s with Y \u2282 R m is created. This is usually the most time consuming part of the sampling generation process, the processing time needed for computing f ( x ) for only a few samples is usually larger than the time needed for creating the complete input sequence. Finally the dataset Train = { x i , y i } for i = 1 to s samples is created and the Test dataset is initialized with an empty set. It is important to note that by using LCVT or HA the input space is uniformly covered independently of the number of samples generated. 4.3 Smart sampling during iteration First the Train dataset from the previous iteration is used as the new Test dataset and then a new Train dataset is created using the generic procedure described in the previous subsection. The number of samples of the Train dataset is increased in each iteration according to the sequences defined by (13) and starting with s ( n , s val ) . In other words, the first training dataset contains the same amount of samples as the testing dataset (satisfying the Chernoff bound) and then new samples are created in each iteration. It is worth noticing that the test and training datasets generated in each smart sampling iteration are complementary (no duplicated inputs) and they cover the full input/output space. 4.4 Incremental function learning The goal of learning is to build a PACC approximator of the target function f ( ) (14) f \u02c6 ( \u03b8 ) \u2248 f ( ) with \u03b8 the parameter vector describing the family of models. In case that artificial neural networks are used as approximators, then \u03b8 represents the weights and biases of the network. In each iteration, the parameter vector \u03b8 is updated based on the information present in training dataset Train. Overfitting is avoided using the early-stopping technique based on the average approximation error over the testing dataset Test. The training algorithm is selected according to the dimensions of the network input/output and the number of training samples. For small- and medium-sized dimensionality the Levenberg\u2013Marquardt algorithm can be used, but with large- and high-size dimensions a backpropagation algorithm working in parallel over a multi-core architecture (Schuessler & Loyola, 2011) is preferred. The smart sampling procedure described in the previous subsections ensures that the size of the training dataset is continuously increased in every iteration. That means that the target function is learned from the training data in an incremental way during each iteration. The proposed incremental function learning optimizes the function approximation problem by learning first the ground structure of the target function with relative few sampling points that cover the complete input/output space and then fine-tuning the model parameters to better approximate the target function using more and more sampling points in every iteration. This process is visualized in Fig. 7 showing the incremental learning of the Rosenbrock function in 5-D, the learned function accurately approximates the target function after a few iterations. 4.5 Check convergence The iteration over smart sampling for creating training datasets and incremental function learning is repeated until pre-defined convergence criteria are reached. The first criteria are the convergence of the statistical moments of the target function output from iteration to iteration as described in Section 3.3. The difference between the statistical moments of Y from the current iteration Y i = f ( X i ) and the previous iterations Y i \u2212 1 = f ( X i \u2212 1 ) should be smaller than a given delta to ensure that the target function is well represented by the generated sampling points. Interestingly, using the minimum number of samples s PACC for calculating the expectation E [ f ( X ) ] of the function f ( X ) by estimating the empirical mean E \u02c6 s m [ f ( X ) ] = 1 / n \u2211 i s m f ( x i ) ensures that the following inequality (15) P ( | E \u02c6 s m [ f ( X ) ] \u2212 E [ f ( X ) ] | \u2264 \u03b5 ) \u2265 1 \u2212 \u03b4 holds for any accuracy level \u03b5 \u2208 ( 0 , 1 ) and confidence \u03b4 \u2208 ( 0 , 1 ) (Alippi, 2014). That means that the convergence check on the first statistical moment is actually a convergence check on the expectation of the target function as function of the number of samples. The second criteria are the convergence of the histograms of the network parameters \u03b8 from iteration to iteration. Following the Bayesian formalism applied to neural networks (MacKay, 1995), learning means changing our belief about the network parameters \u03b8 from the prior P ( \u03b8 ) to the posterior P ( \u03b8 | T ) as a consequence of seeing the training data Train (16) P ( \u03b8 | Train ) = P ( Train | \u03b8 ) P ( \u03b8 ) P ( Train ) . P ( Train | \u03b8 ) is the likelihood and P ( Train ) is called the evidence for the neural network. In other terms, the posterior distribution incorporates the prior knowledge and the information conveyed by the training dataset. The Occam factor (MacKay, 1995) that penalizes a neural network for having the parameters \u03b8 defined as (17) Occam factor = \u03c3 \u03b8 | Train \u03c3 \u03b8 where \u03c3 \u03b8 | Train is the width of the evidence and the prior is uniform on a large interval \u03c3 \u03b8 . The second convergence criteria are reached when the ratio of the Occam factors from iteration to iteration is close to one. This ratio is difficult to compute directly but it can be approximated by the ratio of the FWHM from the histogram of the network parameters \u03b8 i and \u03b8 i \u2212 1 from the previous and current iteration. The third and last stop criterion is the check that a maximum allowed number of iterations are reached. 4.6 Determine approximator accuracy and confidence levels The PACC formalism allows a probabilistic performance estimation of the accuracy \u03c4 and confidence \u03b7 of f \u02c6 ( x ) from Eq. (11) by defining a p ( \u03b3 ) such that (18) p ( \u03b3 ) = Pr ( | f ( x ) \u2212 f \u02c6 ( x ) | \u2264 \u03b3 ) . Following the method from Alippi (2014), this probability can be approximated with p \u02c6 ( \u03b3 ) defined as (19) p \u02c6 ( \u03b3 ) = 1 s \u2211 i = 1 s L ( | f ( x i ) \u2212 f \u02c6 ( x i ) | \u2264 \u03b3 ) , L ( u ( x i ) \u2264 \u03b3 ) = { 1 if u ( x i ) \u2264 \u03b3 0 if u ( x i ) > \u03b3 and evaluated over the finite dataset x i \u2208 Val . The Val dataset is created using the generic procedure described in Section 4.2 and using s ( n , s val ) sampling points, that means that the Val dataset has at least s PACC element and therefore the Chernoff bound holds. The value \u03b3 \u0304 is defined as the smallest value from an arbitrary incremental set of points { \u03b3 1 , \u2026 , \u03b3 k } with \u03b3 i < \u03b3 j , \u2200 i < j from which p \u02c6 ( \u03b3 i ) \u2265 1 \u2212 \u03b5 , \u2200 \u03b3 i \u2265 \u03b3 \u0304 . Selecting k \u2265 s PACC points, the Chernoff bound discrepancy | p ( \u03b3 \u0304 ) \u2212 p \u02c6 ( \u03b3 \u0304 ) | \u2264 \u03b5 holds with probability 1 \u2212 \u03b4 and therefore p ( \u03b3 \u0304 ) \u2265 1 \u2212 \u03b5 . The PACC accuracy of f \u02c6 is then \u03c4 = \u03b3 \u0304 with confidence \u03b7 = 1 \u2212 \u03b5 (Alippi, 2014). 5 Results This section shows the results of using the SSIFL algorithm for two benchmark functions and one function from a real-world problem. Note that the selected asymmetric benchmark functions with multiple minima and maxima are very complex not only from the sampling but also from the function approximation point of view. 5.1 Regression of 5-D input space benchmark function The Shifted Ackley function F SA defined in (2) with an input space dimension of 5 is approximated using the SSIFL algorithm. This function is characterized by a nearly flat outer region and a deep hole at the shifted center, see left plot in Fig. 3. Therefore we use a Gaussian probability distribution important sampling function center at the hole. The expected accuracy and confidence levels are set to \u03b5 = 0.03 and \u03b4 = 0.01 ; then s PACC is calculated using (12) given 2944 as result and the corresponding s val is set to 5 5 = 3125 . The initial feedforward neural network with three hidden layers of 25\u201310\u20135 neurons is created and the Levenberg\u2013Marquardt algorithm is used to train the NN. Moreover, the activation functions used are tangent sigmoid for the hidden layers and linear for the output layer. In the first iteration the input sequence for the Test and Train datasets are created using LCVT with 55 and 65 samples respectively, the input sequences are resampled using the Gaussian importance sampling function and the Shifted Ackley function is evaluated in the resampled input sequences to generate the target output. The NN is then trained with the Test and Train datasets. In the second iteration the Test dataset is replaced with the Train dataset from the previous iteration containing a total of 65 samples. The new Train dataset is created by first generating a LCVT input sequence with 75 new samples, the input sequence is resampled with the Gaussian importance sampling function and the corresponding target outputs are computed using the F SA function. The NN from the previous iteration is re-trained with the new Train and Test datasets. A total of three iterations are needed before the convergence criteria are reached. Table 1 summarizes the smart sampling (target function mean and standard deviation) and incremental function learning (epochs needed, RMS on the training dataset, and Occam factor) results for each iteration. Finally a validation dataset Val with s val = 4 5 samples is created and it is used to compute the accuracy and confidence levels of the final neural network. The results are 0.9959 and 0.99 respectively, as mean value of the target function is \u2212118.454, a mean accuracy at the 0.84% level is reached. 5.2 Regression of 100-D input space benchmark function The Rosenbrock function defined as F RO = \u2211 i = 1 n / 2 [ 100 ( x 2 i \u2212 1 2 \u2212 x 2 i \u2212 1 2 ) 2 + ( x 2 i \u2212 1 \u2212 1 ) 2 ] with an input space dimension of 100 is approximated using the SSIFL algorithm. First the expected accuracy \u03b5 = 0.02 and confidence \u03b4 = 0.03 are defined; then s PACC = 5250 is calculated and finally the corresponding s val is set to 104. The initial feedforward neural network with one hidden layer of 100 neurons is created; the NN will be trained using the conjugate gradient backpropagation algorithm. Furthermore, the activation functions used are tangent sigmoid for the hidden layers and linear for the output layer. The NN is trained with Test and Train datasets created by evaluating the target function F RO on HA input sequences with 104 and 105 samples respectively. In the second iteration the Test dataset is replaced with the Train dataset from the previous iteration containing a total of 104 samples and a new Train dataset is created evaluating the Rosenbrock function over a new input HA sequence with 106 samples. The NN from the previous iteration is re-trained using backpropagation and taking as input the new Train and Test datasets. The third and last iteration contains 107 new Train samples. Finally the accuracy and confidence levels of the final neural network are computed using a validation dataset Val with s val = 4 5 samples. The results for each single iteration are summarized in Table 2 . 5.3 Regression of 62-D output space function from a real-world problem The operational processing of atmospheric remote sensing data usually requires the usage of very complex and extremely time consuming radiative transfer (Gimeno Garc\u00eda et al., 2012) models. In this subsection we apply the SSIFL algorithm to accurately approximate a radiative transfer model problem characterized by a 5 dimension input space representing the satellite viewing geometry and surface conditions. In contrast to the benchmark functions, the function from this real-world problem has not a single output value but the output space covers 62 dimensions. The expected accuracy and confidence levels are set to \u03b5 = 0.05 and \u03b4 = 0.02 ; the calculated s PACC is 921 and the corresponding s val is set to 4 5 = 1024 . The initial feedforward neural network is created using one hidden layer with 70 neurons. The hidden layers are activated by a tangent sigmoid function and the output layer by a linear function. The weights are initialized using the Nguyen\u2013Widrow algorithm and the training is performed using the conjugate gradient backpropagation. In the first iteration the input sequence for the Test and Train datasets are created using HA with 35 and 45 samples respectively. The forward model is evaluated using both 5-dimensional input sequences in order to generate the corresponding outputs in the 62-dimension space. The NN is then trained with the Test and Train datasets. In the second iteration the Test dataset is replaced with the Train dataset from the previous iteration containing a total of 45 samples and a new Train dataset is created using 55 new samples. The NN from the previous iteration is re-trained with the new Train and Test datasets. This iteration process is repeated seven times until the convergence criteria are reached. In the final iteration the Test and Train datasets contain a total of 115 (161051) and 125 (248832) new samples, Table 3 summarizes the smart sampling and incremental function learning results for each iteration. It is important to note that the generation of the almost half a million sample points is a very CPU demanding task; the time needed for training the NNs is minor compared with the time needed for computing the radiative transfer modeling outputs. In the final step the validation dataset Val with s val = 3 5 samples is created and it is used to compute the accuracy 0.001606684 and confidence levels 0.98 of the final neural network. 5.4 Regression of 280-D input space function from a real-world problem In the previous subsections we presented the results of applying SSIFL to regression problems where the samples are created as part of the algorithm with the constraint of minimizing the number of calls to the target function. In this subsection we show how to apply SSIFL to problems with pre-existing datasets that follow an unknown probability distribution function. The SSIFL algorithm can be easily adapted for such problems: the smart sampling is not used for creating new patterns, but it is used for resampling patterns from the pre-existing dataset. The smart sampling technique described in Sections 4.2 and 4.3 is adapted as follows. After creating the set of s inputs X = { x 1 , \u2026 , x s } with X \u2282 R n and n the input space dimension, the patterns { e i , y i } with e \u2282 R n and y \u2282 R m from the pre-existing dataset that are closest to x i are selected as the Train dataset. Depending on the type of the input attributes different distance measurements can be applied to find the e i closest to x i . We apply the adapted SSIFL to the \u201cBlog feedback\u201d dataset (Buza, 2014) with 280 input dimensions downloaded from UCI and consisting of 52397 and 7624 pre-existing training and validation data. In the first SSIFL iteration the input sequences x i using HA are created with 102 and 103 samples and 280 dimensions. Test and Train datasets are then created by resampling from the pre-existing { e i , y i } patterns that are nearest to the HA sequence points, the closest patterns are selected using the Euclidean distance between the points e i and x i . Note that the distance in all dimensions are equally weighted by normalizing the input attributes of the pre-existing data to [0, 1]. A feedforward neural network with one hidden layer of 100 neurons is trained using the resampled datasets. In the second iteration the Test dataset is replaced with the Train dataset from the previous iteration and a new Train dataset is created resampling 104 patterns from the remaining pre-existing dataset. The third and final iteration uses the remaining 41397 samples from the pre-existing dataset as the Train dataset. The NNs from the previous iterations are re-trained with the new Train and Test datasets. See Tables 3 and 4 for a summary of the results from applying SSIFL to this problem. Finally the accuracy of the trained NNs is assessed computing the mean square error (MSE) over the pre-existing validation dataset containing 7624 samples. The NN trained with 10000 samples is already quite accurate with only a 8.4% worst MSE than the one from the NN trained with the complete dataset. As comparison the MSE of NNs trained with 10000 randomly subsamples are on average 66.1% worst. In this way we demonstrate that SSIFL optimally sub-samples and accurately approximates the underlying function of pre-existing datasets. 6 Conclusions In this paper we presented a novel approach (SSIFL) for computing a regression model that accurately approximates functions defined over high dimensional input spaces. This has been achieved under the constraint of minimizing the number of calls to the target function for generating the training data. We smartly combine previously published deep theoretical methods and tools into a practical sampling and function learning algorithm and we showed the applicability of the proposed technique to high-dimensional regression problems. The sampling method used for generating the training dataset plays a key-role in order to reach high performance of the regression model. Different sampling methods have been evaluated and systematically analyzed in this study. Following a comprehensive discrimination analysis, in this paper we showed that the LCVT and HA sampling sequences are superior in handling data in high dimensionality and therefore they have been selected among all the other techniques for the proposed smart sampling technique. However, due to high computational effort needed for calculating the sequence, it might be more convenient to use the HA method in very high dimensional spaces, which has been already pointed out in this study to reach good achievements in reasonable computational time. Smart sampling allows the easy incorporation of a priori information about the probability distribution of the target function (importance sampling). The number of samples to be created (i.e., the calls to the target function) is minimized by incrementally creating the new training dataset until it contains an optimal representation of the target function. Incremental function learning takes place in each iteration: the training datasets from previous iterations are reused as the test datasets for the current iteration. The novel SSIFL technique proposed in this paper confirmed to be very efficient in order to minimize the mean square error in each function learning iteration. Learning takes place in an incremental way, the regression model is improved in each iteration based on the model from the previous iteration and the new train and test datasets. Finally, the accuracy and confidence levels of the regression function are determined using a probabilistic performance estimation method. The SSIFL algorithm has been proven to scale well for very high input dimensions dataset as shown with two benchmark functions with 5-D and 100-D. Furthermore the practical applicability and goodness of SSIFL method has been confirmed in two real-world applications with 62-D and 280-D. It is worth noting that SSIFL is (a) a generic approach that may be used for problems where the training patterns are either created or resampled in an optimal way and (b) it can be combined with any regression tool such as neural networks, support vector machines and many others. Acknowledgments We are grateful to the reviewers for their constructive input to the application of SSIFL to real-world problems. This research work was supported by the German Aerospace Center (DLR). References Alippi, 2014 C. Alippi Intelligence for embedded systems\u2014a methodological approach 2014 Springer Switzerland Aziza and Tayarani-N., 2014 M. Aziza M.-H. Tayarani-N. An adaptive memetic Particle Swarm Optimization algorithm for finding large-scale Latin hypercube designs Engineering Applications of Artificial Intelligence 36 2014 222 237 Beachkofski and Grandhi, 2002 Beachkofski, B. K., & Grandhi, R. V. (2002). Improved distributed hypercube sampling. In 43rd structures, structural dynamics, and materials conference (pp. 22\u201325). Braaten and Weller, 1979 E. Braaten G. Weller An improved low-discrepancy sequence for multidimensional quasi-Monte Carlo integration Journal of Computational Physics 33 2 1979 249 258 Buza, 2014 K. Buza Feedback prediction for blogs Data analysis, machine learning and knowledge discovery 2014 Springer 145 152 Cervellera and Macci\u00f2, 2013 C. Cervellera D. Macci\u00f2 Learning with Kernel smoothing models and low-discrepancy sampling IEEE Transactions on Neural Networks and Learning Systems 24 3 2013 504 509 Chernoff, 1952 H. Chernoff A measure of asymptotic efficiency for tests of a hypothesis based on the sum of observations The Annals of Mathematical Statistics 23 4 1952 493 507 Cioppa, 2002 T.M. Cioppa Efficient nearly orthogonal and space filling experimental designs for high-dimensional complex models (Ph.D. dissertation) 2002 Naval Postgraduate School California Du et al., 2010 Q. Du M. Gunzburger L. Ju Advances in studies and applications of centroidal Voronoi tessellations Numerical Mathematics: Theory, Methods and Applications 3 2 2010 119 142 En\u0103chescu, 2013 En\u0103chescu, C. (2013). Supervised learning using an active strategy. In The 7th international conference interdisciplinarity in engineering (pp. 220\u2013228). Fang et al., 2002 K.-T. Fang C.-X. Ma P. Winker Centered L2 discrepancy of random sampling and latin hypercube design, and construction of uniform designs Mathematics of Computation 71 237 2002 275 296 Flato et al., 2013 G. Flato Evaluation of climate models in Climate Change 2013: The Physical Science Basis. Contribution of Working Group I to the Fifth Assessment Report of the Intergovernmental Panel on Climate Change 2013 Cambridge University Press (pp. 741\u2013866) Gimeno Garc\u00eda et al., 2012 S. Gimeno Garc\u00eda T. Trautmann V. Venema Reduction of radiation biases by incorporating the missing cloud variability by means of downscaling techniques: a study using the 3-d mocart model Atmospheric Measurement Techniques 5 2012 2261 2276 Gnecco et al., 2011 G. Gnecco V. K\u016frkov\u00e1 M. Sanguineti Some comparisons of complexity in dictionary-based and linear computational models Neural Networks 24 2 2011 171 182 Gordon et al., 2000 C. Gordon C. Cooper C.A. Senior H. Banks J.M. Gregory T.C. Johns The simulation of SST, sea ice extents and ocean heat transports in a version of the Hadley Centre coupled model without flux adjustments Climate Dynamics 16 2\u20133 2000 147 168 Grell et al., 2005 G.A. Grell Fully coupled \u201conline\u201d chemistry within the WRF model Atmospheric Environment 39 37 2005 6957 6975 Halton, 1960 J.H. Halton On the efficiency of certain quasi-random sequences of points in evaluating multi-dimensional integrals Numerische Mathematik 2 1 1960 84 90 Han and Pan, 2011 J. Han H.-L. Pan Revision of convection and vertical diffusion schemes in the NCEP global forecast system Weather and Forecasting 26 2011 520 533 Haupt et al., 2009 S.E. Haupt A. Pasini C. Marzban Artificial intelligence methods in the environmental sciences 2009 Springer Netherlands Hilbert and L\u00f3pez, 2011 M. Hilbert P. L\u00f3pez The world\u2019s technological capacity to store, communicate, and compute information Science 332 6025 2011 60 65 Hsieh and Tang, 1998 W.W. Hsieh B. Tang Applying neural network models to prediction and data analysis in meteorology and oceanography Bulletin of the American Meteorological Society 79 9 1998 1855 1870 Jin and Hammer, 2014 Y. Jin B. Hammer Computational intelligence in big data IEEE Computational Intelligence Magazine 3 2014 12 13 Kainen et al., 2012 P.C. Kainen V. K\u016frkov\u00e1 M. Sanguineti Dependence of computational models on input dimension: Tractability of approximation and optimization tasks IEEE Transactions on Information Theory 58 2 2012 1203 1214 Kazimipour et al., 2013 Kazimipour, H., Li, X., & Qin, A. K. (2013). Initialization methods for large scale global optimization. In IEEE congress on evolutionary computation (pp. 2750\u20132757). Kolmogorov, 1957 A. Kolmogorov On the representation of continuous functions of several variables by superposition of continuous functions of one variable and addition Doklady Akademii Nauk SSSR 114 1957 953 956 Krasnopolsky and Chevallier, 2003 V.M. Krasnopolsky F. Chevallier Some neural network applications in environmental sciences. Part II: advancing computational efficiency of environmental numerical models Neural Networks 16 2003 335 348 Krasnopolsky and Schiller, 2007 V.M. Krasnopolsky H. Schiller Neural network emulations for complex multidimensional geophysical mappings: Applications of neural network techniques to atmospheric and oceanic satellite retrievals and numerical modeling Reviews of Geophysics 45 2007 RG3009 Leung and Wang, 2001 Y.-W. Leung Y. Wang An orthogonal genetic algorithm with quantization for global numerical optimization IEEE Transactions on Evolutionary Computation 5 1 2001 41 53 Liang et al., 2005 Liang, J. J., Suganthan, P. N., & Deb, K. (2005). Novel composition test functions for numerical global optimization. In Proceedings of the IEEE swarm intelligence symposium (pp. 68\u201375). Loyola, 2006 D. Loyola Applications of neural network methods to the processing of earth observation satellite data Neural Networks 19 2 2006 168 177 Lynch, 2006 P. Lynch The ENIAC integrations The emergence of numerical weather prediction 2006 University Press Cambridge 206 208 Lynch, 2008 C. Lynch Big data: How do your data grow? Nature 455 7209 2008 28 29 MacKay, 1995 D.J.C. MacKay Probable networks and plausible predictions\u2014a review of practical Bayesian methods for supervised neural networks Network: Computation in Neural Systems 6 3 1995 469 505 Marsaglia and Tsang, 2000 G. Marsaglia W.W. Tsang The Ziggurat method for generating random variables Journal of Statistical Software 5 8 2000 Matsumoto and Nishimura, 1998 M. Matsumoto T. Nishimura Mersenne Twister: A 623-dimensionally equidistributed uniform pseudorandom number generator ACM Transactions on Modeling and Computer Simulation 8 1 1998 3 30 McKay et al., 1979 M.D. McKay R.J. Beckman W.J. Conover A comparison of three methods for selecting values of input variables in the analysis of output from a computer code Technometrics 21 2 1979 239 245 Menut et al., 2013 L. Menut B. Bessagnet D. Khvorostyanov M. Beekmann N. Blond A. Colette CHIMERE 2013: a model for regional atmospheric composition modelling Geoscientific Model Development 6 2013 981 1028 Morcrette, 1991 J.-J. Morcrette Radiation and cloud radiative properties in the ECMWF operational weather forecast model J. Geophys. Res. 96D 1991 9121 9132 Moskowitz and Caflisch, 1996 B. Moskowitz R. Caflisch Smoothness and dimension reduction in quasi-Monte Carlo methods Mathematical and Computer Modelling 23 89 1996 37 54 Niederreiter, 1992 H. Niederreiter Random number generation and quasi-Monte Carlo methods 1992 Society for Industrial and Applied Mathematics O\u2019Leary, 2013 D.E. O\u2019Leary Artificial intelligence and big data IEEE Intelligent Systems 28 2 2013 96 99 Patelli et al., 2011 E. Patelli H.J. Pradlwarter G.I. Schu\u00ebller On multinormal integrals by Importance Sampling for parallel system reliability Structural Safety 33 1 2011 1 7 Peng et al., 2012 L. Peng Y. Wang G. Dai Z. Cao A novel differential evolution with uniform design for continuous global optimization Journal of Computers 7 1 2012 3 10 Perkins et al., 2012 T. Perkins S. Adler-Golden M.W. Matthew A. Berk L.S. Bernstein J. Lee Speed and accuracy improvements in FLAASH atmospheric correction of hyperspectral imagery Optical Engineering 51 11 2012 Qazi and Linshu, 2006 M. Qazi H. Linshu Nearly-orthogonal sampling and neural network metamodel driven conceptual design of multistage space launch vehicle Computer-Aided Design 38 2006 595 607 Rahnamayan et al., 2007 Rahnamayan, S., Tizhoosh, H. R., & Salama, M. M. (2007). Quasi-oppositional differential evolution. In IEEE congress on evolutionary computation(pp. 2229\u20132236). Rahnamayan et al., 2008 S. Rahnamayan H.R. Tizhoosh M.M. Salama Opposition-based differential evolution IEEE Transactions on Evolutionary Computation 12 1 2008 64 79 Richter et al., 2014 R. Richter T. Heege V. Kiselev D. Schl\u00e4pfer Correction of ozone influence on TOA radiance International Journal of Remote Sensing 35 23 2014 8044 8056 Robinson and Atcitty, 1999 Robinson, D., & Atcitty, D. (1999). Comparison of quasi- and pseudo- Monte Carlo sampling for reliability and uncertainty analysis. In 40th structures, structural dynamics, and materials conference. Romero et al., 2006 V.J. Romero J.V. Burkardt M.D. Gunzburger J.S. Peterson Comparison of pure and Latinized centroidal Voronoi tessellation against various other statistical sampling methods Reliability Engineering & System Safety 91 10\u201311 2006 1266 1280 Sacks et al., 1989 J. Sacks W.J. Welch T.J. Mitchell H.P. Wynn Design and analysis of computer experiments Statistical Science 4 4 1989 409 423 Sagaut, 2006 P. Sagaut Large eddy simulation for incompressible flows 3rd ed. 2006 Springer Schuessler and Loyola, 2011 O. Schuessler D. Loyola Parallel training of artificial neural networks using multithreaded and multicore CPUs Adaptive and natural computing algorithms Lecture notes in computer science Vol. 6593 2011 70 79 Swiler et al., 2006 Swiler, L. P., Slepoy, R., & Giunta, A. A. (2006). Evaluation of sampling methods in constructing response surface approximations. In 47th AIAA/ASME/ASCE/AHS/ASC structures, structural dynamics, and materials conference(pp. 1\u201324). Tang et al., 2008 Tang, K., Yao, X., Suganthan, P. N., MacNish, C., Chen, Y.-P., & Chen, C.-M. et al. (2008). Benchmark functions for the CEC\u20192008 special session and competition on large scale global optimization. Nature Inspired Computation and Applications Laboratory, USTC, China. Thi\u00e9mard, 2001 E. Thi\u00e9mard An algorithm to compute bounds for the star discrepancy Journal of Complexity 17 4 2001 850 880 Tripathi et al., 2006 S. Tripathi V.V. Srinivas R.S. Nanjundiah Downscaling of precipitation for climate change scenarios: A support vector machine approach Journal of Hydrology 330 3\u20134 2006 621 640 Vapnik, 2006 V.N. Vapnik Estimation of dependences based on empirical data 2006 Springer New York Yiteng et al., 2014 Z. Yiteng O. Yew-Soon I.W. Tsang The emerging \u201cBig Dimensionality\u201d IEEE Computational Intelligence Magazine 3 2014 14 26", "scopus-id": "84951855624", "pubmed-id": "26476936", "coredata": {"eid": "1-s2.0-S0893608015001768", "dc:description": "Abstract Very large high dimensional data are common nowadays and they impose new challenges to data-driven and data-intensive algorithms. Computational Intelligence techniques have the potential to provide powerful tools for addressing these challenges, but the current literature focuses mainly on handling scalability issues related to data volume in terms of sample size for classification tasks. This work presents a systematic and comprehensive approach for optimally handling regression tasks with very large high dimensional data. The proposed approach is based on smart sampling techniques for minimizing the number of samples to be generated by using an iterative approach that creates new sample sets until the input and output space of the function to be approximated are optimally covered. Incremental function learning takes place in each sampling iteration, the new samples are used to fine tune the regression results of the function learning algorithm. The accuracy and confidence levels of the resulting approximation function are assessed using the probably approximately correct computation framework. The smart sampling and incremental function learning techniques can be easily used in practical applications and scale well in the case of extremely large data. The feasibility and good results of the proposed techniques are demonstrated using benchmark functions as well as functions from real-world problems.", "openArchiveArticle": "false", "prism:coverDate": "2016-06-30", "openaccessUserLicense": "http://creativecommons.org/licenses/by/4.0/", "prism:aggregationType": "Journal", "prism:url": "https://api.elsevier.com/content/article/pii/S0893608015001768", "dc:creator": [{"@_fa": "true", "$": "Loyola R, Diego G."}, {"@_fa": "true", "$": "Pedergnana, Mattia"}, {"@_fa": "true", "$": "Gimeno Garc\u00eda, Sebasti\u00e1n"}], "link": [{"@_fa": "true", "@rel": "self", "@href": "https://api.elsevier.com/content/article/pii/S0893608015001768"}, {"@_fa": "true", "@rel": "scidir", "@href": "https://www.sciencedirect.com/science/article/pii/S0893608015001768"}], "dc:format": "application/json", "openaccessType": "Full", "pii": "S0893-6080(15)00176-8", "prism:volume": "78", "prism:publisher": "The Authors. Published by Elsevier Ltd.", "dc:title": "Smart sampling and incremental function learning for very large high dimensional data", "prism:copyright": "\u00a9 2015 The Authors. Published by Elsevier Ltd.", "prism:issueName": "Special Issue on \"Neural Network Learning in Big Data\"", "openaccess": "1", "prism:issn": "08936080", "dcterms:subject": [{"@_fa": "true", "$": "High dimensional function approximation"}, {"@_fa": "true", "$": "Sampling discrepancy"}, {"@_fa": "true", "$": "Design of experiments"}, {"@_fa": "true", "$": "Probably approximately correct computation"}, {"@_fa": "true", "$": "Function learning"}, {"@_fa": "true", "$": "Neural networks"}], "openaccessArticle": "true", "prism:publicationName": "Neural Networks", "openaccessSponsorType": "Author", "prism:pageRange": "75-87", "prism:endingPage": "87", "pubType": "2016 Special Issue", "prism:coverDisplayDate": "June 2016", "prism:doi": "10.1016/j.neunet.2015.09.001", "prism:startingPage": "75", "dc:identifier": "doi:10.1016/j.neunet.2015.09.001", "openaccessSponsorName": null}, "objects": {"object": [{"@category": "thumbnail", "@height": "56", "@width": "219", "@_fa": "true", "$": "https://api.elsevier.com/content/object/eid/1-s2.0-S0893608015001768-gr4.sml?httpAccept=%2A%2F%2A", "@multimediatype": "GIF image file", "@type": "IMAGE-THUMBNAIL", "@size": "16344", "@ref": "gr4", "@mimetype": "image/gif"}, {"@category": "thumbnail", "@height": "128", "@width": "219", "@_fa": "true", "$": "https://api.elsevier.com/content/object/eid/1-s2.0-S0893608015001768-gr2.sml?httpAccept=%2A%2F%2A", "@multimediatype": "GIF image file", "@type": "IMAGE-THUMBNAIL", "@size": "31307", "@ref": "gr2", "@mimetype": "image/gif"}, {"@category": "thumbnail", "@height": "164", "@width": "176", "@_fa": "true", "$": "https://api.elsevier.com/content/object/eid/1-s2.0-S0893608015001768-fx1.sml?httpAccept=%2A%2F%2A", "@multimediatype": "GIF image file", "@type": "IMAGE-THUMBNAIL", "@size": "22993", "@ref": "fx1", "@mimetype": "image/gif"}, {"@category": "thumbnail", "@height": "86", "@width": "219", "@_fa": "true", "$": "https://api.elsevier.com/content/object/eid/1-s2.0-S0893608015001768-gr1.sml?httpAccept=%2A%2F%2A", "@multimediatype": "GIF image file", "@type": "IMAGE-THUMBNAIL", "@size": "24192", "@ref": "gr1", "@mimetype": "image/gif"}, {"@category": "thumbnail", "@height": "94", "@width": "219", "@_fa": "true", "$": "https://api.elsevier.com/content/object/eid/1-s2.0-S0893608015001768-gr5.sml?httpAccept=%2A%2F%2A", "@multimediatype": "GIF image file", "@type": "IMAGE-THUMBNAIL", "@size": "18728", "@ref": "gr5", "@mimetype": "image/gif"}, {"@category": "thumbnail", "@height": "164", "@width": "204", "@_fa": "true", "$": "https://api.elsevier.com/content/object/eid/1-s2.0-S0893608015001768-gr7.sml?httpAccept=%2A%2F%2A", "@multimediatype": "GIF image file", "@type": "IMAGE-THUMBNAIL", "@size": "26652", "@ref": "gr7", "@mimetype": "image/gif"}, {"@category": "thumbnail", "@height": "163", "@width": "100", "@_fa": "true", "$": "https://api.elsevier.com/content/object/eid/1-s2.0-S0893608015001768-gr6.sml?httpAccept=%2A%2F%2A", "@multimediatype": "GIF image file", "@type": "IMAGE-THUMBNAIL", "@size": "22166", "@ref": "gr6", "@mimetype": "image/gif"}, {"@category": "thumbnail", "@height": "45", "@width": "219", "@_fa": "true", "$": "https://api.elsevier.com/content/object/eid/1-s2.0-S0893608015001768-gr3.sml?httpAccept=%2A%2F%2A", "@multimediatype": "GIF image file", "@type": "IMAGE-THUMBNAIL", "@size": "18532", "@ref": "gr3", "@mimetype": "image/gif"}, {"@category": "standard", "@height": "192", "@width": "753", "@_fa": "true", "$": "https://api.elsevier.com/content/object/eid/1-s2.0-S0893608015001768-gr4.jpg?httpAccept=%2A%2F%2A", "@multimediatype": "JPEG image file", "@type": "IMAGE-DOWNSAMPLED", "@size": "88285", "@ref": "gr4", "@mimetype": "image/jpeg"}, {"@category": "standard", "@height": "440", "@width": "753", "@_fa": "true", "$": "https://api.elsevier.com/content/object/eid/1-s2.0-S0893608015001768-gr2.jpg?httpAccept=%2A%2F%2A", "@multimediatype": "JPEG image file", "@type": "IMAGE-DOWNSAMPLED", "@size": "168491", "@ref": "gr2", "@mimetype": "image/jpeg"}, {"@category": "standard", "@height": "351", "@width": "376", "@_fa": "true", "$": "https://api.elsevier.com/content/object/eid/1-s2.0-S0893608015001768-fx1.jpg?httpAccept=%2A%2F%2A", "@multimediatype": "JPEG image file", "@type": "IMAGE-DOWNSAMPLED", "@size": "79798", "@ref": "fx1", "@mimetype": "image/jpeg"}, {"@category": "standard", "@height": "297", "@width": "753", "@_fa": "true", "$": "https://api.elsevier.com/content/object/eid/1-s2.0-S0893608015001768-gr1.jpg?httpAccept=%2A%2F%2A", "@multimediatype": "JPEG image file", "@type": "IMAGE-DOWNSAMPLED", "@size": "136881", "@ref": "gr1", "@mimetype": "image/jpeg"}, {"@category": "standard", "@height": "271", "@width": "633", "@_fa": "true", "$": "https://api.elsevier.com/content/object/eid/1-s2.0-S0893608015001768-gr5.jpg?httpAccept=%2A%2F%2A", "@multimediatype": "JPEG image file", "@type": "IMAGE-DOWNSAMPLED", "@size": "93708", "@ref": "gr5", "@mimetype": "image/jpeg"}, {"@category": "standard", "@height": "518", "@width": "646", "@_fa": "true", "$": "https://api.elsevier.com/content/object/eid/1-s2.0-S0893608015001768-gr7.jpg?httpAccept=%2A%2F%2A", "@multimediatype": "JPEG image file", "@type": "IMAGE-DOWNSAMPLED", "@size": "166226", "@ref": "gr7", "@mimetype": "image/jpeg"}, {"@category": "standard", "@height": "956", "@width": "585", "@_fa": "true", "$": "https://api.elsevier.com/content/object/eid/1-s2.0-S0893608015001768-gr6.jpg?httpAccept=%2A%2F%2A", "@multimediatype": "JPEG image file", "@type": "IMAGE-DOWNSAMPLED", "@size": "238389", "@ref": "gr6", "@mimetype": "image/jpeg"}, {"@category": "standard", "@height": "155", "@width": "753", "@_fa": "true", "$": "https://api.elsevier.com/content/object/eid/1-s2.0-S0893608015001768-gr3.jpg?httpAccept=%2A%2F%2A", "@multimediatype": "JPEG image file", "@type": "IMAGE-DOWNSAMPLED", "@size": "104707", "@ref": "gr3", "@mimetype": "image/jpeg"}, {"@category": "thumbnail", "@height": "8", "@width": "14", "@_fa": "true", "$": "https://api.elsevier.com/content/object/eid/1-s2.0-S0893608015001768-si25.gif?httpAccept=%2A%2F%2A", "@multimediatype": "GIF image file", "@type": "ALTIMG", "@size": "145", "@ref": "si25", "@mimetype": "image/gif"}, {"@category": "thumbnail", "@height": "18", "@width": "127", "@_fa": "true", "$": "https://api.elsevier.com/content/object/eid/1-s2.0-S0893608015001768-si123.gif?httpAccept=%2A%2F%2A", "@multimediatype": "GIF image file", "@type": "ALTIMG", "@size": "516", "@ref": "si123", "@mimetype": "image/gif"}, {"@category": "thumbnail", "@height": "19", "@width": "73", "@_fa": "true", "$": "https://api.elsevier.com/content/object/eid/1-s2.0-S0893608015001768-si56.gif?httpAccept=%2A%2F%2A", "@multimediatype": "GIF image file", "@type": "ALTIMG", "@size": "433", "@ref": "si56", "@mimetype": "image/gif"}, {"@category": "thumbnail", "@height": "18", "@width": "73", "@_fa": "true", "$": "https://api.elsevier.com/content/object/eid/1-s2.0-S0893608015001768-si149.gif?httpAccept=%2A%2F%2A", "@multimediatype": "GIF image file", "@type": "ALTIMG", "@size": "418", "@ref": "si149", "@mimetype": "image/gif"}, {"@category": "thumbnail", "@height": "15", "@width": "29", "@_fa": "true", "$": "https://api.elsevier.com/content/object/eid/1-s2.0-S0893608015001768-si143.gif?httpAccept=%2A%2F%2A", "@multimediatype": "GIF image file", "@type": "ALTIMG", "@size": "231", "@ref": "si143", "@mimetype": "image/gif"}, {"@category": "thumbnail", "@height": "17", "@width": "57", "@_fa": "true", "$": "https://api.elsevier.com/content/object/eid/1-s2.0-S0893608015001768-si204.gif?httpAccept=%2A%2F%2A", "@multimediatype": "GIF image file", "@type": "ALTIMG", "@size": "275", "@ref": "si204", "@mimetype": "image/gif"}, {"@category": "thumbnail", "@height": "15", "@width": "82", "@_fa": "true", "$": "https://api.elsevier.com/content/object/eid/1-s2.0-S0893608015001768-si71.gif?httpAccept=%2A%2F%2A", "@multimediatype": "GIF image file", "@type": "ALTIMG", "@size": "361", "@ref": "si71", "@mimetype": "image/gif"}, {"@category": "thumbnail", "@height": "15", "@width": "55", "@_fa": "true", "$": "https://api.elsevier.com/content/object/eid/1-s2.0-S0893608015001768-si169.gif?httpAccept=%2A%2F%2A", "@multimediatype": "GIF image file", "@type": "ALTIMG", "@size": "368", "@ref": "si169", "@mimetype": "image/gif"}, {"@category": "thumbnail", "@height": "42", "@width": "171", "@_fa": "true", "$": "https://api.elsevier.com/content/object/eid/1-s2.0-S0893608015001768-si121.gif?httpAccept=%2A%2F%2A", "@multimediatype": "GIF image file", "@type": "ALTIMG", "@size": "990", "@ref": "si121", "@mimetype": "image/gif"}, {"@category": "thumbnail", "@height": "15", "@width": "45", "@_fa": "true", "$": "https://api.elsevier.com/content/object/eid/1-s2.0-S0893608015001768-si166.gif?httpAccept=%2A%2F%2A", "@multimediatype": "GIF image file", "@type": "ALTIMG", "@size": "314", "@ref": "si166", "@mimetype": "image/gif"}, {"@category": "thumbnail", "@height": "32", "@width": "266", "@_fa": "true", "$": "https://api.elsevier.com/content/object/eid/1-s2.0-S0893608015001768-si160.gif?httpAccept=%2A%2F%2A", "@multimediatype": "GIF image file", "@type": "ALTIMG", "@size": "1082", "@ref": "si160", "@mimetype": "image/gif"}, {"@category": "thumbnail", "@height": "8", "@width": "10", "@_fa": "true", "$": "https://api.elsevier.com/content/object/eid/1-s2.0-S0893608015001768-si31.gif?httpAccept=%2A%2F%2A", "@multimediatype": "GIF image file", "@type": "ALTIMG", "@size": "123", "@ref": "si31", "@mimetype": "image/gif"}, {"@category": "thumbnail", "@height": "15", "@width": "32", "@_fa": "true", "$": "https://api.elsevier.com/content/object/eid/1-s2.0-S0893608015001768-si81.gif?httpAccept=%2A%2F%2A", "@multimediatype": "GIF image file", "@type": "ALTIMG", "@size": "259", "@ref": "si81", "@mimetype": "image/gif"}, {"@category": "thumbnail", "@height": "41", "@width": "194", "@_fa": "true", "$": "https://api.elsevier.com/content/object/eid/1-s2.0-S0893608015001768-si53.gif?httpAccept=%2A%2F%2A", "@multimediatype": "GIF image file", "@type": "ALTIMG", "@size": "975", "@ref": "si53", "@mimetype": "image/gif"}, {"@category": "thumbnail", "@height": "15", "@width": "76", "@_fa": "true", "$": "https://api.elsevier.com/content/object/eid/1-s2.0-S0893608015001768-si17.gif?httpAccept=%2A%2F%2A", "@multimediatype": "GIF image file", "@type": "ALTIMG", "@size": "360", "@ref": "si17", "@mimetype": "image/gif"}, {"@category": "thumbnail", "@height": "44", "@width": "290", "@_fa": "true", "$": "https://api.elsevier.com/content/object/eid/1-s2.0-S0893608015001768-si46.gif?httpAccept=%2A%2F%2A", "@multimediatype": "GIF image file", "@type": "ALTIMG", "@size": "1230", "@ref": "si46", "@mimetype": "image/gif"}, {"@category": "thumbnail", "@height": "15", "@width": "55", "@_fa": "true", "$": "https://api.elsevier.com/content/object/eid/1-s2.0-S0893608015001768-si147.gif?httpAccept=%2A%2F%2A", "@multimediatype": "GIF image file", "@type": "ALTIMG", "@size": "327", "@ref": "si147", "@mimetype": "image/gif"}, {"@category": "thumbnail", "@height": "15", "@width": "69", "@_fa": "true", "$": "https://api.elsevier.com/content/object/eid/1-s2.0-S0893608015001768-si168.gif?httpAccept=%2A%2F%2A", "@multimediatype": "GIF image file", "@type": "ALTIMG", "@size": "434", "@ref": "si168", "@mimetype": "image/gif"}, {"@category": "thumbnail", "@height": "17", "@width": "72", "@_fa": "true", "$": "https://api.elsevier.com/content/object/eid/1-s2.0-S0893608015001768-si7.gif?httpAccept=%2A%2F%2A", "@multimediatype": "GIF image file", "@type": "ALTIMG", "@size": "454", "@ref": "si7", "@mimetype": "image/gif"}, {"@category": "thumbnail", "@height": "15", "@width": "97", "@_fa": "true", "$": "https://api.elsevier.com/content/object/eid/1-s2.0-S0893608015001768-si155.gif?httpAccept=%2A%2F%2A", "@multimediatype": "GIF image file", "@type": "ALTIMG", "@size": "404", "@ref": "si155", "@mimetype": "image/gif"}, {"@category": "thumbnail", "@height": "98", "@width": "321", "@_fa": "true", "$": "https://api.elsevier.com/content/object/eid/1-s2.0-S0893608015001768-si68.gif?httpAccept=%2A%2F%2A", "@multimediatype": "GIF image file", "@type": "ALTIMG", "@size": "2797", "@ref": "si68", "@mimetype": "image/gif"}, {"@category": "thumbnail", "@height": "18", "@width": "11", "@_fa": "true", "$": "https://api.elsevier.com/content/object/eid/1-s2.0-S0893608015001768-si88.gif?httpAccept=%2A%2F%2A", "@multimediatype": "GIF image file", "@type": "ALTIMG", "@size": "141", "@ref": "si88", "@mimetype": "image/gif"}, {"@category": "thumbnail", "@height": "14", "@width": "72", "@_fa": "true", "$": "https://api.elsevier.com/content/object/eid/1-s2.0-S0893608015001768-si14.gif?httpAccept=%2A%2F%2A", "@multimediatype": "GIF image file", "@type": "ALTIMG", "@size": "280", "@ref": "si14", "@mimetype": "image/gif"}, {"@category": "thumbnail", "@height": "11", "@width": "13", "@_fa": "true", "$": "https://api.elsevier.com/content/object/eid/1-s2.0-S0893608015001768-si78.gif?httpAccept=%2A%2F%2A", "@multimediatype": "GIF image file", "@type": "ALTIMG", "@size": "145", "@ref": "si78", "@mimetype": "image/gif"}, {"@category": "thumbnail", "@height": "12", "@width": "17", "@_fa": "true", "$": "https://api.elsevier.com/content/object/eid/1-s2.0-S0893608015001768-si173.gif?httpAccept=%2A%2F%2A", "@multimediatype": "GIF image file", "@type": "ALTIMG", "@size": "166", "@ref": "si173", "@mimetype": "image/gif"}, {"@category": "thumbnail", "@height": "14", "@width": "71", "@_fa": "true", "$": "https://api.elsevier.com/content/object/eid/1-s2.0-S0893608015001768-si216.gif?httpAccept=%2A%2F%2A", "@multimediatype": "GIF image file", "@type": "ALTIMG", "@size": "335", "@ref": "si216", "@mimetype": "image/gif"}, {"@category": "thumbnail", "@height": "12", "@width": "37", "@_fa": "true", "$": "https://api.elsevier.com/content/object/eid/1-s2.0-S0893608015001768-si115.gif?httpAccept=%2A%2F%2A", "@multimediatype": "GIF image file", "@type": "ALTIMG", "@size": "179", "@ref": "si115", "@mimetype": "image/gif"}, {"@category": "thumbnail", "@height": "15", "@width": "68", "@_fa": "true", "$": "https://api.elsevier.com/content/object/eid/1-s2.0-S0893608015001768-si114.gif?httpAccept=%2A%2F%2A", "@multimediatype": "GIF image file", "@type": "ALTIMG", "@size": "334", "@ref": "si114", "@mimetype": "image/gif"}, {"@category": "thumbnail", "@height": "16", "@width": "159", "@_fa": "true", "$": "https://api.elsevier.com/content/object/eid/1-s2.0-S0893608015001768-si189.gif?httpAccept=%2A%2F%2A", "@multimediatype": "GIF image file", "@type": "ALTIMG", "@size": "585", "@ref": "si189", "@mimetype": "image/gif"}, {"@category": "thumbnail", "@height": "15", "@width": "39", "@_fa": "true", "$": "https://api.elsevier.com/content/object/eid/1-s2.0-S0893608015001768-si124.gif?httpAccept=%2A%2F%2A", "@multimediatype": "GIF image file", "@type": "ALTIMG", "@size": "276", "@ref": "si124", "@mimetype": "image/gif"}, {"@category": "thumbnail", "@height": "16", "@width": "33", "@_fa": "true", "$": "https://api.elsevier.com/content/object/eid/1-s2.0-S0893608015001768-si181.gif?httpAccept=%2A%2F%2A", "@multimediatype": "GIF image file", "@type": "ALTIMG", "@size": "257", "@ref": "si181", "@mimetype": "image/gif"}, {"@category": "thumbnail", "@height": "14", "@width": "71", "@_fa": "true", "$": "https://api.elsevier.com/content/object/eid/1-s2.0-S0893608015001768-si202.gif?httpAccept=%2A%2F%2A", "@multimediatype": "GIF image file", "@type": "ALTIMG", "@size": "332", "@ref": "si202", "@mimetype": "image/gif"}, {"@category": "thumbnail", "@height": "12", "@width": "10", "@_fa": "true", "$": "https://api.elsevier.com/content/object/eid/1-s2.0-S0893608015001768-si26.gif?httpAccept=%2A%2F%2A", "@multimediatype": "GIF image file", "@type": "ALTIMG", "@size": "135", "@ref": "si26", "@mimetype": "image/gif"}, {"@category": "thumbnail", "@height": "13", "@width": "53", "@_fa": "true", "$": "https://api.elsevier.com/content/object/eid/1-s2.0-S0893608015001768-si15.gif?httpAccept=%2A%2F%2A", "@multimediatype": "GIF image file", "@type": "ALTIMG", "@size": "266", "@ref": "si15", "@mimetype": "image/gif"}, {"@category": "thumbnail", "@height": "18", "@width": "101", "@_fa": "true", "$": "https://api.elsevier.com/content/object/eid/1-s2.0-S0893608015001768-si122.gif?httpAccept=%2A%2F%2A", "@multimediatype": "GIF image file", "@type": "ALTIMG", "@size": "446", "@ref": "si122", "@mimetype": "image/gif"}, {"@category": "thumbnail", "@height": "15", "@width": "22", "@_fa": "true", "$": "https://api.elsevier.com/content/object/eid/1-s2.0-S0893608015001768-si138.gif?httpAccept=%2A%2F%2A", "@multimediatype": "GIF image file", "@type": "ALTIMG", "@size": "193", "@ref": "si138", "@mimetype": "image/gif"}, {"@category": "thumbnail", "@height": "60", "@width": "276", "@_fa": "true", "$": "https://api.elsevier.com/content/object/eid/1-s2.0-S0893608015001768-si66.gif?httpAccept=%2A%2F%2A", "@multimediatype": "GIF image file", "@type": "ALTIMG", "@size": "1463", "@ref": "si66", "@mimetype": "image/gif"}, {"@category": "thumbnail", "@height": "12", "@width": "60", "@_fa": "true", "$": "https://api.elsevier.com/content/object/eid/1-s2.0-S0893608015001768-si199.gif?httpAccept=%2A%2F%2A", "@multimediatype": "GIF image file", "@type": "ALTIMG", "@size": "289", "@ref": "si199", "@mimetype": "image/gif"}, {"@category": "thumbnail", "@height": "14", "@width": "30", "@_fa": "true", "$": "https://api.elsevier.com/content/object/eid/1-s2.0-S0893608015001768-si11.gif?httpAccept=%2A%2F%2A", "@multimediatype": "GIF image file", "@type": "ALTIMG", "@size": "237", "@ref": "si11", "@mimetype": "image/gif"}, {"@category": "thumbnail", "@height": "12", "@width": "9", "@_fa": "true", "$": "https://api.elsevier.com/content/object/eid/1-s2.0-S0893608015001768-si126.gif?httpAccept=%2A%2F%2A", "@multimediatype": "GIF image file", "@type": "ALTIMG", "@size": "133", "@ref": "si126", "@mimetype": "image/gif"}, {"@category": "thumbnail", "@height": "14", "@width": "22", "@_fa": "true", "$": "https://api.elsevier.com/content/object/eid/1-s2.0-S0893608015001768-si8.gif?httpAccept=%2A%2F%2A", "@multimediatype": "GIF image file", "@type": "ALTIMG", "@size": "194", "@ref": "si8", "@mimetype": "image/gif"}, {"@category": "thumbnail", "@height": "20", "@width": "123", "@_fa": "true", "$": "https://api.elsevier.com/content/object/eid/1-s2.0-S0893608015001768-si191.gif?httpAccept=%2A%2F%2A", "@multimediatype": "GIF image file", "@type": "ALTIMG", "@size": "506", "@ref": "si191", "@mimetype": "image/gif"}, {"@category": "thumbnail", "@height": "15", "@width": "68", "@_fa": "true", "$": "https://api.elsevier.com/content/object/eid/1-s2.0-S0893608015001768-si196.gif?httpAccept=%2A%2F%2A", "@multimediatype": "GIF image file", "@type": "ALTIMG", "@size": "246", "@ref": "si196", "@mimetype": "image/gif"}, {"@category": "thumbnail", "@height": "18", "@width": "36", "@_fa": "true", "$": "https://api.elsevier.com/content/object/eid/1-s2.0-S0893608015001768-si132.gif?httpAccept=%2A%2F%2A", "@multimediatype": "GIF image file", "@type": "ALTIMG", "@size": "293", "@ref": "si132", "@mimetype": "image/gif"}, {"@category": "thumbnail", "@height": "15", "@width": "30", "@_fa": "true", "$": "https://api.elsevier.com/content/object/eid/1-s2.0-S0893608015001768-si57.gif?httpAccept=%2A%2F%2A", "@multimediatype": "GIF image file", "@type": "ALTIMG", "@size": "221", "@ref": "si57", "@mimetype": "image/gif"}, {"@category": "thumbnail", "@height": "32", "@width": "215", "@_fa": "true", "$": "https://api.elsevier.com/content/object/eid/1-s2.0-S0893608015001768-si180.gif?httpAccept=%2A%2F%2A", "@multimediatype": "GIF image file", "@type": "ALTIMG", "@size": "912", "@ref": "si180", "@mimetype": "image/gif"}, {"@category": "thumbnail", "@height": "44", "@width": "136", "@_fa": "true", "$": "https://api.elsevier.com/content/object/eid/1-s2.0-S0893608015001768-si73.gif?httpAccept=%2A%2F%2A", "@multimediatype": "GIF image file", "@type": "ALTIMG", "@size": "706", "@ref": "si73", "@mimetype": "image/gif"}, {"@category": "thumbnail", "@height": "16", "@width": "92", "@_fa": "true", "$": "https://api.elsevier.com/content/object/eid/1-s2.0-S0893608015001768-si193.gif?httpAccept=%2A%2F%2A", "@multimediatype": "GIF image file", "@type": "ALTIMG", "@size": "394", "@ref": "si193", "@mimetype": "image/gif"}, {"@category": "thumbnail", "@height": "15", "@width": "131", "@_fa": "true", "$": "https://api.elsevier.com/content/object/eid/1-s2.0-S0893608015001768-si51.gif?httpAccept=%2A%2F%2A", "@multimediatype": "GIF image file", "@type": "ALTIMG", "@size": "466", "@ref": "si51", "@mimetype": "image/gif"}, {"@category": "thumbnail", "@height": "12", "@width": "13", "@_fa": "true", "$": "https://api.elsevier.com/content/object/eid/1-s2.0-S0893608015001768-si54.gif?httpAccept=%2A%2F%2A", "@multimediatype": "GIF image file", "@type": "ALTIMG", "@size": "141", "@ref": "si54", "@mimetype": "image/gif"}, {"@category": "thumbnail", "@height": "20", "@width": "171", "@_fa": "true", "$": "https://api.elsevier.com/content/object/eid/1-s2.0-S0893608015001768-si159.gif?httpAccept=%2A%2F%2A", "@multimediatype": "GIF image file", "@type": "ALTIMG", "@size": "736", "@ref": "si159", "@mimetype": "image/gif"}, {"@category": "thumbnail", "@height": "15", "@width": "28", "@_fa": "true", "$": "https://api.elsevier.com/content/object/eid/1-s2.0-S0893608015001768-si83.gif?httpAccept=%2A%2F%2A", "@multimediatype": "GIF image file", "@type": "ALTIMG", "@size": "210", "@ref": "si83", "@mimetype": "image/gif"}, {"@category": "thumbnail", "@height": "21", "@width": "316", "@_fa": "true", "$": "https://api.elsevier.com/content/object/eid/1-s2.0-S0893608015001768-si205.gif?httpAccept=%2A%2F%2A", "@multimediatype": "GIF image file", "@type": "ALTIMG", "@size": "1167", "@ref": "si205", "@mimetype": "image/gif"}, {"@category": "thumbnail", "@height": "14", "@width": "20", "@_fa": "true", "$": "https://api.elsevier.com/content/object/eid/1-s2.0-S0893608015001768-si2.gif?httpAccept=%2A%2F%2A", "@multimediatype": "GIF image file", "@type": "ALTIMG", "@size": "183", "@ref": "si2", "@mimetype": "image/gif"}, {"@category": "thumbnail", "@height": "8", "@width": "9", "@_fa": "true", "$": "https://api.elsevier.com/content/object/eid/1-s2.0-S0893608015001768-si125.gif?httpAccept=%2A%2F%2A", "@multimediatype": "GIF image file", "@type": "ALTIMG", "@size": "117", "@ref": "si125", "@mimetype": "image/gif"}, {"@category": "thumbnail", "@height": "35", "@width": "154", "@_fa": "true", "$": "https://api.elsevier.com/content/object/eid/1-s2.0-S0893608015001768-si171.gif?httpAccept=%2A%2F%2A", "@multimediatype": "GIF image file", "@type": "ALTIMG", "@size": "813", "@ref": "si171", "@mimetype": "image/gif"}, {"@category": "thumbnail", "@height": "31", "@width": "180", "@_fa": "true", "$": "https://api.elsevier.com/content/object/eid/1-s2.0-S0893608015001768-si80.gif?httpAccept=%2A%2F%2A", "@multimediatype": "GIF image file", "@type": "ALTIMG", "@size": "786", "@ref": "si80", "@mimetype": "image/gif"}, {"@category": "thumbnail", "@height": "15", "@width": "110", "@_fa": "true", "$": "https://api.elsevier.com/content/object/eid/1-s2.0-S0893608015001768-si48.gif?httpAccept=%2A%2F%2A", "@multimediatype": "GIF image file", "@type": "ALTIMG", "@size": "381", "@ref": "si48", "@mimetype": "image/gif"}, {"@category": "thumbnail", "@height": "13", "@width": "54", "@_fa": "true", "$": "https://api.elsevier.com/content/object/eid/1-s2.0-S0893608015001768-si16.gif?httpAccept=%2A%2F%2A", "@multimediatype": "GIF image file", "@type": "ALTIMG", "@size": "264", "@ref": "si16", "@mimetype": "image/gif"}, {"@category": "thumbnail", "@height": "18", "@width": "29", "@_fa": "true", "$": "https://api.elsevier.com/content/object/eid/1-s2.0-S0893608015001768-si178.gif?httpAccept=%2A%2F%2A", "@multimediatype": "GIF image file", "@type": "ALTIMG", "@size": "248", "@ref": "si178", "@mimetype": "image/gif"}, {"@category": "thumbnail", "@height": "15", "@width": "54", "@_fa": "true", "$": "https://api.elsevier.com/content/object/eid/1-s2.0-S0893608015001768-si183.gif?httpAccept=%2A%2F%2A", "@multimediatype": "GIF image file", "@type": "ALTIMG", "@size": "309", "@ref": "si183", "@mimetype": "image/gif"}, {"@category": "thumbnail", "@height": "15", "@width": "68", "@_fa": "true", "$": "https://api.elsevier.com/content/object/eid/1-s2.0-S0893608015001768-si116.gif?httpAccept=%2A%2F%2A", "@multimediatype": "GIF image file", "@type": "ALTIMG", "@size": "354", "@ref": "si116", "@mimetype": "image/gif"}, {"@category": "thumbnail", "@height": "12", "@width": "61", "@_fa": "true", "$": "https://api.elsevier.com/content/object/eid/1-s2.0-S0893608015001768-si207.gif?httpAccept=%2A%2F%2A", "@multimediatype": "GIF image file", "@type": "ALTIMG", "@size": "308", "@ref": "si207", "@mimetype": "image/gif"}, {"@category": "thumbnail", "@height": "12", "@width": "61", "@_fa": "true", "$": "https://api.elsevier.com/content/object/eid/1-s2.0-S0893608015001768-si213.gif?httpAccept=%2A%2F%2A", "@multimediatype": "GIF image file", "@type": "ALTIMG", "@size": "305", "@ref": "si213", "@mimetype": "image/gif"}, {"@category": "thumbnail", "@height": "11", "@width": "35", "@_fa": "true", "$": "https://api.elsevier.com/content/object/eid/1-s2.0-S0893608015001768-si18.gif?httpAccept=%2A%2F%2A", "@multimediatype": "GIF image file", "@type": "ALTIMG", "@size": "160", "@ref": "si18", "@mimetype": "image/gif"}, {"@category": "thumbnail", "@height": "14", "@width": "63", "@_fa": "true", "$": "https://api.elsevier.com/content/object/eid/1-s2.0-S0893608015001768-si1.gif?httpAccept=%2A%2F%2A", "@multimediatype": "GIF image file", "@type": "ALTIMG", "@size": "304", "@ref": "si1", "@mimetype": "image/gif"}, {"@category": "thumbnail", "@height": "15", "@width": "12", "@_fa": "true", "$": "https://api.elsevier.com/content/object/eid/1-s2.0-S0893608015001768-si174.gif?httpAccept=%2A%2F%2A", "@multimediatype": "GIF image file", "@type": "ALTIMG", "@size": "160", "@ref": "si174", "@mimetype": "image/gif"}, {"@category": "thumbnail", "@height": "11", "@width": "12", "@_fa": "true", "$": "https://api.elsevier.com/content/object/eid/1-s2.0-S0893608015001768-si226.gif?httpAccept=%2A%2F%2A", "@multimediatype": "GIF image file", "@type": "ALTIMG", "@size": "140", "@ref": "si226", "@mimetype": "image/gif"}, {"@category": "thumbnail", "@height": "11", "@width": "61", "@_fa": "true", "$": "https://api.elsevier.com/content/object/eid/1-s2.0-S0893608015001768-si206.gif?httpAccept=%2A%2F%2A", "@multimediatype": "GIF image file", "@type": "ALTIMG", "@size": "285", "@ref": "si206", "@mimetype": "image/gif"}, {"@category": "thumbnail", "@height": "11", "@width": "9", "@_fa": "true", "$": "https://api.elsevier.com/content/object/eid/1-s2.0-S0893608015001768-si101.gif?httpAccept=%2A%2F%2A", "@multimediatype": "GIF image file", "@type": "ALTIMG", "@size": "133", "@ref": "si101", "@mimetype": "image/gif"}, {"@category": "thumbnail", "@height": "15", "@width": "15", "@_fa": "true", "$": "https://api.elsevier.com/content/object/eid/1-s2.0-S0893608015001768-si133.gif?httpAccept=%2A%2F%2A", "@multimediatype": "GIF image file", "@type": "ALTIMG", "@size": "173", "@ref": "si133", "@mimetype": "image/gif"}, {"@category": "thumbnail", "@height": "15", "@width": "112", "@_fa": "true", "$": "https://api.elsevier.com/content/object/eid/1-s2.0-S0893608015001768-si136.gif?httpAccept=%2A%2F%2A", "@multimediatype": "GIF image file", "@type": "ALTIMG", "@size": "392", "@ref": "si136", "@mimetype": "image/gif"}, {"@category": "thumbnail", "@height": "15", "@width": "56", "@_fa": "true", "$": "https://api.elsevier.com/content/object/eid/1-s2.0-S0893608015001768-si74.gif?httpAccept=%2A%2F%2A", "@multimediatype": "GIF image file", "@type": "ALTIMG", "@size": "288", "@ref": "si74", "@mimetype": "image/gif"}, {"@category": "thumbnail", "@height": "15", "@width": "26", "@_fa": "true", "$": "https://api.elsevier.com/content/object/eid/1-s2.0-S0893608015001768-si175.gif?httpAccept=%2A%2F%2A", "@multimediatype": "GIF image file", "@type": "ALTIMG", "@size": "190", "@ref": "si175", "@mimetype": "image/gif"}, {"@category": "thumbnail", "@height": "118", "@width": "378", "@_fa": "true", "$": "https://api.elsevier.com/content/object/eid/1-s2.0-S0893608015001768-si43.gif?httpAccept=%2A%2F%2A", "@multimediatype": "GIF image file", "@type": "ALTIMG", "@size": "2716", "@ref": "si43", "@mimetype": "image/gif"}, {"@category": "thumbnail", "@height": "15", "@width": "51", "@_fa": "true", "$": "https://api.elsevier.com/content/object/eid/1-s2.0-S0893608015001768-si157.gif?httpAccept=%2A%2F%2A", "@multimediatype": "GIF image file", "@type": "ALTIMG", "@size": "314", "@ref": "si157", "@mimetype": "image/gif"}, {"@category": "thumbnail", "@height": "15", "@width": "66", "@_fa": "true", "$": "https://api.elsevier.com/content/object/eid/1-s2.0-S0893608015001768-si154.gif?httpAccept=%2A%2F%2A", "@multimediatype": "GIF image file", "@type": "ALTIMG", "@size": "352", "@ref": "si154", "@mimetype": "image/gif"}, {"@category": "thumbnail", "@height": "15", "@width": "26", "@_fa": "true", "$": "https://api.elsevier.com/content/object/eid/1-s2.0-S0893608015001768-si72.gif?httpAccept=%2A%2F%2A", "@multimediatype": "GIF image file", "@type": "ALTIMG", "@size": "205", "@ref": "si72", "@mimetype": "image/gif"}, {"@category": "thumbnail", "@height": "9", "@width": "9", "@_fa": "true", "$": "https://api.elsevier.com/content/object/eid/1-s2.0-S0893608015001768-si100.gif?httpAccept=%2A%2F%2A", "@multimediatype": "GIF image file", "@type": "ALTIMG", "@size": "114", "@ref": "si100", "@mimetype": "image/gif"}, {"@category": "thumbnail", "@height": "12", "@width": "10", "@_fa": "true", "$": "https://api.elsevier.com/content/object/eid/1-s2.0-S0893608015001768-si150.gif?httpAccept=%2A%2F%2A", "@multimediatype": "GIF image file", "@type": "ALTIMG", "@size": "139", "@ref": "si150", "@mimetype": "image/gif"}, {"@category": "thumbnail", "@height": "15", "@width": "100", "@_fa": "true", "$": "https://api.elsevier.com/content/object/eid/1-s2.0-S0893608015001768-si144.gif?httpAccept=%2A%2F%2A", "@multimediatype": "GIF image file", "@type": "ALTIMG", "@size": "486", "@ref": "si144", "@mimetype": "image/gif"}, {"@category": "thumbnail", "@height": "15", "@width": "31", "@_fa": "true", "$": "https://api.elsevier.com/content/object/eid/1-s2.0-S0893608015001768-si165.gif?httpAccept=%2A%2F%2A", "@multimediatype": "GIF image file", "@type": "ALTIMG", "@size": "257", "@ref": "si165", "@mimetype": "image/gif"}, {"@category": "thumbnail", "@height": "11", "@width": "11", "@_fa": "true", "$": "https://api.elsevier.com/content/object/eid/1-s2.0-S0893608015001768-si60.gif?httpAccept=%2A%2F%2A", "@multimediatype": "GIF image file", "@type": "ALTIMG", "@size": "135", "@ref": "si60", "@mimetype": "image/gif"}, {"@category": "thumbnail", "@height": "15", "@width": "53", "@_fa": "true", "$": "https://api.elsevier.com/content/object/eid/1-s2.0-S0893608015001768-si224.gif?httpAccept=%2A%2F%2A", "@multimediatype": "GIF image file", "@type": "ALTIMG", "@size": "275", "@ref": "si224", "@mimetype": "image/gif"}, {"@category": "thumbnail", "@height": "11", "@width": "12", "@_fa": "true", "$": "https://api.elsevier.com/content/object/eid/1-s2.0-S0893608015001768-si153.gif?httpAccept=%2A%2F%2A", "@multimediatype": "GIF image file", "@type": "ALTIMG", "@size": "131", "@ref": "si153", "@mimetype": "image/gif"}, {"@category": "thumbnail", "@height": "15", "@width": "46", "@_fa": "true", "$": "https://api.elsevier.com/content/object/eid/1-s2.0-S0893608015001768-si59.gif?httpAccept=%2A%2F%2A", "@multimediatype": "GIF image file", "@type": "ALTIMG", "@size": "270", "@ref": "si59", "@mimetype": "image/gif"}, {"@category": "thumbnail", "@height": "16", "@width": "94", "@_fa": "true", "$": "https://api.elsevier.com/content/object/eid/1-s2.0-S0893608015001768-si188.gif?httpAccept=%2A%2F%2A", "@multimediatype": "GIF image file", "@type": "ALTIMG", "@size": "412", "@ref": "si188", "@mimetype": "image/gif"}, {"@category": "thumbnail", "@height": "13", "@width": "48", "@_fa": "true", "$": "https://api.elsevier.com/content/object/eid/1-s2.0-S0893608015001768-si223.gif?httpAccept=%2A%2F%2A", "@multimediatype": "GIF image file", "@type": "ALTIMG", "@size": "251", "@ref": "si223", "@mimetype": "image/gif"}, {"@category": "thumbnail", "@height": "39", "@width": "115", "@_fa": "true", "$": "https://api.elsevier.com/content/object/eid/1-s2.0-S0893608015001768-si70.gif?httpAccept=%2A%2F%2A", "@multimediatype": "GIF image file", "@type": "ALTIMG", "@size": "600", "@ref": "si70", "@mimetype": "image/gif"}, {"@category": "thumbnail", "@height": "17", "@width": "71", "@_fa": "true", "$": "https://api.elsevier.com/content/object/eid/1-s2.0-S0893608015001768-si6.gif?httpAccept=%2A%2F%2A", "@multimediatype": "GIF image file", "@type": "ALTIMG", "@size": "432", "@ref": "si6", "@mimetype": "image/gif"}, {"@category": "thumbnail", "@height": "14", "@width": "15", "@_fa": "true", "$": "https://api.elsevier.com/content/object/eid/1-s2.0-S0893608015001768-si65.gif?httpAccept=%2A%2F%2A", "@multimediatype": "GIF image file", "@type": "ALTIMG", "@size": "155", "@ref": "si65", "@mimetype": "image/gif"}, {"@category": "thumbnail", "@height": "12", "@width": "18", "@_fa": "true", "$": "https://api.elsevier.com/content/object/eid/1-s2.0-S0893608015001768-si77.gif?httpAccept=%2A%2F%2A", "@multimediatype": "GIF image file", "@type": "ALTIMG", "@size": "152", "@ref": "si77", "@mimetype": "image/gif"}, {"@category": "thumbnail", "@height": "12", "@width": "43", "@_fa": "true", "$": "https://api.elsevier.com/content/object/eid/1-s2.0-S0893608015001768-si27.gif?httpAccept=%2A%2F%2A", "@multimediatype": "GIF image file", "@type": "ALTIMG", "@size": "202", "@ref": "si27", "@mimetype": "image/gif"}, {"@category": "thumbnail", "@height": "15", "@width": "42", "@_fa": "true", "$": "https://api.elsevier.com/content/object/eid/1-s2.0-S0893608015001768-si195.gif?httpAccept=%2A%2F%2A", "@multimediatype": "GIF image file", "@type": "ALTIMG", "@size": "190", "@ref": "si195", "@mimetype": "image/gif"}, {"@category": "thumbnail", "@height": "14", "@width": "11", "@_fa": "true", "$": "https://api.elsevier.com/content/object/eid/1-s2.0-S0893608015001768-si20.gif?httpAccept=%2A%2F%2A", "@multimediatype": "GIF image file", "@type": "ALTIMG", "@size": "129", "@ref": "si20", "@mimetype": "image/gif"}, {"@category": "thumbnail", "@height": "15", "@width": "24", "@_fa": "true", "$": "https://api.elsevier.com/content/object/eid/1-s2.0-S0893608015001768-si36.gif?httpAccept=%2A%2F%2A", "@multimediatype": "GIF image file", "@type": "ALTIMG", "@size": "211", "@ref": "si36", "@mimetype": "image/gif"}, {"@category": "thumbnail", "@height": "14", "@width": "87", "@_fa": "true", "$": "https://api.elsevier.com/content/object/eid/1-s2.0-S0893608015001768-si208.gif?httpAccept=%2A%2F%2A", "@multimediatype": "GIF image file", "@type": "ALTIMG", "@size": "412", "@ref": "si208", "@mimetype": "image/gif"}, {"@category": "thumbnail", "@height": "16", "@width": "81", "@_fa": "true", "$": "https://api.elsevier.com/content/object/eid/1-s2.0-S0893608015001768-si187.gif?httpAccept=%2A%2F%2A", "@multimediatype": "GIF image file", "@type": "ALTIMG", "@size": "336", "@ref": "si187", "@mimetype": "image/gif"}, {"@category": "thumbnail", "@height": "17", "@width": "60", "@_fa": "true", "$": "https://api.elsevier.com/content/object/eid/1-s2.0-S0893608015001768-si5.gif?httpAccept=%2A%2F%2A", "@multimediatype": "GIF image file", "@type": "ALTIMG", "@size": "376", "@ref": "si5", "@mimetype": "image/gif"}, {"@category": "thumbnail", "@height": "15", "@width": "11", "@_fa": "true", "$": "https://api.elsevier.com/content/object/eid/1-s2.0-S0893608015001768-si186.gif?httpAccept=%2A%2F%2A", "@multimediatype": "GIF image file", "@type": "ALTIMG", "@size": "133", "@ref": "si186", "@mimetype": "image/gif"}, {"@category": "thumbnail", "@height": "11", "@width": "61", "@_fa": "true", "$": "https://api.elsevier.com/content/object/eid/1-s2.0-S0893608015001768-si212.gif?httpAccept=%2A%2F%2A", "@multimediatype": "GIF image file", "@type": "ALTIMG", "@size": "285", "@ref": "si212", "@mimetype": "image/gif"}, {"@category": "thumbnail", "@height": "12", "@width": "10", "@_fa": "true", "$": "https://api.elsevier.com/content/object/eid/1-s2.0-S0893608015001768-si38.gif?httpAccept=%2A%2F%2A", "@multimediatype": "GIF image file", "@type": "ALTIMG", "@size": "135", "@ref": "si38", "@mimetype": "image/gif"}, {"@category": "thumbnail", "@height": "11", "@width": "32", "@_fa": "true", "$": "https://api.elsevier.com/content/object/eid/1-s2.0-S0893608015001768-si112.gif?httpAccept=%2A%2F%2A", "@multimediatype": "GIF image file", "@type": "ALTIMG", "@size": "217", "@ref": "si112", "@mimetype": "image/gif"}, {"@category": "thumbnail", "@height": "13", "@width": "49", "@_fa": "true", "$": "https://api.elsevier.com/content/object/eid/1-s2.0-S0893608015001768-si49.gif?httpAccept=%2A%2F%2A", "@multimediatype": "GIF image file", "@type": "ALTIMG", "@size": "256", "@ref": "si49", "@mimetype": "image/gif"}, {"@category": "thumbnail", "@height": "15", "@width": "79", "@_fa": "true", "$": "https://api.elsevier.com/content/object/eid/1-s2.0-S0893608015001768-si44.gif?httpAccept=%2A%2F%2A", "@multimediatype": "GIF image file", "@type": "ALTIMG", "@size": "303", "@ref": "si44", "@mimetype": "image/gif"}, {"@category": "thumbnail", "@height": "8", "@width": "10", "@_fa": "true", "$": "https://api.elsevier.com/content/object/eid/1-s2.0-S0893608015001768-si24.gif?httpAccept=%2A%2F%2A", "@multimediatype": "GIF image file", "@type": "ALTIMG", "@size": "124", "@ref": "si24", "@mimetype": "image/gif"}, {"@category": "thumbnail", "@height": "15", "@width": "215", "@_fa": "true", "$": "https://api.elsevier.com/content/object/eid/1-s2.0-S0893608015001768-si129.gif?httpAccept=%2A%2F%2A", "@multimediatype": "GIF image file", "@type": "ALTIMG", "@size": "780", "@ref": "si129", "@mimetype": "image/gif"}, {"@category": "thumbnail", "@height": "84", "@width": "256", "@_fa": "true", "$": "https://api.elsevier.com/content/object/eid/1-s2.0-S0893608015001768-si182.gif?httpAccept=%2A%2F%2A", "@multimediatype": "GIF image file", "@type": "ALTIMG", "@size": "2127", "@ref": "si182", "@mimetype": "image/gif"}, {"@category": "thumbnail", "@height": "13", "@width": "40", "@_fa": "true", "$": "https://api.elsevier.com/content/object/eid/1-s2.0-S0893608015001768-si64.gif?httpAccept=%2A%2F%2A", "@multimediatype": "GIF image file", "@type": "ALTIMG", "@size": "217", "@ref": "si64", "@mimetype": "image/gif"}, {"@category": "thumbnail", "@height": "17", "@width": "39", "@_fa": "true", "$": "https://api.elsevier.com/content/object/eid/1-s2.0-S0893608015001768-si52.gif?httpAccept=%2A%2F%2A", "@multimediatype": "GIF image file", "@type": "ALTIMG", "@size": "306", "@ref": "si52", "@mimetype": "image/gif"}, {"@category": "thumbnail", "@height": "32", "@width": "256", "@_fa": "true", "$": "https://api.elsevier.com/content/object/eid/1-s2.0-S0893608015001768-si102.gif?httpAccept=%2A%2F%2A", "@multimediatype": "GIF image file", "@type": "ALTIMG", "@size": "994", "@ref": "si102", "@mimetype": "image/gif"}, {"@category": "thumbnail", "@height": "15", "@width": "79", "@_fa": "true", "$": "https://api.elsevier.com/content/object/eid/1-s2.0-S0893608015001768-si55.gif?httpAccept=%2A%2F%2A", "@multimediatype": "GIF image file", "@type": "ALTIMG", "@size": "344", "@ref": "si55", "@mimetype": "image/gif"}, {"@category": "thumbnail", "@height": "14", "@width": "10", "@_fa": "true", "$": "https://api.elsevier.com/content/object/eid/1-s2.0-S0893608015001768-si58.gif?httpAccept=%2A%2F%2A", "@multimediatype": "GIF image file", "@type": "ALTIMG", "@size": "125", "@ref": "si58", "@mimetype": "image/gif"}, {"@category": "thumbnail", "@height": "44", "@width": "393", "@_fa": "true", "$": "https://api.elsevier.com/content/object/eid/1-s2.0-S0893608015001768-si45.gif?httpAccept=%2A%2F%2A", "@multimediatype": "GIF image file", "@type": "ALTIMG", "@size": "1755", "@ref": "si45", "@mimetype": "image/gif"}, {"@category": "thumbnail", "@height": "41", "@width": "177", "@_fa": "true", "$": "https://api.elsevier.com/content/object/eid/1-s2.0-S0893608015001768-si33.gif?httpAccept=%2A%2F%2A", "@multimediatype": "GIF image file", "@type": "ALTIMG", "@size": "969", "@ref": "si33", "@mimetype": "image/gif"}, {"@category": "thumbnail", "@height": "11", "@width": "21", "@_fa": "true", "$": "https://api.elsevier.com/content/object/eid/1-s2.0-S0893608015001768-si128.gif?httpAccept=%2A%2F%2A", "@multimediatype": "GIF image file", "@type": "ALTIMG", "@size": "177", "@ref": "si128", "@mimetype": "image/gif"}, {"@category": "thumbnail", "@height": "15", "@width": "33", "@_fa": "true", "$": "https://api.elsevier.com/content/object/eid/1-s2.0-S0893608015001768-si158.gif?httpAccept=%2A%2F%2A", "@multimediatype": "GIF image file", "@type": "ALTIMG", "@size": "249", "@ref": "si158", "@mimetype": "image/gif"}, {"@category": "thumbnail", "@height": "16", "@width": "33", "@_fa": "true", "$": "https://api.elsevier.com/content/object/eid/1-s2.0-S0893608015001768-si179.gif?httpAccept=%2A%2F%2A", "@multimediatype": "GIF image file", "@type": "ALTIMG", "@size": "246", "@ref": "si179", "@mimetype": "image/gif"}, {"@category": "thumbnail", "@height": "35", "@width": "110", "@_fa": "true", "$": "https://api.elsevier.com/content/object/eid/1-s2.0-S0893608015001768-si113.gif?httpAccept=%2A%2F%2A", "@multimediatype": "GIF image file", "@type": "ALTIMG", "@size": "595", "@ref": "si113", "@mimetype": "image/gif"}, {"@category": "thumbnail", "@height": "14", "@width": "43", "@_fa": "true", "$": "https://api.elsevier.com/content/object/eid/1-s2.0-S0893608015001768-si172.gif?httpAccept=%2A%2F%2A", "@multimediatype": "GIF image file", "@type": "ALTIMG", "@size": "281", "@ref": "si172", "@mimetype": "image/gif"}, {"@category": "thumbnail", "@height": "15", "@width": "61", "@_fa": "true", "$": "https://api.elsevier.com/content/object/eid/1-s2.0-S0893608015001768-si190.gif?httpAccept=%2A%2F%2A", "@multimediatype": "GIF image file", "@type": "ALTIMG", "@size": "318", "@ref": "si190", "@mimetype": "image/gif"}, {"@category": "thumbnail", "@height": "31", "@width": "152", "@_fa": "true", "$": "https://api.elsevier.com/content/object/eid/1-s2.0-S0893608015001768-si97.gif?httpAccept=%2A%2F%2A", "@multimediatype": "GIF image file", "@type": "ALTIMG", "@size": "724", "@ref": "si97", "@mimetype": "image/gif"}, {"@category": "thumbnail", "@height": "8", "@width": "8", "@_fa": "true", "$": "https://api.elsevier.com/content/object/eid/1-s2.0-S0893608015001768-si19.gif?httpAccept=%2A%2F%2A", "@multimediatype": "GIF image file", "@type": "ALTIMG", "@size": "114", "@ref": "si19", "@mimetype": "image/gif"}, {"@category": "thumbnail", "@height": "17", "@width": "57", "@_fa": "true", "$": "https://api.elsevier.com/content/object/eid/1-s2.0-S0893608015001768-si217.gif?httpAccept=%2A%2F%2A", "@multimediatype": "GIF image file", "@type": "ALTIMG", "@size": "281", "@ref": "si217", "@mimetype": "image/gif"}, {"@category": "thumbnail", "@height": "15", "@width": "77", "@_fa": "true", "$": "https://api.elsevier.com/content/object/eid/1-s2.0-S0893608015001768-si139.gif?httpAccept=%2A%2F%2A", "@multimediatype": "GIF image file", "@type": "ALTIMG", "@size": "345", "@ref": "si139", "@mimetype": "image/gif"}, {"@category": "thumbnail", "@height": "39", "@width": "199", "@_fa": "true", "$": "https://api.elsevier.com/content/object/eid/1-s2.0-S0893608015001768-si167.gif?httpAccept=%2A%2F%2A", "@multimediatype": "GIF image file", "@type": "ALTIMG", "@size": "1177", "@ref": "si167", "@mimetype": "image/gif"}, {"@category": "thumbnail", "@height": "15", "@width": "43", "@_fa": "true", "$": "https://api.elsevier.com/content/object/eid/1-s2.0-S0893608015001768-si222.gif?httpAccept=%2A%2F%2A", "@multimediatype": "GIF image file", "@type": "ALTIMG", "@size": "288", "@ref": "si222", "@mimetype": "image/gif"}, {"@category": "thumbnail", "@height": "11", "@width": "61", "@_fa": "true", "$": "https://api.elsevier.com/content/object/eid/1-s2.0-S0893608015001768-si198.gif?httpAccept=%2A%2F%2A", "@multimediatype": "GIF image file", "@type": "ALTIMG", "@size": "290", "@ref": "si198", "@mimetype": "image/gif"}]}, "link": {"@rel": "abstract", "@href": "https://api.elsevier.com/content/abstract/scopus_id/84951855624"}}