{"scopus-eid": "2-s2.0-84908027298", "originalText": "serial JL 272371 291210 291682 291870 291901 31 Journal of Biomedical Informatics JOURNALBIOMEDICALINFORMATICS 2014-05-29 2014-05-29 2014-10-07T16:50:29 1-s2.0-S1532046414001270 S1532-0464(14)00127-0 S1532046414001270 10.1016/j.jbi.2014.05.010 S300 S300.1 FULL-TEXT 1-s2.0-S1532046414X00055 2016-03-22T21:37:15.086296-04:00 0 0 20141001 20141031 2014 2014-05-29T00:00:00Z absattachment articleinfo articletitlenorm authfirstinitialnorm authfirstsurnamenorm cid cids contenttype copyright crossmark dateloaded dateloadedtxt datesearch datesort dateupdated dco docsubtype doctype doi eid ewtransactionid hubeid indexeddate issn issnnorm itemstage itemtransactionid itemweight openaccess openarchive pg pgfirst pglast pii piinorm pubdateend pubdatestart pubdatetxt pubyr sectiontitle sortorder srctitle srctitlenorm srctype ssids alllist content subj subheadings suppl tomb volfirst volissue volumelist webpdf webpdfpagecount yearnav figure table body mmlmath acknowledge affil articletitle auth authfirstini authfull authkeywords authlast footnotes grantsponsor highlightsabst primabst ref specialabst 1532-0464 15320464 true 51 51 C Volume 51 19 165 175 165 175 201410 October 2014 2014-10-01 2014-10-31 2014 Original Research article fla Copyright \u00a9 2014 Elsevier Inc. All rights reserved. MULTILABELCLASSIFICATIONCHRONICALLYILLPATIENTSBAGWORDSSUPERVISEDDIMENSIONALITYREDUCTIONALGORITHMS BROMURI S 1 Introduction 2 Background 2.1 Multi-label classification 2.2 Kernels 2.3 Locality preserving projections 2.4 Linear discriminant analysis and local linear discriminant analysis 2.5 Kernel local Fisher discriminant analysis 3 Materials 3.1 The Portavita dataset 3.2 MIMIC II dataset 3.3 Missing value imputation 4 Methods 4.1 From irregular multivariate time series to bag of words 4.2 Nearest centroid classification and label ranking 4.3 Multi-label metrics 5 Results 5.1 Parameters selection with CV 5.2 Results on the Portavita dataset 5.3 Results on the MIMIC II dataset 5.4 Discussion 6 Conclusions Acknowledgments References MCADAMMARX 2013 143 148 C GHABLY 2013 245 J KANNAMPALLIL 2013 21 29 T SUN 2010 4149 4152 J PROCEEDINGS201020THINTERNATIONALCONFERENCEPATTERNRECOGNITIONICPR10 LOCALIZEDSUPERVISEDMETRICLEARNINGTEMPORALPHYSIOLOGICALDATA SUN 2012 16 24 J MARIMONT 1979 59 70 R JIU 2012 409 419 M MADJAROV 2012 3084 3104 G ZHANG 2013 1 M JI 2009 1077 1082 S PROCEEDINGS21STINTERNATIONALJONTCONFERENCEARTIFICIALINTELLIGENCEIJCAI09 LINEARDIMENSIONALITYREDUCTIONFORMULTILABELCLASSIFICATION PACHARAWONGSAKDA 2012 423 434 E PRICAI IMPROVINGMULTILABELCLASSIFICATIONUSINGSEMISUPERVISEDLEARNINGDIMENSIONALITYREDUCTION QIAN 2010 B AAAI SEMISUPERVISEDDIMENSIONREDUCTIONFORMULTILABELCLASSIFICATION CADE 2008 1322 1335 W SAEED 2011 952 960 M ZHANG 2007 2038 2048 M SHAWETAYLOR 2004 J KERNELMETHODSFORPATTERNANALYSIS HE 2004 X ADVANCESINNEURALINFORMATIONPROCESSINGSYSTEMSVOL16 LOCALITYPRESERVINGPROJECTIONS FUKUNAGA 1990 K INTRODUCTIONSTATISTICALPATTERNRECOGNITION SUGIYAMA 2007 1027 1061 M LITTLE 2012 1355 1360 R DZIURA 2013 343 358 J JACKSON 2010 593 612 D FISHER 1936 179 188 R YOUNES 2011 Z ZHANG 2006 1338 1351 M CORTES 1995 273 297 C KO 2012 1029 1030 Y PROCEEDINGS35THINTERNATIONALACMSIGIRCONFERENCERESEARCHDEVELOPMENTININFORMATIONRETRIEVALSIGIR12 ASTUDYTERMWEIGHTINGSCHEMESUSINGCLASSINFORMATIONFORTEXTCLASSIFICATION SIVIC 2009 591 606 J SIVIC 2005 471 478 J ADVANCESINMULTIMEDIAINFORMATIONPROCESSINGPCM2004 EFFICIENTVISUALCONTENTRETRIEVALMININGINVIDEOS MACQUEEN 1967 281 297 J PROCFIFTHBERKELEYSYMPOSIUMMATHEMATICALSTATISTICSPROBABILITY METHODSFORCLASSIFICATIONANALYSISMULTIVARIATEOBSERVATIONS TSOUMAKAS 2010 667 685 G DATAMININGKNOWLEDGEDISCOVERYHANDBOOK MININGMULTILABELDATA SCHAPIRE 2000 135 168 R DUNDAR 2004 1010 1014 M LINNET 1988 158 168 K WANG 2013 1496 1509 Z PARK 2008 878 887 C BROMURIX2014X165 BROMURIX2014X165X175 BROMURIX2014X165XS BROMURIX2014X165X175XS Full 2016-03-23T01:08:07Z OA-Window ElsevierBranded http://www.elsevier.com/open-access/userlicense/1.0/ item S1532-0464(14)00127-0 S1532046414001270 1-s2.0-S1532046414001270 10.1016/j.jbi.2014.05.010 272371 2014-10-07T12:44:25.317298-04:00 2014-10-01 2014-10-31 1-s2.0-S1532046414001270-main.pdf https://s3.amazonaws.com/prod-ucs-content-store-us-east/content/pii:S1532046414001270/MAIN/application/pdf/98f218f0d1fc92e9db272f7fa2f5933f/main.pdf https://s3-eu-west-1.amazonaws.com/prod-ucs-content-store-eu-west/content/pii:S1532046414001270/MAIN/application/pdf/98f218f0d1fc92e9db272f7fa2f5933f/main.pdf main.pdf pdf true 1145409 MAIN 11 1-s2.0-S1532046414001270-main_1.png https://s3.amazonaws.com/prod-ucs-content-store-us-east/content/pii:S1532046414001270/PREVIEW/image/png/cf565ea7b4680f2c8b3ba5c0b10c160f/main_1.png https://s3-eu-west-1.amazonaws.com/prod-ucs-content-store-eu-west/content/pii:S1532046414001270/PREVIEW/image/png/cf565ea7b4680f2c8b3ba5c0b10c160f/main_1.png main_1.png png 55475 849 656 IMAGE-WEB-PDF 1 1-s2.0-S1532046414001270-si134.gif https://s3.amazonaws.com/prod-ucs-content-store-us-east/content/pii:S1532046414001270/STRIPIN/image/gif/38be7f41f58f2ea58663700d54897f41/si134.gif https://s3-eu-west-1.amazonaws.com/prod-ucs-content-store-eu-west/content/pii:S1532046414001270/STRIPIN/image/gif/38be7f41f58f2ea58663700d54897f41/si134.gif si134 si134.gif gif 6791 103 450 ALTIMG 1-s2.0-S1532046414001270-si131.gif https://s3.amazonaws.com/prod-ucs-content-store-us-east/content/pii:S1532046414001270/STRIPIN/image/gif/dd8e6adac859147c92ebbee155e13406/si131.gif https://s3-eu-west-1.amazonaws.com/prod-ucs-content-store-eu-west/content/pii:S1532046414001270/STRIPIN/image/gif/dd8e6adac859147c92ebbee155e13406/si131.gif si131 si131.gif gif 6079 76 359 ALTIMG 1-s2.0-S1532046414001270-si130.gif https://s3.amazonaws.com/prod-ucs-content-store-us-east/content/pii:S1532046414001270/STRIPIN/image/gif/3f069ac1ceb758080941f0c5f0ceb32e/si130.gif https://s3-eu-west-1.amazonaws.com/prod-ucs-content-store-eu-west/content/pii:S1532046414001270/STRIPIN/image/gif/3f069ac1ceb758080941f0c5f0ceb32e/si130.gif si130 si130.gif gif 3727 45 309 ALTIMG 1-s2.0-S1532046414001270-si129.gif https://s3.amazonaws.com/prod-ucs-content-store-us-east/content/pii:S1532046414001270/STRIPIN/image/gif/654e0963143ed20cf674db3280b5e778/si129.gif https://s3-eu-west-1.amazonaws.com/prod-ucs-content-store-eu-west/content/pii:S1532046414001270/STRIPIN/image/gif/654e0963143ed20cf674db3280b5e778/si129.gif si129 si129.gif gif 2551 44 178 ALTIMG 1-s2.0-S1532046414001270-si128.gif https://s3.amazonaws.com/prod-ucs-content-store-us-east/content/pii:S1532046414001270/STRIPIN/image/gif/34ab8728ec72eff4f4a4d42e279b277b/si128.gif https://s3-eu-west-1.amazonaws.com/prod-ucs-content-store-eu-west/content/pii:S1532046414001270/STRIPIN/image/gif/34ab8728ec72eff4f4a4d42e279b277b/si128.gif si128 si128.gif gif 3697 45 313 ALTIMG 1-s2.0-S1532046414001270-si127.gif https://s3.amazonaws.com/prod-ucs-content-store-us-east/content/pii:S1532046414001270/STRIPIN/image/gif/305cd475f68c3657ac7248331284f908/si127.gif https://s3-eu-west-1.amazonaws.com/prod-ucs-content-store-eu-west/content/pii:S1532046414001270/STRIPIN/image/gif/305cd475f68c3657ac7248331284f908/si127.gif si127 si127.gif gif 2875 45 205 ALTIMG 1-s2.0-S1532046414001270-si125.gif https://s3.amazonaws.com/prod-ucs-content-store-us-east/content/pii:S1532046414001270/STRIPIN/image/gif/3858c8f91085c246708e7e2c735cdca4/si125.gif https://s3-eu-west-1.amazonaws.com/prod-ucs-content-store-eu-west/content/pii:S1532046414001270/STRIPIN/image/gif/3858c8f91085c246708e7e2c735cdca4/si125.gif si125 si125.gif gif 2033 41 192 ALTIMG 1-s2.0-S1532046414001270-si123.gif https://s3.amazonaws.com/prod-ucs-content-store-us-east/content/pii:S1532046414001270/STRIPIN/image/gif/e5401809cd8eb5305ce9bd57f6a07e6c/si123.gif https://s3-eu-west-1.amazonaws.com/prod-ucs-content-store-eu-west/content/pii:S1532046414001270/STRIPIN/image/gif/e5401809cd8eb5305ce9bd57f6a07e6c/si123.gif si123 si123.gif gif 2433 44 167 ALTIMG 1-s2.0-S1532046414001270-si121.gif https://s3.amazonaws.com/prod-ucs-content-store-us-east/content/pii:S1532046414001270/STRIPIN/image/gif/5667b96ac5bddfb9ca3086f0a6552390/si121.gif https://s3-eu-west-1.amazonaws.com/prod-ucs-content-store-eu-west/content/pii:S1532046414001270/STRIPIN/image/gif/5667b96ac5bddfb9ca3086f0a6552390/si121.gif si121 si121.gif gif 2421 51 194 ALTIMG 1-s2.0-S1532046414001270-si120.gif https://s3.amazonaws.com/prod-ucs-content-store-us-east/content/pii:S1532046414001270/STRIPIN/image/gif/0bb5a41808e4f1aeb4911709fb4c979c/si120.gif https://s3-eu-west-1.amazonaws.com/prod-ucs-content-store-eu-west/content/pii:S1532046414001270/STRIPIN/image/gif/0bb5a41808e4f1aeb4911709fb4c979c/si120.gif si120 si120.gif gif 1523 23 154 ALTIMG 1-s2.0-S1532046414001270-si116.gif https://s3.amazonaws.com/prod-ucs-content-store-us-east/content/pii:S1532046414001270/STRIPIN/image/gif/b44e4cd5fd94fbcdd3424591d67106fd/si116.gif https://s3-eu-west-1.amazonaws.com/prod-ucs-content-store-eu-west/content/pii:S1532046414001270/STRIPIN/image/gif/b44e4cd5fd94fbcdd3424591d67106fd/si116.gif si116 si116.gif gif 1473 25 122 ALTIMG 1-s2.0-S1532046414001270-si114.gif https://s3.amazonaws.com/prod-ucs-content-store-us-east/content/pii:S1532046414001270/STRIPIN/image/gif/11b2587c1ea7c2c38e4cfb4192d7497a/si114.gif https://s3-eu-west-1.amazonaws.com/prod-ucs-content-store-eu-west/content/pii:S1532046414001270/STRIPIN/image/gif/11b2587c1ea7c2c38e4cfb4192d7497a/si114.gif si114 si114.gif gif 1075 39 75 ALTIMG 1-s2.0-S1532046414001270-si109.gif https://s3.amazonaws.com/prod-ucs-content-store-us-east/content/pii:S1532046414001270/STRIPIN/image/gif/c1e97f2f1c96221583895268f0cc94f4/si109.gif https://s3-eu-west-1.amazonaws.com/prod-ucs-content-store-eu-west/content/pii:S1532046414001270/STRIPIN/image/gif/c1e97f2f1c96221583895268f0cc94f4/si109.gif si109 si109.gif gif 1607 48 133 ALTIMG 1-s2.0-S1532046414001270-si98.gif https://s3.amazonaws.com/prod-ucs-content-store-us-east/content/pii:S1532046414001270/STRIPIN/image/gif/3df1a984c1988aeff2425bff4e92280f/si98.gif https://s3-eu-west-1.amazonaws.com/prod-ucs-content-store-eu-west/content/pii:S1532046414001270/STRIPIN/image/gif/3df1a984c1988aeff2425bff4e92280f/si98.gif si98 si98.gif gif 2141 49 144 ALTIMG 1-s2.0-S1532046414001270-si96.gif https://s3.amazonaws.com/prod-ucs-content-store-us-east/content/pii:S1532046414001270/STRIPIN/image/gif/139d7f79f418f2e8dbeb030c1f8cc502/si96.gif https://s3-eu-west-1.amazonaws.com/prod-ucs-content-store-eu-west/content/pii:S1532046414001270/STRIPIN/image/gif/139d7f79f418f2e8dbeb030c1f8cc502/si96.gif si96 si96.gif gif 1955 49 138 ALTIMG 1-s2.0-S1532046414001270-si94.gif https://s3.amazonaws.com/prod-ucs-content-store-us-east/content/pii:S1532046414001270/STRIPIN/image/gif/eaaeb627f2952fcdd7c405ff869229a5/si94.gif https://s3-eu-west-1.amazonaws.com/prod-ucs-content-store-eu-west/content/pii:S1532046414001270/STRIPIN/image/gif/eaaeb627f2952fcdd7c405ff869229a5/si94.gif si94 si94.gif gif 3851 51 302 ALTIMG 1-s2.0-S1532046414001270-si91.gif https://s3.amazonaws.com/prod-ucs-content-store-us-east/content/pii:S1532046414001270/STRIPIN/image/gif/11a1b003fa0c07fb9d5fe169bbcff990/si91.gif https://s3-eu-west-1.amazonaws.com/prod-ucs-content-store-eu-west/content/pii:S1532046414001270/STRIPIN/image/gif/11a1b003fa0c07fb9d5fe169bbcff990/si91.gif si91 si91.gif gif 3565 41 307 ALTIMG 1-s2.0-S1532046414001270-si86.gif https://s3.amazonaws.com/prod-ucs-content-store-us-east/content/pii:S1532046414001270/STRIPIN/image/gif/3a82c38ad72963ab916eba823772c1d4/si86.gif https://s3-eu-west-1.amazonaws.com/prod-ucs-content-store-eu-west/content/pii:S1532046414001270/STRIPIN/image/gif/3a82c38ad72963ab916eba823772c1d4/si86.gif si86 si86.gif gif 3793 52 309 ALTIMG 1-s2.0-S1532046414001270-si85.gif https://s3.amazonaws.com/prod-ucs-content-store-us-east/content/pii:S1532046414001270/STRIPIN/image/gif/49d1a8fe42fb5a27e1673b3090e8ee2f/si85.gif https://s3-eu-west-1.amazonaws.com/prod-ucs-content-store-eu-west/content/pii:S1532046414001270/STRIPIN/image/gif/49d1a8fe42fb5a27e1673b3090e8ee2f/si85.gif si85 si85.gif gif 3087 52 238 ALTIMG 1-s2.0-S1532046414001270-si84.gif https://s3.amazonaws.com/prod-ucs-content-store-us-east/content/pii:S1532046414001270/STRIPIN/image/gif/8e4e07ab926815d484234eabe72572d0/si84.gif https://s3-eu-west-1.amazonaws.com/prod-ucs-content-store-eu-west/content/pii:S1532046414001270/STRIPIN/image/gif/8e4e07ab926815d484234eabe72572d0/si84.gif si84 si84.gif gif 2931 48 243 ALTIMG 1-s2.0-S1532046414001270-si83.gif https://s3.amazonaws.com/prod-ucs-content-store-us-east/content/pii:S1532046414001270/STRIPIN/image/gif/bb5bacb3fe36dd0b1fe775363533dd2a/si83.gif https://s3-eu-west-1.amazonaws.com/prod-ucs-content-store-eu-west/content/pii:S1532046414001270/STRIPIN/image/gif/bb5bacb3fe36dd0b1fe775363533dd2a/si83.gif si83 si83.gif gif 2979 48 249 ALTIMG 1-s2.0-S1532046414001270-si80.gif https://s3.amazonaws.com/prod-ucs-content-store-us-east/content/pii:S1532046414001270/STRIPIN/image/gif/00c40e0387c19566eb9b3207a7d6af3e/si80.gif https://s3-eu-west-1.amazonaws.com/prod-ucs-content-store-eu-west/content/pii:S1532046414001270/STRIPIN/image/gif/00c40e0387c19566eb9b3207a7d6af3e/si80.gif si80 si80.gif gif 3241 49 215 ALTIMG 1-s2.0-S1532046414001270-si73.gif https://s3.amazonaws.com/prod-ucs-content-store-us-east/content/pii:S1532046414001270/STRIPIN/image/gif/c6bd943d6e6dc6e1663a87f9642ee0cb/si73.gif https://s3-eu-west-1.amazonaws.com/prod-ucs-content-store-eu-west/content/pii:S1532046414001270/STRIPIN/image/gif/c6bd943d6e6dc6e1663a87f9642ee0cb/si73.gif si73 si73.gif gif 2385 48 216 ALTIMG 1-s2.0-S1532046414001270-si70.gif https://s3.amazonaws.com/prod-ucs-content-store-us-east/content/pii:S1532046414001270/STRIPIN/image/gif/9c914c900f6fbc4ff2fba1af9be5a3a0/si70.gif https://s3-eu-west-1.amazonaws.com/prod-ucs-content-store-eu-west/content/pii:S1532046414001270/STRIPIN/image/gif/9c914c900f6fbc4ff2fba1af9be5a3a0/si70.gif si70 si70.gif gif 2581 50 220 ALTIMG 1-s2.0-S1532046414001270-si66.gif https://s3.amazonaws.com/prod-ucs-content-store-us-east/content/pii:S1532046414001270/STRIPIN/image/gif/d8f910f114b93788c52baad948710108/si66.gif https://s3-eu-west-1.amazonaws.com/prod-ucs-content-store-eu-west/content/pii:S1532046414001270/STRIPIN/image/gif/d8f910f114b93788c52baad948710108/si66.gif si66 si66.gif gif 3951 53 300 ALTIMG 1-s2.0-S1532046414001270-si57.gif https://s3.amazonaws.com/prod-ucs-content-store-us-east/content/pii:S1532046414001270/STRIPIN/image/gif/5ccaceaa0efefdaff9c67147659f479d/si57.gif https://s3-eu-west-1.amazonaws.com/prod-ucs-content-store-eu-west/content/pii:S1532046414001270/STRIPIN/image/gif/5ccaceaa0efefdaff9c67147659f479d/si57.gif si57 si57.gif gif 2183 45 170 ALTIMG 1-s2.0-S1532046414001270-si54.gif https://s3.amazonaws.com/prod-ucs-content-store-us-east/content/pii:S1532046414001270/STRIPIN/image/gif/7efd215eb91696518072f828bed250cf/si54.gif https://s3-eu-west-1.amazonaws.com/prod-ucs-content-store-eu-west/content/pii:S1532046414001270/STRIPIN/image/gif/7efd215eb91696518072f828bed250cf/si54.gif si54 si54.gif gif 1911 43 144 ALTIMG 1-s2.0-S1532046414001270-si99.gif https://s3.amazonaws.com/prod-ucs-content-store-us-east/content/pii:S1532046414001270/STRIPIN/image/gif/97ded2128d827181d13235de62547b75/si99.gif https://s3-eu-west-1.amazonaws.com/prod-ucs-content-store-eu-west/content/pii:S1532046414001270/STRIPIN/image/gif/97ded2128d827181d13235de62547b75/si99.gif si99 si99.gif gif 665 14 44 ALTIMG 1-s2.0-S1532046414001270-si97.gif https://s3.amazonaws.com/prod-ucs-content-store-us-east/content/pii:S1532046414001270/STRIPIN/image/gif/a6423348ea6485bd4bf3c1e6cd16612a/si97.gif https://s3-eu-west-1.amazonaws.com/prod-ucs-content-store-eu-west/content/pii:S1532046414001270/STRIPIN/image/gif/a6423348ea6485bd4bf3c1e6cd16612a/si97.gif si97 si97.gif gif 383 17 15 ALTIMG 1-s2.0-S1532046414001270-si95.gif https://s3.amazonaws.com/prod-ucs-content-store-us-east/content/pii:S1532046414001270/STRIPIN/image/gif/124b91672ead1d228b37917e0e2d9593/si95.gif https://s3-eu-west-1.amazonaws.com/prod-ucs-content-store-eu-west/content/pii:S1532046414001270/STRIPIN/image/gif/124b91672ead1d228b37917e0e2d9593/si95.gif si95 si95.gif gif 391 14 15 ALTIMG 1-s2.0-S1532046414001270-si93.gif https://s3.amazonaws.com/prod-ucs-content-store-us-east/content/pii:S1532046414001270/STRIPIN/image/gif/a028c4825ec436d66fb3f8ef99db6d42/si93.gif https://s3-eu-west-1.amazonaws.com/prod-ucs-content-store-eu-west/content/pii:S1532046414001270/STRIPIN/image/gif/a028c4825ec436d66fb3f8ef99db6d42/si93.gif si93 si93.gif gif 503 21 18 ALTIMG 1-s2.0-S1532046414001270-si92.gif https://s3.amazonaws.com/prod-ucs-content-store-us-east/content/pii:S1532046414001270/STRIPIN/image/gif/df6da2057fcac1780daadef0c6e92380/si92.gif https://s3-eu-west-1.amazonaws.com/prod-ucs-content-store-eu-west/content/pii:S1532046414001270/STRIPIN/image/gif/df6da2057fcac1780daadef0c6e92380/si92.gif si92 si92.gif gif 823 22 45 ALTIMG 1-s2.0-S1532046414001270-si90.gif https://s3.amazonaws.com/prod-ucs-content-store-us-east/content/pii:S1532046414001270/STRIPIN/image/gif/b3de61cc074facf2330ac937ffd8275a/si90.gif https://s3-eu-west-1.amazonaws.com/prod-ucs-content-store-eu-west/content/pii:S1532046414001270/STRIPIN/image/gif/b3de61cc074facf2330ac937ffd8275a/si90.gif si90 si90.gif gif 373 11 14 ALTIMG 1-s2.0-S1532046414001270-si9.gif https://s3.amazonaws.com/prod-ucs-content-store-us-east/content/pii:S1532046414001270/STRIPIN/image/gif/29b00db1ff6bc395cc3b6cfadfa9052f/si9.gif https://s3-eu-west-1.amazonaws.com/prod-ucs-content-store-eu-west/content/pii:S1532046414001270/STRIPIN/image/gif/29b00db1ff6bc395cc3b6cfadfa9052f/si9.gif si9 si9.gif gif 743 17 65 ALTIMG 1-s2.0-S1532046414001270-si89.gif https://s3.amazonaws.com/prod-ucs-content-store-us-east/content/pii:S1532046414001270/STRIPIN/image/gif/46b915967b708713893b80f6a59f8a22/si89.gif https://s3-eu-west-1.amazonaws.com/prod-ucs-content-store-eu-west/content/pii:S1532046414001270/STRIPIN/image/gif/46b915967b708713893b80f6a59f8a22/si89.gif si89 si89.gif gif 397 14 14 ALTIMG 1-s2.0-S1532046414001270-si88.gif https://s3.amazonaws.com/prod-ucs-content-store-us-east/content/pii:S1532046414001270/STRIPIN/image/gif/ffa263ceda330a6db027df0f218ff0fe/si88.gif https://s3-eu-west-1.amazonaws.com/prod-ucs-content-store-eu-west/content/pii:S1532046414001270/STRIPIN/image/gif/ffa263ceda330a6db027df0f218ff0fe/si88.gif si88 si88.gif gif 481 19 22 ALTIMG 1-s2.0-S1532046414001270-si87.gif https://s3.amazonaws.com/prod-ucs-content-store-us-east/content/pii:S1532046414001270/STRIPIN/image/gif/abe48dbc2049e8c318aa4181d872faa5/si87.gif https://s3-eu-west-1.amazonaws.com/prod-ucs-content-store-eu-west/content/pii:S1532046414001270/STRIPIN/image/gif/abe48dbc2049e8c318aa4181d872faa5/si87.gif si87 si87.gif gif 909 19 76 ALTIMG 1-s2.0-S1532046414001270-si82.gif https://s3.amazonaws.com/prod-ucs-content-store-us-east/content/pii:S1532046414001270/STRIPIN/image/gif/5d7aef9ceef0c0376ef6c90c0e6ad2ba/si82.gif https://s3-eu-west-1.amazonaws.com/prod-ucs-content-store-eu-west/content/pii:S1532046414001270/STRIPIN/image/gif/5d7aef9ceef0c0376ef6c90c0e6ad2ba/si82.gif si82 si82.gif gif 539 18 24 ALTIMG 1-s2.0-S1532046414001270-si81.gif https://s3.amazonaws.com/prod-ucs-content-store-us-east/content/pii:S1532046414001270/STRIPIN/image/gif/c1c4496e6fbae7e270374bf6e1207fe4/si81.gif https://s3-eu-west-1.amazonaws.com/prod-ucs-content-store-eu-west/content/pii:S1532046414001270/STRIPIN/image/gif/c1c4496e6fbae7e270374bf6e1207fe4/si81.gif si81 si81.gif gif 555 18 27 ALTIMG 1-s2.0-S1532046414001270-si8.gif https://s3.amazonaws.com/prod-ucs-content-store-us-east/content/pii:S1532046414001270/STRIPIN/image/gif/766e79ea1f9eee36a71298902cb28b4d/si8.gif https://s3-eu-west-1.amazonaws.com/prod-ucs-content-store-eu-west/content/pii:S1532046414001270/STRIPIN/image/gif/766e79ea1f9eee36a71298902cb28b4d/si8.gif si8 si8.gif gif 483 14 40 ALTIMG 1-s2.0-S1532046414001270-si79.gif https://s3.amazonaws.com/prod-ucs-content-store-us-east/content/pii:S1532046414001270/STRIPIN/image/gif/43f30c7bd748aab22c59d76167af5f29/si79.gif https://s3-eu-west-1.amazonaws.com/prod-ucs-content-store-eu-west/content/pii:S1532046414001270/STRIPIN/image/gif/43f30c7bd748aab22c59d76167af5f29/si79.gif si79 si79.gif gif 507 14 30 ALTIMG 1-s2.0-S1532046414001270-si78.gif https://s3.amazonaws.com/prod-ucs-content-store-us-east/content/pii:S1532046414001270/STRIPIN/image/gif/f1b8410905a8803a98c43a191819a82a/si78.gif https://s3-eu-west-1.amazonaws.com/prod-ucs-content-store-eu-west/content/pii:S1532046414001270/STRIPIN/image/gif/f1b8410905a8803a98c43a191819a82a/si78.gif si78 si78.gif gif 513 18 23 ALTIMG 1-s2.0-S1532046414001270-si77.gif https://s3.amazonaws.com/prod-ucs-content-store-us-east/content/pii:S1532046414001270/STRIPIN/image/gif/adb4cb1655389ab30ff72398e5c77be7/si68.gif https://s3-eu-west-1.amazonaws.com/prod-ucs-content-store-eu-west/content/pii:S1532046414001270/STRIPIN/image/gif/adb4cb1655389ab30ff72398e5c77be7/si68.gif si77 si77.gif gif 278 17 25 ALTIMG 1-s2.0-S1532046414001270-si76.gif https://s3.amazonaws.com/prod-ucs-content-store-us-east/content/pii:S1532046414001270/STRIPIN/image/gif/c9bfb163e614096d84ca831ea55d128e/si72.gif https://s3-eu-west-1.amazonaws.com/prod-ucs-content-store-eu-west/content/pii:S1532046414001270/STRIPIN/image/gif/c9bfb163e614096d84ca831ea55d128e/si72.gif si76 si76.gif gif 218 14 14 ALTIMG 1-s2.0-S1532046414001270-si75.gif https://s3.amazonaws.com/prod-ucs-content-store-us-east/content/pii:S1532046414001270/STRIPIN/image/gif/8f1417953b14fb6e567a1de3d9d3c060/si75.gif https://s3-eu-west-1.amazonaws.com/prod-ucs-content-store-eu-west/content/pii:S1532046414001270/STRIPIN/image/gif/8f1417953b14fb6e567a1de3d9d3c060/si75.gif si75 si75.gif gif 231 14 17 ALTIMG 1-s2.0-S1532046414001270-si74.gif https://s3.amazonaws.com/prod-ucs-content-store-us-east/content/pii:S1532046414001270/STRIPIN/image/gif/ef53c43d0c15a6f1ecc11fc3bef2074a/si74.gif https://s3-eu-west-1.amazonaws.com/prod-ucs-content-store-eu-west/content/pii:S1532046414001270/STRIPIN/image/gif/ef53c43d0c15a6f1ecc11fc3bef2074a/si74.gif si74 si74.gif gif 212 14 13 ALTIMG 1-s2.0-S1532046414001270-si72.gif https://s3.amazonaws.com/prod-ucs-content-store-us-east/content/pii:S1532046414001270/STRIPIN/image/gif/c9bfb163e614096d84ca831ea55d128e/si72.gif https://s3-eu-west-1.amazonaws.com/prod-ucs-content-store-eu-west/content/pii:S1532046414001270/STRIPIN/image/gif/c9bfb163e614096d84ca831ea55d128e/si72.gif si72 si72.gif gif 218 14 14 ALTIMG 1-s2.0-S1532046414001270-si71.gif https://s3.amazonaws.com/prod-ucs-content-store-us-east/content/pii:S1532046414001270/STRIPIN/image/gif/63c2ebf463ac2b992f041d90b743ad8c/si71.gif https://s3-eu-west-1.amazonaws.com/prod-ucs-content-store-eu-west/content/pii:S1532046414001270/STRIPIN/image/gif/63c2ebf463ac2b992f041d90b743ad8c/si71.gif si71 si71.gif gif 230 14 16 ALTIMG 1-s2.0-S1532046414001270-si7.gif https://s3.amazonaws.com/prod-ucs-content-store-us-east/content/pii:S1532046414001270/STRIPIN/image/gif/848cd884d5bfa3630579964aa46cec23/si7.gif https://s3-eu-west-1.amazonaws.com/prod-ucs-content-store-eu-west/content/pii:S1532046414001270/STRIPIN/image/gif/848cd884d5bfa3630579964aa46cec23/si7.gif si7 si7.gif gif 254 13 41 ALTIMG 1-s2.0-S1532046414001270-si69.gif https://s3.amazonaws.com/prod-ucs-content-store-us-east/content/pii:S1532046414001270/STRIPIN/image/gif/d3fb1543067d2104daa833e6b8307506/si69.gif https://s3-eu-west-1.amazonaws.com/prod-ucs-content-store-eu-west/content/pii:S1532046414001270/STRIPIN/image/gif/d3fb1543067d2104daa833e6b8307506/si69.gif si69 si69.gif gif 278 18 23 ALTIMG 1-s2.0-S1532046414001270-si68.gif https://s3.amazonaws.com/prod-ucs-content-store-us-east/content/pii:S1532046414001270/STRIPIN/image/gif/adb4cb1655389ab30ff72398e5c77be7/si68.gif https://s3-eu-west-1.amazonaws.com/prod-ucs-content-store-eu-west/content/pii:S1532046414001270/STRIPIN/image/gif/adb4cb1655389ab30ff72398e5c77be7/si68.gif si68 si68.gif gif 278 17 25 ALTIMG 1-s2.0-S1532046414001270-si67.gif https://s3.amazonaws.com/prod-ucs-content-store-us-east/content/pii:S1532046414001270/STRIPIN/image/gif/a4e3d30ea1caae8298801bc3fdaf77d7/si65.gif https://s3-eu-west-1.amazonaws.com/prod-ucs-content-store-eu-west/content/pii:S1532046414001270/STRIPIN/image/gif/a4e3d30ea1caae8298801bc3fdaf77d7/si65.gif si67 si67.gif gif 267 14 28 ALTIMG 1-s2.0-S1532046414001270-si65.gif https://s3.amazonaws.com/prod-ucs-content-store-us-east/content/pii:S1532046414001270/STRIPIN/image/gif/a4e3d30ea1caae8298801bc3fdaf77d7/si65.gif https://s3-eu-west-1.amazonaws.com/prod-ucs-content-store-eu-west/content/pii:S1532046414001270/STRIPIN/image/gif/a4e3d30ea1caae8298801bc3fdaf77d7/si65.gif si65 si65.gif gif 267 14 28 ALTIMG 1-s2.0-S1532046414001270-si64.gif https://s3.amazonaws.com/prod-ucs-content-store-us-east/content/pii:S1532046414001270/STRIPIN/image/gif/8268f7adeefb67803d66ed5f856b7c2e/si64.gif https://s3-eu-west-1.amazonaws.com/prod-ucs-content-store-eu-west/content/pii:S1532046414001270/STRIPIN/image/gif/8268f7adeefb67803d66ed5f856b7c2e/si64.gif si64 si64.gif gif 220 14 14 ALTIMG 1-s2.0-S1532046414001270-si63.gif https://s3.amazonaws.com/prod-ucs-content-store-us-east/content/pii:S1532046414001270/STRIPIN/image/gif/fc92fbdbdea91cd676cd9b87b98a45cc/si63.gif https://s3-eu-west-1.amazonaws.com/prod-ucs-content-store-eu-west/content/pii:S1532046414001270/STRIPIN/image/gif/fc92fbdbdea91cd676cd9b87b98a45cc/si63.gif si63 si63.gif gif 208 11 14 ALTIMG 1-s2.0-S1532046414001270-si62.gif https://s3.amazonaws.com/prod-ucs-content-store-us-east/content/pii:S1532046414001270/STRIPIN/image/gif/574bac7450d534a58b2b5f77c63a176d/si62.gif https://s3-eu-west-1.amazonaws.com/prod-ucs-content-store-eu-west/content/pii:S1532046414001270/STRIPIN/image/gif/574bac7450d534a58b2b5f77c63a176d/si62.gif si62 si62.gif gif 476 19 76 ALTIMG 1-s2.0-S1532046414001270-si61.gif https://s3.amazonaws.com/prod-ucs-content-store-us-east/content/pii:S1532046414001270/STRIPIN/image/gif/1d9d6e69b0038cb3e0295331a90f563a/si61.gif https://s3-eu-west-1.amazonaws.com/prod-ucs-content-store-eu-west/content/pii:S1532046414001270/STRIPIN/image/gif/1d9d6e69b0038cb3e0295331a90f563a/si61.gif si61 si61.gif gif 411 17 64 ALTIMG 1-s2.0-S1532046414001270-si60.gif https://s3.amazonaws.com/prod-ucs-content-store-us-east/content/pii:S1532046414001270/STRIPIN/image/gif/b7b59eadad204198fbb82ba7305adb75/si60.gif https://s3-eu-west-1.amazonaws.com/prod-ucs-content-store-eu-west/content/pii:S1532046414001270/STRIPIN/image/gif/b7b59eadad204198fbb82ba7305adb75/si60.gif si60 si60.gif gif 257 10 39 ALTIMG 1-s2.0-S1532046414001270-si6.gif https://s3.amazonaws.com/prod-ucs-content-store-us-east/content/pii:S1532046414001270/STRIPIN/image/gif/a18eeebaf1f1d7d97e18c1ca08066e13/si27.gif https://s3-eu-west-1.amazonaws.com/prod-ucs-content-store-eu-west/content/pii:S1532046414001270/STRIPIN/image/gif/a18eeebaf1f1d7d97e18c1ca08066e13/si27.gif si6 si6.gif gif 393 17 65 ALTIMG 1-s2.0-S1532046414001270-si59.gif https://s3.amazonaws.com/prod-ucs-content-store-us-east/content/pii:S1532046414001270/STRIPIN/image/gif/dc10ac570102275178dc186b9ab8dce6/si59.gif https://s3-eu-west-1.amazonaws.com/prod-ucs-content-store-eu-west/content/pii:S1532046414001270/STRIPIN/image/gif/dc10ac570102275178dc186b9ab8dce6/si59.gif si59 si59.gif gif 224 13 18 ALTIMG 1-s2.0-S1532046414001270-si58.gif https://s3.amazonaws.com/prod-ucs-content-store-us-east/content/pii:S1532046414001270/STRIPIN/image/gif/7b070e5b50a651cf41bf671de5d4aff0/si58.gif https://s3-eu-west-1.amazonaws.com/prod-ucs-content-store-eu-west/content/pii:S1532046414001270/STRIPIN/image/gif/7b070e5b50a651cf41bf671de5d4aff0/si58.gif si58 si58.gif gif 235 13 19 ALTIMG 1-s2.0-S1532046414001270-si56.gif https://s3.amazonaws.com/prod-ucs-content-store-us-east/content/pii:S1532046414001270/STRIPIN/image/gif/26e4ece7eabb107e43a16d825b5d6719/si56.gif https://s3-eu-west-1.amazonaws.com/prod-ucs-content-store-eu-west/content/pii:S1532046414001270/STRIPIN/image/gif/26e4ece7eabb107e43a16d825b5d6719/si56.gif si56 si56.gif gif 221 13 14 ALTIMG 1-s2.0-S1532046414001270-si55.gif https://s3.amazonaws.com/prod-ucs-content-store-us-east/content/pii:S1532046414001270/STRIPIN/image/gif/fc92fbdbdea91cd676cd9b87b98a45cc/si63.gif https://s3-eu-west-1.amazonaws.com/prod-ucs-content-store-eu-west/content/pii:S1532046414001270/STRIPIN/image/gif/fc92fbdbdea91cd676cd9b87b98a45cc/si63.gif si55 si55.gif gif 208 11 14 ALTIMG 1-s2.0-S1532046414001270-si53.gif https://s3.amazonaws.com/prod-ucs-content-store-us-east/content/pii:S1532046414001270/STRIPIN/image/gif/9402a961d7d63a9d2f3541d804b68cc5/si52.gif https://s3-eu-west-1.amazonaws.com/prod-ucs-content-store-eu-west/content/pii:S1532046414001270/STRIPIN/image/gif/9402a961d7d63a9d2f3541d804b68cc5/si52.gif si53 si53.gif gif 316 17 40 ALTIMG 1-s2.0-S1532046414001270-si52.gif https://s3.amazonaws.com/prod-ucs-content-store-us-east/content/pii:S1532046414001270/STRIPIN/image/gif/9402a961d7d63a9d2f3541d804b68cc5/si52.gif https://s3-eu-west-1.amazonaws.com/prod-ucs-content-store-eu-west/content/pii:S1532046414001270/STRIPIN/image/gif/9402a961d7d63a9d2f3541d804b68cc5/si52.gif si52 si52.gif gif 316 17 40 ALTIMG 1-s2.0-S1532046414001270-si51.gif https://s3.amazonaws.com/prod-ucs-content-store-us-east/content/pii:S1532046414001270/STRIPIN/image/gif/fcc3645b30d024da858895e4c07fe2ee/si51.gif https://s3-eu-west-1.amazonaws.com/prod-ucs-content-store-eu-west/content/pii:S1532046414001270/STRIPIN/image/gif/fcc3645b30d024da858895e4c07fe2ee/si51.gif si51 si51.gif gif 895 18 166 ALTIMG 1-s2.0-S1532046414001270-si50.gif https://s3.amazonaws.com/prod-ucs-content-store-us-east/content/pii:S1532046414001270/STRIPIN/image/gif/61274b6738948aece7bb2cb60c7036ee/si50.gif https://s3-eu-west-1.amazonaws.com/prod-ucs-content-store-eu-west/content/pii:S1532046414001270/STRIPIN/image/gif/61274b6738948aece7bb2cb60c7036ee/si50.gif si50 si50.gif gif 209 16 11 ALTIMG 1-s2.0-S1532046414001270-si5.gif https://s3.amazonaws.com/prod-ucs-content-store-us-east/content/pii:S1532046414001270/STRIPIN/image/gif/516c7b45877ae1cfaaec4a2228d31874/si5.gif https://s3-eu-west-1.amazonaws.com/prod-ucs-content-store-eu-west/content/pii:S1532046414001270/STRIPIN/image/gif/516c7b45877ae1cfaaec4a2228d31874/si5.gif si5 si5.gif gif 316 14 50 ALTIMG 1-s2.0-S1532046414001270-si49.gif https://s3.amazonaws.com/prod-ucs-content-store-us-east/content/pii:S1532046414001270/STRIPIN/image/gif/dc0bfd8e4994c18a3ddb6dd0372c4892/si49.gif https://s3-eu-west-1.amazonaws.com/prod-ucs-content-store-eu-west/content/pii:S1532046414001270/STRIPIN/image/gif/dc0bfd8e4994c18a3ddb6dd0372c4892/si49.gif si49 si49.gif gif 420 17 83 ALTIMG 1-s2.0-S1532046414001270-si48.gif https://s3.amazonaws.com/prod-ucs-content-store-us-east/content/pii:S1532046414001270/STRIPIN/image/gif/d6050b1817e403553f83893374748bdf/si48.gif https://s3-eu-west-1.amazonaws.com/prod-ucs-content-store-eu-west/content/pii:S1532046414001270/STRIPIN/image/gif/d6050b1817e403553f83893374748bdf/si48.gif si48 si48.gif gif 574 17 131 ALTIMG 1-s2.0-S1532046414001270-si47.gif https://s3.amazonaws.com/prod-ucs-content-store-us-east/content/pii:S1532046414001270/STRIPIN/image/gif/74a6e7eaa1f30ca4b00b7fcb796ae83f/si47.gif https://s3-eu-west-1.amazonaws.com/prod-ucs-content-store-eu-west/content/pii:S1532046414001270/STRIPIN/image/gif/74a6e7eaa1f30ca4b00b7fcb796ae83f/si47.gif si47 si47.gif gif 996 18 193 ALTIMG 1-s2.0-S1532046414001270-si46.gif https://s3.amazonaws.com/prod-ucs-content-store-us-east/content/pii:S1532046414001270/STRIPIN/image/gif/80f20bed2c8884abe17f5eb2bfc9815b/si46.gif https://s3-eu-west-1.amazonaws.com/prod-ucs-content-store-eu-west/content/pii:S1532046414001270/STRIPIN/image/gif/80f20bed2c8884abe17f5eb2bfc9815b/si46.gif si46 si46.gif gif 721 17 133 ALTIMG 1-s2.0-S1532046414001270-si45.gif https://s3.amazonaws.com/prod-ucs-content-store-us-east/content/pii:S1532046414001270/STRIPIN/image/gif/f93b3f162950323c1b56628f08d9d948/si45.gif https://s3-eu-west-1.amazonaws.com/prod-ucs-content-store-eu-west/content/pii:S1532046414001270/STRIPIN/image/gif/f93b3f162950323c1b56628f08d9d948/si45.gif si45 si45.gif gif 453 17 94 ALTIMG 1-s2.0-S1532046414001270-si44.gif https://s3.amazonaws.com/prod-ucs-content-store-us-east/content/pii:S1532046414001270/STRIPIN/image/gif/468d4e8838c987a4705f0e5c0237db8d/si44.gif https://s3-eu-west-1.amazonaws.com/prod-ucs-content-store-eu-west/content/pii:S1532046414001270/STRIPIN/image/gif/468d4e8838c987a4705f0e5c0237db8d/si44.gif si44 si44.gif gif 299 16 39 ALTIMG 1-s2.0-S1532046414001270-si43.gif https://s3.amazonaws.com/prod-ucs-content-store-us-east/content/pii:S1532046414001270/STRIPIN/image/gif/99647aa6395dad7bf1ac87e9564868a4/si43.gif https://s3-eu-west-1.amazonaws.com/prod-ucs-content-store-eu-west/content/pii:S1532046414001270/STRIPIN/image/gif/99647aa6395dad7bf1ac87e9564868a4/si43.gif si43 si43.gif gif 412 17 50 ALTIMG 1-s2.0-S1532046414001270-si42.gif https://s3.amazonaws.com/prod-ucs-content-store-us-east/content/pii:S1532046414001270/STRIPIN/image/gif/b3dcc84b66d6a7fdb18ce680016c6ba1/si42.gif https://s3-eu-west-1.amazonaws.com/prod-ucs-content-store-eu-west/content/pii:S1532046414001270/STRIPIN/image/gif/b3dcc84b66d6a7fdb18ce680016c6ba1/si42.gif si42 si42.gif gif 467 18 68 ALTIMG 1-s2.0-S1532046414001270-si41.gif https://s3.amazonaws.com/prod-ucs-content-store-us-east/content/pii:S1532046414001270/STRIPIN/image/gif/05fd0dceb52b22b61dea37f1b9b00650/si41.gif https://s3-eu-west-1.amazonaws.com/prod-ucs-content-store-eu-west/content/pii:S1532046414001270/STRIPIN/image/gif/05fd0dceb52b22b61dea37f1b9b00650/si41.gif si41 si41.gif gif 304 17 38 ALTIMG 1-s2.0-S1532046414001270-si40.gif https://s3.amazonaws.com/prod-ucs-content-store-us-east/content/pii:S1532046414001270/STRIPIN/image/gif/925eed500dcc01869d260eb1550bc47f/si40.gif https://s3-eu-west-1.amazonaws.com/prod-ucs-content-store-eu-west/content/pii:S1532046414001270/STRIPIN/image/gif/925eed500dcc01869d260eb1550bc47f/si40.gif si40 si40.gif gif 200 13 10 ALTIMG 1-s2.0-S1532046414001270-si4.gif https://s3.amazonaws.com/prod-ucs-content-store-us-east/content/pii:S1532046414001270/STRIPIN/image/gif/8aeb04a736c9163438c30d0574896c71/si4.gif https://s3-eu-west-1.amazonaws.com/prod-ucs-content-store-eu-west/content/pii:S1532046414001270/STRIPIN/image/gif/8aeb04a736c9163438c30d0574896c71/si4.gif si4 si4.gif gif 319 14 50 ALTIMG 1-s2.0-S1532046414001270-si39.gif https://s3.amazonaws.com/prod-ucs-content-store-us-east/content/pii:S1532046414001270/STRIPIN/image/gif/c180b45c19bb0221179a37260ed1de9c/si39.gif https://s3-eu-west-1.amazonaws.com/prod-ucs-content-store-eu-west/content/pii:S1532046414001270/STRIPIN/image/gif/c180b45c19bb0221179a37260ed1de9c/si39.gif si39 si39.gif gif 987 17 205 ALTIMG 1-s2.0-S1532046414001270-si38.gif https://s3.amazonaws.com/prod-ucs-content-store-us-east/content/pii:S1532046414001270/STRIPIN/image/gif/05fd0dceb52b22b61dea37f1b9b00650/si41.gif https://s3-eu-west-1.amazonaws.com/prod-ucs-content-store-eu-west/content/pii:S1532046414001270/STRIPIN/image/gif/05fd0dceb52b22b61dea37f1b9b00650/si41.gif si38 si38.gif gif 304 17 38 ALTIMG 1-s2.0-S1532046414001270-si37.gif https://s3.amazonaws.com/prod-ucs-content-store-us-east/content/pii:S1532046414001270/STRIPIN/image/gif/d50c3bdc19311a3e908e537860541f5c/si37.gif https://s3-eu-west-1.amazonaws.com/prod-ucs-content-store-eu-west/content/pii:S1532046414001270/STRIPIN/image/gif/d50c3bdc19311a3e908e537860541f5c/si37.gif si37 si37.gif gif 367 16 49 ALTIMG 1-s2.0-S1532046414001270-si36.gif https://s3.amazonaws.com/prod-ucs-content-store-us-east/content/pii:S1532046414001270/STRIPIN/image/gif/5fd156e730149f3baf1405f795eaa501/si36.gif https://s3-eu-west-1.amazonaws.com/prod-ucs-content-store-eu-west/content/pii:S1532046414001270/STRIPIN/image/gif/5fd156e730149f3baf1405f795eaa501/si36.gif si36 si36.gif gif 347 16 52 ALTIMG 1-s2.0-S1532046414001270-si35.gif https://s3.amazonaws.com/prod-ucs-content-store-us-east/content/pii:S1532046414001270/STRIPIN/image/gif/80f20bed2c8884abe17f5eb2bfc9815b/si46.gif https://s3-eu-west-1.amazonaws.com/prod-ucs-content-store-eu-west/content/pii:S1532046414001270/STRIPIN/image/gif/80f20bed2c8884abe17f5eb2bfc9815b/si46.gif si35 si35.gif gif 721 17 133 ALTIMG 1-s2.0-S1532046414001270-si34.gif https://s3.amazonaws.com/prod-ucs-content-store-us-east/content/pii:S1532046414001270/STRIPIN/image/gif/bca08bfd0c54c9f017060a9f433000eb/si33.gif https://s3-eu-west-1.amazonaws.com/prod-ucs-content-store-eu-west/content/pii:S1532046414001270/STRIPIN/image/gif/bca08bfd0c54c9f017060a9f433000eb/si33.gif si34 si34.gif gif 217 14 15 ALTIMG 1-s2.0-S1532046414001270-si33.gif https://s3.amazonaws.com/prod-ucs-content-store-us-east/content/pii:S1532046414001270/STRIPIN/image/gif/bca08bfd0c54c9f017060a9f433000eb/si33.gif https://s3-eu-west-1.amazonaws.com/prod-ucs-content-store-eu-west/content/pii:S1532046414001270/STRIPIN/image/gif/bca08bfd0c54c9f017060a9f433000eb/si33.gif si33 si33.gif gif 217 14 15 ALTIMG 1-s2.0-S1532046414001270-si32.gif https://s3.amazonaws.com/prod-ucs-content-store-us-east/content/pii:S1532046414001270/STRIPIN/image/gif/bca08bfd0c54c9f017060a9f433000eb/si33.gif https://s3-eu-west-1.amazonaws.com/prod-ucs-content-store-eu-west/content/pii:S1532046414001270/STRIPIN/image/gif/bca08bfd0c54c9f017060a9f433000eb/si33.gif si32 si32.gif gif 217 14 15 ALTIMG 1-s2.0-S1532046414001270-si31.gif https://s3.amazonaws.com/prod-ucs-content-store-us-east/content/pii:S1532046414001270/STRIPIN/image/gif/fc92fbdbdea91cd676cd9b87b98a45cc/si63.gif https://s3-eu-west-1.amazonaws.com/prod-ucs-content-store-eu-west/content/pii:S1532046414001270/STRIPIN/image/gif/fc92fbdbdea91cd676cd9b87b98a45cc/si63.gif si31 si31.gif gif 208 11 14 ALTIMG 1-s2.0-S1532046414001270-si30.gif https://s3.amazonaws.com/prod-ucs-content-store-us-east/content/pii:S1532046414001270/STRIPIN/image/gif/c489a395f64f05bf63e125f70c014d3f/si30.gif https://s3-eu-west-1.amazonaws.com/prod-ucs-content-store-eu-west/content/pii:S1532046414001270/STRIPIN/image/gif/c489a395f64f05bf63e125f70c014d3f/si30.gif si30 si30.gif gif 471 17 100 ALTIMG 1-s2.0-S1532046414001270-si3.gif https://s3.amazonaws.com/prod-ucs-content-store-us-east/content/pii:S1532046414001270/STRIPIN/image/gif/a18eeebaf1f1d7d97e18c1ca08066e13/si27.gif https://s3-eu-west-1.amazonaws.com/prod-ucs-content-store-eu-west/content/pii:S1532046414001270/STRIPIN/image/gif/a18eeebaf1f1d7d97e18c1ca08066e13/si27.gif si3 si3.gif gif 393 17 65 ALTIMG 1-s2.0-S1532046414001270-si29.gif https://s3.amazonaws.com/prod-ucs-content-store-us-east/content/pii:S1532046414001270/STRIPIN/image/gif/29533ae20e63f671fcb3f59daef73f3a/si29.gif https://s3-eu-west-1.amazonaws.com/prod-ucs-content-store-eu-west/content/pii:S1532046414001270/STRIPIN/image/gif/29533ae20e63f671fcb3f59daef73f3a/si29.gif si29 si29.gif gif 400 16 75 ALTIMG 1-s2.0-S1532046414001270-si28.gif https://s3.amazonaws.com/prod-ucs-content-store-us-east/content/pii:S1532046414001270/STRIPIN/image/gif/afdd36cb9fe147b10574d12e712851c6/si28.gif https://s3-eu-west-1.amazonaws.com/prod-ucs-content-store-eu-west/content/pii:S1532046414001270/STRIPIN/image/gif/afdd36cb9fe147b10574d12e712851c6/si28.gif si28 si28.gif gif 1373 17 355 ALTIMG 1-s2.0-S1532046414001270-si27.gif https://s3.amazonaws.com/prod-ucs-content-store-us-east/content/pii:S1532046414001270/STRIPIN/image/gif/a18eeebaf1f1d7d97e18c1ca08066e13/si27.gif https://s3-eu-west-1.amazonaws.com/prod-ucs-content-store-eu-west/content/pii:S1532046414001270/STRIPIN/image/gif/a18eeebaf1f1d7d97e18c1ca08066e13/si27.gif si27 si27.gif gif 393 17 65 ALTIMG 1-s2.0-S1532046414001270-si26.gif https://s3.amazonaws.com/prod-ucs-content-store-us-east/content/pii:S1532046414001270/STRIPIN/image/gif/e689c368fac0a3f38a756b6873c69c6c/si26.gif https://s3-eu-west-1.amazonaws.com/prod-ucs-content-store-eu-west/content/pii:S1532046414001270/STRIPIN/image/gif/e689c368fac0a3f38a756b6873c69c6c/si26.gif si26 si26.gif gif 389 16 73 ALTIMG 1-s2.0-S1532046414001270-si25.gif https://s3.amazonaws.com/prod-ucs-content-store-us-east/content/pii:S1532046414001270/STRIPIN/image/gif/fa3e21351033456ec9487bafcb437670/si25.gif https://s3-eu-west-1.amazonaws.com/prod-ucs-content-store-eu-west/content/pii:S1532046414001270/STRIPIN/image/gif/fa3e21351033456ec9487bafcb437670/si25.gif si25 si25.gif gif 265 17 26 ALTIMG 1-s2.0-S1532046414001270-si24.gif https://s3.amazonaws.com/prod-ucs-content-store-us-east/content/pii:S1532046414001270/STRIPIN/image/gif/88ad646719f58c137adf2e737aadc0cc/si24.gif https://s3-eu-west-1.amazonaws.com/prod-ucs-content-store-eu-west/content/pii:S1532046414001270/STRIPIN/image/gif/88ad646719f58c137adf2e737aadc0cc/si24.gif si24 si24.gif gif 246 16 39 ALTIMG 1-s2.0-S1532046414001270-si23.gif https://s3.amazonaws.com/prod-ucs-content-store-us-east/content/pii:S1532046414001270/STRIPIN/image/gif/a175e31f3b1e987cdde7e08e50ab7839/si23.gif https://s3-eu-west-1.amazonaws.com/prod-ucs-content-store-eu-west/content/pii:S1532046414001270/STRIPIN/image/gif/a175e31f3b1e987cdde7e08e50ab7839/si23.gif si23 si23.gif gif 340 20 64 ALTIMG 1-s2.0-S1532046414001270-si22.gif https://s3.amazonaws.com/prod-ucs-content-store-us-east/content/pii:S1532046414001270/STRIPIN/image/gif/a18eeebaf1f1d7d97e18c1ca08066e13/si27.gif https://s3-eu-west-1.amazonaws.com/prod-ucs-content-store-eu-west/content/pii:S1532046414001270/STRIPIN/image/gif/a18eeebaf1f1d7d97e18c1ca08066e13/si27.gif si22 si22.gif gif 393 17 65 ALTIMG 1-s2.0-S1532046414001270-si21.gif https://s3.amazonaws.com/prod-ucs-content-store-us-east/content/pii:S1532046414001270/STRIPIN/image/gif/4480527ce5e79c4e4cfbf3ca7c50f741/si21.gif https://s3-eu-west-1.amazonaws.com/prod-ucs-content-store-eu-west/content/pii:S1532046414001270/STRIPIN/image/gif/4480527ce5e79c4e4cfbf3ca7c50f741/si21.gif si21 si21.gif gif 288 17 34 ALTIMG 1-s2.0-S1532046414001270-si20.gif https://s3.amazonaws.com/prod-ucs-content-store-us-east/content/pii:S1532046414001270/STRIPIN/image/gif/03c5d0785e34cc67498cf7d4535affc3/si20.gif https://s3-eu-west-1.amazonaws.com/prod-ucs-content-store-eu-west/content/pii:S1532046414001270/STRIPIN/image/gif/03c5d0785e34cc67498cf7d4535affc3/si20.gif si20 si20.gif gif 334 17 65 ALTIMG 1-s2.0-S1532046414001270-si2.gif https://s3.amazonaws.com/prod-ucs-content-store-us-east/content/pii:S1532046414001270/STRIPIN/image/gif/bf88872e5a10d8d88c4390137964cf88/si2.gif https://s3-eu-west-1.amazonaws.com/prod-ucs-content-store-eu-west/content/pii:S1532046414001270/STRIPIN/image/gif/bf88872e5a10d8d88c4390137964cf88/si2.gif si2 si2.gif gif 300 14 50 ALTIMG 1-s2.0-S1532046414001270-si19.gif https://s3.amazonaws.com/prod-ucs-content-store-us-east/content/pii:S1532046414001270/STRIPIN/image/gif/24d62eee87205d3521c585adcd9fefbf/si19.gif https://s3-eu-west-1.amazonaws.com/prod-ucs-content-store-eu-west/content/pii:S1532046414001270/STRIPIN/image/gif/24d62eee87205d3521c585adcd9fefbf/si19.gif si19 si19.gif gif 348 17 65 ALTIMG 1-s2.0-S1532046414001270-si18.gif https://s3.amazonaws.com/prod-ucs-content-store-us-east/content/pii:S1532046414001270/STRIPIN/image/gif/a18eeebaf1f1d7d97e18c1ca08066e13/si27.gif https://s3-eu-west-1.amazonaws.com/prod-ucs-content-store-eu-west/content/pii:S1532046414001270/STRIPIN/image/gif/a18eeebaf1f1d7d97e18c1ca08066e13/si27.gif si18 si18.gif gif 393 17 65 ALTIMG 1-s2.0-S1532046414001270-si17.gif https://s3.amazonaws.com/prod-ucs-content-store-us-east/content/pii:S1532046414001270/STRIPIN/image/gif/ef1922f0eb092ce87fd3521178e1f9dd/si17.gif https://s3-eu-west-1.amazonaws.com/prod-ucs-content-store-eu-west/content/pii:S1532046414001270/STRIPIN/image/gif/ef1922f0eb092ce87fd3521178e1f9dd/si17.gif si17 si17.gif gif 265 13 43 ALTIMG 1-s2.0-S1532046414001270-si16.gif https://s3.amazonaws.com/prod-ucs-content-store-us-east/content/pii:S1532046414001270/STRIPIN/image/gif/d81a3295fc653d9bd4540db9a42f6cb8/si16.gif https://s3-eu-west-1.amazonaws.com/prod-ucs-content-store-eu-west/content/pii:S1532046414001270/STRIPIN/image/gif/d81a3295fc653d9bd4540db9a42f6cb8/si16.gif si16 si16.gif gif 297 14 52 ALTIMG 1-s2.0-S1532046414001270-si15.gif https://s3.amazonaws.com/prod-ucs-content-store-us-east/content/pii:S1532046414001270/STRIPIN/image/gif/a18eeebaf1f1d7d97e18c1ca08066e13/si27.gif https://s3-eu-west-1.amazonaws.com/prod-ucs-content-store-eu-west/content/pii:S1532046414001270/STRIPIN/image/gif/a18eeebaf1f1d7d97e18c1ca08066e13/si27.gif si15 si15.gif gif 393 17 65 ALTIMG 1-s2.0-S1532046414001270-si142.gif https://s3.amazonaws.com/prod-ucs-content-store-us-east/content/pii:S1532046414001270/STRIPIN/image/gif/26eab395ec77585e8ee64e96a358cd61/si142.gif https://s3-eu-west-1.amazonaws.com/prod-ucs-content-store-eu-west/content/pii:S1532046414001270/STRIPIN/image/gif/26eab395ec77585e8ee64e96a358cd61/si142.gif si142 si142.gif gif 385 14 64 ALTIMG 1-s2.0-S1532046414001270-si141.gif https://s3.amazonaws.com/prod-ucs-content-store-us-east/content/pii:S1532046414001270/STRIPIN/image/gif/7a9900f67d5ce27b6d9a9c95ba20e03f/si141.gif https://s3-eu-west-1.amazonaws.com/prod-ucs-content-store-eu-west/content/pii:S1532046414001270/STRIPIN/image/gif/7a9900f67d5ce27b6d9a9c95ba20e03f/si141.gif si141 si141.gif gif 190 13 10 ALTIMG 1-s2.0-S1532046414001270-si140.gif https://s3.amazonaws.com/prod-ucs-content-store-us-east/content/pii:S1532046414001270/STRIPIN/image/gif/1d3af5db6d8d472148f03ca0cd64ff05/si140.gif https://s3-eu-west-1.amazonaws.com/prod-ucs-content-store-eu-west/content/pii:S1532046414001270/STRIPIN/image/gif/1d3af5db6d8d472148f03ca0cd64ff05/si140.gif si140 si140.gif gif 194 10 12 ALTIMG 1-s2.0-S1532046414001270-si14.gif https://s3.amazonaws.com/prod-ucs-content-store-us-east/content/pii:S1532046414001270/STRIPIN/image/gif/6920fcc4bad2dcf1f670e8ff883ec078/si14.gif https://s3-eu-west-1.amazonaws.com/prod-ucs-content-store-eu-west/content/pii:S1532046414001270/STRIPIN/image/gif/6920fcc4bad2dcf1f670e8ff883ec078/si14.gif si14 si14.gif gif 275 14 42 ALTIMG 1-s2.0-S1532046414001270-si139.gif https://s3.amazonaws.com/prod-ucs-content-store-us-east/content/pii:S1532046414001270/STRIPIN/image/gif/7b493365eeb4deca322168896f0163ac/si139.gif https://s3-eu-west-1.amazonaws.com/prod-ucs-content-store-eu-west/content/pii:S1532046414001270/STRIPIN/image/gif/7b493365eeb4deca322168896f0163ac/si139.gif si139 si139.gif gif 183 13 10 ALTIMG 1-s2.0-S1532046414001270-si138.gif https://s3.amazonaws.com/prod-ucs-content-store-us-east/content/pii:S1532046414001270/STRIPIN/image/gif/bfb532768131d65f7150bb6c0a7b65a7/si138.gif https://s3-eu-west-1.amazonaws.com/prod-ucs-content-store-eu-west/content/pii:S1532046414001270/STRIPIN/image/gif/bfb532768131d65f7150bb6c0a7b65a7/si138.gif si138 si138.gif gif 430 14 67 ALTIMG 1-s2.0-S1532046414001270-si137.gif https://s3.amazonaws.com/prod-ucs-content-store-us-east/content/pii:S1532046414001270/STRIPIN/image/gif/92e5cf9f68e8efefafc6b1d62f4ec44d/si137.gif https://s3-eu-west-1.amazonaws.com/prod-ucs-content-store-eu-west/content/pii:S1532046414001270/STRIPIN/image/gif/92e5cf9f68e8efefafc6b1d62f4ec44d/si137.gif si137 si137.gif gif 425 14 67 ALTIMG 1-s2.0-S1532046414001270-si136.gif https://s3.amazonaws.com/prod-ucs-content-store-us-east/content/pii:S1532046414001270/STRIPIN/image/gif/8689ec42ce7933af753f3fb9985e40cb/si136.gif https://s3-eu-west-1.amazonaws.com/prod-ucs-content-store-eu-west/content/pii:S1532046414001270/STRIPIN/image/gif/8689ec42ce7933af753f3fb9985e40cb/si136.gif si136 si136.gif gif 179 17 9 ALTIMG 1-s2.0-S1532046414001270-si135.gif https://s3.amazonaws.com/prod-ucs-content-store-us-east/content/pii:S1532046414001270/STRIPIN/image/gif/d0a2050b37f86935a48e4e3b5b5affe5/si135.gif https://s3-eu-west-1.amazonaws.com/prod-ucs-content-store-eu-west/content/pii:S1532046414001270/STRIPIN/image/gif/d0a2050b37f86935a48e4e3b5b5affe5/si135.gif si135 si135.gif gif 188 11 12 ALTIMG 1-s2.0-S1532046414001270-si133.gif https://s3.amazonaws.com/prod-ucs-content-store-us-east/content/pii:S1532046414001270/STRIPIN/image/gif/bca08bfd0c54c9f017060a9f433000eb/si33.gif https://s3-eu-west-1.amazonaws.com/prod-ucs-content-store-eu-west/content/pii:S1532046414001270/STRIPIN/image/gif/bca08bfd0c54c9f017060a9f433000eb/si33.gif si133 si133.gif gif 217 14 15 ALTIMG 1-s2.0-S1532046414001270-si132.gif https://s3.amazonaws.com/prod-ucs-content-store-us-east/content/pii:S1532046414001270/STRIPIN/image/gif/6f41c5f5de84c35d5be06524f10d1561/si132.gif https://s3-eu-west-1.amazonaws.com/prod-ucs-content-store-eu-west/content/pii:S1532046414001270/STRIPIN/image/gif/6f41c5f5de84c35d5be06524f10d1561/si132.gif si132 si132.gif gif 327 16 45 ALTIMG 1-s2.0-S1532046414001270-si13.gif https://s3.amazonaws.com/prod-ucs-content-store-us-east/content/pii:S1532046414001270/STRIPIN/image/gif/694cd30c96077b9b643ba1290e21504c/si13.gif https://s3-eu-west-1.amazonaws.com/prod-ucs-content-store-eu-west/content/pii:S1532046414001270/STRIPIN/image/gif/694cd30c96077b9b643ba1290e21504c/si13.gif si13 si13.gif gif 269 14 43 ALTIMG 1-s2.0-S1532046414001270-si126.gif https://s3.amazonaws.com/prod-ucs-content-store-us-east/content/pii:S1532046414001270/STRIPIN/image/gif/d902b3af43b5c37fe9ff59d6e663cccc/si126.gif https://s3-eu-west-1.amazonaws.com/prod-ucs-content-store-eu-west/content/pii:S1532046414001270/STRIPIN/image/gif/d902b3af43b5c37fe9ff59d6e663cccc/si126.gif si126 si126.gif gif 1036 17 252 ALTIMG 1-s2.0-S1532046414001270-si124.gif https://s3.amazonaws.com/prod-ucs-content-store-us-east/content/pii:S1532046414001270/STRIPIN/image/gif/f4ce82b9caed68d4774ad0fe155e2e00/si124.gif https://s3-eu-west-1.amazonaws.com/prod-ucs-content-store-eu-west/content/pii:S1532046414001270/STRIPIN/image/gif/f4ce82b9caed68d4774ad0fe155e2e00/si124.gif si124 si124.gif gif 574 23 75 ALTIMG 1-s2.0-S1532046414001270-si122.gif https://s3.amazonaws.com/prod-ucs-content-store-us-east/content/pii:S1532046414001270/STRIPIN/image/gif/25cb4ef2fe4f11e5bcbe9085e7ea4498/si122.gif https://s3-eu-west-1.amazonaws.com/prod-ucs-content-store-eu-west/content/pii:S1532046414001270/STRIPIN/image/gif/25cb4ef2fe4f11e5bcbe9085e7ea4498/si122.gif si122 si122.gif gif 244 14 19 ALTIMG 1-s2.0-S1532046414001270-si12.gif https://s3.amazonaws.com/prod-ucs-content-store-us-east/content/pii:S1532046414001270/STRIPIN/image/gif/a18eeebaf1f1d7d97e18c1ca08066e13/si27.gif https://s3-eu-west-1.amazonaws.com/prod-ucs-content-store-eu-west/content/pii:S1532046414001270/STRIPIN/image/gif/a18eeebaf1f1d7d97e18c1ca08066e13/si27.gif si12 si12.gif gif 393 17 65 ALTIMG 1-s2.0-S1532046414001270-si119.gif https://s3.amazonaws.com/prod-ucs-content-store-us-east/content/pii:S1532046414001270/STRIPIN/image/gif/38195c2219a8a907a9531ab7a958d517/si119.gif https://s3-eu-west-1.amazonaws.com/prod-ucs-content-store-eu-west/content/pii:S1532046414001270/STRIPIN/image/gif/38195c2219a8a907a9531ab7a958d517/si119.gif si119 si119.gif gif 325 17 31 ALTIMG 1-s2.0-S1532046414001270-si118.gif https://s3.amazonaws.com/prod-ucs-content-store-us-east/content/pii:S1532046414001270/STRIPIN/image/gif/a06da4c52ddd726bbd1256e51f8737cd/si118.gif https://s3-eu-west-1.amazonaws.com/prod-ucs-content-store-eu-west/content/pii:S1532046414001270/STRIPIN/image/gif/a06da4c52ddd726bbd1256e51f8737cd/si118.gif si118 si118.gif gif 338 24 27 ALTIMG 1-s2.0-S1532046414001270-si117.gif https://s3.amazonaws.com/prod-ucs-content-store-us-east/content/pii:S1532046414001270/STRIPIN/image/gif/761f6cc2ae0d4a44dbf6c0e60cc733bf/si117.gif https://s3-eu-west-1.amazonaws.com/prod-ucs-content-store-eu-west/content/pii:S1532046414001270/STRIPIN/image/gif/761f6cc2ae0d4a44dbf6c0e60cc733bf/si117.gif si117 si117.gif gif 276 16 23 ALTIMG 1-s2.0-S1532046414001270-si115.gif https://s3.amazonaws.com/prod-ucs-content-store-us-east/content/pii:S1532046414001270/STRIPIN/image/gif/277a9ed083f64ed3947c16a41db1103b/si115.gif https://s3-eu-west-1.amazonaws.com/prod-ucs-content-store-eu-west/content/pii:S1532046414001270/STRIPIN/image/gif/277a9ed083f64ed3947c16a41db1103b/si115.gif si115 si115.gif gif 402 17 95 ALTIMG 1-s2.0-S1532046414001270-si113.gif https://s3.amazonaws.com/prod-ucs-content-store-us-east/content/pii:S1532046414001270/STRIPIN/image/gif/9038d3e0efa099d19a1b6c20ebeea70f/si113.gif https://s3-eu-west-1.amazonaws.com/prod-ucs-content-store-eu-west/content/pii:S1532046414001270/STRIPIN/image/gif/9038d3e0efa099d19a1b6c20ebeea70f/si113.gif si113 si113.gif gif 199 13 13 ALTIMG 1-s2.0-S1532046414001270-si112.gif https://s3.amazonaws.com/prod-ucs-content-store-us-east/content/pii:S1532046414001270/STRIPIN/image/gif/7f4902d8173f9b3d693fe9d34dbe1287/si112.gif https://s3-eu-west-1.amazonaws.com/prod-ucs-content-store-eu-west/content/pii:S1532046414001270/STRIPIN/image/gif/7f4902d8173f9b3d693fe9d34dbe1287/si112.gif si112 si112.gif gif 197 11 13 ALTIMG 1-s2.0-S1532046414001270-si111.gif https://s3.amazonaws.com/prod-ucs-content-store-us-east/content/pii:S1532046414001270/STRIPIN/image/gif/02ae0ae99107e912ee0c82cdacf19fdf/si111.gif https://s3-eu-west-1.amazonaws.com/prod-ucs-content-store-eu-west/content/pii:S1532046414001270/STRIPIN/image/gif/02ae0ae99107e912ee0c82cdacf19fdf/si111.gif si111 si111.gif gif 244 18 34 ALTIMG 1-s2.0-S1532046414001270-si110.gif https://s3.amazonaws.com/prod-ucs-content-store-us-east/content/pii:S1532046414001270/STRIPIN/image/gif/38be12dc575e4df0dbb852b8e6a807cf/si110.gif https://s3-eu-west-1.amazonaws.com/prod-ucs-content-store-eu-west/content/pii:S1532046414001270/STRIPIN/image/gif/38be12dc575e4df0dbb852b8e6a807cf/si110.gif si110 si110.gif gif 220 14 16 ALTIMG 1-s2.0-S1532046414001270-si11.gif https://s3.amazonaws.com/prod-ucs-content-store-us-east/content/pii:S1532046414001270/STRIPIN/image/gif/b10b34bd0b7447ecb9dd5f3496bf0052/si11.gif https://s3-eu-west-1.amazonaws.com/prod-ucs-content-store-eu-west/content/pii:S1532046414001270/STRIPIN/image/gif/b10b34bd0b7447ecb9dd5f3496bf0052/si11.gif si11 si11.gif gif 263 14 40 ALTIMG 1-s2.0-S1532046414001270-si108.gif https://s3.amazonaws.com/prod-ucs-content-store-us-east/content/pii:S1532046414001270/STRIPIN/image/gif/277a9ed083f64ed3947c16a41db1103b/si115.gif https://s3-eu-west-1.amazonaws.com/prod-ucs-content-store-eu-west/content/pii:S1532046414001270/STRIPIN/image/gif/277a9ed083f64ed3947c16a41db1103b/si115.gif si108 si108.gif gif 402 17 95 ALTIMG 1-s2.0-S1532046414001270-si107.gif https://s3.amazonaws.com/prod-ucs-content-store-us-east/content/pii:S1532046414001270/STRIPIN/image/gif/7f4902d8173f9b3d693fe9d34dbe1287/si112.gif https://s3-eu-west-1.amazonaws.com/prod-ucs-content-store-eu-west/content/pii:S1532046414001270/STRIPIN/image/gif/7f4902d8173f9b3d693fe9d34dbe1287/si112.gif si107 si107.gif gif 197 11 13 ALTIMG 1-s2.0-S1532046414001270-si106.gif https://s3.amazonaws.com/prod-ucs-content-store-us-east/content/pii:S1532046414001270/STRIPIN/image/gif/54b748a3f2e2db2b45aa3ad358bca900/si106.gif https://s3-eu-west-1.amazonaws.com/prod-ucs-content-store-eu-west/content/pii:S1532046414001270/STRIPIN/image/gif/54b748a3f2e2db2b45aa3ad358bca900/si106.gif si106 si106.gif gif 471 17 105 ALTIMG 1-s2.0-S1532046414001270-si105.gif https://s3.amazonaws.com/prod-ucs-content-store-us-east/content/pii:S1532046414001270/STRIPIN/image/gif/d8d3084c3f50e8e2382b3064d18d7192/si105.gif https://s3-eu-west-1.amazonaws.com/prod-ucs-content-store-eu-west/content/pii:S1532046414001270/STRIPIN/image/gif/d8d3084c3f50e8e2382b3064d18d7192/si105.gif si105 si105.gif gif 369 19 52 ALTIMG 1-s2.0-S1532046414001270-si104.gif https://s3.amazonaws.com/prod-ucs-content-store-us-east/content/pii:S1532046414001270/STRIPIN/image/gif/96dad9094723bd2baa036bf9009210ee/si104.gif https://s3-eu-west-1.amazonaws.com/prod-ucs-content-store-eu-west/content/pii:S1532046414001270/STRIPIN/image/gif/96dad9094723bd2baa036bf9009210ee/si104.gif si104 si104.gif gif 557 17 130 ALTIMG 1-s2.0-S1532046414001270-si103.gif https://s3.amazonaws.com/prod-ucs-content-store-us-east/content/pii:S1532046414001270/STRIPIN/image/gif/88d91c6eee3468857108446321266900/si103.gif https://s3-eu-west-1.amazonaws.com/prod-ucs-content-store-eu-west/content/pii:S1532046414001270/STRIPIN/image/gif/88d91c6eee3468857108446321266900/si103.gif si103 si103.gif gif 347 14 44 ALTIMG 1-s2.0-S1532046414001270-si102.gif https://s3.amazonaws.com/prod-ucs-content-store-us-east/content/pii:S1532046414001270/STRIPIN/image/gif/f295dd6c1e7b9bb9c34176c2a478532f/si102.gif https://s3-eu-west-1.amazonaws.com/prod-ucs-content-store-eu-west/content/pii:S1532046414001270/STRIPIN/image/gif/f295dd6c1e7b9bb9c34176c2a478532f/si102.gif si102 si102.gif gif 295 14 34 ALTIMG 1-s2.0-S1532046414001270-si101.gif https://s3.amazonaws.com/prod-ucs-content-store-us-east/content/pii:S1532046414001270/STRIPIN/image/gif/deed4ef9a953254da94dfbdb7dde888a/si101.gif https://s3-eu-west-1.amazonaws.com/prod-ucs-content-store-eu-west/content/pii:S1532046414001270/STRIPIN/image/gif/deed4ef9a953254da94dfbdb7dde888a/si101.gif si101 si101.gif gif 369 14 44 ALTIMG 1-s2.0-S1532046414001270-si100.gif https://s3.amazonaws.com/prod-ucs-content-store-us-east/content/pii:S1532046414001270/STRIPIN/image/gif/e30ea2407e0b96fd7de249350928568d/si100.gif https://s3-eu-west-1.amazonaws.com/prod-ucs-content-store-eu-west/content/pii:S1532046414001270/STRIPIN/image/gif/e30ea2407e0b96fd7de249350928568d/si100.gif si100 si100.gif gif 310 14 34 ALTIMG 1-s2.0-S1532046414001270-si10.gif https://s3.amazonaws.com/prod-ucs-content-store-us-east/content/pii:S1532046414001270/STRIPIN/image/gif/3434025aa677052fa4228961a74dd5c3/si10.gif https://s3-eu-west-1.amazonaws.com/prod-ucs-content-store-eu-west/content/pii:S1532046414001270/STRIPIN/image/gif/3434025aa677052fa4228961a74dd5c3/si10.gif si10 si10.gif gif 275 14 41 ALTIMG 1-s2.0-S1532046414001270-si1.gif https://s3.amazonaws.com/prod-ucs-content-store-us-east/content/pii:S1532046414001270/STRIPIN/image/gif/289bfffa08428d67f650e61799d282bc/si1.gif https://s3-eu-west-1.amazonaws.com/prod-ucs-content-store-eu-west/content/pii:S1532046414001270/STRIPIN/image/gif/289bfffa08428d67f650e61799d282bc/si1.gif si1 si1.gif gif 312 14 50 ALTIMG 1-s2.0-S1532046414001270-gr1_lrg.jpg https://s3.amazonaws.com/prod-ucs-content-store-us-east/content/pii:S1532046414001270/gr1/HIGHRES/image/jpeg/3cd90e7214de8eff2c832c6e54767283/gr1_lrg.jpg https://s3-eu-west-1.amazonaws.com/prod-ucs-content-store-eu-west/content/pii:S1532046414001270/gr1/HIGHRES/image/jpeg/3cd90e7214de8eff2c832c6e54767283/gr1_lrg.jpg gr1 gr1_lrg.jpg jpg 487427 2423 2533 IMAGE-HIGH-RES 1-s2.0-S1532046414001270-fx1_lrg.jpg https://s3.amazonaws.com/prod-ucs-content-store-us-east/content/pii:S1532046414001270/fx1/HIGHRES/image/jpeg/198353d4348f26548ea8e3d0fa6be400/fx1_lrg.jpg https://s3-eu-west-1.amazonaws.com/prod-ucs-content-store-eu-west/content/pii:S1532046414001270/fx1/HIGHRES/image/jpeg/198353d4348f26548ea8e3d0fa6be400/fx1_lrg.jpg fx1 true fx1_lrg.jpg jpg 134543 886 936 IMAGE-HIGH-RES 1-s2.0-S1532046414001270-gr2_lrg.jpg https://s3.amazonaws.com/prod-ucs-content-store-us-east/content/pii:S1532046414001270/gr2/HIGHRES/image/jpeg/b9e7672db0e0f9c3e85827d1f73ff63a/gr2_lrg.jpg https://s3-eu-west-1.amazonaws.com/prod-ucs-content-store-eu-west/content/pii:S1532046414001270/gr2/HIGHRES/image/jpeg/b9e7672db0e0f9c3e85827d1f73ff63a/gr2_lrg.jpg gr2 gr2_lrg.jpg jpg 681237 870 2581 IMAGE-HIGH-RES 1-s2.0-S1532046414001270-gr1.jpg https://s3.amazonaws.com/prod-ucs-content-store-us-east/content/pii:S1532046414001270/gr1/DOWNSAMPLED/image/jpeg/436da334d64e913640d797731b146a30/gr1.jpg https://s3-eu-west-1.amazonaws.com/prod-ucs-content-store-eu-west/content/pii:S1532046414001270/gr1/DOWNSAMPLED/image/jpeg/436da334d64e913640d797731b146a30/gr1.jpg gr1 gr1.jpg jpg 66714 547 572 IMAGE-DOWNSAMPLED 1-s2.0-S1532046414001270-fx1.jpg https://s3.amazonaws.com/prod-ucs-content-store-us-east/content/pii:S1532046414001270/fx1/DOWNSAMPLED/image/jpeg/7956fa7067c439391bdd39115c1a2693/fx1.jpg https://s3-eu-west-1.amazonaws.com/prod-ucs-content-store-eu-west/content/pii:S1532046414001270/fx1/DOWNSAMPLED/image/jpeg/7956fa7067c439391bdd39115c1a2693/fx1.jpg fx1 true fx1.jpg jpg 22699 200 211 IMAGE-DOWNSAMPLED 1-s2.0-S1532046414001270-gr2.jpg https://s3.amazonaws.com/prod-ucs-content-store-us-east/content/pii:S1532046414001270/gr2/DOWNSAMPLED/image/jpeg/d30bd6ca5ae6a622b7e2fdb3931b14a4/gr2.jpg https://s3-eu-west-1.amazonaws.com/prod-ucs-content-store-eu-west/content/pii:S1532046414001270/gr2/DOWNSAMPLED/image/jpeg/d30bd6ca5ae6a622b7e2fdb3931b14a4/gr2.jpg gr2 gr2.jpg jpg 50728 197 583 IMAGE-DOWNSAMPLED 1-s2.0-S1532046414001270-gr1.sml https://s3.amazonaws.com/prod-ucs-content-store-us-east/content/pii:S1532046414001270/gr1/THUMBNAIL/image/gif/17b30009fac7052079ffc2614db6cea7/gr1.sml https://s3-eu-west-1.amazonaws.com/prod-ucs-content-store-eu-west/content/pii:S1532046414001270/gr1/THUMBNAIL/image/gif/17b30009fac7052079ffc2614db6cea7/gr1.sml gr1 gr1.sml sml 5946 164 171 IMAGE-THUMBNAIL 1-s2.0-S1532046414001270-fx1.sml https://s3.amazonaws.com/prod-ucs-content-store-us-east/content/pii:S1532046414001270/fx1/THUMBNAIL/image/gif/beb677cba099a0a8605d7a4a1211e20c/fx1.sml https://s3-eu-west-1.amazonaws.com/prod-ucs-content-store-eu-west/content/pii:S1532046414001270/fx1/THUMBNAIL/image/gif/beb677cba099a0a8605d7a4a1211e20c/fx1.sml fx1 true fx1.sml sml 5810 164 173 IMAGE-THUMBNAIL 1-s2.0-S1532046414001270-gr2.sml https://s3.amazonaws.com/prod-ucs-content-store-us-east/content/pii:S1532046414001270/gr2/THUMBNAIL/image/gif/a84d67a2df124f43175fc70d415e5975/gr2.sml https://s3-eu-west-1.amazonaws.com/prod-ucs-content-store-eu-west/content/pii:S1532046414001270/gr2/THUMBNAIL/image/gif/a84d67a2df124f43175fc70d415e5975/gr2.sml gr2 gr2.sml sml 6911 74 219 IMAGE-THUMBNAIL YJBIN 2181 S1532-0464(14)00127-0 10.1016/j.jbi.2014.05.010 Elsevier Inc. Fig. 1 BoW with kernel methods. Fig. 2 Grid search on hamming loss and average precision for KLFDA. Table 1 Distribution of labels in the Portavita dataset. Label Number of patients % Hypertension 280 53.33 Dyslipidemia 280 53.33 Microvascular 280 53.33 Macrovascular 280 53.33 Table 2 Portavita dataset descriptive statistics. Test name Frequency MEAN MEDIAN MIN MAX SD % Missing values BMI (kg/cm2) Each visit 29.79 29.00 16.00 49.00 5.20 0.00 Body Weight (g) Each visit 85.17 84.00 35.00 189.00 16.99 0.00 Heart-rate (bpm) 3/6months 72.83 72.00 60.00 360.00 11.26 35.44 Height (cm) Once 169.04 169.00 130.00 270.00 9.95 52.33 Abdominal circumference (cm) 3/6months 103.03 102.00 75.00 189.00 13.57 84.17 Diastolic blood pressure (mmHg) 3/6months 78.24 80.00 60.00 180.00 9.81 7.61 Systolic blood pressure (mmHg) 3/6months 138.07 138.00 100.00 270.00 17.69 7.90 HDL-cholesterol (mg/dL) 3/6months 1.22 1.20 0.09 9.30 0.34 2.58 LDL-cholesterol (mg/dL) 3/6months 2.72 2.60 0.30 17.20 0.98 5.09 HbA1c (mg/dL) 6months 52.29 50.00 5.30 180.00 12.91 16.27 Total Chol/HDL-Chol ratio 3/6months 4.15 3.90 1.30 27.30 1.35 4.05 Albumine/Creatinine ratio 3/6months 5.05 1.10 0.40 939.20 18.56 49.04 Aspartate Transaminase (IU/L) 3/6months 33.60 24.00 5.00 2985.00 71.38 91.52 Natrium (mmol/L) 3/6months 139.73 140.00 116.00 165.00 2.84 60.26 Kalium (mmol/L) 3/6months 4.35 4.30 2.20 7.80 0.47 39.74 Creatinine in Urine (mg/dL) 3/6months 79.90 75.00 8.00 1085.00 29.52 18.19 Albumine in Urine (mg/dL) 3/6months 30.81 8.00 0.60 1000.00 82.54 46.27 Hemoglobin (g/dl) 3/6months 8.40 8.50 2.90 12.30 1.07 80.82 Fasting Glucose (mmol/L) 3months 7.61 7.20 1.30 42.60 2.15 14.48 Alanine Transaminase (IU/L) 3/6months 32.00 25.00 4.00 2510.00 42.81 76.53 GammaGT (IU/L) 3/6months 61.99 35.00 4.00 2855.00 104.82 87.24 Creatinine Kinase (IU/L) 3/6months 128.42 91.00 8.00 5750.00 176.33 92.46 Total Cholesterol (mmol/L) 3/6months 4.80 4.70 1.30 33.30 1.16 2.55 Triglyceride (mmol/L) 3/6months 1.94 1.62 0.12 87.05 1.49 2.84 Cockcroft (mL/min) variable 90.35 84.00 6.00 4356.00 94.03 53.32 Glucose after Meal (mmol/L) 3months 9.03 8.20 1.20 61.00 3.68 90.68 Modification of Diet in Renal Disease (mL/min) Variable 85.02 84.00 3.00 974.00 26.29 33.29 Table 3 Distribution of labels in the MIMIC II dataset. Label Number of patients % Thyroid disease 297 11.2 Diabetes mellitus 875 33.2 Lipoid metabolism disease 671 25.4 Fluid electrolyte disease 1014 38.4 Hypertensive disease 1568 59.5 Thrombosis 180 6.8 Hypotension 294 11.1 COPD 573 21.7 Liver Disease 208 7.8 Kidney Disease 1013 38.4 Table 4 Mimic II dataset descriptive statistics. Test name MEAN MEDIAN MIN MAX SD % Missing val Hematocrit of Blood (volume fraction) 31.19 30.70 2.00 67.70 4.94 0.25 Platelets in Blood (103/uL) 241.26 218.00 5.00 3162.00 151.43 0.27 Leukocytes in Blood (103/uL) 10.22 8.90 0.10 303.90 7.38 0.3 Hemoglobin in Blood (mmol/L) 10.51 10.30 0.00 23.80 1.70 0.3 Erythrocyte mean corpuscular volume (fL) 90.13 90.00 0.00 139.00 6.84 0.31 Erythrocytes in Blood (103/uL) 3.51 3.45 0.00 7.39 0.61 0.31 Erythrocyte mean corpuscular hemoglobin concentration (g/dL) 33.39 33.40 0.00 39.70 1.57 0.31 Erythrocyte mean corpuscular hemoglobin (pg/cell) 30.07 30.10 0.00 46.10 2.54 0.31 Erythrocyte distribution width (Ratio) 16.07 15.60 0.00 35.00 2.34 0.32 Urea nitrogen in Serum or Plasma (mg/dL) 32.18 25.00 1.00 280.00 23.89 0.33 Creatinine in Serum or Plasma (mg/dL) 1.81 1.10 0.00 73.00 1.92 0.33 Potassium in Serum or Plasma (mg/dL) 4.18 4.10 1.40 13.80 0.67 0.61 Sodium in Serum or Plasma (mEq/L) 138.52 139.00 102.00 180.00 4.94 0.68 Chloride in Blood (mEq/L) 103.12 103.00 59.00 141.00 6.18 0.69 Bicarbonate in Serum (mEq/L) 25.41 25.00 4.00 65.00 4.97 0.69 Anion gap in Blood (mEq/L) 14.22 14.00 0.00 117.00 3.90 0.71 Glucose in Serum or Plasma (mg/dL) 130.59 116.00 4.00 2220.00 63.80 0.71 Magnesium in Serum or Plasma (mg/dL) 2.01 2.00 0.20 25.20 0.37 2.16 INR in Blood by Coagulation assay 1.74 1.40 0.00 88.60 1.47 2.71 Prothrombin time (PT) in Blood by Coagulation assay 16.89 14.60 7.00 150.00 7.09 2.74 Activated partial thrombplastin time (aPTT) in Blood by Coagulation assay 44.94 35.30 16.40 193.30 25.71 2.94 Phosphate in Serum or Plasma (mg/dL) 3.75 3.50 0.30 22.60 1.41 4.36 Calcium [Mass/volume] in Serum or Plasma (mg/dL) 8.56 8.50 0.30 25.40 0.83 4.54 pH of Urine 5.88 5.50 5.00 9.00 0.99 15.3 Urobilinogen in Urine (mg/dL) 1.79 1.00 0.20 12.00 2.61 15.3 Ketones in Urine (mg/dL) 48.93 15.00 10.00 150.00 49.13 15.3 Specific gravity of Urine by Test strip 1.02 1.02 1.00 1.08 0.01 15.3 Protein in Urine by Test strip (mg in 24h) 106.39 30.00 15.00 500.00 146.79 15.3 Glucose in Urine by Test strip (mg in 24h) 461.21 250.00 70.00 1000.00 401.51 15.3 Table 5 Selected parameters. Algorithm Parameters Portavita Parameters MIMIC II Interval Step KDA-BR \u03bb = 40 , cb =600 \u03bb = 10 , cb =800 [1:50], [ 10 2 : 10 3 ] lin, lin KDA \u03bb = 49 , cb =600 \u03bb = 20 , cb =800 [1:50], [ 10 2 : 10 3 ] lin, lin KLFDA-BR N =30, \u03bb = 5 , cb =600 N =40, \u03bb = 3 , cb =800 [1:50], [1:50], [ 10 2 : 10 3 ] lin, lin, lin KLFDA N =34, \u03bb = 9 , cb =600 N =47, \u03bb = 3 , cb =800 [1:50], [1:50], [ 10 2 : 10 3 ] lin, lin, lin MLkNN N =29, \u03c3 = 2 , cb =600 N =19, \u03c3 = 3 , cb =800 [1:50], [1:50], [ 10 2 : 10 3 ] lin, lin, lin DMLkNN N =29, \u03c3 = 12 , cb =600 N =19, \u03c3 = 5 , cb =800 [1:50], [1:50], [ 10 2 : 10 3 ] lin, lin, lin BPMLL \u03bb = 10 - 6 , HN =5, cb =600 \u03bb = 10 - 7 , HN =7, cb =800 [ 10 - 8 :1], [1:20], [ 10 2 : 10 3 ] log, lin, lin BR-SVM C =10, \u03b3 = 10 - 1 , cb =600 C =5, \u03b3 = 1 , cb =800 [1: 10 2 ], [ 10 - 3 : 10 3 ], [ 10 2 : 10 3 ] lin, log, lin Table 6 Results for the Portavita dataset. Values in bold identify the best result for a given metric. Algorithm/metric Average precision Hamming loss Ranking loss Coverage One-error BoW 68%\u00b14% 51.6%\u00b14.2% 50%\u00b15.6% 2.2\u00b10.14 50%\u00b17.8% LDA 67.8%\u00b14% 51.1%\u00b14.3% 51.9%\u00b15.7% 2.3\u00b10.14 48%\u00b18% LDA-BR 67%\u00b14% 52.8%\u00b14.3% 52.2%\u00b15.8% 2.3\u00b10.14 48%\u00b18% KDA-BR 67.8%\u00b13.8% 57.5%\u00b13.2% 58%\u00b13.9% 2.25\u00b10.15 48%\u00b18% KDA 78.3%\u00b13.8% 39.1%\u00b14.1% 33.4%\u00b15.5% 1.94\u00b10.16 32.1%\u00b17.5% KLFDA-BR 73.5%\u00b13.8% 41.6%\u00b13.5% 38.9%\u00b15.2% 2.07\u00b10.16 35.7%\u00b17.7% KLFDA 78.8% \u00b13.7% 37.3% \u00b14% 32.2% \u00b15.2% 1.87 \u00b10.16 32.1%\u00b17.5% MLkNN 78.2%\u00b13.7% 44%\u00b13.8% 36\u00b15.5% 2\u00b10.16 30% \u00b17.5% DMLkNN 76.1%\u00b13.8% 44.8%\u00b13.8% 37%\u00b15.4% 2.1\u00b10.15 33.3%\u00b17.5% BPMLL 75.7%\u00b13.8% 42.6%\u00b14.1% 38.3%\u00b15.6% 2\u00b10.16 36%\u00b17.7% BR-SVM 78.2%\u00b13.7% 39.3%\u00b14.2% 34%\u00b15.3% 1.98\u00b10.16 33.3%\u00b17.5% Table 7 Results for the MIMIC II dataset. Values in bold identify the best result for a given metric. Algorithm/metric Average precision Hamming loss Ranking loss Coverage One-error BoW 47.5%\u00b11.6% 44.5%\u00b11.1% 39.5%\u00b11.6% 5.6\u00b10.14 69%\u00b13.4% LDA 50.9%\u00b11.6% 42.7%\u00b11.1% 38.2%\u00b11.5% 5.4\u00b10.17 63.2%\u00b13.3% LDA-BR 43.3%\u00b11.4% 40.2%\u00b10.8% 39.2%\u00b11.4% 5.14\u00b10.15 82.93%\u00b12.5% KDA-BR 64.74%\u00b11.8% 23.7%\u00b11.2% 26%\u00b11.4% 4.67\u00b10.19 39.7%\u00b13.3% KDA 66%\u00b11.8% 23.4%\u00b10.9% 23.2%\u00b11.4% 4.2\u00b10.18 40.5%\u00b13.3% KLFDA-BR 64.79%\u00b11.8% 23.8%\u00b11.1% 25.9%\u00b11.4% 4.59\u00b10.18 40%\u00b13.4% KLFDA 65.5%\u00b11.8% 23.3%\u00b10.9% 23.7%\u00b11.4% 4.25\u00b10.16 41.1%\u00b13.3% MLkNN 68.4% \u00b11.8% 21.7%\u00b11% 20% \u00b11.5% 4 \u00b10.17 35.6%\u00b13% DMLkNN 68.1%\u00b13.8% 21.6% \u00b10.8% 21.5%\u00b11.5% 4\u00b10.17 34.1% \u00b13.2% BPMLL 67.8%\u00b11% 26%\u00b10.8% 37.1%\u00b13.3% 4\u00b10.18 37%\u00b13.3% BR-SVM 57.7%\u00b11.8% 22.2%\u00b10.9% 37%\u00b11% 5.8\u00b10.19 38.6%\u00b13.2% Table 8 Hamming loss per symbol in the Portavita dataset. H=Hypertension, D=Dyslipidemia, Mi=Microvascular, Ma=Macrovascular. Symbol H D Mi Ma KLFDA (%) KDA (%) BR-SVM (%) MLkNN (%) 1 No No No Yes 40 42.5 60 60 2 No No Yes No 40 35 47.5 50 3 No No Yes Yes 40 45 42.5 42.5 4 No Yes No No 25 32.5 27.5 40 5 No Yes No Yes 42.5 45 40 42.5 6 No Yes Yes No 20 15 15 30 7 No Yes Yes Yes 40 40 42.5 42.5 8 Yes No No No 35 32.5 40 45 9 Yes No No Yes 40 40 45 57.5 10 Yes No Yes No 47.5 57.5 47.5 42.5 11 Yes No Yes Yes 45 40 62.5 52.5 12 Yes Yes No No 27.5 40 20 40 13 Yes Yes No Yes 40 40 40 42.5 14 Yes Yes Yes No 35 37.5 30 30 15 Yes Yes Yes Yes 42.5 40 30 42.5 Multi-label classification of chronically ill patients with bag of words and supervised dimensionality reduction algorithms Stefano Bromuri a \u204e stefano.bromuri@hevs.ch Damien Zufferey a Jean Hennebert b Michael Schumacher a a University of Applied Sciences Western Switzerland, Institute of Business Information Systems, TechnoArk 3, CH-3960 Sierre, Switzerland University of Applied Sciences Western Switzerland Institute of Business Information Systems TechnoArk 3 CH-3960 Sierre Switzerland b University of Applied Sciences Western Switzerland, Institute of Information and Communication Technologies, Bd de P\u00e9rolles 80, CH-1705 Fribourg, Switzerland University of Applied Sciences Western Switzerland Institute of Information and Communication Technologies Bd de P\u00e9rolles 80 CH-1705 Fribourg Switzerland \u204e Corresponding author. Graphical abstract Highlights \u2022 We study discrete medical time series datasets with multi-label classification. \u2022 We focus on chronically ill patients with multiple illnesses. \u2022 We use Bag of Words quantization on medical time series. \u2022 We compare multi-label classification and dimensionality reduction algorithms. Abstract Objective This research is motivated by the issue of classifying illnesses of chronically ill patients for decision support in clinical settings. Our main objective is to propose multi-label classification of multivariate time series contained in medical records of chronically ill patients, by means of quantization methods, such as bag of words (BoW), and multi-label classification algorithms. Our second objective is to compare supervised dimensionality reduction techniques to state-of-the-art multi-label classification algorithms. The hypothesis is that kernel methods and locality preserving projections make such algorithms good candidates to study multi-label medical time series. Methods We combine BoW and supervised dimensionality reduction algorithms to perform multi-label classification on health records of chronically ill patients. The considered algorithms are compared with state-of-the-art multi-label classifiers in two real world datasets. Portavita dataset contains 525 diabetes type 2 (DT2) patients, with co-morbidities of DT2 such as hypertension, dyslipidemia, and microvascular or macrovascular issues. MIMIC II dataset contains 2635 patients affected by thyroid disease, diabetes mellitus, lipoid metabolism disease, fluid electrolyte disease, hypertensive disease, thrombosis, hypotension, chronic obstructive pulmonary disease (COPD), liver disease and kidney disease. The algorithms are evaluated using multi-label evaluation metrics such as hamming loss, one error, coverage, ranking loss, and average precision. Results Non-linear dimensionality reduction approaches behave well on medical time series quantized using the BoW algorithm, with results comparable to state-of-the-art multi-label classification algorithms. Chaining the projected features has a positive impact on the performance of the algorithm with respect to pure binary relevance approaches. Conclusions The evaluation highlights the feasibility of representing medical health records using the BoW for multi-label classification tasks. The study also highlights that dimensionality reduction algorithms based on kernel methods, locality preserving projections or both are good candidates to deal with multi-label classification tasks in medical time series with many missing values and high label density. Keywords Multi-label classification Complex patient Diabetes type 2 Clinical data Dimensionality reduction Kernel methods 1 Introduction The average lifespan has increased considerably due to the invention of better drugs and improvement of healthcare, but the rate of chronic illnesses per patient has also increased, becoming a burden for the economy of industrialized and emerging countries [1]. The interaction between chronic illnesses and multiple drugs intake make the patient treatment complex to handle for caregivers. The possibility of taking informed decisions about complex patients is important to slow down the development of their illnesses. Unfortunately, doctors have to take decisions whose consequences will be evaluated only after years of treatment. Furthermore, given the growth in number of chronically ill patients, caregivers are often in charge of hundreds of patients [2]. In addition, patient electronic health records (EHR) often contain the evolution in time of the patient clinical data, which are high dimensional multivariate time series of physiological values. As reported in [3], physicians would use services that improve their understanding of an illness even if these involve more cognitive effort than in the standard practice. In particular, in the medical informatics and data mining community [4,5] it has already been discussed that classifying patients given their physiological values and laboratory tests may help caregivers\u2019 decision making process. This paper is motivated by the problem of classifying patients affected by multiple illnesses to enhance the decision support of medical doctors. There are two challenges to overcome in order to define a system capable to correctly classify the multiple illnesses that may affect a chronically ill patient: (a) dealing with irregular multivariate time series; and (b) dealing with the interaction of multiple co-morbidities in a heterogeneous population of patients. The presence of high dimensional and multivariate data presents a big challenge to standard classification algorithms due to the curse of dimensionality [6]. Clinical time series are often irregular, a patient may present different number of records with respect to another patient and the periods of time in which the values are collected may not be aligned. The challenge is even more difficult if we consider the inherently multi-label properties of medical data, where a patient may present multiple co-morbidities at once. Concerning irregular time series, quantization algorithms, such as the Bag of Words (BoW) model, have proven successful in several medical tasks [7]. As a matter of fact, BoW is often used in biomedical time series. In [7], Wang et al. present an application of the BoW model to EEG and ECG signals. Similarly to us, the authors of [7] are faced with the issue of time series of different length with possibly heterogeneous patients at hand. Jiu et al. present a supervised approach towards BoW codebook generation using neural networks in [8]. In particular, the approach uses Multi-Layer Perceptrons (MLP) and the backpropagation algorithm to update the weights of the codewords according to their discrimination capabilities with respect to a set of classes. Similarly to [8], in [9] Ordonez et al. present a modification of the BoW model to classify medical time series. Such a model uses continuous multivariate time series to compute a symbolic representation of the signals that is then used as the codebook for the classification of the patients. Concerning multi-label classification algorithms, an extensive review can be found in [10]. Multi-label learning [11] implies training sets where each instance has a labelset and the task is to predict the labelset of unseen instances. As reported in [10], there exist works that combine supervised dimensionality reduction with multi-label learning [12\u201314]. Furthermore, most of these works focus on applying multi-label techniques on text analysis with static datasets [15]. In general terms multi-label classification of complex patients in discrete medical time series is quite an unexplored issue. Firstly, we think that the main contribution of this paper is to propose the combination of BoW, to quantize irregular time series present in patient health records, and multi-label classification algorithms, to classify the chronic illnesses that a patient may present. These are two established techniques, but in medical settings their combination is quite novel. Secondly, we believe that this contribution is interesting to biomedical informatics as we evaluate linear and non-linear supervised dimensionality reduction approaches with respect to multi-label classification in medical time series, and we compare these approaches with state-of-the-art multi-label classification algorithms. In doing this, we aim at identifying the most effective supervised dimensionality reduction techniques with respect to medical time series. We aim to confirm the hypothesis that, given the nature of the data at hand, non-linear supervised dimensionality reduction algorithms have a behavior comparable to state of the art multi-label classifiers. Thirdly, our contribution is also of interest to biomedical research because we perform our evaluation against two real world medical datasets: the Portavita dataset, provided for this study by the Portavita company, 1 www.portavita.eu. 1 containing 525 diabetic patients presenting, sometimes simultaneously, hypertension, dyslipidemia or microvascular and macrovascular complications of diabetes type 2 (DT2) [16]; an extraction of 2635 patients from the public MIMIC II database [17], where we consider patients affected simultaneously by thyroid disease, diabetes mellitus, lipoid metabolism disease, fluid electrolyte disease, hypertensive disease, thrombosis, hypotension, chronic obstructive pulmonary disease (COPD), liver disease and kidney disease. The rest of this paper is organized as follows: Section 2 presents a background on multi-label classification, kernel methods, and supervised dimensionality reduction algorithms; Section 3 presents the Portavita and MIMIC II datasets and their properties; Section 4 presents the training schema for the attempted multi-label classification algorithms; Section 5 presents an evaluation for the multi-label algorithms considered in this paper; finally, Section 6 concludes this paper and draws the lines for future work. 2 Background In this Section we present the concepts of multi-label classification, kernels, locality preserving projections and multi-class Fisher discriminant analysis. In Section 4 we show how we combined these concepts in a system for classification of multi-label chronically ill patients. 2.1 Multi-label classification Let X be the domain of observations and let L be the finite set of labels. Given a training set T = { ( x 1 , Y 1 ) , ( x 2 , Y 2 ) , \u2026 , ( x n , Y n ) } ( x i \u2208 X , Y i \u2286 L ) i.i.d. drawn from an unknown distribution D, the goal is to learn a multi-label classifier h : X \u2192 2 L . However, it is often more convenient to learn a real-valued scoring function of the form f : X \u00d7 L \u2192 R . Given an instance x i and its associated label set Y i , a working system will attempt to produce larger values for labels in Y i than those that are not in Y i , i.e. f ( x i , y 1 ) > f ( x i , y 2 ) for any y 1 \u2208 Y i and y 2 \u2209 Y i . By the use of the function f ( \u00b7 , \u00b7 ) , we can obtain a multi-label classifier: h ( x i ) = { y | f ( x i , y ) > \u03b4 , y \u2208 L } , where \u03b4 is a threshold to infer from the training set. The function f ( \u00b7 , \u00b7 ) can also be adapted to a ranking function rank f ( \u00b7 , \u00b7 ) , which maps the outputs of f ( x i , y ) for any y \u2208 L to { 1 , 2 , \u2026 , | L | } such that if f ( x i , y 1 ) > f ( x i , y 2 ) then rank f ( x i , y 1 ) < rank f ( x i , y 2 ) . Furthermore, there exist several approaches to train multi-label classifiers (see [10] for a comprehensive review on the subject). The simplest approach, known as binary relevance (BR), is to train one binary classifier per label with traditional classification algorithms, considering each label as a separated problem. BR has the disadvantage of not taking into consideration the relationships existing amongst labels. To overcome this issue, several ensemble methods have been defined in the past, amongst which the most popular ones are classifier chains (CC) and label powersets approaches (LP). CC methods work by recursively training classifiers with the label predicted by the previous classifier as new features. LP methods focus on training classifiers defining classes by means of subsets of the labelset. Despite having been demonstrated effective, CC and LP methods present computational disadvantages with respect to BR methods, whose complexity is linear in respect to the number of labels. In addition, CC methods are difficult to train with classifier presenting many parameters, as each classifier in the chain needs to be optimized differently. Secondly, LP method are computationally infeasible due to the large number of possible classes in a labelset. Other approaches use the probabilistic distribution of the labels and their dependencies within a neighborhood to tune the classifier output. MLkNN [18] is a successful example of such a method. Within this paper we will show the effect of using dimensionality reduction algorithms with a BR approach, considering the output of each classifier as separated, or as CC classifiers by concatenating the projected features. 2.2 Kernels Non-linear subspaces may be suitable to describe clinical datasets as due to their high dimensionality they may lie in complex manifolds. Therefore, we may need to map our input data in terms of clinical datasets to a higher dimensional space using a linearization function. If we consider a set of m samples x 1 , x 2 , \u2026 , x m \u2208 R n , belonging to c classes, then we can consider a non-linear mapping \u03d5 : R n \u2192 F , where we choose \u03d5 so that \u3008 \u03d5 ( x i ) , \u03d5 ( x j ) \u3009 = K ( x i , x j ) , where K ( \u00b7 , \u00b7 ) is a positive semi-definite kernel function. Performing this map explicitly can be computationally expensive, to avoid it we can apply the Kernel Trick [19], and calculate the Gram matrix K ( \u00b7 , \u00b7 ) , containing the inner product between the input vectors in the linearization space. This then allows us to modify linear techniques using the inner product with appropriate kernel functions, opening up the possibility of applying well known approaches in non-linear spaces. Within this paper we will use the RBF kernel and the histogram intersection kernel [20]. The RBF kernel is defined as: (1) K ( x , y ) = exp - \u2016 x - y \u2016 2 2 \u03c3 2 The histogram intersection kernel can be defined starting from two histograms x and y consisting both of m features. We denote the ith features of x as x i and for y as y i . Then we can define the kernel as: (2) K ( x , y ) = \u2211 i m min ( x i , y i ) A big advantage of this kernel is that it is parameterless. 2.3 Locality preserving projections As explained in [21], a LPP projection is a linear transformation for which the data residing in a space R n are mapped in a subspace R r , with r < n , such that nearby data pairs in the original n-dimensional space are also close in the identified subspace. More formally, if we consider a square matrix A \u2208 R d \u00d7 d , where A i , j \u2208 [ 0 , 1 ] , representing the affinity between the elements x i and x j in a dataset with d elements, the T LPP transformation matrix can be defined as follows: (3) T LPP = arg min T \u2208 R d \u00d7 r 1 2 \u2211 i , j = 1 n A i , j \u2016 T T x i - T T x j \u2016 2 Within this paper we are interested in the usage of such a projection within the KLFDA technique, further details on how to calculate T LPP can be found in [21]. 2.4 Linear discriminant analysis and local linear discriminant analysis Linear Discriminant Analysis (LDA) [22] is a widely used supervised dimensionality reduction technique that can find the linear transformation which best separates elements of different classes. To achieve this, LDA makes use of the within-class scatter matrix S ( w ) and of the between-class scatter matrix S ( b ) . These can be defined as: (4) S ( w ) = \u2211 i = 1 C \u2211 x \u2208 E i ( x - \u03bc i ) ( x - \u03bc i ) T where \u03bc i is the mean of class E i , and (5) S ( b ) = \u2211 i = 1 C N i ( \u03bc i - \u03bc ) ( \u03bc i - \u03bc ) T where \u03bc is the global mean and N i is the number of elements belonging to class E i . S ( w ) is a measure of the variance between the elements belonging to the same class, while S ( b ) is a measure of the variance of the elements belonging to different classes. Ideally, we want the scatter to be minimized for elements of the same class and maximized for elements of different classes. The transformation matrix T LDA that achieves this is defined as: (6) T LDA = arg max det ( T T S ( w ) T ) det ( T T S ( b ) T ) As explained in [23], to specify a Locality Sensitive LDA (LSDA), we can define the local within-class scatter matrix S \u223c ( w ) and the local between class scatter matrix S \u223c ( b ) (7) S \u223c ( w ) = 1 2 \u2211 i , j = 1 n W \u223c i , j ( w ) ( x i - x j ) ( x i - x j ) T (8) S \u223c ( b ) = 1 2 \u2211 i , j = 1 n W \u223c i , j ( b ) ( x i - x j ) ( x i - x j ) T where (9) W \u223c i , j ( w ) = A i , j / N i if y i = y j = c , 0 if y i \u2260 y j (10) W \u223c i , j ( b ) = A i , j ( 1 / N - 1 / N i ) if y i = y j = c , 1 / N if y i \u2260 y j which implies that we are weighting the pairwise values according to their affinity matrix A i , j \u2208 [ 0 , 1 ] , with A i , j closer to 1 if x j is close to x i and to 0 if they are far apart. Then, the objective function can be expressed again as a generalized eigenvalue problem: (11) T LSDA = arg max T \u2208 R d \u00d7 r tr ( ( T T S \u223c ( w ) T ) - 1 T T S \u223c ( b ) T ) ) we refer the interested reader to [23], for further details on how to compute LSDA. 2.5 Kernel local Fisher discriminant analysis KLFDA [23] is a generalization of the previously presented LSDA using kernel functions. If we consider S \u223c b \u03d5 , S \u223c w \u03d5 and S \u223c t \u03d5 as the local between-class, within-class and total scatter matrices respectively in the space identified by a kernel mapping, then KLFDA seeks to find: (12) T opt = arg max T T S \u223c b \u03d5 T T T S \u223c w \u03d5 T = arg max T T S \u223c b \u03d5 T T T S \u223c t \u03d5 T We can justify the use of supervised techniques based on LPP and kernel methods with the considerations in [21], for which LPP is particularly useful in applications where by preserving the structure of the neighborhood in the lower dimensional space, nearest neighbor based approaches can still perform well, and the curse of dimensionality is mitigated. Kernel methods are useful in cases where the classes are non-linearly separable. In our case, we apply the version of KLFDA specified in [23] using regularization. 3 Materials In this Section, we present the descriptive statistics of the two datasets taken into consideration. For multi-label datasets, amongst the descriptive statistics it is important to also consider label cardinality and label density. Given a dataset D, and a set of labels L, where the labels of an example are denoted with Y i we can define label cardinality and label density as below. Label Cardinality: Label cardinality of a dataset D is the average number of labels of the examples in D: (13) LC ( D ) = 1 | D | \u2211 i = 1 | D | | Y i | Label Density: Label density of D is the average number of labels of the examples in D divided by | L | (14) LD ( D ) = 1 | D | \u2211 i = 1 | D | | Y i | | L | Label cardinality quantifies the average number of alternative labels that characterize the examples in the dataset. With respect to label cardinality, label density also considers the number of labels. The two metrics are important because multi-label algorithms may present a different behavior in datasets with similar cardinality, but different density. 3.1 The Portavita dataset The Portavita dataset is a medical dataset collected during the standard care of DT2 patients. Such a dataset includes 525 diabetic patients affected by four complications which are: hypertension, dyslipidemia, microvascular and macrovascular diseases. A summary showing the distribution of the labels amongst the patients in such a dataset is shown in Table 1 . The Portavita dataset presents a label cardinality of 2.13, a label density of 0.532 , with a total of 15 possible symbols (combination of co-occurring labels), all occurring in the dataset. All patients have multiple health records (>3), for an average number of records per patient equal to 6.72 and a total number of records equal to 3528, comprising a set of common laboratory tests and physical examinations that are part of normal routine tests in DT2. Table 2 gives a summary of the descriptive statistics of such laboratory tests. Depending on the stability of the diabetic patient physiological values, the data may be collected once every six months, or once every three months, to check for the presence of microvascular or macrovascular complications. As this is a real world dataset, the presence of a label may simply point towards a suspected issues, requiring further laboratory tests before it can be confirmed. In other cases, the label is assigned at the beginning of the treatment, and then it is never removed even if the patient does not present the complication any more. We can calculate that the prior probability for a patient to present a label to be 53.33% for each label, which represents a base average precision to compare against with the attempted classifiers. In the Portavita dataset, the tests are performed with a frequency of 3/6months for most of the features, which are conducted at the same time for each patient, and consequently, it is quite easy to produce a set of vectors and to go from the relational model to the multivariate time series associated to a patient for this dataset. 3.2 MIMIC II dataset As a second dataset for our study, we decided to use an extraction of 2635 patients from the MIMIC II database. Since MIMIC II is a large database, we decided to select patients that had more than 40 records. Our selection has an average of 60.39 records and a total of 159,127 records. The chronic illnesses and number of patients per illness in MIMIC II dataset are shown in Table 3 . The MIMIC II dataset has a label cardinality of 2.54 and a label density of 0.254 , with 1023 possible symbols, of which 194 are present in the dataset. The patients of MIMIC II are very different from those of Portavita, as MIMIC II is focused on intensive care patients, while Portavita\u2019s patients are standard care patients. This also implies that there are more laboratory tests collected per patient in MIMIC II than in Portavita. In MIMIC II the frequencies of the laboratory tests depend on the gravity of the patient and not on a treatment. We transformed the patients\u2019 records in multivariate time series by taking the sample frequency of the most frequent laboratory tests for each patient (for example, glucose in serum) and we applied a last observation carried forward (LOCF) to the less frequent measurements considering them as constant between two measurements. We are aware that LOCF underestimates the variability of the data. Our simplifying assumption in applying LOCF is that if the variability between measurements of such values was not crucial for the caregivers of the intensive care units in the first place, then it is acceptable to underestimate variability in our classification analysis. Validating approaches to handle data sampled with different frequencies is an interesting problem that we cannot exhaust within a single contribution, and therefore will be subject of future work. For those data that are completely missing, we applied the imputation approach explained in the next Section. The descriptive statistics of MIMIC II dataset, are shown in Table 4 . In MIMIC II case, the descriptive statistics for the physiological values are calculated before the LOCF procedure. The missing values rates are calculated after LOCF. A difference between Portavita and MIMIC II datasets is that Portavita has a balanced distribution of labels, whereas in MIMIC II the patient populations are imbalanced. Additionally the two datasets differ in label density. Another difference is that Portavita has a time granularity of months, whereas the tests are performed multiple times per day in MIMIC II. Finally, Portavita has way more missing values than MIMIC II. These differences will allow us to evaluate the considered algorithms in diverse settings and thus also highlight their strengths and weaknesses. 3.3 Missing value imputation For both of the datasets, the multivariate time series present missing values. In medical datasets, the missing at random assumption does not hold, since if a patient presents missing values for a test, it is often because there was no medical reason to perform it. Thus, removing patients with many missing values would bias the study towards patients with more recognized medical conditions. Similarly, removing features with many missing values implies losing information about the status of the patients. In the Portavita dataset, some of the features are missing more than 90% of the values. This is quite a normal situation in real world standard care datasets, as the patients considered may have different treatments and needs. To be useful, classification algorithms must be robust to large amounts of missing values and still be able to generalize with respect to unseen data. It is well known that there is not a single universal approach to deal with missing values [24] in medical datasets. One of the most used approaches is to substitute the mean for the missing values [25], but this is rarely considered acceptable [26]. A more acceptable approach is to use medical knowledge to substitute with values within a likely range [26]. With respect to the mean imputation, this avoids the misleading effect of considering ill someone due to imputing values out of normal ranges. Given these considerations, we performed plausible physiological values imputation in our multi-label classification analysis. We either impute physiological values in ranges that are likely for the given patient illnesses (putting high blood pressure if the patient has hypertension) or we impute physiological values of a healthy person when the related illness label is absent (normal blood pressure if the patient has not hypertension). 4 Methods In this section we illustrate how we apply a set of multi-label classification algorithms to the selected medical discrete time series datasets. For each of the algorithms selected we apply the following steps on the data: after transforming our data from medical records to multivariate time series as described in Section 3, we standardize the data to have the same contribution for each feature, we apply a BoW quantization and we standardize the data again to have the same contribution for each codeword. Then, for dimensionality reduction approaches, we apply a dimensionality reduction algorithm and we use a nearest centroid classifier based on the cosine distance. For standard multi-label classifiers, we apply the multi-label classification algorithm after the second standardization step. Fig. 1 , inspired by the work of Wang et al. in [7], illustrates the main steps applied by our system in the specific case of KLFDA. For the comparison, we chose the following algorithms, all applied on the model calculated with BoW: \u2022 BoW Cosine: This technique applies the cosine distance on the patient histograms and it represents the baseline for the comparison. \u2022 LDA-BR, KDA-BR and KLFDA-BR: Linear Discriminant Analysis [27], Kernel Discriminant Analysis and Kernel Local Fisher Discriminant Analysis, with a binary relevance approach, where the classes of the patients are those explained in Section 3. \u2022 LDA, KDA and KLFDA: The same as above, but concatenating the features. \u2022 MLkNN, DMLkNN, BPMLL, BR-SVM: Multi-label k-nearest neighbors [18], dependent multi-label k-nearest neighbors [28], back propagation multi-label learning [29] and multi-label support vector machines with a binary relevance approach [30]. We purposely decided to use multi-label algorithms capable of handling non-linearly separable data to confirm our hypothesis that supervised dimensionality reduction algorithms such as KLFDA and KDA are suitable candidates for multi-label learning in medical time series. In the rest of this Section we explain how we apply the BoW algorithm, the nearest centroid classifier and finally the metrics used for the evaluation of the multi-label classifiers. 4.1 From irregular multivariate time series to bag of words The BoW model was originally introduced for text document analysis [31]. In document retrieval a codebook is defined as a set of pre-selected words, also called codewords. The BoW method counts the codewords per document, reducing each document to a histogram. Adapted versions of the BoW model have been recently applied in the field of computer vision for image classification [32,33], and for biomedical time series classification [7]. When the entities to be analyzed are not documents, but are irregular time series of continuous physiological values, the codebook of the BoW model can be defined using a clustering algorithm. In this paper, the k-means algorithm [34] is used to cluster the multivariate time series obtained from the health records as explained in Section 3, associated to the patients to create a set of centroids. These centroids then become the codewords retained in the codebook. More formally, if we have a set of health records X = [ x 1 , x 2 , \u2026 , x n ] , with x i \u2208 R d , where d are numerical features of each record, associated to a set of patients P, where each patient can have more than one record, and a set of clustering centers c i \u2208 [ c 1 , \u2026 , c h ] calculated with k-means and representing the codebook, then we can set an un-normalized feature f, in an un-normalized histogram u , for f = 1 , \u2026 , | P | , as: (15) u f = \u2211 i = 1 P r \u2016 x i - c f \u2016 2 where P r is the number of records associated to a patient, and \u2016 \u00b7 \u2016 2 is the euclidean norm. After calculating u , we can calculate a normalized histogram h , as: (16) h f = u f \u2016 u \u2016 2 for f = 1 , \u2026 , | P | . Each patient is then represented in terms of a normalized histogram, allowing us to compare patients even if they have a different number of records. 4.2 Nearest centroid classification and label ranking To classify a new element x we first use the eigenvectors computed with KLFDA to project the testing sample in the identified subspace for a given label k: (17) x \u02c6 ( k ) = T opt ( k ) * \u03d5 ( x ) where x \u02c6 ( k ) is the projected testing sample using the transformation matrix T opt ( k ) , calculated for label k, on the mapping \u03d5 ( x ) . Second, we concatenate all the test sample projections for each of the labels in a single vector: (18) x \u02c6 \u02c6 = ( x \u02c6 ( 1 ) | x \u02c6 ( 2 ) | \u2026 | x \u02c6 ( k ) ) The possibility to concatenate features is a big advantage of dimensionality reduction approaches such as KDA and KLFDA as it allows us to define an easy way to chain the features calculated by the different classifiers, without the need to train another classifier recursively as it happens with classifier chains (CC). Third, we calculate a cosine distance between the mean of the projected training elements and the projected testing element for each of the labels. (19) d k = cos ( x \u02c6 \u02c6 , \u03bc k ) = x \u02c6 \u02c6 \u00b7 \u03bc k \u2016 x \u02c6 \u02c6 \u2016 \u2016 \u03bc k \u2016 where \u03bc k represent the mean of the concatenation of the features of the training elements in the projected space belonging to label k. To decide whether an element has a label or not, we perform the following test: (20) y \u02c6 k = 1 if d k < d \u223c k , 0 otherwise Finally, we can define the ranking function rank f ( x \u02c6 \u02c6 , k ) for label k as: (21) rank f ( x \u02c6 \u02c6 , k ) = 1 - d k d k + d \u223c k 4.3 Multi-label metrics As stated in [18,35], multi-label performance metrics differ from single label ones. Following the same approach presented in [36,18], we propose the following five evaluation metrics for multi-label learning. Let a testing set S = { ( x 1 , Y 1 ) , ( x 2 , Y 2 ) , \u2026 , ( x m , Y m ) } . Hamming loss: evaluates how many times an observation-label pair is misclassified. The score lies between 0 and 1, where 0 is the best: (22) hloss S ( h ) = 1 m \u2211 i = 1 m | h ( x i ) \u25b5 Y i | | L | One-error: evaluates how many times the top-ranked label is not in the set of proper labels of the observation. The score lies between 0 and 1, where 0 is the best: (23) one - error S ( f ) = 1 m \u2211 i = 1 m \u03b3 ( arg max y \u2208 L f ( x i , y ) ) , where (24) \u03b3 ( y ) = 1 if y \u2209 Y i , 0 otherwise. Coverage: evaluates how far on average we need to traverse the list of labels in order to cover all the proper labels of the observation. A score as small as possible is better: (25) coverage S ( f ) = 1 m \u2211 i = 1 m max y \u2208 Y i rank f ( x i , y ) - 1 . Ranking loss: evaluates the average part of label pairs that are ordered in reverse for the observation. The score lies between 0 and 1, where 0 is the best: (26) rloss S ( f ) = 1 m \u2211 i = 1 m 1 | Y i | | ( L \u29f9 Y i ) | \u00d7 | { ( y 1 , y 2 ) | f ( x i , y 1 ) \u2a7d f ( x i , y 2 ) , ( y 1 , y 2 ) \u2208 Y i \u00d7 ( L \u29f9 Y i ) } | Average precision: evaluates the average fraction of labels ranked above a particular label y \u2208 Y i which actually are in Y i . The score lies between 0 and 1, where 1 is the best: (27) avgprec S ( f ) = 1 m \u2211 i = 1 m 1 | Y i | \u00d7 \u2211 y \u2208 Y i | { y \u2032 | rank f ( x i , y \u2032 ) \u2a7d rank f ( x i , y ) , y \u2032 \u2208 Y i } | rank f ( x i , y ) . where \u25b5 represents the symmetric difference, and \u29f9 is the set-theoretic difference. 5 Results In this section we evaluate the combination of BoW and multi-label classification algorithms. In the Portavita dataset, we perform our evaluation using a leave-one-patient-out cross validation (LOPO CV). LOPO CV proved to be suitable for the medical domain [37], as it avoids situations that happen with leave-one-out (LOO), where records of the same patient are both in the training and testing set. Furthermore, LOPO CV presents an advantage with respect to N-folds CV, in which the selection of the random splits may lead to choose suboptimal parameters. Given the fact that we have 525 patients and 3528 health records, the computational cost of LOPO CV is affordable for the Portavita dataset. For model selection, we split our dataset into a training/validation set and a testing set, applying a LOPO CV on the training/validation set to select the best model for the testing phase. We withheld 375 patients for the training/validation and 150 patients for the testing. Concerning the MIMIC II dataset extraction, we used a 10-fold CV approach for the grid search, splitting the dataset and keeping 70% of the patients (1844) for training and validation and 30% (791) patients for testing, while keeping the same distribution of labels in the test dataset. 10-folds CV was chosen as this dataset counts 2635 patients for a total of 159,127 health records, and LOPO CV was computationally infeasible to run a grid search. 5.1 Parameters selection with CV The combination of BoW and dimensionality reduction techniques involves many parameters: size of the codebook, neighbors for the affinity matrix, the regularization coefficient, and the number of components to retain in the dimensionality reduction. Given the large amount of parameters to evaluate, we decided to run a grid search with a step of 100 for the size of the codebook, identifying cb = 600 as the best size for the codebook for all the considered algorithms in the Portavita dataset and cb = 800 for the MIMIC II dataset. After the dimensionality reduction applied by LDA, KDA, and KLFDA, we always retain components that can explain at least 99% of the variance of the model. Fig. 2 shows the grid search on average precision and hamming loss, run on the training set, for the other parameters of KLFDA in the Portavita dataset. Table 5 summarizes the parameters selection performed with LOPO CV and 10-fold cross validation concerning the algorithms studied for the Portavita and MIMIC II datasets. The parameter N identifies the number of neighbors, while \u03bb identifies the regularization factor, \u03c3 the smoothing parameter for MLkNN and DMLkNN, \u03b3 the exponent of the RBF kernel, and HN the number of hidden nodes in the BPMLL algorithm. In particular, the most difficult algorithm to train has been BPMLL as it requires more parameters than the other algorithms. To simplify the search, we decided to keep the learning rate constant to the default value \u03b1 = 0.05 . 5.2 Results on the Portavita dataset After training and validation of the model, we perform our testing using 150 additional patients from the Portavita dataset, with respect to the performance measures discussed in Section 4. Table 6 shows the results for the selected algorithms on the Portavita dataset, with a confidence interval of 95%. The BoW Cosine approach is taken as a baseline for the comparison with the other algorithms. The classes of patients of the Portavita dataset do not appear to be linearly separable and linear techniques such as LDA and LDA-BR do not seem to improve the results with respect to a BoW classifier. We think that this is due to the tendency of non-regularized LDA to overfit when the ratio between the classes and the features of the training elements is small [38,39]. KLFDA and KDA with feature concatenation achieve a better hamming and ranking loss than the other considered algorithms. KLFDA also achieves a better average precision. This suggests that in the case of classifying patients affected by DT2, the possibility of using supervised kernel methods and LPP brings an advantage in terms of classification. Another advantage of both KDA and KLFDA when compared to the other considered algorithms is the possibility of concatenating the projected features calculated by each of the classifiers. The KLFDA-BR and KDA-BR algorithms, on the contrary, do not perform much better than the standard BoW approach. In particular KDA-BR performs exactly the same as the BoW case. This is probably due to the fact that the relationship between the labels is not taken into consideration, degrading performances. KLFDA-BR shows an improvement with respect to BoW. This suggests that algorithms considering the locality of the data are likely to perform better than algorithms considering only the labels. MLkNN performs similarly to KDA and KLFDA, with the best one-error score, confirming that making use of neighborhood properties of the dataset is quite important in the case of DT2 patients. In contrast, BPMLL does not generalize too well with respect to new data after the training. The main issue of BPMLL is the large number of parameters to train, which makes it difficult to tune properly. Furthermore, BPMLL seems to be affected more by the large rate of missing values in the Portavita dataset than the other considered algorithms. BR-SVM performs well in both training and testing, despite not considering the interaction between the labels, which seems to explain the difference in performance with KLFDA concerning hamming loss and ranking loss. 5.3 Results on the MIMIC II dataset Table 7 shows the results for the selected algorithms on the MIMIC II dataset, with a confidence interval of 95%. As it is clear from Table 7, BoW without any transformation is affected by the curse of dimensionality and LDA-BR does not really give meaningful results. LDA manages to improve the results with respect to BoW, but as in the Portavita dataset, the algorithm does not perform well. First, Table 7 shows that for the MIMIC II dataset, the two best performing algorithms are MLkNN and DMLkNN, while the KDA and KLFDA algorithms perform similarly to MLkNN and DMLkNN. The fact that MIMIC II dataset has less missing values than Portavita, seems to favor the BPMLL algorithm, which performs well from the perspective of the average precision. BPMLL still does not perform well for the hamming loss and the ranking loss, which we believe related to the difficulty in training the algorithm. Second, binary relevance approaches seem to perform well on MIMIC II, except for BR-SVM. KDA-BR performs similarly to KLFDA-BR: this may happen because MIMIC II has 194 different symbols, and thus the interaction between the illnesses is quite complex, limiting the advantage of LPP projections. Furthermore, KDA-BR and KLFDA-BR seem to have comparable results to KLFDA and KDA, where the calculated features are concatenated. This may be related to the fact that MIMIC II is imbalanced. Concatenating features moves the centroid of a label depending on the features calculated for the other labels, but majority labels may have more impact in defining the centroids, degrading the performance. The difference in performance between BR-SVM, KDA-BR and KLFDA-BR is of more difficult interpretation. This could be caused by the use of regularization or of the nearest centroid classifier in KDA-BR and KLFDA-BR algorithms. 5.4 Discussion The fact that KLFDA and KDA perform better than the other algorithms for the Portavita dataset in respect to hamming loss and ranking loss is quite important in medical applications such as classification of diabetic patients complications. Hamming loss discriminates the capability of the algorithm to identify the presence of a complication, while ranking loss discriminates how well the algorithm ranks the labels. These metrics allow a caregiver to understand which patient illnesses have a strong expression, giving an indication on where to act more promptly. The performed evaluation illustrates the strengths and weaknesses of KDA and KLFDA for multi-label classification tasks: the behavior of KDA and KLFDA is comparable with that of state-of-the-art multi-label classification algorithms, but they seem to present an advantage with respect to datasets with a large number of missing values and with a high label density such as the Portavita dataset. We can have a better idea of the behavior of KDA and KLFDA by looking at Table 8 , comparing the hamming loss per symbol of KLFDA, KDA, BR-SVM and MLkNN, in the Portavita dataset (confidence intervals are omitted as we only have 10 elements per symbol). In these results, we see that KDA has an advantage where the patients have only one label, which are also those patients presenting many missing values in Portavita dataset. For the other classes, KDA performs similarly to BR-SVM, with some exceptions, probably caused by the fact that BR-SVM finds support vectors, whereas KDA is a variance based method. KLFDA seems to combine the behavior of KDA, BR-SVM and MLkNN: the eigenvectors explaining little variance are discarded just like in KDA; the use of kernel methods allows KLFDA to deal with non-linearity in the data, similarly to BR-SVM; the LPP transformation allows KLFDA to consider the neighborhood of the elements, similarly to MLkNN, but in addition if there are enough elements per symbol, with a high label density, the retained eigenvectors would be able to characterize those symbols expressing most variance. In this sense, when dealing with datasets presenting the three aspects of missing data, high label density and non-linearity, KLFDA may have an advantage with respect to other techniques. In MIMIC II, KLFDA and KDA perform slightly worse on the average precision than MLkNN and DMLkNN, but they are comparable for hamming loss and ranking loss. A possible reason for this is that MIMIC II dataset is imbalanced. KLFDA and KDA are variance based methods, so an imbalanced estimation of the classes variance impacts the calculated model and its performance. Looking at the hamming loss per symbol in MIMIC II, we found that the absence of missing values in MIMIC II, cancels the advantage of KLFDA and KDA, as they behave similarly to MLkNN for patients with only one complication. Additionally, MIMIC II has a low label density, with 194 symbols and few patients for most of the symbols, which may be difficult to characterize for the variance based model calculated by KLFDA and KDA. If this is the case, only the effect of the LPP projection of KLFDA, and of the nearest centroid classifier for KLFDA and KDA would be present and that would explain the similar behavior of KLFDA and KDA with MlKNN. Finally, an advantage of KLFDA and KDA it that they compute a model based on eigenvectors, which allows to include new patients\u2019 records by projecting their BoW representation and then recalculating the centroids for each class, while MLkNN and DMLkNN have to store the new instances in memory, that is infeasible with big datasets. 6 Conclusions In this paper we studied the combination of the BoW model in medical time series with dimensionality reduction approaches for multi-label patient classification. When taking the Portavita dataset into consideration, the KLFDA algorithm with a nearest centroid classifier achieves the best results. In the MIMIC II dataset, dimensionality reduction algorithms are comparable to state-of-the-art multi-label classification algorithms, but suffer from the fact that the dataset is imbalanced. There are several possible extensions to this work. At the moment we are using a single kernel mapping, but extensions of KLFDA and KDA that work with multiple kernel learning have already been defined [40]. Multiple kernels could achieve a better mapping for our data and improve the precision of KLFDA and KDA. Another promising approach could be to develop a multi-label version of KLFDA and KDA, similarly to what is proposed in [41]. This would require modifying the definition of the scatter matrices in KLFDA and KDA to consider multiple labels, which is quite a challenging problem. In Section 3, we identified the issue of dealing with values sampled at different frequencies. Quantizing patient data with different sampling frequencies or considering descriptive statistics rather than a codebook, could be suitable approaches. Finally, we could apply a different substitution to LOCF and generate physiological values with a maximum likelihood model, provided that enough patients\u2019 records are available. Acknowledgments This work was partially supported by the FP7 287841 COMMODITY12 project. We thank the anonymous reviewers for the useful comments that allowed us to improve the paper considerably. References [1] C. McAdam Marx Economic implications of type 2 diabetes management Am J Manag Care 19 2013 143 148 [2] J.G. Ghably B.J. Paterson A.N. Peiris Endocrinology in crisis? South Med J 106 2013 245 [3] T.G. Kannampallil A. Franklin R. Mishra K.F. Almoosa T. Cohen V.L. Patel Understanding the nature of information seeking behavior in critical care: Implications for the design of health information technology Artif Intell Med 57 2013 21 29 [4] J. Sun D. Sow J. Hu S. Ebadollahi Localized supervised metric learning on temporal physiological data Proceedings of the 2010 20th International Conference on Pattern Recognition, ICPR \u201910 2010 IEEE Computer Society Washington, DC, USA 4149 4152 [5] J. Sun F. Wang J. Hu S. Edabollahi Supervised patient similarity measure of heterogeneous patient records SIGKDD Explor 14 2012 16 24 [6] R.B. Marimont M.B. Shapiro Nearest neighbour searches and the curse of dimensionality IMA J Appl Math 24 1979 59 70 [7] Wang J, Liu P, She MF, Nahavandi S, Kouzani AZ. Bag-of-words representation for biomedical time series classification. CoRR abs/1212.2262; 2012. [8] M. Jiu C. Wolf C. Garcia A. Baskurt Supervised learning and codebook optimization for bag of words models Cognitive Comput 4 2012 409 419 [9] Ord\u00f3\u00f1ez P, Armstrong T, Oates T, Fackler J. Using modified multivariate bag-of-words models to classify physiological data. In: Spiliopoulou M, Wang H, Cook DJ, Pei J, Wang W, Za\u00efane OR, et al. editors. ICDM workshops. IEEE; 2011. p. 534\u201339. [10] G. Madjarov D. Kocev D. Gjorgjevikj S. Dzeroski An extensive experimental comparison of methods for multi-label learning Pattern Recognit 45 2012 3084 3104 [11] M.-L. Zhang Z.-H. Zhou A review on multi-label learning algorithms IEEE Trans Knowl Data Eng 99 2013 1 [12] S. Ji J. Ye Linear dimensionality reduction for multi-label classification Proceedings of the 21st international jont conference on Artificial intelligence, IJCAI\u201909 2009 Morgan Kaufman Publishers Inc. San Francisco, CA, USA 1077 1082 [13] E. Pacharawongsakda C. Nattee T. Theeramunkong Improving multi-label classification using semi-supervised learning and dimensionality reduction P. Anthony M. Ishizuka D. Lukose PRICAI Lecture notes in computer science vol. 7458 2012 Springer 423 434 [14] B. Qian I. Davidson Semi-supervised dimension reduction for multi-label classification M. Fox D. Poole AAAI 2010 AAAI Press [15] Pestian JP, Brew C, Matykiewicz P, Hovermale DJ, Johnson N, Cohen KB, et al. A shared task involving multi-label classification of clinical free text. In: Proceedings of the workshop on BioNLP 2007: biological, translational, and clinical language processing, BioNLP \u201907, association for computational linguistics. Stroudsburg, PA, USA; 2007. p. 97\u2013104. [16] W.T. Cade Diabetes-related microvascular and macrovascular diseases in the physical therapy setting Phys Ther 88 2008 1322 1335 [17] M. Saeed M. Villarroel A.T. Reisner G. Clifford L.-W. Lehman G. Moody Multiparameter intelligent monitoring in intensive care II (MIMIC-II): a public-access intensive care unit database Crit Care Med 39 2011 952 960 [18] M.-L. Zhang Z.-H. Zhou ML-KNN: a lazy learning approach to multi-label learning Pattern Recognit 40 2007 2038 2048 [19] J. Shawe-Taylor N. Cristianini Kernel methods for pattern analysis 2004 Cambridge University Press [20] Barla A, Odone F, Verri A. Histogram intersection kernel for image classification. In: ICIP (3). p. 513\u201316. [21] X. He P. Niyogi Locality preserving projections S. Thrun L. Saul B. Sch\u00f6lkopf Advances in neural information processing systems, vol. 16 2004 MIT Press Cambridge, MA [22] K. Fukunaga Introduction to statistical pattern recognition 2nd ed. 1990 Academic Press Professional, Inc. San Diego, CA, USA [23] M. Sugiyama Dimensionality reduction of multimodal labeled data by local fisher discriminant analysis J Mach Learning Res 8 2007 1027 1061 [24] R.J. Little R. D\u2019Agostino M.L. Cohen K. Dickersin S.S. Emerson J.T. Farrar The prevention and treatment of missing data in clinical trials N Engl J Med 367 2012 1355 1360 [25] J.D. Dziura L.A. Post Q. Zhao Z. Fu P. Peduzzi Strategies for dealing with missing data in clinical trials: from design to analysis Yale J Biol Med 86 2013 343 358 [26] D. Jackson I.R. White M. Leese How much can we learn about missing data? An exploration of a clinical trial in psychiatry J R Stat Soc Ser A Stat Soc 173 2010 593 612 [27] R.A. Fisher The use of multiple measurements in taxonomic problems Ann Eugenics 7 1936 179 188 [28] Z. Younes F. Abdallah T. Denoeux H. Snoussi A dependent multilabel classification method derived from the k-nearest neighbor rule EURASIP J Adv Sig Proc 2011 2011 [29] M.-L. Zhang Z.-H. Zhou Multilabel neural networks with applications to functional genomics and text categorization IEEE Trans Knowl Data Eng 18 2006 1338 1351 [30] C. Cortes V. Vapnik Support-vector networks Mach Learning 20 1995 273 297 [31] Y. Ko A study of term weighting schemes using class information for text classification Proceedings of the 35th international ACM SIGIR conference on research and development in information retrieval, SIGIR\u201912 2012 ACM New York, NY, USA 1029 1030 [32] J. Sivic A. Zisserman Efficient visual search of videos cast as text retrieval IEEE Trans Pattern Anal Mach Intell 31 2009 591 606 [33] J. Sivic A. Zisserman Efficient visual content retrieval and mining in videos K. Aizawa Y. Nakamura S. Satoh Advances in multimedia information processing \u2013 PCM 2004 Lecture notes in computer science vol. 3332 2005 Springer Berlin Heidelberg 471 478 [34] J.B. MacQueen Some methods for classification and analysis of multivariate observations L.M.L. Cam J. Neyman Proc. of the fifth Berkeley symposium on mathematical statistics and probability vol. 1 1967 University of California Press 281 297 [35] G. Tsoumakas I. Katakis I.P. Vlahavas Mining multi-label data O. Maimon L. Rokach Data mining and knowledge discovery handbook 2010 Springer 667 685 [36] R.E. Schapire Y. Singer Boostexter: a boosting-based system for text categorization Mach Learning 39 2000 135 168 [37] M. Dundar G. Fung L. Bogoni M. Macari A. Megibow B. Rao A methodology for training and validating a CAD system and potential pitfalls Int Congr Ser 1268 2004 1010 1014 [CARS 2004 \u2013 Computer Assisted Radiology and Surgery. Proceedings of the 18th International Congress and Exhibition] [38] Jain A, Chandrasekaran B. Dimensionality and sample size considerations. In: Krishnaiah P, Kanal L. editors. Pattern recognition in practice; 1982. p. 835\u201355. [39] K. Linnet On the sensitivity of linear discriminant analysis to sampling variation and analytical errors Comput Biomed Res 21 1988 158 168 [40] Z. Wang X. Sun Multiple kernel local Fisher discriminant analysis for face recognition Signal Process 93 2013 1496 1509 [Special issue on Machine Learning in Intelligent Image Processing] [41] C.H. Park M. Lee On applying linear discriminant analysis for multi-labeled problems Pattern Recognit Lett 29 2008 878 887", "scopus-id": "84908027298", "pubmed-id": "24879897", "coredata": {"eid": "1-s2.0-S1532046414001270", "dc:description": "Abstract Objective This research is motivated by the issue of classifying illnesses of chronically ill patients for decision support in clinical settings. Our main objective is to propose multi-label classification of multivariate time series contained in medical records of chronically ill patients, by means of quantization methods, such as bag of words (BoW), and multi-label classification algorithms. Our second objective is to compare supervised dimensionality reduction techniques to state-of-the-art multi-label classification algorithms. The hypothesis is that kernel methods and locality preserving projections make such algorithms good candidates to study multi-label medical time series. Methods We combine BoW and supervised dimensionality reduction algorithms to perform multi-label classification on health records of chronically ill patients. The considered algorithms are compared with state-of-the-art multi-label classifiers in two real world datasets. Portavita dataset contains 525 diabetes type 2 (DT2) patients, with co-morbidities of DT2 such as hypertension, dyslipidemia, and microvascular or macrovascular issues. MIMIC II dataset contains 2635 patients affected by thyroid disease, diabetes mellitus, lipoid metabolism disease, fluid electrolyte disease, hypertensive disease, thrombosis, hypotension, chronic obstructive pulmonary disease (COPD), liver disease and kidney disease. The algorithms are evaluated using multi-label evaluation metrics such as hamming loss, one error, coverage, ranking loss, and average precision. Results Non-linear dimensionality reduction approaches behave well on medical time series quantized using the BoW algorithm, with results comparable to state-of-the-art multi-label classification algorithms. Chaining the projected features has a positive impact on the performance of the algorithm with respect to pure binary relevance approaches. Conclusions The evaluation highlights the feasibility of representing medical health records using the BoW for multi-label classification tasks. The study also highlights that dimensionality reduction algorithms based on kernel methods, locality preserving projections or both are good candidates to deal with multi-label classification tasks in medical time series with many missing values and high label density.", "openArchiveArticle": "true", "prism:coverDate": "2014-10-31", "openaccessUserLicense": "http://www.elsevier.com/open-access/userlicense/1.0/", "prism:aggregationType": "Journal", "prism:url": "https://api.elsevier.com/content/article/pii/S1532046414001270", "dc:creator": [{"@_fa": "true", "$": "Bromuri, Stefano"}, {"@_fa": "true", "$": "Zufferey, Damien"}, {"@_fa": "true", "$": "Hennebert, Jean"}, {"@_fa": "true", "$": "Schumacher, Michael"}], "link": [{"@_fa": "true", "@rel": "self", "@href": "https://api.elsevier.com/content/article/pii/S1532046414001270"}, {"@_fa": "true", "@rel": "scidir", "@href": "https://www.sciencedirect.com/science/article/pii/S1532046414001270"}], "dc:format": "application/json", "openaccessType": "Full", "pii": "S1532-0464(14)00127-0", "prism:volume": "51", "prism:publisher": "Elsevier Inc.", "dc:title": "Multi-label classification of chronically ill patients with bag of words and supervised dimensionality reduction algorithms", "prism:copyright": "Copyright \u00a9 2014 Elsevier Inc. All rights reserved.", "openaccess": "1", "prism:issn": "15320464", "dcterms:subject": [{"@_fa": "true", "$": "Multi-label classification"}, {"@_fa": "true", "$": "Complex patient"}, {"@_fa": "true", "$": "Diabetes type 2"}, {"@_fa": "true", "$": "Clinical data"}, {"@_fa": "true", "$": "Dimensionality reduction"}, {"@_fa": "true", "$": "Kernel methods"}], "openaccessArticle": "true", "prism:publicationName": "Journal of Biomedical Informatics", "openaccessSponsorType": "ElsevierBranded", "prism:pageRange": "165-175", "prism:endingPage": "175", "prism:coverDisplayDate": "October 2014", "prism:doi": "10.1016/j.jbi.2014.05.010", "prism:startingPage": "165", "dc:identifier": "doi:10.1016/j.jbi.2014.05.010", "openaccessSponsorName": null}, "objects": {"object": [{"@category": "thumbnail", "@height": "103", "@width": "450", "@_fa": "true", "$": "https://api.elsevier.com/content/object/eid/1-s2.0-S1532046414001270-si134.gif?httpAccept=%2A%2F%2A", "@multimediatype": "GIF image file", "@type": "ALTIMG", "@size": "6791", "@ref": "si134", "@mimetype": "image/gif"}, {"@category": "thumbnail", "@height": "76", "@width": "359", "@_fa": "true", "$": "https://api.elsevier.com/content/object/eid/1-s2.0-S1532046414001270-si131.gif?httpAccept=%2A%2F%2A", "@multimediatype": "GIF image file", "@type": "ALTIMG", "@size": "6079", "@ref": "si131", "@mimetype": "image/gif"}, {"@category": "thumbnail", "@height": "45", "@width": "309", "@_fa": "true", "$": "https://api.elsevier.com/content/object/eid/1-s2.0-S1532046414001270-si130.gif?httpAccept=%2A%2F%2A", "@multimediatype": "GIF image file", "@type": "ALTIMG", "@size": "3727", "@ref": "si130", "@mimetype": "image/gif"}, {"@category": "thumbnail", "@height": "44", "@width": "178", "@_fa": "true", "$": "https://api.elsevier.com/content/object/eid/1-s2.0-S1532046414001270-si129.gif?httpAccept=%2A%2F%2A", "@multimediatype": "GIF image file", "@type": "ALTIMG", "@size": "2551", "@ref": "si129", "@mimetype": "image/gif"}, {"@category": "thumbnail", "@height": "45", "@width": "313", "@_fa": "true", "$": "https://api.elsevier.com/content/object/eid/1-s2.0-S1532046414001270-si128.gif?httpAccept=%2A%2F%2A", "@multimediatype": "GIF image file", "@type": "ALTIMG", "@size": "3697", "@ref": "si128", "@mimetype": "image/gif"}, {"@category": "thumbnail", "@height": "45", "@width": "205", "@_fa": "true", "$": "https://api.elsevier.com/content/object/eid/1-s2.0-S1532046414001270-si127.gif?httpAccept=%2A%2F%2A", "@multimediatype": "GIF image file", "@type": "ALTIMG", "@size": "2875", "@ref": "si127", "@mimetype": "image/gif"}, {"@category": "thumbnail", "@height": "41", "@width": "192", "@_fa": "true", "$": "https://api.elsevier.com/content/object/eid/1-s2.0-S1532046414001270-si125.gif?httpAccept=%2A%2F%2A", "@multimediatype": "GIF image file", "@type": "ALTIMG", "@size": "2033", "@ref": "si125", "@mimetype": "image/gif"}, {"@category": "thumbnail", "@height": "44", "@width": "167", "@_fa": "true", "$": "https://api.elsevier.com/content/object/eid/1-s2.0-S1532046414001270-si123.gif?httpAccept=%2A%2F%2A", "@multimediatype": "GIF image file", "@type": "ALTIMG", "@size": "2433", "@ref": "si123", "@mimetype": "image/gif"}, {"@category": "thumbnail", "@height": "51", "@width": "194", "@_fa": "true", "$": "https://api.elsevier.com/content/object/eid/1-s2.0-S1532046414001270-si121.gif?httpAccept=%2A%2F%2A", "@multimediatype": "GIF image file", "@type": "ALTIMG", "@size": "2421", "@ref": "si121", "@mimetype": "image/gif"}, {"@category": "thumbnail", "@height": "23", "@width": "154", "@_fa": "true", "$": "https://api.elsevier.com/content/object/eid/1-s2.0-S1532046414001270-si120.gif?httpAccept=%2A%2F%2A", "@multimediatype": "GIF image file", "@type": "ALTIMG", "@size": "1523", "@ref": "si120", "@mimetype": "image/gif"}, {"@category": "thumbnail", "@height": "25", "@width": "122", "@_fa": "true", "$": "https://api.elsevier.com/content/object/eid/1-s2.0-S1532046414001270-si116.gif?httpAccept=%2A%2F%2A", "@multimediatype": "GIF image file", "@type": "ALTIMG", "@size": "1473", "@ref": "si116", "@mimetype": "image/gif"}, {"@category": "thumbnail", "@height": "39", "@width": "75", "@_fa": "true", "$": "https://api.elsevier.com/content/object/eid/1-s2.0-S1532046414001270-si114.gif?httpAccept=%2A%2F%2A", "@multimediatype": "GIF image file", "@type": "ALTIMG", "@size": "1075", "@ref": "si114", "@mimetype": "image/gif"}, {"@category": "thumbnail", "@height": "48", "@width": "133", "@_fa": "true", "$": "https://api.elsevier.com/content/object/eid/1-s2.0-S1532046414001270-si109.gif?httpAccept=%2A%2F%2A", "@multimediatype": "GIF image file", "@type": "ALTIMG", "@size": "1607", "@ref": "si109", "@mimetype": "image/gif"}, {"@category": "thumbnail", "@height": "49", "@width": "144", "@_fa": "true", "$": "https://api.elsevier.com/content/object/eid/1-s2.0-S1532046414001270-si98.gif?httpAccept=%2A%2F%2A", "@multimediatype": "GIF image file", "@type": "ALTIMG", "@size": "2141", "@ref": "si98", "@mimetype": "image/gif"}, {"@category": "thumbnail", "@height": "49", "@width": "138", "@_fa": "true", "$": "https://api.elsevier.com/content/object/eid/1-s2.0-S1532046414001270-si96.gif?httpAccept=%2A%2F%2A", "@multimediatype": "GIF image file", "@type": "ALTIMG", "@size": "1955", "@ref": "si96", "@mimetype": "image/gif"}, {"@category": "thumbnail", "@height": "51", "@width": "302", "@_fa": "true", "$": "https://api.elsevier.com/content/object/eid/1-s2.0-S1532046414001270-si94.gif?httpAccept=%2A%2F%2A", "@multimediatype": "GIF image file", "@type": "ALTIMG", "@size": "3851", "@ref": "si94", "@mimetype": "image/gif"}, {"@category": "thumbnail", "@height": "41", "@width": "307", "@_fa": "true", "$": "https://api.elsevier.com/content/object/eid/1-s2.0-S1532046414001270-si91.gif?httpAccept=%2A%2F%2A", "@multimediatype": "GIF image file", "@type": "ALTIMG", "@size": "3565", "@ref": "si91", "@mimetype": "image/gif"}, {"@category": "thumbnail", "@height": "52", "@width": "309", "@_fa": "true", "$": "https://api.elsevier.com/content/object/eid/1-s2.0-S1532046414001270-si86.gif?httpAccept=%2A%2F%2A", "@multimediatype": "GIF image file", "@type": "ALTIMG", "@size": "3793", "@ref": "si86", "@mimetype": "image/gif"}, {"@category": "thumbnail", "@height": "52", "@width": "238", "@_fa": "true", "$": "https://api.elsevier.com/content/object/eid/1-s2.0-S1532046414001270-si85.gif?httpAccept=%2A%2F%2A", "@multimediatype": "GIF image file", "@type": "ALTIMG", "@size": "3087", "@ref": "si85", "@mimetype": "image/gif"}, {"@category": "thumbnail", "@height": "48", "@width": "243", "@_fa": "true", "$": "https://api.elsevier.com/content/object/eid/1-s2.0-S1532046414001270-si84.gif?httpAccept=%2A%2F%2A", "@multimediatype": "GIF image file", "@type": "ALTIMG", "@size": "2931", "@ref": "si84", "@mimetype": "image/gif"}, {"@category": "thumbnail", "@height": "48", "@width": "249", "@_fa": "true", "$": "https://api.elsevier.com/content/object/eid/1-s2.0-S1532046414001270-si83.gif?httpAccept=%2A%2F%2A", "@multimediatype": "GIF image file", "@type": "ALTIMG", "@size": "2979", "@ref": "si83", "@mimetype": "image/gif"}, {"@category": "thumbnail", "@height": "49", "@width": "215", "@_fa": "true", "$": "https://api.elsevier.com/content/object/eid/1-s2.0-S1532046414001270-si80.gif?httpAccept=%2A%2F%2A", "@multimediatype": "GIF image file", "@type": "ALTIMG", "@size": "3241", "@ref": "si80", "@mimetype": "image/gif"}, {"@category": "thumbnail", "@height": "48", "@width": "216", "@_fa": "true", "$": "https://api.elsevier.com/content/object/eid/1-s2.0-S1532046414001270-si73.gif?httpAccept=%2A%2F%2A", "@multimediatype": "GIF image file", "@type": "ALTIMG", "@size": "2385", "@ref": "si73", "@mimetype": "image/gif"}, {"@category": "thumbnail", "@height": "50", "@width": "220", "@_fa": "true", "$": "https://api.elsevier.com/content/object/eid/1-s2.0-S1532046414001270-si70.gif?httpAccept=%2A%2F%2A", "@multimediatype": "GIF image file", "@type": "ALTIMG", "@size": "2581", "@ref": "si70", "@mimetype": "image/gif"}, {"@category": "thumbnail", "@height": "53", "@width": "300", "@_fa": "true", "$": "https://api.elsevier.com/content/object/eid/1-s2.0-S1532046414001270-si66.gif?httpAccept=%2A%2F%2A", "@multimediatype": "GIF image file", "@type": "ALTIMG", "@size": "3951", "@ref": "si66", "@mimetype": "image/gif"}, {"@category": "thumbnail", "@height": "45", "@width": "170", "@_fa": "true", "$": "https://api.elsevier.com/content/object/eid/1-s2.0-S1532046414001270-si57.gif?httpAccept=%2A%2F%2A", "@multimediatype": "GIF image file", "@type": "ALTIMG", "@size": "2183", "@ref": "si57", "@mimetype": "image/gif"}, {"@category": "thumbnail", "@height": "43", "@width": "144", "@_fa": "true", "$": "https://api.elsevier.com/content/object/eid/1-s2.0-S1532046414001270-si54.gif?httpAccept=%2A%2F%2A", "@multimediatype": "GIF image file", "@type": "ALTIMG", "@size": "1911", "@ref": "si54", "@mimetype": "image/gif"}, {"@category": "thumbnail", "@height": "14", "@width": "44", "@_fa": "true", "$": "https://api.elsevier.com/content/object/eid/1-s2.0-S1532046414001270-si99.gif?httpAccept=%2A%2F%2A", "@multimediatype": "GIF image file", "@type": "ALTIMG", "@size": "665", "@ref": "si99", "@mimetype": "image/gif"}, {"@category": "thumbnail", "@height": "17", "@width": "15", "@_fa": "true", "$": "https://api.elsevier.com/content/object/eid/1-s2.0-S1532046414001270-si97.gif?httpAccept=%2A%2F%2A", "@multimediatype": "GIF image file", "@type": "ALTIMG", "@size": "383", "@ref": "si97", "@mimetype": "image/gif"}, {"@category": "thumbnail", "@height": "14", "@width": "15", "@_fa": "true", "$": "https://api.elsevier.com/content/object/eid/1-s2.0-S1532046414001270-si95.gif?httpAccept=%2A%2F%2A", "@multimediatype": "GIF image file", "@type": "ALTIMG", "@size": "391", "@ref": "si95", "@mimetype": "image/gif"}, {"@category": "thumbnail", "@height": "21", "@width": "18", "@_fa": "true", "$": "https://api.elsevier.com/content/object/eid/1-s2.0-S1532046414001270-si93.gif?httpAccept=%2A%2F%2A", "@multimediatype": "GIF image file", "@type": "ALTIMG", "@size": "503", "@ref": "si93", "@mimetype": "image/gif"}, {"@category": "thumbnail", "@height": "22", "@width": "45", "@_fa": "true", "$": "https://api.elsevier.com/content/object/eid/1-s2.0-S1532046414001270-si92.gif?httpAccept=%2A%2F%2A", "@multimediatype": "GIF image file", "@type": "ALTIMG", "@size": "823", "@ref": "si92", "@mimetype": "image/gif"}, {"@category": "thumbnail", "@height": "11", "@width": "14", "@_fa": "true", "$": "https://api.elsevier.com/content/object/eid/1-s2.0-S1532046414001270-si90.gif?httpAccept=%2A%2F%2A", "@multimediatype": "GIF image file", "@type": "ALTIMG", "@size": "373", "@ref": "si90", "@mimetype": "image/gif"}, {"@category": "thumbnail", "@height": "17", "@width": "65", "@_fa": "true", "$": "https://api.elsevier.com/content/object/eid/1-s2.0-S1532046414001270-si9.gif?httpAccept=%2A%2F%2A", "@multimediatype": "GIF image file", "@type": "ALTIMG", "@size": "743", "@ref": "si9", "@mimetype": "image/gif"}, {"@category": "thumbnail", "@height": "14", "@width": "14", "@_fa": "true", "$": "https://api.elsevier.com/content/object/eid/1-s2.0-S1532046414001270-si89.gif?httpAccept=%2A%2F%2A", "@multimediatype": "GIF image file", "@type": "ALTIMG", "@size": "397", "@ref": "si89", "@mimetype": "image/gif"}, {"@category": "thumbnail", "@height": "19", "@width": "22", "@_fa": "true", "$": "https://api.elsevier.com/content/object/eid/1-s2.0-S1532046414001270-si88.gif?httpAccept=%2A%2F%2A", "@multimediatype": "GIF image file", "@type": "ALTIMG", "@size": "481", "@ref": "si88", "@mimetype": "image/gif"}, {"@category": "thumbnail", "@height": "19", "@width": "76", "@_fa": "true", "$": "https://api.elsevier.com/content/object/eid/1-s2.0-S1532046414001270-si87.gif?httpAccept=%2A%2F%2A", "@multimediatype": "GIF image file", "@type": "ALTIMG", "@size": "909", "@ref": "si87", "@mimetype": "image/gif"}, {"@category": "thumbnail", "@height": "18", "@width": "24", "@_fa": "true", "$": "https://api.elsevier.com/content/object/eid/1-s2.0-S1532046414001270-si82.gif?httpAccept=%2A%2F%2A", "@multimediatype": "GIF image file", "@type": "ALTIMG", "@size": "539", "@ref": "si82", "@mimetype": "image/gif"}, {"@category": "thumbnail", "@height": "18", "@width": "27", "@_fa": "true", "$": "https://api.elsevier.com/content/object/eid/1-s2.0-S1532046414001270-si81.gif?httpAccept=%2A%2F%2A", "@multimediatype": "GIF image file", "@type": "ALTIMG", "@size": "555", "@ref": "si81", "@mimetype": "image/gif"}, {"@category": "thumbnail", "@height": "14", "@width": "40", "@_fa": "true", "$": "https://api.elsevier.com/content/object/eid/1-s2.0-S1532046414001270-si8.gif?httpAccept=%2A%2F%2A", "@multimediatype": "GIF image file", "@type": "ALTIMG", "@size": "483", "@ref": "si8", "@mimetype": "image/gif"}, {"@category": "thumbnail", "@height": "14", "@width": "30", "@_fa": "true", "$": "https://api.elsevier.com/content/object/eid/1-s2.0-S1532046414001270-si79.gif?httpAccept=%2A%2F%2A", "@multimediatype": "GIF image file", "@type": "ALTIMG", "@size": "507", "@ref": "si79", "@mimetype": "image/gif"}, {"@category": "thumbnail", "@height": "18", "@width": "23", "@_fa": "true", "$": "https://api.elsevier.com/content/object/eid/1-s2.0-S1532046414001270-si78.gif?httpAccept=%2A%2F%2A", "@multimediatype": "GIF image file", "@type": "ALTIMG", "@size": "513", "@ref": "si78", "@mimetype": "image/gif"}, {"@category": "thumbnail", "@height": "17", "@width": "25", "@_fa": "true", "$": "https://api.elsevier.com/content/object/eid/1-s2.0-S1532046414001270-si77.gif?httpAccept=%2A%2F%2A", "@multimediatype": "GIF image file", "@type": "ALTIMG", "@size": "278", "@ref": "si77", "@mimetype": "image/gif"}, {"@category": "thumbnail", "@height": "14", "@width": "14", "@_fa": "true", "$": "https://api.elsevier.com/content/object/eid/1-s2.0-S1532046414001270-si76.gif?httpAccept=%2A%2F%2A", "@multimediatype": "GIF image file", "@type": "ALTIMG", "@size": "218", "@ref": "si76", "@mimetype": "image/gif"}, {"@category": "thumbnail", "@height": "14", "@width": "17", "@_fa": "true", "$": "https://api.elsevier.com/content/object/eid/1-s2.0-S1532046414001270-si75.gif?httpAccept=%2A%2F%2A", "@multimediatype": "GIF image file", "@type": "ALTIMG", "@size": "231", "@ref": "si75", "@mimetype": "image/gif"}, {"@category": "thumbnail", "@height": "14", "@width": "13", "@_fa": "true", "$": "https://api.elsevier.com/content/object/eid/1-s2.0-S1532046414001270-si74.gif?httpAccept=%2A%2F%2A", "@multimediatype": "GIF image file", "@type": "ALTIMG", "@size": "212", "@ref": "si74", "@mimetype": "image/gif"}, {"@category": "thumbnail", "@height": "14", "@width": "14", "@_fa": "true", "$": "https://api.elsevier.com/content/object/eid/1-s2.0-S1532046414001270-si72.gif?httpAccept=%2A%2F%2A", "@multimediatype": "GIF image file", "@type": "ALTIMG", "@size": "218", "@ref": "si72", "@mimetype": "image/gif"}, {"@category": "thumbnail", "@height": "14", "@width": "16", "@_fa": "true", "$": "https://api.elsevier.com/content/object/eid/1-s2.0-S1532046414001270-si71.gif?httpAccept=%2A%2F%2A", "@multimediatype": "GIF image file", "@type": "ALTIMG", "@size": "230", "@ref": "si71", "@mimetype": "image/gif"}, {"@category": "thumbnail", "@height": "13", "@width": "41", "@_fa": "true", "$": "https://api.elsevier.com/content/object/eid/1-s2.0-S1532046414001270-si7.gif?httpAccept=%2A%2F%2A", "@multimediatype": "GIF image file", "@type": "ALTIMG", "@size": "254", "@ref": "si7", "@mimetype": "image/gif"}, {"@category": "thumbnail", "@height": "18", "@width": "23", "@_fa": "true", "$": "https://api.elsevier.com/content/object/eid/1-s2.0-S1532046414001270-si69.gif?httpAccept=%2A%2F%2A", "@multimediatype": "GIF image file", "@type": "ALTIMG", "@size": "278", "@ref": "si69", "@mimetype": "image/gif"}, {"@category": "thumbnail", "@height": "17", "@width": "25", "@_fa": "true", "$": "https://api.elsevier.com/content/object/eid/1-s2.0-S1532046414001270-si68.gif?httpAccept=%2A%2F%2A", "@multimediatype": "GIF image file", "@type": "ALTIMG", "@size": "278", "@ref": "si68", "@mimetype": "image/gif"}, {"@category": "thumbnail", "@height": "14", "@width": "28", "@_fa": "true", "$": "https://api.elsevier.com/content/object/eid/1-s2.0-S1532046414001270-si67.gif?httpAccept=%2A%2F%2A", "@multimediatype": "GIF image file", "@type": "ALTIMG", "@size": "267", "@ref": "si67", "@mimetype": "image/gif"}, {"@category": "thumbnail", "@height": "14", "@width": "28", "@_fa": "true", "$": "https://api.elsevier.com/content/object/eid/1-s2.0-S1532046414001270-si65.gif?httpAccept=%2A%2F%2A", "@multimediatype": "GIF image file", "@type": "ALTIMG", "@size": "267", "@ref": "si65", "@mimetype": "image/gif"}, {"@category": "thumbnail", "@height": "14", "@width": "14", "@_fa": "true", "$": "https://api.elsevier.com/content/object/eid/1-s2.0-S1532046414001270-si64.gif?httpAccept=%2A%2F%2A", "@multimediatype": "GIF image file", "@type": "ALTIMG", "@size": "220", "@ref": "si64", "@mimetype": "image/gif"}, {"@category": "thumbnail", "@height": "11", "@width": "14", "@_fa": "true", "$": "https://api.elsevier.com/content/object/eid/1-s2.0-S1532046414001270-si63.gif?httpAccept=%2A%2F%2A", "@multimediatype": "GIF image file", "@type": "ALTIMG", "@size": "208", "@ref": "si63", "@mimetype": "image/gif"}, {"@category": "thumbnail", "@height": "19", "@width": "76", "@_fa": "true", "$": "https://api.elsevier.com/content/object/eid/1-s2.0-S1532046414001270-si62.gif?httpAccept=%2A%2F%2A", "@multimediatype": "GIF image file", "@type": "ALTIMG", "@size": "476", "@ref": "si62", "@mimetype": "image/gif"}, {"@category": "thumbnail", "@height": "17", "@width": "64", "@_fa": "true", "$": "https://api.elsevier.com/content/object/eid/1-s2.0-S1532046414001270-si61.gif?httpAccept=%2A%2F%2A", "@multimediatype": "GIF image file", "@type": "ALTIMG", "@size": "411", "@ref": "si61", "@mimetype": "image/gif"}, {"@category": "thumbnail", "@height": "10", "@width": "39", "@_fa": "true", "$": "https://api.elsevier.com/content/object/eid/1-s2.0-S1532046414001270-si60.gif?httpAccept=%2A%2F%2A", "@multimediatype": "GIF image file", "@type": "ALTIMG", "@size": "257", "@ref": "si60", "@mimetype": "image/gif"}, {"@category": "thumbnail", "@height": "17", "@width": "65", "@_fa": "true", "$": "https://api.elsevier.com/content/object/eid/1-s2.0-S1532046414001270-si6.gif?httpAccept=%2A%2F%2A", "@multimediatype": "GIF image file", "@type": "ALTIMG", "@size": "393", "@ref": "si6", "@mimetype": "image/gif"}, {"@category": "thumbnail", "@height": "13", "@width": "18", "@_fa": "true", "$": "https://api.elsevier.com/content/object/eid/1-s2.0-S1532046414001270-si59.gif?httpAccept=%2A%2F%2A", "@multimediatype": "GIF image file", "@type": "ALTIMG", "@size": "224", "@ref": "si59", "@mimetype": "image/gif"}, {"@category": "thumbnail", "@height": "13", "@width": "19", "@_fa": "true", "$": "https://api.elsevier.com/content/object/eid/1-s2.0-S1532046414001270-si58.gif?httpAccept=%2A%2F%2A", "@multimediatype": "GIF image file", "@type": "ALTIMG", "@size": "235", "@ref": "si58", "@mimetype": "image/gif"}, {"@category": "thumbnail", "@height": "13", "@width": "14", "@_fa": "true", "$": "https://api.elsevier.com/content/object/eid/1-s2.0-S1532046414001270-si56.gif?httpAccept=%2A%2F%2A", "@multimediatype": "GIF image file", "@type": "ALTIMG", "@size": "221", "@ref": "si56", "@mimetype": "image/gif"}, {"@category": "thumbnail", "@height": "11", "@width": "14", "@_fa": "true", "$": "https://api.elsevier.com/content/object/eid/1-s2.0-S1532046414001270-si55.gif?httpAccept=%2A%2F%2A", "@multimediatype": "GIF image file", "@type": "ALTIMG", "@size": "208", "@ref": "si55", "@mimetype": "image/gif"}, {"@category": "thumbnail", "@height": "17", "@width": "40", "@_fa": "true", "$": "https://api.elsevier.com/content/object/eid/1-s2.0-S1532046414001270-si53.gif?httpAccept=%2A%2F%2A", "@multimediatype": "GIF image file", "@type": "ALTIMG", "@size": "316", "@ref": "si53", "@mimetype": "image/gif"}, {"@category": "thumbnail", "@height": "17", "@width": "40", "@_fa": "true", "$": "https://api.elsevier.com/content/object/eid/1-s2.0-S1532046414001270-si52.gif?httpAccept=%2A%2F%2A", "@multimediatype": "GIF image file", "@type": "ALTIMG", "@size": "316", "@ref": "si52", "@mimetype": "image/gif"}, {"@category": "thumbnail", "@height": "18", "@width": "166", "@_fa": "true", "$": "https://api.elsevier.com/content/object/eid/1-s2.0-S1532046414001270-si51.gif?httpAccept=%2A%2F%2A", "@multimediatype": "GIF image file", "@type": "ALTIMG", "@size": "895", "@ref": "si51", "@mimetype": "image/gif"}, {"@category": "thumbnail", "@height": "16", "@width": "11", "@_fa": "true", "$": "https://api.elsevier.com/content/object/eid/1-s2.0-S1532046414001270-si50.gif?httpAccept=%2A%2F%2A", "@multimediatype": "GIF image file", "@type": "ALTIMG", "@size": "209", "@ref": "si50", "@mimetype": "image/gif"}, {"@category": "thumbnail", "@height": "14", "@width": "50", "@_fa": "true", "$": "https://api.elsevier.com/content/object/eid/1-s2.0-S1532046414001270-si5.gif?httpAccept=%2A%2F%2A", "@multimediatype": "GIF image file", "@type": "ALTIMG", "@size": "316", "@ref": "si5", "@mimetype": "image/gif"}, {"@category": "thumbnail", "@height": "17", "@width": "83", "@_fa": "true", "$": "https://api.elsevier.com/content/object/eid/1-s2.0-S1532046414001270-si49.gif?httpAccept=%2A%2F%2A", "@multimediatype": "GIF image file", "@type": "ALTIMG", "@size": "420", "@ref": "si49", "@mimetype": "image/gif"}, {"@category": "thumbnail", "@height": "17", "@width": "131", "@_fa": "true", "$": "https://api.elsevier.com/content/object/eid/1-s2.0-S1532046414001270-si48.gif?httpAccept=%2A%2F%2A", "@multimediatype": "GIF image file", "@type": "ALTIMG", "@size": "574", "@ref": "si48", "@mimetype": "image/gif"}, {"@category": "thumbnail", "@height": "18", "@width": "193", "@_fa": "true", "$": "https://api.elsevier.com/content/object/eid/1-s2.0-S1532046414001270-si47.gif?httpAccept=%2A%2F%2A", "@multimediatype": "GIF image file", "@type": "ALTIMG", "@size": "996", "@ref": "si47", "@mimetype": "image/gif"}, {"@category": "thumbnail", "@height": "17", "@width": "133", "@_fa": "true", "$": "https://api.elsevier.com/content/object/eid/1-s2.0-S1532046414001270-si46.gif?httpAccept=%2A%2F%2A", "@multimediatype": "GIF image file", "@type": "ALTIMG", "@size": "721", "@ref": "si46", "@mimetype": "image/gif"}, {"@category": "thumbnail", "@height": "17", "@width": "94", "@_fa": "true", "$": "https://api.elsevier.com/content/object/eid/1-s2.0-S1532046414001270-si45.gif?httpAccept=%2A%2F%2A", "@multimediatype": "GIF image file", "@type": "ALTIMG", "@size": "453", "@ref": "si45", "@mimetype": "image/gif"}, {"@category": "thumbnail", "@height": "16", "@width": "39", "@_fa": "true", "$": "https://api.elsevier.com/content/object/eid/1-s2.0-S1532046414001270-si44.gif?httpAccept=%2A%2F%2A", "@multimediatype": "GIF image file", "@type": "ALTIMG", "@size": "299", "@ref": "si44", "@mimetype": "image/gif"}, {"@category": "thumbnail", "@height": "17", "@width": "50", "@_fa": "true", "$": "https://api.elsevier.com/content/object/eid/1-s2.0-S1532046414001270-si43.gif?httpAccept=%2A%2F%2A", "@multimediatype": "GIF image file", "@type": "ALTIMG", "@size": "412", "@ref": "si43", "@mimetype": "image/gif"}, {"@category": "thumbnail", "@height": "18", "@width": "68", "@_fa": "true", "$": "https://api.elsevier.com/content/object/eid/1-s2.0-S1532046414001270-si42.gif?httpAccept=%2A%2F%2A", "@multimediatype": "GIF image file", "@type": "ALTIMG", "@size": "467", "@ref": "si42", "@mimetype": "image/gif"}, {"@category": "thumbnail", "@height": "17", "@width": "38", "@_fa": "true", "$": "https://api.elsevier.com/content/object/eid/1-s2.0-S1532046414001270-si41.gif?httpAccept=%2A%2F%2A", "@multimediatype": "GIF image file", "@type": "ALTIMG", "@size": "304", "@ref": "si41", "@mimetype": "image/gif"}, {"@category": "thumbnail", "@height": "13", "@width": "10", "@_fa": "true", "$": "https://api.elsevier.com/content/object/eid/1-s2.0-S1532046414001270-si40.gif?httpAccept=%2A%2F%2A", "@multimediatype": "GIF image file", "@type": "ALTIMG", "@size": "200", "@ref": "si40", "@mimetype": "image/gif"}, {"@category": "thumbnail", "@height": "14", "@width": "50", "@_fa": "true", "$": "https://api.elsevier.com/content/object/eid/1-s2.0-S1532046414001270-si4.gif?httpAccept=%2A%2F%2A", "@multimediatype": "GIF image file", "@type": "ALTIMG", "@size": "319", "@ref": "si4", "@mimetype": "image/gif"}, {"@category": "thumbnail", "@height": "17", "@width": "205", "@_fa": "true", "$": "https://api.elsevier.com/content/object/eid/1-s2.0-S1532046414001270-si39.gif?httpAccept=%2A%2F%2A", "@multimediatype": "GIF image file", "@type": "ALTIMG", "@size": "987", "@ref": "si39", "@mimetype": "image/gif"}, {"@category": "thumbnail", "@height": "17", "@width": "38", "@_fa": "true", "$": "https://api.elsevier.com/content/object/eid/1-s2.0-S1532046414001270-si38.gif?httpAccept=%2A%2F%2A", "@multimediatype": "GIF image file", "@type": "ALTIMG", "@size": "304", "@ref": "si38", "@mimetype": "image/gif"}, {"@category": "thumbnail", "@height": "16", "@width": "49", "@_fa": "true", "$": "https://api.elsevier.com/content/object/eid/1-s2.0-S1532046414001270-si37.gif?httpAccept=%2A%2F%2A", "@multimediatype": "GIF image file", "@type": "ALTIMG", "@size": "367", "@ref": "si37", "@mimetype": "image/gif"}, {"@category": "thumbnail", "@height": "16", "@width": "52", "@_fa": "true", "$": "https://api.elsevier.com/content/object/eid/1-s2.0-S1532046414001270-si36.gif?httpAccept=%2A%2F%2A", "@multimediatype": "GIF image file", "@type": "ALTIMG", "@size": "347", "@ref": "si36", "@mimetype": "image/gif"}, {"@category": "thumbnail", "@height": "17", "@width": "133", "@_fa": "true", "$": "https://api.elsevier.com/content/object/eid/1-s2.0-S1532046414001270-si35.gif?httpAccept=%2A%2F%2A", "@multimediatype": "GIF image file", "@type": "ALTIMG", "@size": "721", "@ref": "si35", "@mimetype": "image/gif"}, {"@category": "thumbnail", "@height": "14", "@width": "15", "@_fa": "true", "$": "https://api.elsevier.com/content/object/eid/1-s2.0-S1532046414001270-si34.gif?httpAccept=%2A%2F%2A", "@multimediatype": "GIF image file", "@type": "ALTIMG", "@size": "217", "@ref": "si34", "@mimetype": "image/gif"}, {"@category": "thumbnail", "@height": "14", "@width": "15", "@_fa": "true", "$": "https://api.elsevier.com/content/object/eid/1-s2.0-S1532046414001270-si33.gif?httpAccept=%2A%2F%2A", "@multimediatype": "GIF image file", "@type": "ALTIMG", "@size": "217", "@ref": "si33", "@mimetype": "image/gif"}, {"@category": "thumbnail", "@height": "14", "@width": "15", "@_fa": "true", "$": "https://api.elsevier.com/content/object/eid/1-s2.0-S1532046414001270-si32.gif?httpAccept=%2A%2F%2A", "@multimediatype": "GIF image file", "@type": "ALTIMG", "@size": "217", "@ref": "si32", "@mimetype": "image/gif"}, {"@category": "thumbnail", "@height": "11", "@width": "14", "@_fa": "true", "$": "https://api.elsevier.com/content/object/eid/1-s2.0-S1532046414001270-si31.gif?httpAccept=%2A%2F%2A", "@multimediatype": "GIF image file", "@type": "ALTIMG", "@size": "208", "@ref": "si31", "@mimetype": "image/gif"}, {"@category": "thumbnail", "@height": "17", "@width": "100", "@_fa": "true", "$": "https://api.elsevier.com/content/object/eid/1-s2.0-S1532046414001270-si30.gif?httpAccept=%2A%2F%2A", "@multimediatype": "GIF image file", "@type": "ALTIMG", "@size": "471", "@ref": "si30", "@mimetype": "image/gif"}, {"@category": "thumbnail", "@height": "17", "@width": "65", "@_fa": "true", "$": "https://api.elsevier.com/content/object/eid/1-s2.0-S1532046414001270-si3.gif?httpAccept=%2A%2F%2A", "@multimediatype": "GIF image file", "@type": "ALTIMG", "@size": "393", "@ref": "si3", "@mimetype": "image/gif"}, {"@category": "thumbnail", "@height": "16", "@width": "75", "@_fa": "true", "$": "https://api.elsevier.com/content/object/eid/1-s2.0-S1532046414001270-si29.gif?httpAccept=%2A%2F%2A", "@multimediatype": "GIF image file", "@type": "ALTIMG", "@size": "400", "@ref": "si29", "@mimetype": "image/gif"}, {"@category": "thumbnail", "@height": "17", "@width": "355", "@_fa": "true", "$": "https://api.elsevier.com/content/object/eid/1-s2.0-S1532046414001270-si28.gif?httpAccept=%2A%2F%2A", "@multimediatype": "GIF image file", "@type": "ALTIMG", "@size": "1373", "@ref": "si28", "@mimetype": "image/gif"}, {"@category": "thumbnail", "@height": "17", "@width": "65", "@_fa": "true", "$": "https://api.elsevier.com/content/object/eid/1-s2.0-S1532046414001270-si27.gif?httpAccept=%2A%2F%2A", "@multimediatype": "GIF image file", "@type": "ALTIMG", "@size": "393", "@ref": "si27", "@mimetype": "image/gif"}, {"@category": "thumbnail", "@height": "16", "@width": "73", "@_fa": "true", "$": "https://api.elsevier.com/content/object/eid/1-s2.0-S1532046414001270-si26.gif?httpAccept=%2A%2F%2A", "@multimediatype": "GIF image file", "@type": "ALTIMG", "@size": "389", "@ref": "si26", "@mimetype": "image/gif"}, {"@category": "thumbnail", "@height": "17", "@width": "26", "@_fa": "true", "$": "https://api.elsevier.com/content/object/eid/1-s2.0-S1532046414001270-si25.gif?httpAccept=%2A%2F%2A", "@multimediatype": "GIF image file", "@type": "ALTIMG", "@size": "265", "@ref": "si25", "@mimetype": "image/gif"}, {"@category": "thumbnail", "@height": "16", "@width": "39", "@_fa": "true", "$": "https://api.elsevier.com/content/object/eid/1-s2.0-S1532046414001270-si24.gif?httpAccept=%2A%2F%2A", "@multimediatype": "GIF image file", "@type": "ALTIMG", "@size": "246", "@ref": "si24", "@mimetype": "image/gif"}, {"@category": "thumbnail", "@height": "20", "@width": "64", "@_fa": "true", "$": "https://api.elsevier.com/content/object/eid/1-s2.0-S1532046414001270-si23.gif?httpAccept=%2A%2F%2A", "@multimediatype": "GIF image file", "@type": "ALTIMG", "@size": "340", "@ref": "si23", "@mimetype": "image/gif"}, {"@category": "thumbnail", "@height": "17", "@width": "65", "@_fa": "true", "$": "https://api.elsevier.com/content/object/eid/1-s2.0-S1532046414001270-si22.gif?httpAccept=%2A%2F%2A", "@multimediatype": "GIF image file", "@type": "ALTIMG", "@size": "393", "@ref": "si22", "@mimetype": "image/gif"}, {"@category": "thumbnail", "@height": "17", "@width": "34", "@_fa": "true", "$": "https://api.elsevier.com/content/object/eid/1-s2.0-S1532046414001270-si21.gif?httpAccept=%2A%2F%2A", "@multimediatype": "GIF image file", "@type": "ALTIMG", "@size": "288", "@ref": "si21", "@mimetype": "image/gif"}, {"@category": "thumbnail", "@height": "17", "@width": "65", "@_fa": "true", "$": "https://api.elsevier.com/content/object/eid/1-s2.0-S1532046414001270-si20.gif?httpAccept=%2A%2F%2A", "@multimediatype": "GIF image file", "@type": "ALTIMG", "@size": "334", "@ref": "si20", "@mimetype": "image/gif"}, {"@category": "thumbnail", "@height": "14", "@width": "50", "@_fa": "true", "$": "https://api.elsevier.com/content/object/eid/1-s2.0-S1532046414001270-si2.gif?httpAccept=%2A%2F%2A", "@multimediatype": "GIF image file", "@type": "ALTIMG", "@size": "300", "@ref": "si2", "@mimetype": "image/gif"}, {"@category": "thumbnail", "@height": "17", "@width": "65", "@_fa": "true", "$": "https://api.elsevier.com/content/object/eid/1-s2.0-S1532046414001270-si19.gif?httpAccept=%2A%2F%2A", "@multimediatype": "GIF image file", "@type": "ALTIMG", "@size": "348", "@ref": "si19", "@mimetype": "image/gif"}, {"@category": "thumbnail", "@height": "17", "@width": "65", "@_fa": "true", "$": "https://api.elsevier.com/content/object/eid/1-s2.0-S1532046414001270-si18.gif?httpAccept=%2A%2F%2A", "@multimediatype": "GIF image file", "@type": "ALTIMG", "@size": "393", "@ref": "si18", "@mimetype": "image/gif"}, {"@category": "thumbnail", "@height": "13", "@width": "43", "@_fa": "true", "$": "https://api.elsevier.com/content/object/eid/1-s2.0-S1532046414001270-si17.gif?httpAccept=%2A%2F%2A", "@multimediatype": "GIF image file", "@type": "ALTIMG", "@size": "265", "@ref": "si17", "@mimetype": "image/gif"}, {"@category": "thumbnail", "@height": "14", "@width": "52", "@_fa": "true", "$": "https://api.elsevier.com/content/object/eid/1-s2.0-S1532046414001270-si16.gif?httpAccept=%2A%2F%2A", "@multimediatype": "GIF image file", "@type": "ALTIMG", "@size": "297", "@ref": "si16", "@mimetype": "image/gif"}, {"@category": "thumbnail", "@height": "17", "@width": "65", "@_fa": "true", "$": "https://api.elsevier.com/content/object/eid/1-s2.0-S1532046414001270-si15.gif?httpAccept=%2A%2F%2A", "@multimediatype": "GIF image file", "@type": "ALTIMG", "@size": "393", "@ref": "si15", "@mimetype": "image/gif"}, {"@category": "thumbnail", "@height": "14", "@width": "64", "@_fa": "true", "$": "https://api.elsevier.com/content/object/eid/1-s2.0-S1532046414001270-si142.gif?httpAccept=%2A%2F%2A", "@multimediatype": "GIF image file", "@type": "ALTIMG", "@size": "385", "@ref": "si142", "@mimetype": "image/gif"}, {"@category": "thumbnail", "@height": "13", "@width": "10", "@_fa": "true", "$": "https://api.elsevier.com/content/object/eid/1-s2.0-S1532046414001270-si141.gif?httpAccept=%2A%2F%2A", "@multimediatype": "GIF image file", "@type": "ALTIMG", "@size": "190", "@ref": "si141", "@mimetype": "image/gif"}, {"@category": "thumbnail", "@height": "10", "@width": "12", "@_fa": "true", "$": "https://api.elsevier.com/content/object/eid/1-s2.0-S1532046414001270-si140.gif?httpAccept=%2A%2F%2A", "@multimediatype": "GIF image file", "@type": "ALTIMG", "@size": "194", "@ref": "si140", "@mimetype": "image/gif"}, {"@category": "thumbnail", "@height": "14", "@width": "42", "@_fa": "true", "$": "https://api.elsevier.com/content/object/eid/1-s2.0-S1532046414001270-si14.gif?httpAccept=%2A%2F%2A", "@multimediatype": "GIF image file", "@type": "ALTIMG", "@size": "275", "@ref": "si14", "@mimetype": "image/gif"}, {"@category": "thumbnail", "@height": "13", "@width": "10", "@_fa": "true", "$": "https://api.elsevier.com/content/object/eid/1-s2.0-S1532046414001270-si139.gif?httpAccept=%2A%2F%2A", "@multimediatype": "GIF image file", "@type": "ALTIMG", "@size": "183", "@ref": "si139", "@mimetype": "image/gif"}, {"@category": "thumbnail", "@height": "14", "@width": "67", "@_fa": "true", "$": "https://api.elsevier.com/content/object/eid/1-s2.0-S1532046414001270-si138.gif?httpAccept=%2A%2F%2A", "@multimediatype": "GIF image file", "@type": "ALTIMG", "@size": "430", "@ref": "si138", "@mimetype": "image/gif"}, {"@category": "thumbnail", "@height": "14", "@width": "67", "@_fa": "true", "$": "https://api.elsevier.com/content/object/eid/1-s2.0-S1532046414001270-si137.gif?httpAccept=%2A%2F%2A", "@multimediatype": "GIF image file", "@type": "ALTIMG", "@size": "425", "@ref": "si137", "@mimetype": "image/gif"}, {"@category": "thumbnail", "@height": "17", "@width": "9", "@_fa": "true", "$": "https://api.elsevier.com/content/object/eid/1-s2.0-S1532046414001270-si136.gif?httpAccept=%2A%2F%2A", "@multimediatype": "GIF image file", "@type": "ALTIMG", "@size": "179", "@ref": "si136", "@mimetype": "image/gif"}, {"@category": "thumbnail", "@height": "11", "@width": "12", "@_fa": "true", "$": "https://api.elsevier.com/content/object/eid/1-s2.0-S1532046414001270-si135.gif?httpAccept=%2A%2F%2A", "@multimediatype": "GIF image file", "@type": "ALTIMG", "@size": "188", "@ref": "si135", "@mimetype": "image/gif"}, {"@category": "thumbnail", "@height": "14", "@width": "15", "@_fa": "true", "$": "https://api.elsevier.com/content/object/eid/1-s2.0-S1532046414001270-si133.gif?httpAccept=%2A%2F%2A", "@multimediatype": "GIF image file", "@type": "ALTIMG", "@size": "217", "@ref": "si133", "@mimetype": "image/gif"}, {"@category": "thumbnail", "@height": "16", "@width": "45", "@_fa": "true", "$": "https://api.elsevier.com/content/object/eid/1-s2.0-S1532046414001270-si132.gif?httpAccept=%2A%2F%2A", "@multimediatype": "GIF image file", "@type": "ALTIMG", "@size": "327", "@ref": "si132", "@mimetype": "image/gif"}, {"@category": "thumbnail", "@height": "14", "@width": "43", "@_fa": "true", "$": "https://api.elsevier.com/content/object/eid/1-s2.0-S1532046414001270-si13.gif?httpAccept=%2A%2F%2A", "@multimediatype": "GIF image file", "@type": "ALTIMG", "@size": "269", "@ref": "si13", "@mimetype": "image/gif"}, {"@category": "thumbnail", "@height": "17", "@width": "252", "@_fa": "true", "$": "https://api.elsevier.com/content/object/eid/1-s2.0-S1532046414001270-si126.gif?httpAccept=%2A%2F%2A", "@multimediatype": "GIF image file", "@type": "ALTIMG", "@size": "1036", "@ref": "si126", "@mimetype": "image/gif"}, {"@category": "thumbnail", "@height": "23", "@width": "75", "@_fa": "true", "$": "https://api.elsevier.com/content/object/eid/1-s2.0-S1532046414001270-si124.gif?httpAccept=%2A%2F%2A", "@multimediatype": "GIF image file", "@type": "ALTIMG", "@size": "574", "@ref": "si124", "@mimetype": "image/gif"}, {"@category": "thumbnail", "@height": "14", "@width": "19", "@_fa": "true", "$": "https://api.elsevier.com/content/object/eid/1-s2.0-S1532046414001270-si122.gif?httpAccept=%2A%2F%2A", "@multimediatype": "GIF image file", "@type": "ALTIMG", "@size": "244", "@ref": "si122", "@mimetype": "image/gif"}, {"@category": "thumbnail", "@height": "17", "@width": "65", "@_fa": "true", "$": "https://api.elsevier.com/content/object/eid/1-s2.0-S1532046414001270-si12.gif?httpAccept=%2A%2F%2A", "@multimediatype": "GIF image file", "@type": "ALTIMG", "@size": "393", "@ref": "si12", "@mimetype": "image/gif"}, {"@category": "thumbnail", "@height": "17", "@width": "31", "@_fa": "true", "$": "https://api.elsevier.com/content/object/eid/1-s2.0-S1532046414001270-si119.gif?httpAccept=%2A%2F%2A", "@multimediatype": "GIF image file", "@type": "ALTIMG", "@size": "325", "@ref": "si119", "@mimetype": "image/gif"}, {"@category": "thumbnail", "@height": "24", "@width": "27", "@_fa": "true", "$": "https://api.elsevier.com/content/object/eid/1-s2.0-S1532046414001270-si118.gif?httpAccept=%2A%2F%2A", "@multimediatype": "GIF image file", "@type": "ALTIMG", "@size": "338", "@ref": "si118", "@mimetype": "image/gif"}, {"@category": "thumbnail", "@height": "16", "@width": "23", "@_fa": "true", "$": "https://api.elsevier.com/content/object/eid/1-s2.0-S1532046414001270-si117.gif?httpAccept=%2A%2F%2A", "@multimediatype": "GIF image file", "@type": "ALTIMG", "@size": "276", "@ref": "si117", "@mimetype": "image/gif"}, {"@category": "thumbnail", "@height": "17", "@width": "95", "@_fa": "true", "$": "https://api.elsevier.com/content/object/eid/1-s2.0-S1532046414001270-si115.gif?httpAccept=%2A%2F%2A", "@multimediatype": "GIF image file", "@type": "ALTIMG", "@size": "402", "@ref": "si115", "@mimetype": "image/gif"}, {"@category": "thumbnail", "@height": "13", "@width": "13", "@_fa": "true", "$": "https://api.elsevier.com/content/object/eid/1-s2.0-S1532046414001270-si113.gif?httpAccept=%2A%2F%2A", "@multimediatype": "GIF image file", "@type": "ALTIMG", "@size": "199", "@ref": "si113", "@mimetype": "image/gif"}, {"@category": "thumbnail", "@height": "11", "@width": "13", "@_fa": "true", "$": "https://api.elsevier.com/content/object/eid/1-s2.0-S1532046414001270-si112.gif?httpAccept=%2A%2F%2A", "@multimediatype": "GIF image file", "@type": "ALTIMG", "@size": "197", "@ref": "si112", "@mimetype": "image/gif"}, {"@category": "thumbnail", "@height": "18", "@width": "34", "@_fa": "true", "$": "https://api.elsevier.com/content/object/eid/1-s2.0-S1532046414001270-si111.gif?httpAccept=%2A%2F%2A", "@multimediatype": "GIF image file", "@type": "ALTIMG", "@size": "244", "@ref": "si111", "@mimetype": "image/gif"}, {"@category": "thumbnail", "@height": "14", "@width": "16", "@_fa": "true", "$": "https://api.elsevier.com/content/object/eid/1-s2.0-S1532046414001270-si110.gif?httpAccept=%2A%2F%2A", "@multimediatype": "GIF image file", "@type": "ALTIMG", "@size": "220", "@ref": "si110", "@mimetype": "image/gif"}, {"@category": "thumbnail", "@height": "14", "@width": "40", "@_fa": "true", "$": "https://api.elsevier.com/content/object/eid/1-s2.0-S1532046414001270-si11.gif?httpAccept=%2A%2F%2A", "@multimediatype": "GIF image file", "@type": "ALTIMG", "@size": "263", "@ref": "si11", "@mimetype": "image/gif"}, {"@category": "thumbnail", "@height": "17", "@width": "95", "@_fa": "true", "$": "https://api.elsevier.com/content/object/eid/1-s2.0-S1532046414001270-si108.gif?httpAccept=%2A%2F%2A", "@multimediatype": "GIF image file", "@type": "ALTIMG", "@size": "402", "@ref": "si108", "@mimetype": "image/gif"}, {"@category": "thumbnail", "@height": "11", "@width": "13", "@_fa": "true", "$": "https://api.elsevier.com/content/object/eid/1-s2.0-S1532046414001270-si107.gif?httpAccept=%2A%2F%2A", "@multimediatype": "GIF image file", "@type": "ALTIMG", "@size": "197", "@ref": "si107", "@mimetype": "image/gif"}, {"@category": "thumbnail", "@height": "17", "@width": "105", "@_fa": "true", "$": "https://api.elsevier.com/content/object/eid/1-s2.0-S1532046414001270-si106.gif?httpAccept=%2A%2F%2A", "@multimediatype": "GIF image file", "@type": "ALTIMG", "@size": "471", "@ref": "si106", "@mimetype": "image/gif"}, {"@category": "thumbnail", "@height": "19", "@width": "52", "@_fa": "true", "$": "https://api.elsevier.com/content/object/eid/1-s2.0-S1532046414001270-si105.gif?httpAccept=%2A%2F%2A", "@multimediatype": "GIF image file", "@type": "ALTIMG", "@size": "369", "@ref": "si105", "@mimetype": "image/gif"}, {"@category": "thumbnail", "@height": "17", "@width": "130", "@_fa": "true", "$": "https://api.elsevier.com/content/object/eid/1-s2.0-S1532046414001270-si104.gif?httpAccept=%2A%2F%2A", "@multimediatype": "GIF image file", "@type": "ALTIMG", "@size": "557", "@ref": "si104", "@mimetype": "image/gif"}, {"@category": "thumbnail", "@height": "14", "@width": "44", "@_fa": "true", "$": "https://api.elsevier.com/content/object/eid/1-s2.0-S1532046414001270-si103.gif?httpAccept=%2A%2F%2A", "@multimediatype": "GIF image file", "@type": "ALTIMG", "@size": "347", "@ref": "si103", "@mimetype": "image/gif"}, {"@category": "thumbnail", "@height": "14", "@width": "34", "@_fa": "true", "$": "https://api.elsevier.com/content/object/eid/1-s2.0-S1532046414001270-si102.gif?httpAccept=%2A%2F%2A", "@multimediatype": "GIF image file", "@type": "ALTIMG", "@size": "295", "@ref": "si102", "@mimetype": "image/gif"}, {"@category": "thumbnail", "@height": "14", "@width": "44", "@_fa": "true", "$": "https://api.elsevier.com/content/object/eid/1-s2.0-S1532046414001270-si101.gif?httpAccept=%2A%2F%2A", "@multimediatype": "GIF image file", "@type": "ALTIMG", "@size": "369", "@ref": "si101", "@mimetype": "image/gif"}, {"@category": "thumbnail", "@height": "14", "@width": "34", "@_fa": "true", "$": "https://api.elsevier.com/content/object/eid/1-s2.0-S1532046414001270-si100.gif?httpAccept=%2A%2F%2A", "@multimediatype": "GIF image file", "@type": "ALTIMG", "@size": "310", "@ref": "si100", "@mimetype": "image/gif"}, {"@category": "thumbnail", "@height": "14", "@width": "41", "@_fa": "true", "$": "https://api.elsevier.com/content/object/eid/1-s2.0-S1532046414001270-si10.gif?httpAccept=%2A%2F%2A", "@multimediatype": "GIF image file", "@type": "ALTIMG", "@size": "275", "@ref": "si10", "@mimetype": "image/gif"}, {"@category": "thumbnail", "@height": "14", "@width": "50", "@_fa": "true", "$": "https://api.elsevier.com/content/object/eid/1-s2.0-S1532046414001270-si1.gif?httpAccept=%2A%2F%2A", "@multimediatype": "GIF image file", "@type": "ALTIMG", "@size": "312", "@ref": "si1", "@mimetype": "image/gif"}, {"@category": "high", "@height": "2423", "@width": "2533", "@_fa": "true", "$": "https://api.elsevier.com/content/object/eid/1-s2.0-S1532046414001270-gr1_lrg.jpg?httpAccept=%2A%2F%2A", "@multimediatype": "JPEG image file", "@type": "IMAGE-HIGH-RES", "@size": "487427", "@ref": "gr1", "@mimetype": "image/jpeg"}, {"@category": "high", "@height": "886", "@width": "936", "@_fa": "true", "$": "https://api.elsevier.com/content/object/eid/1-s2.0-S1532046414001270-fx1_lrg.jpg?httpAccept=%2A%2F%2A", "@multimediatype": "JPEG image file", "@type": "IMAGE-HIGH-RES", "@size": "134543", "@ref": "fx1", "@mimetype": "image/jpeg"}, {"@category": "high", "@height": "870", "@width": "2581", "@_fa": "true", "$": "https://api.elsevier.com/content/object/eid/1-s2.0-S1532046414001270-gr2_lrg.jpg?httpAccept=%2A%2F%2A", "@multimediatype": "JPEG image file", "@type": "IMAGE-HIGH-RES", "@size": "681237", "@ref": "gr2", "@mimetype": "image/jpeg"}, {"@category": "standard", "@height": "547", "@width": "572", "@_fa": "true", "$": "https://api.elsevier.com/content/object/eid/1-s2.0-S1532046414001270-gr1.jpg?httpAccept=%2A%2F%2A", "@multimediatype": "JPEG image file", "@type": "IMAGE-DOWNSAMPLED", "@size": "66714", "@ref": "gr1", "@mimetype": "image/jpeg"}, {"@category": "standard", "@height": "200", "@width": "211", "@_fa": "true", "$": "https://api.elsevier.com/content/object/eid/1-s2.0-S1532046414001270-fx1.jpg?httpAccept=%2A%2F%2A", "@multimediatype": "JPEG image file", "@type": "IMAGE-DOWNSAMPLED", "@size": "22699", "@ref": "fx1", "@mimetype": "image/jpeg"}, {"@category": "standard", "@height": "197", "@width": "583", "@_fa": "true", "$": "https://api.elsevier.com/content/object/eid/1-s2.0-S1532046414001270-gr2.jpg?httpAccept=%2A%2F%2A", "@multimediatype": "JPEG image file", "@type": "IMAGE-DOWNSAMPLED", "@size": "50728", "@ref": "gr2", "@mimetype": "image/jpeg"}, {"@category": "thumbnail", "@height": "164", "@width": "171", "@_fa": "true", "$": "https://api.elsevier.com/content/object/eid/1-s2.0-S1532046414001270-gr1.sml?httpAccept=%2A%2F%2A", "@multimediatype": "GIF image file", "@type": "IMAGE-THUMBNAIL", "@size": "5946", "@ref": "gr1", "@mimetype": "image/gif"}, {"@category": "thumbnail", "@height": "164", "@width": "173", "@_fa": "true", "$": "https://api.elsevier.com/content/object/eid/1-s2.0-S1532046414001270-fx1.sml?httpAccept=%2A%2F%2A", "@multimediatype": "GIF image file", "@type": "IMAGE-THUMBNAIL", "@size": "5810", "@ref": "fx1", "@mimetype": "image/gif"}, {"@category": "thumbnail", "@height": "74", "@width": "219", "@_fa": "true", "$": "https://api.elsevier.com/content/object/eid/1-s2.0-S1532046414001270-gr2.sml?httpAccept=%2A%2F%2A", "@multimediatype": "GIF image file", "@type": "IMAGE-THUMBNAIL", "@size": "6911", "@ref": "gr2", "@mimetype": "image/gif"}]}, "link": {"@rel": "abstract", "@href": "https://api.elsevier.com/content/abstract/scopus_id/84908027298"}}